,number,value,datetime_start,datetime_complete,duration,params_1D_featurizer,params_1d_model,params_2d_model,params_C_linear_svc,params_C_logistic_regression,params_C_passive_aggressive_classifier,params_C_svc,params_Cs_logistic_regression_cv,params_activation_mlp_classifier,params_algorithm_ada_boost_classifier,params_algorithm_kneighbors_classifier,params_algorithm_radius_neighbors_classifier,params_alpha_bernoulli_nb,params_alpha_complement_nb,params_alpha_mlp_classifier,params_alpha_ridge_classifier,params_alpha_ridge_classifier_cv,params_attention_dropout_0,params_attention_key_dim_0,params_base_estimator_bagging_classifier,params_base_filters,params_batch_normalization_0,params_batch_normalization_1,params_batch_normalization_2,params_batch_normalization_3,params_batch_normalization_4,params_batch_size_deepchem,params_batchnorm,params_bootstrap_bagging_classifier,params_bootstrap_features,params_classification_model,params_conv_activation_0,params_conv_activation_1,params_conv_activation_2,params_conv_batch_norm_0,params_conv_batch_norm_1,params_conv_batch_norm_2,params_conv_dropout_0,params_conv_dropout_1,params_conv_dropout_2,params_criterion_gradient_boosting_classifier,params_degree_nu_svc,params_degree_one_class_svm,params_degree_svc,params_dense_activation,params_dense_dropout,params_dense_layer_size,params_dense_units,params_depth_dmpnn,params_dropout,params_dropout_attentive_fp,params_dropout_dag,params_dropout_gcn,params_dropout_graph_conv,params_dropout_pagtn,params_dropout_text_cnn,params_dropouts_weave,params_embedding_dim,params_embedding_output_dim,params_epochs_deepchem,params_f1,params_f2,params_feature_selector,params_featurizer_type,params_filter_0,params_filter_1,params_filter_2,params_filters,params_fnn_dropout_p,params_fnn_layers,params_fpSize,params_g_noise,params_gamma_nu_svc,params_gamma_one_class_svm,params_gamma_svc,params_graph_conv_layers_conv_model,params_graph_conv_layers_gcn,params_graph_feat_size_attentive_fp,params_gru_dropout_0,params_gru_dropout_1,params_gru_units_0,params_gru_units_1,params_hidden_activation_0,params_hidden_activation_1,params_hidden_activation_2,params_hidden_activation_3,params_hidden_activation_4,params_hidden_dropout_0,params_hidden_dropout_1,params_hidden_dropout_2,params_hidden_dropout_3,params_hidden_dropout_4,params_hidden_layer_sizes_mlp_classifier,params_hidden_layer_units_0,params_hidden_layer_units_1,params_hidden_layer_units_2,params_hidden_layer_units_3,params_hidden_layer_units_4,params_k,params_kernel_nu_svc,params_kernel_one_class_svm,params_kernel_size_0,params_kernel_size_1,params_kernel_size_2,params_kernel_size_smiles_to_vec,params_kernel_svc,params_l1_0,params_l1_1,params_l1_2,params_l1_3,params_l1_4,params_l2_0,params_l2_1,params_l2_2,params_l2_3,params_l2_4,params_layer_sizes_dag,params_layer_sizes_gather,params_leaf_size_kneighbors_classifier,params_leaf_size_radius_neighbors_classifier,params_learning_rate_ada_boost_classifier,params_learning_rate_gradient_boosting_classifier,params_learning_rate_hist_gradient_boosting_classifier,params_loss_gradient_boosting_classifier,params_lstm_dropout_0,params_lstm_dropout_1,params_lstm_dropout_2,params_lstm_units_0,params_lstm_units_1,params_lstm_units_2,params_master_atom,params_maxLength,params_maxPath,params_max_features_gradient_boosting_classifier,params_max_length_pagtn,params_max_path,params_minLength,params_minPath,params_min_path,params_model_steps,params_model_type,params_nBits,params_n_attention_heads,params_n_attention_layers,params_n_bits,params_n_conv_layers,params_n_embedding_text_cnn,params_n_estimators,params_n_estimators_ada_boost_classifier,params_n_estimators_bagging_classifier,params_n_estimators_gradient_boosting_classifier,params_n_graph_feat_dag,params_n_graph_feat_weave,params_n_gru_layers,params_n_hidden_layers,params_n_hidden_weave,params_n_lstm_layers,params_n_neighbors_kneighbors_classifier,params_n_rnn_layers,params_norm,params_nu_nu_svc,params_nu_one_class_svm,params_num_heads,params_num_layers_attentive_fp,params_num_layers_pagtn,params_p,params_percentile,params_predictor_dropout_gcn,params_radius,params_radius_n_radius_neighbors_classifier,params_reg_param,params_rnn_dropouts_0,params_rnn_units_0,params_scaler,params_standardization_type,params_standardizer,params_stride_0,params_stride_1,params_stride_2,params_strides,params_support_weak,params_threshold,params_use_chirality_attentive_fp,params_use_chirality_gat,params_use_chirality_gcn,params_use_chirality_graph_conv,params_use_chirality_weave,params_use_edges_gat,params_use_edges_gcn,params_use_partial_charge_attentive_fp,params_use_partial_charge_gat,params_use_partial_charge_gcn,params_weights_kneighbors_classifier,params_weights_radius_neighbors_classifier,params_with_mean,params_with_std,state
70,70,0.7688922738542401,2024-02-17 18:58:55.637438,2024-02-17 20:50:38.609948,0 days 01:51:42.972510,,,,,,,,,,,,,,,,,,,,,,,,,,,64.0,,,,,,,,,,,,,,,,,,,,256.0,,,,,,,0.5,,,,,,645.0,,,,,,,,,,,,,,,,"[128, 64]",,,,,,,,,,,,,,,,,,,,,,,,,,,,,,,,,,,,,,,,,,,,,,,,,,,,,,,True,,,,,,,,,graph_conv_model,deepchem,,,,,,,,,,,,,,,,,,,,,,,,,,,,,,,,,,,chembl_standardizer,,,,,,,,,,True,,,,,,,,,,,COMPLETE
71,71,0.7665788388390105,2024-02-17 20:50:38.625008,2024-02-17 22:40:19.908174,0 days 01:49:41.283166,,,,,,,,,,,,,,,,,,,,,,,,,,,64.0,,,,,,,,,,,,,,,,,,,,256.0,,,,,,,0.5,,,,,,664.0,,,,,,,,,,,,,,,,"[128, 64]",,,,,,,,,,,,,,,,,,,,,,,,,,,,,,,,,,,,,,,,,,,,,,,,,,,,,,,True,,,,,,,,,graph_conv_model,deepchem,,,,,,,,,,,,,,,,,,,,,,,,,,,,,,,,,,,chembl_standardizer,,,,,,,,,,True,,,,,,,,,,,COMPLETE
72,72,0.774087002603982,2024-02-17 22:40:19.922155,2024-02-18 00:43:16.495218,0 days 02:02:56.573063,,,,,,,,,,,,,,,,,,,,,,,,,,,64.0,,,,,,,,,,,,,,,,,,,,256.0,,,,,,,0.5,,,,,,642.0,,,,,,,,,,,,,,,,"[128, 64]",,,,,,,,,,,,,,,,,,,,,,,,,,,,,,,,,,,,,,,,,,,,,,,,,,,,,,,True,,,,,,,,,graph_conv_model,deepchem,,,,,,,,,,,,,,,,,,,,,,,,,,,,,,,,,,,chembl_standardizer,,,,,,,,,,True,,,,,,,,,,,COMPLETE
73,73,-inf,2024-02-18 00:43:16.512170,2024-02-18 03:43:17.147536,0 days 03:00:00.635366,,,,,,,,,,,,,,,,,,,,,,,,,,,64.0,,,,,,,,,,,,,,,,,,,,256.0,,,,,,,0.5,,,,,,621.0,,,,,,,,,,,,,,,,"[128, 64]",,,,,,,,,,,,,,,,,,,,,,,,,,,,,,,,,,,,,,,,,,,,,,,,,,,,,,,True,,,,,,,,,graph_conv_model,deepchem,,,,,,,,,,,,,,,,,,,,,,,,,,,,,,,,,,,chembl_standardizer,,,,,,,,,,True,,,,,,,,,,,COMPLETE
74,74,0.7692430706510415,2024-02-18 03:43:17.206169,2024-02-18 06:07:26.697898,0 days 02:24:09.491729,,,,,,,,,,,,,,,,,,,,,,,,,,,64.0,,,,,,,,,,,,,,,,,,,,256.0,,,,,,,0.5,,,,,,676.0,,,,,,,,,,,,,,,,"[128, 64]",,,,,,,,,,,,,,,,,,,,,,,,,,,,,,,,,,,,,,,,,,,,,,,,,,,,,,,True,,,,,,,,,graph_conv_model,deepchem,,,,,,,,,,,,,,,,,,,,,,,,,,,,,,,,,,,chembl_standardizer,,,,,,,,,,True,,,,,,,,,,,COMPLETE
75,75,-inf,2024-02-18 06:07:26.714927,2024-02-18 09:07:27.424477,0 days 03:00:00.709550,,,,,,,,,,,,,,,,,,,,,,,,,,,64.0,,,,,,,,,,,,,,,,,,,,256.0,,,,,,,0.5,,,,,,684.0,,,,,,,,,,,,,,,,"[128, 64]",,,,,,,,,,,,,,,,,,,,,,,,,,,,,,,,,,,,,,,,,,,,,,,,,,,,,,,True,,,,,,,,,graph_conv_model,deepchem,,,,,,,,,,,,,,,,,,,,,,,,,,,,,,,,,,,chembl_standardizer,,,,,,,,,,True,,,,,,,,,,,COMPLETE
76,76,-inf,2024-02-18 09:07:27.479907,2024-02-18 12:07:27.933832,0 days 03:00:00.453925,,,,,,,,,,,,,,,,,,,,,,,,,,,64.0,,,,,,,,,,,,,,,,,,,,256.0,,,,,,,0.5,,,,,,718.0,,,,,,,,,,,,,,,,"[128, 64]",,,,,,,,,,,,,,,,,,,,,,,,,,,,,,,,,,,,,,,,,,,,,,,,,,,,,,,True,,,,,,,,,graph_conv_model,deepchem,,,,,,,,,,,,,,,,,,,,,,,,,,,,,,,,,,,chembl_standardizer,,,,,,,,,,True,,,,,,,,,,,COMPLETE
77,77,0.7706927325602287,2024-02-18 12:07:27.971704,2024-02-18 14:02:41.274921,0 days 01:55:13.303217,,,,,,,,,,,,,,,,,,,,,,,,,,,64.0,,,,,,,,,,,,,,,,,,,,256.0,,,,,,,0.5,,,,,,500.0,,,,,,,,,,,,,,,,"[128, 64]",,,,,,,,,,,,,,,,,,,,,,,,,,,,,,,,,,,,,,,,,,,,,,,,,,,,,,,True,,,,,,,,,graph_conv_model,deepchem,,,,,,,,,,,,,,,,,,,,,,,,,,,,,,,,,,,chembl_standardizer,,,,,,,,,,True,,,,,,,,,,,COMPLETE
78,78,0.7654477753887674,2024-02-18 14:02:41.356720,2024-02-18 16:10:22.110231,0 days 02:07:40.753511,,,,,,,,,,,,,,,,,,,,,,,,,,,64.0,,,,,,,,,,,,,,,,,,,,256.0,,,,,,,0.5,,,,,,508.0,,,,,,,,,,,,,,,,"[128, 64]",,,,,,,,,,,,,,,,,,,,,,,,,,,,,,,,,,,,,,,,,,,,,,,,,,,,,,,True,,,,,,,,,graph_conv_model,deepchem,,,,,,,,,,,,,,,,,,,,,,,,,,,,,,,,,,,chembl_standardizer,,,,,,,,,,True,,,,,,,,,,,COMPLETE
79,79,0.7754854669167148,2024-02-18 16:10:22.126659,2024-02-18 17:59:25.825022,0 days 01:49:03.698363,,,,,,,,,,,,,,,,,,,,,,,,,,,64.0,,,,,,,,,,,,,,,,,,,,256.0,,,,,,,0.5,,,,,,485.0,,,,,,,,,,,,,,,,"[128, 64]",,,,,,,,,,,,,,,,,,,,,,,,,,,,,,,,,,,,,,,,,,,,,,,,,,,,,,,True,,,,,,,,,graph_conv_model,deepchem,,,,,,,,,,,,,,,,,,,,,,,,,,,,,,,,,,,chembl_standardizer,,,,,,,,,,True,,,,,,,,,,,COMPLETE
80,80,0.7491385342772854,2024-02-18 17:59:25.849058,2024-02-18 20:12:13.853153,0 days 02:12:48.004095,,,,,,,,,,,,,,,,,,,,,,,,,,,64.0,,,,,,,,,,,,,,,,,,,,256.0,,,,,,,0.5,,,,,,478.0,,,,,,,,,,,,,,,,"[128, 64]",,,,,,,,,,,,,,,,,,,,,,,,,,,,,,,,,,,,,,,,,,,,,,,,,,,,,,,True,,,,,,,,,graph_conv_model,deepchem,,,,,,,,,,,,,,,,,,,,,,,,,,,,,,,,,,,chembl_standardizer,,,,,,,,,,True,,,,,,,,,,,COMPLETE
81,81,0.7652475666704497,2024-02-18 20:12:13.937736,2024-02-18 22:27:21.498809,0 days 02:15:07.561073,,,,,,,,,,,,,,,,,,,,,,,,,,,64.0,,,,,,,,,,,,,,,,,,,,256.0,,,,,,,0.5,,,,,,476.0,,,,,,,,,,,,,,,,"[128, 64]",,,,,,,,,,,,,,,,,,,,,,,,,,,,,,,,,,,,,,,,,,,,,,,,,,,,,,,True,,,,,,,,,graph_conv_model,deepchem,,,,,,,,,,,,,,,,,,,,,,,,,,,,,,,,,,,chembl_standardizer,,,,,,,,,,True,,,,,,,,,,,COMPLETE
82,82,0.7602508464555994,2024-02-18 22:27:21.529313,2024-02-19 00:47:40.481120,0 days 02:20:18.951807,,,,,,,,,,,,,,,,,,,,,,,,,,,64.0,,,,,,,,,,,,,,,,,,,,256.0,,,,,,,0.5,,,,,,500.0,,,,,,,,,,,,,,,,"[128, 64]",,,,,,,,,,,,,,,,,,,,,,,,,,,,,,,,,,,,,,,,,,,,,,,,,,,,,,,True,,,,,,,,,graph_conv_model,deepchem,,,,,,,,,,,,,,,,,,,,,,,,,,,,,,,,,,,chembl_standardizer,,,,,,,,,,True,,,,,,,,,,,COMPLETE
83,83,0.7714330790617845,2024-02-19 00:47:40.496407,2024-02-19 03:13:32.252573,0 days 02:25:51.756166,,,,,,,,,,,,,,,,,,,,,,,,,,,64.0,,,,,,,,,,,,,,,,,,,,256.0,,,,,,,0.5,,,,,,495.0,,,,,,,,,,,,,,,,"[128, 64]",,,,,,,,,,,,,,,,,,,,,,,,,,,,,,,,,,,,,,,,,,,,,,,,,,,,,,,True,,,,,,,,,graph_conv_model,deepchem,,,,,,,,,,,,,,,,,,,,,,,,,,,,,,,,,,,chembl_standardizer,,,,,,,,,,True,,,,,,,,,,,COMPLETE
84,84,0.76248647386236,2024-02-19 03:13:32.293534,2024-02-19 05:34:27.993456,0 days 02:20:55.699922,,,,,,,,,,,,,,,,,,,,,,,,,,,64.0,,,,,,,,,,,,,,,,,,,,256.0,,,,,,,0.5,,,,,,433.0,,,,,,,,,,,,,,,,"[128, 64]",,,,,,,,,,,,,,,,,,,,,,,,,,,,,,,,,,,,,,,,,,,,,,,,,,,,,,,True,,,,,,,,,graph_conv_model,deepchem,,,,,,,,,,,,,,,,,,,,,,,,,,,,,,,,,,,chembl_standardizer,,,,,,,,,,True,,,,,,,,,,,COMPLETE
85,85,0.7797160273827107,2024-02-19 05:34:28.013335,2024-02-19 08:19:49.181859,0 days 02:45:21.168524,,,,,,,,,,,,,,,,,,,,,,,,,,,64.0,,,,,,,,,,,,,,,,,,,,256.0,,,,,,,0.5,,,,,,572.0,,,,,,,,,,,,,,,,"[128, 64]",,,,,,,,,,,,,,,,,,,,,,,,,,,,,,,,,,,,,,,,,,,,,,,,,,,,,,,True,,,,,,,,,graph_conv_model,deepchem,,,,,,,,,,,,,,,,,,,,,,,,,,,,,,,,,,,chembl_standardizer,,,,,,,,,,True,,,,,,,,,,,COMPLETE
86,86,0.745640009127053,2024-02-19 08:19:49.197198,2024-02-19 10:07:39.351882,0 days 01:47:50.154684,,,,,,,,,,,,,,,,,,,,,,,,,,,64.0,,,,,,,,,,,,,,,,,,,,256.0,,,,,,,0.5,,,,,,582.0,,,,,,,,,,,,,,,,"[128, 64]",,,,,,,,,,,,,,,,,,,,,,,,,,,,,,,,,,,,,,,,,,,,,,,,,,,,,,,True,,,,,,,,,graph_conv_model,deepchem,,,,,,,,,,,,,,,,,,,,,,,,,,,,,,,,,,,chembl_standardizer,,,,,,,,,,True,,,,,,,,,,,COMPLETE
87,87,0.7733287045122144,2024-02-19 10:07:39.369290,2024-02-19 12:26:11.997668,0 days 02:18:32.628378,,,,,,,,,,,,,,,,,,,,,,,,,,,64.0,,,,,,,,,,,,,,,,,,,,256.0,,,,,,,0.5,,,,,,666.0,,,,,,,,,,,,,,,,"[128, 64]",,,,,,,,,,,,,,,,,,,,,,,,,,,,,,,,,,,,,,,,,,,,,,,,,,,,,,,True,,,,,,,,,graph_conv_model,deepchem,,,,,,,,,,,,,,,,,,,,,,,,,,,,,,,,,,,chembl_standardizer,,,,,,,,,,True,,,,,,,,,,,COMPLETE
88,88,-inf,2024-02-19 12:26:12.023936,2024-02-19 15:26:12.541750,0 days 03:00:00.517814,,,,,,,,,,,,,,,,,,,,,,,,,,,64.0,,,,,,,,,,,,,,,,,,,,,,4.0,,,,,,,,,,,663.0,,,,,,,,,0.0,2.0,,,,,,,,,,,,,,,,,,,,,,,,,,,,,,,,,,,,,,,,,,,,,,,,,,,,,,,,,,,,,,,,,,,,,,dmpnn_model,deepchem,,,,,,,,,,,,,,,,,,,,,,,,,,,,,,,,,,,chembl_standardizer,,,,,,,,,,,,,,,,,,,,,COMPLETE
89,89,-inf,2024-02-19 15:26:12.639709,2024-02-19 18:26:13.497430,0 days 03:00:00.857721,,,,,,,,,,,,,,,,,,,,,,,,,,,64.0,,,,,,,,,,,,,,,,,,,,256.0,,,,,,,0.25,,,,,,736.0,,,,,,,,,,,,,,,,"[128, 64]",,,,,,,,,,,,,,,,,,,,,,,,,,,,,,,,,,,,,,,,,,,,,,,,,,,,,,,True,,,,,,,,,graph_conv_model,deepchem,,,,,,,,,,,,,,,,,,,,,,,,,,,,,,,,,,,chembl_standardizer,,,,,,,,,,True,,,,,,,,,,,COMPLETE
90,90,-inf,2024-02-19 18:26:13.546453,2024-02-19 21:26:14.479141,0 days 03:00:00.932688,,,,,,,,,,,,,,,,,,,,,,,,,,,64.0,,,,,,,,,,,,,,,,,,,,512.0,,,,,,,0.5,,,,,,579.0,,,,,,,,,,,,,,,,"[64, 64]",,,,,,,,,,,,,,,,,,,,,,,,,,,,,,,,,,,,,,,,,,,,,,,,,,,,,,,False,,,,,,,,,graph_conv_model,deepchem,,,,,,,,,,,,,,,,,,,,,,,,,,,,,,,,,,,chembl_standardizer,,,,,,,,,,False,,,,,,,,,,,COMPLETE
91,91,0.7673728481371607,2024-02-19 21:26:14.544916,2024-02-20 00:14:49.520818,0 days 02:48:34.975902,,,,,,,,,,,,,,,,,,,,,,,,,,,64.0,,,,,,,,,,,,,,,,,,,,256.0,,,,,,,0.5,,,,,,537.0,,,,,,,,,,,,,,,,"[128, 64]",,,,,,,,,,,,,,,,,,,,,,,,,,,,,,,,,,,,,,,,,,,,,,,,,,,,,,,True,,,,,,,,,graph_conv_model,deepchem,,,,,,,,,,,,,,,,,,,,,,,,,,,,,,,,,,,chembl_standardizer,,,,,,,,,,True,,,,,,,,,,,COMPLETE
92,92,-inf,2024-02-20 00:14:49.549618,2024-02-20 03:14:50.207653,0 days 03:00:00.658035,,,,,,,,,,,,,,,,,,,,,,,,,,,64.0,,,,,,,,,,,,,,,,,,,,256.0,,,,,,,0.5,,,,,,644.0,,,,,,,,,,,,,,,,"[128, 64]",,,,,,,,,,,,,,,,,,,,,,,,,,,,,,,,,,,,,,,,,,,,,,,,,,,,,,,True,,,,,,,,,graph_conv_model,deepchem,,,,,,,,,,,,,,,,,,,,,,,,,,,,,,,,,,,chembl_standardizer,,,,,,,,,,True,,,,,,,,,,,COMPLETE
93,93,-inf,2024-02-20 03:14:50.242258,2024-02-20 06:14:51.857466,0 days 03:00:01.615208,,,,,,,,,,,,,,,,,,,,,,,,,,,64.0,,,,,,,,,,,,,,,,,,,,128.0,,,,,,,0.5,,,,,,558.0,,,,,,,,,,,,,,,,"[256, 128]",,,,,,,,,,,,,,,,,,,,,,,,,,,,,,,,,,,,,,,,,,,,,,,,,,,,,,,True,,,,,,,,,graph_conv_model,deepchem,,,,,,,,,,,,,,,,,,,,,,,,,,,,,,,,,,,chembl_standardizer,,,,,,,,,,True,,,,,,,,,,,COMPLETE
94,94,-inf,2024-02-20 06:14:52.025462,2024-02-20 09:14:52.963562,0 days 03:00:00.938100,,,,,,,,,,,,,,,,,,,,,,,,,,,64.0,,,,,,,,,,,,,,,,,,,,256.0,,,,,,,0.5,,,,,,670.0,,,,,,,,,,,,,,,,"[256, 128, 64]",,,,,,,,,,,,,,,,,,,,,,,,,,,,,,,,,,,,,,,,,,,,,,,,,,,,,,,True,,,,,,,,,graph_conv_model,deepchem,,,,,,,,,,,,,,,,,,,,,,,,,,,,,,,,,,,chembl_standardizer,,,,,,,,,,True,,,,,,,,,,,COMPLETE
95,95,0.7443301332784187,2024-02-20 09:14:53.086654,2024-02-20 11:32:35.001932,0 days 02:17:41.915278,,,,,,,,,,,,,,,,,,,,,,,,,,,64.0,,,,,,,,,,,,,,,,,,,,256.0,,,,,,,0.0,,,,,,403.0,,,,,,,,,,,,,,,,"[128, 64]",,,,,,,,,,,,,,,,,,,,,,,,,,,,,,,,,,,,,,,,,,,,,,,,,,,,,,,True,,,,,,,,,graph_conv_model,deepchem,,,,,,,,,,,,,,,,,,,,,,,,,,,,,,,,,,simple_standardisation,custom_standardizer,,,,,,,,,,True,,,,,,,,,,,COMPLETE
96,96,0.7711570747270076,2024-02-20 11:32:35.033291,2024-02-20 14:13:17.872281,0 days 02:40:42.838990,,,,,,,,,,,,,,,,,,,,,,,,,,,64.0,,,,,,,,,,,,,,,,,,,,256.0,,,,,,,0.5,,,,,,551.0,,,,,,,,,,,,,,,,"[128, 64]",,,,,,,,,,,,,,,,,,,,,,,,,,,,,,,,,,,,,,,,,,,,,,,,,,,,,,,True,,,,,,,,,graph_conv_model,deepchem,,,,,,,,,,,,,,,,,,,,,,,,,,,,,,,,,,,chembl_standardizer,,,,,,,,,,True,,,,,,,,,,,COMPLETE
97,97,0.7658303603738272,2024-02-20 14:13:17.905679,2024-02-20 17:04:05.691206,0 days 02:50:47.785527,,,,,,,,,,,,,,,,,,,,,,,,,,,64.0,,,,,,,,,,,,,,,,,,,,256.0,,,,,,,0.5,,,,,,550.0,,,,,,,,,,,,,,,,"[128, 64]",,,,,,,,,,,,,,,,,,,,,,,,,,,,,,,,,,,,,,,,,,,,,,,,,,,,,,,True,,,,,,,,,graph_conv_model,deepchem,,,,,,,,,,,,,,,,,,,,,,,,,,,,,,,,,,,chembl_standardizer,,,,,,,,,,True,,,,,,,,,,,COMPLETE
98,98,-inf,2024-02-20 17:04:05.731290,2024-02-20 20:04:06.877685,0 days 03:00:01.146395,,,,,,,,,,,,,,,,,,,,,,,,,,,64.0,True,,,,,,,,,,,,,,,,,,,,,,,,,0.5,,,,,,,544.0,,,,,,,,,,,,,,,,,"[64, 128]",,,,,,,,,,,,,,,,,,,,,,,,,,,,,,,,,,,,,,,,,,,,,,,,,,,,,,,,,,,,,,,gcn_model,deepchem,,,,,,,,,,,,,,,,,,,,,,,,,,,0.5,,,,,,,,chembl_standardizer,,,,,,,,,False,,,,True,,,False,,,,,COMPLETE
99,99,-inf,2024-02-20 20:04:07.000212,2024-02-20 23:04:07.504697,0 days 03:00:00.504485,,,,,,,,,,,,,,,,,,,,,,,,,,,8.0,,,,,,,,,,,,,,,,,,,,256.0,,,,,,,0.5,,,,,,606.0,,,,,,,,,,,,,,,,"[128, 64]",,,,,,,,,,,,,,,,,,,,,,,,,,,,,,,,,,,,,,,,,,,,,,,,,,,,,,,True,,,,,,,,,graph_conv_model,deepchem,,,,,,,,,,,,,,,,,,,,,,,,,,,,,,,,,,,chembl_standardizer,,,,,,,,,,True,,,,,,,,,,,COMPLETE
