,number,value,datetime_start,datetime_complete,duration,params_1D_featurizer,params_1d_model,params_2d_model,params_C_passive_aggressive_regressor,params_activation_mlp_regressor,params_algorithm_kneighbors_regressor,params_alpha_mlp_regressor,params_alpha_quantile_regressor,params_attention_dropout_0,params_attention_dropout_1,params_attention_key_dim_0,params_attention_key_dim_1,params_base_estimator_bagging_regressor,params_base_filters,params_batch_normalization_0,params_batch_size_deepchem,params_batchnorm,params_bootstrap_bagging_regressor,params_bootstrap_extra_trees_regressor,params_bootstrap_features,params_bootstrap_random_forest_regressor,params_conv_activation_0,params_conv_activation_1,params_conv_batch_norm_0,params_conv_batch_norm_1,params_conv_dropout_0,params_conv_dropout_1,params_criterion_extra_trees_regressor,params_criterion_random_forest_regressor,params_dense_activation,params_dense_dropout,params_dense_layer_size,params_dense_units,params_depth_dmpnn,params_dropout,params_dropout_attentive_fp,params_dropout_dag,params_dropout_gcn,params_dropout_graph_conv,params_dropout_pagtn,params_dropout_text_cnn,params_dropouts_dtnn,params_dropouts_weave,params_embed_dropout_p,params_embedding_dim,params_embedding_output_dim,params_encoder_dropout_p,params_epochs_deepchem,params_f1,params_f2,params_feature_selector,params_featurizer_type,params_ff_dropout_p,params_filter_0,params_filter_1,params_filters,params_fnn_dropout_p,params_fnn_layers,params_fpSize,params_g_noise,params_gen_dropout_p,params_gen_n_layers,params_graph_conv_layers_conv_model,params_graph_conv_layers_gcn,params_graph_feat_size_attentive_fp,params_gru_dropout_0,params_gru_dropout_1,params_gru_dropout_2,params_gru_units_0,params_gru_units_1,params_gru_units_2,params_hidden_activation_0,params_hidden_dropout_0,params_hidden_layer_sizes_mlp_regressor,params_hidden_layer_units_0,params_k,params_kernel_size_0,params_kernel_size_1,params_kernel_size_smiles_to_vec,params_l1_0,params_l2_0,params_layer_sizes_dag,params_layer_sizes_gather,params_leaf_size_kneighbors_regressor,params_lstm_dropout_0,params_lstm_dropout_1,params_lstm_dropout_2,params_lstm_units_0,params_lstm_units_1,params_lstm_units_2,params_master_atom,params_maxLength,params_maxPath,params_max_features_extra_trees_regressor,params_max_features_random_forest_regressor,params_max_length_pagtn,params_max_path,params_method,params_minLength,params_minPath,params_min_path,params_model_steps,params_model_type,params_nBits,params_n_attention_heads,params_n_attention_layers,params_n_bits,params_n_conv_layers,params_n_embedding_dtnn,params_n_embedding_text_cnn,params_n_encoders,params_n_estimators,params_n_estimators_bagging_regressor,params_n_estimators_extra_trees_regressor,params_n_estimators_random_forest_regressor,params_n_graph_feat_dag,params_n_graph_feat_weave,params_n_gru_layers,params_n_hidden_dtnn,params_n_hidden_layers,params_n_hidden_weave,params_n_layers,params_n_lstm_layers,params_n_neighbors_kneighbors_regressor,params_n_rnn_layers,params_num_heads,params_num_layers_attentive_fp,params_num_layers_pagtn,params_p,params_percentile,params_predictor_dropout_gcn,params_quantile,params_radius,params_regression_model,params_rnn_dropouts_0,params_rnn_units_0,params_sa_dropout_p,params_scaler,params_standardization_type,params_standardize,params_standardizer,params_stride_0,params_stride_1,params_strides,params_support_weak,params_threshold,params_use_chirality_attentive_fp,params_use_chirality_gat,params_use_chirality_gcn,params_use_chirality_graph_conv,params_use_chirality_weave,params_use_edges_gat,params_use_edges_gcn,params_use_partial_charge_attentive_fp,params_use_partial_charge_gat,params_use_partial_charge_gcn,params_weights_kneighbors_regressor,state
98,98,,2024-03-03 01:28:41.344294,2024-03-03 03:06:42.179529,0 days 01:38:00.835235,,,,,,,,,,,,,,,,256.0,,,,,,,,,,,,,,,,,,,,,,,,,,,0.0,,,,,475.0,,,,,,,,,,,,,,,,,,,,,,,,,,,,,,,,,,,,,,,,,,,,,,,,,,,,,,weave_model,deepchem,,,,,,,,,,,,,,64.0,,,,50.0,,,,,,,,,,,,,,,,,,simple_standardisation,,custom_standardizer,,,,,,,,,,True,,,,,,,FAIL
99,99,,2024-03-03 03:06:42.188956,2024-03-03 04:45:33.101631,0 days 01:38:50.912675,,,,,,,,,,,,,,,,256.0,,,,,,,,,,,,,,,,,,,,,,,,,,,0.5,,,,,470.0,,,,,,,,,,,,,,,,,,,,,,,,,,,,,,,,,,,,,,,,,,,,,,,,,,,,,,weave_model,deepchem,,,,,,,,,,,,,,64.0,,,,200.0,,,,,,,,,,,,,,,,,,simple_standardisation,,custom_standardizer,,,,,,,,,,True,,,,,,,FAIL
