,number,value,datetime_start,datetime_complete,duration,params_1D_featurizer,params_1d_model,params_2d_model,params_C_passive_aggressive_regressor,params_activation_mlp_regressor,params_algorithm_kneighbors_regressor,params_alpha_mlp_regressor,params_alpha_quantile_regressor,params_attention_dropout_0,params_attention_dropout_1,params_attention_key_dim_0,params_attention_key_dim_1,params_base_estimator_bagging_regressor,params_base_filters,params_batch_normalization_0,params_batch_size_deepchem,params_batchnorm,params_bootstrap_bagging_regressor,params_bootstrap_extra_trees_regressor,params_bootstrap_features,params_bootstrap_random_forest_regressor,params_conv_activation_0,params_conv_activation_1,params_conv_batch_norm_0,params_conv_batch_norm_1,params_conv_dropout_0,params_conv_dropout_1,params_criterion_extra_trees_regressor,params_criterion_random_forest_regressor,params_dense_activation,params_dense_dropout,params_dense_layer_size,params_dense_units,params_depth_dmpnn,params_dropout,params_dropout_attentive_fp,params_dropout_dag,params_dropout_gcn,params_dropout_graph_conv,params_dropout_pagtn,params_dropout_text_cnn,params_dropouts_dtnn,params_dropouts_weave,params_embed_dropout_p,params_embedding_dim,params_embedding_output_dim,params_encoder_dropout_p,params_epochs_deepchem,params_f1,params_f2,params_feature_selector,params_featurizer_type,params_ff_dropout_p,params_filter_0,params_filter_1,params_filters,params_fnn_dropout_p,params_fnn_layers,params_fpSize,params_g_noise,params_gen_dropout_p,params_gen_n_layers,params_graph_conv_layers_conv_model,params_graph_conv_layers_gcn,params_graph_feat_size_attentive_fp,params_gru_dropout_0,params_gru_dropout_1,params_gru_dropout_2,params_gru_units_0,params_gru_units_1,params_gru_units_2,params_hidden_activation_0,params_hidden_dropout_0,params_hidden_layer_sizes_mlp_regressor,params_hidden_layer_units_0,params_k,params_kernel_size_0,params_kernel_size_1,params_kernel_size_smiles_to_vec,params_l1_0,params_l2_0,params_layer_sizes_dag,params_layer_sizes_gather,params_leaf_size_kneighbors_regressor,params_lstm_dropout_0,params_lstm_dropout_1,params_lstm_dropout_2,params_lstm_units_0,params_lstm_units_1,params_lstm_units_2,params_master_atom,params_maxLength,params_maxPath,params_max_features_extra_trees_regressor,params_max_features_random_forest_regressor,params_max_length_pagtn,params_max_path,params_method,params_minLength,params_minPath,params_min_path,params_model_steps,params_model_type,params_nBits,params_n_attention_heads,params_n_attention_layers,params_n_bits,params_n_conv_layers,params_n_embedding_dtnn,params_n_embedding_text_cnn,params_n_encoders,params_n_estimators,params_n_estimators_bagging_regressor,params_n_estimators_extra_trees_regressor,params_n_estimators_random_forest_regressor,params_n_graph_feat_dag,params_n_graph_feat_weave,params_n_gru_layers,params_n_hidden_dtnn,params_n_hidden_layers,params_n_hidden_weave,params_n_layers,params_n_lstm_layers,params_n_neighbors_kneighbors_regressor,params_n_rnn_layers,params_num_heads,params_num_layers_attentive_fp,params_num_layers_pagtn,params_p,params_percentile,params_predictor_dropout_gcn,params_quantile,params_radius,params_regression_model,params_rnn_dropouts_0,params_rnn_units_0,params_sa_dropout_p,params_scaler,params_standardization_type,params_standardize,params_standardizer,params_stride_0,params_stride_1,params_strides,params_support_weak,params_threshold,params_use_chirality_attentive_fp,params_use_chirality_gat,params_use_chirality_gcn,params_use_chirality_graph_conv,params_use_chirality_weave,params_use_edges_gat,params_use_edges_gcn,params_use_partial_charge_attentive_fp,params_use_partial_charge_gat,params_use_partial_charge_gcn,params_weights_kneighbors_regressor,state
42,42,,2024-02-29 00:09:34.262057,2024-02-29 01:27:49.203528,0 days 01:18:14.941471,,,,,,,,,,,,,,,,64.0,,,,,,,,,,,,,,,,,,,,,,,,,,,0.5,,,,,474.0,,,,,,,,,,,,,,,,,,,,,,,,,,,,,,,,,,,,,,,,,,,,,,,,,,,,,,weave_model,deepchem,,,,,,,,,,,,,,128.0,,,,100.0,,,,,,,,,,,,,,,,,,,,chembl_standardizer,,,,,,,,,,False,,,,,,,FAIL
43,43,,2024-02-29 01:27:49.235588,2024-02-29 02:43:47.377677,0 days 01:15:58.142089,,,,,,,,,,,,,,,,64.0,,,,,,,,,,,,,,,,,,,,,,,,,,,0.5,,,,,458.0,,,,,,,,,,,,,,,,,,,,,,,,,,,,,,,,,,,,,,,,,,,,,,,,,,,,,,weave_model,deepchem,,,,,,,,,,,,,,128.0,,,,50.0,,,,,,,,,,,,,,,,,,,,chembl_standardizer,,,,,,,,,,True,,,,,,,FAIL
44,44,,2024-02-29 02:43:47.391008,2024-02-29 04:09:50.044328,0 days 01:26:02.653320,,,,,,,,,,,,,,,,64.0,,,,,,,,,,,,,,,,,,,,,,,,,,,0.25,,,,,459.0,,,,,,,,,,,,,,,,,,,,,,,,,,,,,,,,,,,,,,,,,,,,,,,,,,,,,,weave_model,deepchem,,,,,,,,,,,,,,256.0,,,,50.0,,,,,,,,,,,,,,,,,,,,chembl_standardizer,,,,,,,,,,False,,,,,,,FAIL
45,45,,2024-02-29 04:09:50.056162,2024-02-29 05:21:15.256111,0 days 01:11:25.199949,,,,,,,,,,,,,,,,64.0,,,,,,,,,,,,,,,,,,,,,,,,,,,0.0,,,,,460.0,,,,,,,,,,,,,,,,,,,,,,,,,,,,,,,,,,,,,,,,,,,,,,,,,,,,,,weave_model,deepchem,,,,,,,,,,,,,,64.0,,,,50.0,,,,,,,,,,,,,,,,,,,,chembl_standardizer,,,,,,,,,,False,,,,,,,FAIL
46,46,,2024-02-29 05:21:15.270414,2024-02-29 06:43:06.919529,0 days 01:21:51.649115,,,,,,,,,,,,,,,,64.0,,,,,,,,,,,,,,,,,,,,,,,,,,,0.5,,,,,458.0,,,,,,,,,,,,,,,,,,,,,,,,,,,,,,,,,,,,,,,,,,,,,,,,,,,,,,weave_model,deepchem,,,,,,,,,,,,,,256.0,,,,50.0,,,,,,,,,,,,,,,,,,,,chembl_standardizer,,,,,,,,,,False,,,,,,,FAIL
47,47,0.3858489448631395,2024-02-29 06:43:06.933475,2024-02-29 07:35:21.147055,0 days 00:52:14.213580,,,,,,,,,,,,,,,,64.0,,,,,,,,,,,,,,,,,,4.0,,,,,,,,,,,,,,431.0,,,,,,,,,0.0,1.0,,,,,,,,,,,,,,,,,,,,,,,,,,,,,,,,,,,,,,,,,,,,dmpnn_model,deepchem,,,,,,,,,,,,,,,,,,,,,,,,,,,,,,,,,,,,,,chembl_standardizer,,,,,,,,,,,,,,,,,COMPLETE
48,48,0.27973745339643147,2024-02-29 07:35:21.168803,2024-02-29 07:53:56.958411,0 days 00:18:35.789608,morgan,,,,,,,0.7360157523437146,,,,,,,,,,,,,,,,,,,,,,,,,,,,,,,,,,,,,,,,,,,percentil_fs,,,,,,,,,,,,,,,,,,,,,,,,,,,,,,,,,,,,,,,,,,,,,,,,,,,,sklearn,,,,2048.0,,,,,,,,,,,,,,,,,,,,,,,0.0,,0.5255003423850355,4.0,quantile_regressor_model,,,,,,,chembl_standardizer,,,,,,,,,,,,,,,,,COMPLETE
49,49,-inf,2024-02-29 07:53:56.993160,2024-02-29 07:53:57.141017,0 days 00:00:00.147857,2d_descriptors,keras_dense,,,,,,,,,,,,,True,,,,,,,,,,,,,,,,,,,,,,,,,,,,,,,,,,,,,1D,,,,,,,,,,,,,,,,,,,,tanh,0.7967800915315651,,56.0,,,,,0.00494107222665153,2.200759678882236e-06,,,,,,,,,,,,,,,,,yeo-johnson,,,,,keras,,,,,,,,,,,,,,,,,1.0,,,,,,,,,,,,,,,,,,power_transformer,,True,,,,,,,,,,,,,,,,,,COMPLETE
50,50,,2024-02-29 07:53:57.157288,2024-02-29 09:33:14.516793,0 days 01:39:17.359505,,,,,,,,,,,,,,,,64.0,,,,,,,,,,,,,,,,,,,,,,,,,,,0.5,,,,,453.0,,,,,,,,,,,,,,,,,,,,,,,,,,,,,,,,,,,,,,,,,,,,,,,,,,,,,,weave_model,deepchem,,,,,,,,,,,,,,256.0,,,,100.0,,,,,,,,,,,,,,,,,,,,basic_standardizer,,,,,,,,,,True,,,,,,,FAIL
51,51,,2024-02-29 09:33:14.533888,2024-02-29 11:07:51.065419,0 days 01:34:36.531531,,,,,,,,,,,,,,,,64.0,,,,,,,,,,,,,,,,,,,,,,,,,,,0.0,,,,,448.0,,,,,,,,,,,,,,,,,,,,,,,,,,,,,,,,,,,,,,,,,,,,,,,,,,,,,,weave_model,deepchem,,,,,,,,,,,,,,64.0,,,,50.0,,,,,,,,,,,,,,,,,,,,basic_standardizer,,,,,,,,,,False,,,,,,,FAIL
52,52,,2024-02-29 11:07:51.095452,2024-02-29 12:29:34.057159,0 days 01:21:42.961707,,,,,,,,,,,,,,,,64.0,,,,,,,,,,,,,,,,,,,,,,,,,,,0.5,,,,,464.0,,,,,,,,,,,,,,,,,,,,,,,,,,,,,,,,,,,,,,,,,,,,,,,,,,,,,,weave_model,deepchem,,,,,,,,,,,,,,128.0,,,,100.0,,,,,,,,,,,,,,,,,,,,basic_standardizer,,,,,,,,,,False,,,,,,,FAIL
53,53,,2024-02-29 12:29:34.069440,2024-02-29 13:48:35.727395,0 days 01:19:01.657955,,,,,,,,,,,,,,,,64.0,,,,,,,,,,,,,,,,,,,,,,,,,,,0.5,,,,,464.0,,,,,,,,,,,,,,,,,,,,,,,,,,,,,,,,,,,,,,,,,,,,,,,,,,,,,,weave_model,deepchem,,,,,,,,,,,,,,64.0,,,,200.0,,,,,,,,,,,,,,,,,,,,basic_standardizer,,,,,,,,,,False,,,,,,,FAIL
54,54,,2024-02-29 13:48:35.739770,2024-02-29 15:08:12.236857,0 days 01:19:36.497087,,,,,,,,,,,,,,,,64.0,,,,,,,,,,,,,,,,,,,,,,,,,,,0.25,,,,,443.0,,,,,,,,,,,,,,,,,,,,,,,,,,,,,,,,,,,,,,,,,,,,,,,,,,,,,,weave_model,deepchem,,,,,,,,,,,,,,128.0,,,,200.0,,,,,,,,,,,,,,,,,,,,basic_standardizer,,,,,,,,,,True,,,,,,,FAIL
55,55,,2024-02-29 15:08:12.248957,2024-02-29 16:48:01.436016,0 days 01:39:49.187059,,,,,,,,,,,,,,,,64.0,,,,,,,,,,,,,,,,,,,,,,,,,,,0.0,,,,,444.0,,,,,,,,,,,,,,,,,,,,,,,,,,,,,,,,,,,,,,,,,,,,,,,,,,,,,,weave_model,deepchem,,,,,,,,,,,,,,256.0,,,,50.0,,,,,,,,,,,,,,,,,,,,basic_standardizer,,,,,,,,,,True,,,,,,,FAIL
56,56,,2024-02-29 16:48:02.060293,2024-02-29 19:41:25.866724,0 days 02:53:23.806431,,,,,,,,,,,,,,,,64.0,,,,,,,,,,,,,,,,,,,,,,,,,,,0.25,,,,,457.0,,,,,,,,,,,,,,,,,,,,,,,,,,,,,,,,,,,,,,,,,,,,,,,,,,,,,,weave_model,deepchem,,,,,,,,,,,,,,128.0,,,,100.0,,,,,,,,,,,,,,,,,,,,basic_standardizer,,,,,,,,,,True,,,,,,,FAIL
57,57,,2024-02-29 19:41:25.889349,2024-02-29 21:25:04.994766,0 days 01:43:39.105417,,,,,,,,,,,,,,,,64.0,,,,,,,,,,,,,,,,,,,,,,,,,,,0.25,,,,,446.0,,,,,,,,,,,,,,,,,,,,,,,,,,,,,,,,,,,,,,,,,,,,,,,,,,,,,,weave_model,deepchem,,,,,,,,,,,,,,128.0,,,,200.0,,,,,,,,,,,,,,,,,,,,chembl_standardizer,,,,,,,,,,False,,,,,,,FAIL
58,58,,2024-02-29 21:25:05.034131,2024-02-29 22:43:55.363877,0 days 01:18:50.329746,,,,,,,,,,,,,,,,64.0,,,,,,,,,,,,,,,,,,,,,,,,,,,0.0,,,,,455.0,,,,,,,,,,,,,,,,,,,,,,,,,,,,,,,,,,,,,,,,,,,,,,,,,,,,,,weave_model,deepchem,,,,,,,,,,,,,,128.0,,,,100.0,,,,,,,,,,,,,,,,,,,,basic_standardizer,,,,,,,,,,True,,,,,,,FAIL
59,59,,2024-02-29 22:43:55.376413,2024-03-01 00:07:57.132977,0 days 01:24:01.756564,,,,,,,,,,,,,,,,64.0,,,,,,,,,,,,,,,,,,,,,,,,,,,0.0,,,,,447.0,,,,,,,,,,,,,,,,,,,,,,,,,,,,,,,,,,,,,,,,,,,,,,,,,,,,,,weave_model,deepchem,,,,,,,,,,,,,,256.0,,,,100.0,,,,,,,,,,,,,,,,,,,,basic_standardizer,,,,,,,,,,False,,,,,,,FAIL
60,60,0.35177993810039604,2024-03-01 00:07:57.146917,2024-03-01 01:14:28.865232,0 days 01:06:31.718315,,,,,,,,,,,,,,,,64.0,False,,,,,,,,,,,,,,,,,,,,,0.0,,,,,,,,,,441.0,,,,,,,,,,,,,,,,"[32, 64]",,,,,,,,,,,,,,,,,,,,,,,,,,,,,,,,,,,,,,gcn_model,deepchem,,,,,,,,,,,,,,,,,,,,,,,,,,,,0.5,,,,,,,,,,basic_standardizer,,,,,,,,False,,,,True,,,True,,COMPLETE
61,61,0.10805728057527342,2024-03-01 01:14:28.885005,2024-03-01 01:40:00.823660,0 days 00:25:31.938655,rdk,,,,,,,,,,,,,,,,,,False,,,,,,,,,absolute_error,,,,,,,,,,,,,,,,,,,,,,,k_best,,,,,,,,2048.0,,,,,,,,,,,,,,,,,5.0,,,,,,,,,,,,,,,,,,log2,,,5.0,,,,3.0,,sklearn,,,,,,,,,,,900.0,,,,,,,,,,,,,,,,,,,,extra_trees_regressor_model,,,,,heavy_standardisation,,custom_standardizer,,,,,,,,,,,,,,,,,COMPLETE
62,62,0.39555148790467504,2024-03-01 01:40:00.889091,2024-03-01 02:24:25.424156,0 days 00:44:24.535065,,,,,,,,,,,,,,,,64.0,,,,,,,,,,,,,,,,,,4.0,,,,,,,,,,,,,,333.0,,,,,,,,,0.0,1.0,,,,,,,,,,,,,,,,,,,,,,,,,,,,,,,,,,,,,,,,,,,,dmpnn_model,deepchem,,,,,,,,,,,,,,,,,,,,,,,,,,,,,,,,,,,,,,chembl_standardizer,,,,,,,,,,,,,,,,,COMPLETE
63,63,,2024-03-01 02:24:25.497728,2024-03-01 03:58:30.603550,0 days 01:34:05.105822,,,,,,,,,,,,,,,,64.0,,,,,,,,,,,,,,,,,,,,,,,,,,,0.0,,,,,346.0,,,,,,,,,,,,,,,,,,,,,,,,,,,,,,,,,,,,,,,,,,,,,,,,,,,,,,weave_model,deepchem,,,,,,,,,,,,,,256.0,,,,200.0,,,,,,,,,,,,,,,,,,,,chembl_standardizer,,,,,,,,,,True,,,,,,,FAIL
64,64,,2024-03-01 03:58:30.618986,2024-03-01 05:11:28.712314,0 days 01:12:58.093328,,,,,,,,,,,,,,,,64.0,,,,,,,,,,,,,,,,,,,,,,,,,,,0.25,,,,,339.0,,,,,,,,,,,,,,,,,,,,,,,,,,,,,,,,,,,,,,,,,,,,,,,,,,,,,,weave_model,deepchem,,,,,,,,,,,,,,128.0,,,,200.0,,,,,,,,,,,,,,,,,,,,chembl_standardizer,,,,,,,,,,True,,,,,,,FAIL
65,65,,2024-03-01 05:11:28.722294,2024-03-01 06:19:07.331126,0 days 01:07:38.608832,,,,,,,,,,,,,,,,64.0,,,,,,,,,,,,,,,,,,,,,,,,,,,0.5,,,,,320.0,,,,,,,,,,,,,,,,,,,,,,,,,,,,,,,,,,,,,,,,,,,,,,,,,,,,,,weave_model,deepchem,,,,,,,,,,,,,,128.0,,,,200.0,,,,,,,,,,,,,,,,,,,,chembl_standardizer,,,,,,,,,,True,,,,,,,FAIL
66,66,0.3970419575880849,2024-03-01 06:19:07.342704,2024-03-01 07:30:18.741353,0 days 01:11:11.398649,,,,,,,,,,,,,,,,64.0,,,,,,,,,,,,,,,,,,4.0,,,,,,,,,,,,,,354.0,,,,,,,,,0.0,1.0,,,,,,,,,,,,,,,,,,,,,,,,,,,,,,,,,,,,,,,,,,,,dmpnn_model,deepchem,,,,,,,,,,,,,,,,,,,,,,,,,,,,,,,,,,,,,,chembl_standardizer,,,,,,,,,,,,,,,,,COMPLETE
67,67,,2024-03-01 07:30:18.781617,2024-03-01 08:48:20.193879,0 days 01:18:01.412262,,,,,,,,,,,,,,,,64.0,,,,,,,,,,,,,,,,,,,,,,,,,,,0.25,,,,,320.0,,,,,,,,,,,,,,,,,,,,,,,,,,,,,,,,,,,,,,,,,,,,,,,,,,,,,,weave_model,deepchem,,,,,,,,,,,,,,256.0,,,,50.0,,,,,,,,,,,,,,,,,,,,chembl_standardizer,,,,,,,,,,False,,,,,,,FAIL
68,68,,2024-03-01 08:48:20.228430,2024-03-01 09:57:33.148943,0 days 01:09:12.920513,,,,,,,,,,,,,,,,64.0,,,,,,,,,,,,,,,,,,,,,,,,,,,0.0,,,,,323.0,,,,,,,,,,,,,,,,,,,,,,,,,,,,,,,,,,,,,,,,,,,,,,,,,,,,,,weave_model,deepchem,,,,,,,,,,,,,,64.0,,,,50.0,,,,,,,,,,,,,,,,,,,,chembl_standardizer,,,,,,,,,,False,,,,,,,FAIL
69,69,,2024-03-01 09:57:33.162588,2024-03-01 11:04:52.792513,0 days 01:07:19.629925,,,,,,,,,,,,,,,,64.0,,,,,,,,,,,,,,,,,,,,,,,,,,,0.5,,,,,316.0,,,,,,,,,,,,,,,,,,,,,,,,,,,,,,,,,,,,,,,,,,,,,,,,,,,,,,weave_model,deepchem,,,,,,,,,,,,,,64.0,,,,100.0,,,,,,,,,,,,,,,,,,,,chembl_standardizer,,,,,,,,,,False,,,,,,,FAIL
70,70,,2024-03-01 11:04:52.804511,2024-03-01 12:11:15.891724,0 days 01:06:23.087213,,,,,,,,,,,,,,,,64.0,,,,,,,,,,,,,,,,,,,,,,,,,,,0.25,,,,,319.0,,,,,,,,,,,,,,,,,,,,,,,,,,,,,,,,,,,,,,,,,,,,,,,,,,,,,,weave_model,deepchem,,,,,,,,,,,,,,64.0,,,,100.0,,,,,,,,,,,,,,,,,,,,chembl_standardizer,,,,,,,,,,True,,,,,,,FAIL
71,71,,2024-03-01 12:11:15.901982,2024-03-01 13:14:48.810404,0 days 01:03:32.908422,,,,,,,,,,,,,,,,64.0,,,,,,,,,,,,,,,,,,,,,,,,,,,0.0,,,,,321.0,,,,,,,,,,,,,,,,,,,,,,,,,,,,,,,,,,,,,,,,,,,,,,,,,,,,,,weave_model,deepchem,,,,,,,,,,,,,,64.0,,,,50.0,,,,,,,,,,,,,,,,,,,,chembl_standardizer,,,,,,,,,,False,,,,,,,FAIL
72,72,,2024-03-01 13:14:48.824240,2024-03-01 14:31:55.152243,0 days 01:17:06.328003,,,,,,,,,,,,,,,,64.0,,,,,,,,,,,,,,,,,,,,,,,,,,,0.5,,,,,355.0,,,,,,,,,,,,,,,,,,,,,,,,,,,,,,,,,,,,,,,,,,,,,,,,,,,,,,weave_model,deepchem,,,,,,,,,,,,,,256.0,,,,100.0,,,,,,,,,,,,,,,,,,,,chembl_standardizer,,,,,,,,,,True,,,,,,,FAIL
73,73,,2024-03-01 14:31:55.165632,2024-03-01 15:37:01.298125,0 days 01:05:06.132493,,,,,,,,,,,,,,,,64.0,,,,,,,,,,,,,,,,,,,,,,,,,,,0.5,,,,,306.0,,,,,,,,,,,,,,,,,,,,,,,,,,,,,,,,,,,,,,,,,,,,,,,,,,,,,,weave_model,deepchem,,,,,,,,,,,,,,64.0,,,,100.0,,,,,,,,,,,,,,,,,,,,chembl_standardizer,,,,,,,,,,False,,,,,,,FAIL
74,74,,2024-03-01 15:37:01.311966,2024-03-01 16:48:03.734659,0 days 01:11:02.422693,,,,,,,,,,,,,,,,64.0,,,,,,,,,,,,,,,,,,,,,,,,,,,0.0,,,,,321.0,,,,,,,,,,,,,,,,,,,,,,,,,,,,,,,,,,,,,,,,,,,,,,,,,,,,,,weave_model,deepchem,,,,,,,,,,,,,,128.0,,,,100.0,,,,,,,,,,,,,,,,,,,,chembl_standardizer,,,,,,,,,,True,,,,,,,FAIL
75,75,0.38424036062028444,2024-03-01 16:48:03.744398,2024-03-01 17:24:03.571428,0 days 00:35:59.827030,,,,,,,,,,,,,,,,64.0,,,,,,,,,,,,,,,,128.0,,,,,,,0.0,,,,,,,,,298.0,,,,,,,,,,,,,,,"[128, 64]",,,,,,,,,,,,,,,,,,,,,,,,,,,,False,,,,,,,,,,,graph_conv_model,deepchem,,,,,,,,,,,,,,,,,,,,,,,,,,,,,,,,,,,,,,chembl_standardizer,,,,,,,,,False,,,,,,,,COMPLETE
76,76,,2024-03-01 17:24:03.589614,2024-03-01 18:45:34.653202,0 days 01:21:31.063588,,,,,,,,,,,,,,,,256.0,,,,,,,,,,,,,,,,,,,,,,,,,,,0.0,,,,,345.0,,,,,,,,,,,,,,,,,,,,,,,,,,,,,,,,,,,,,,,,,,,,,,,,,,,,,,weave_model,deepchem,,,,,,,,,,,,,,128.0,,,,100.0,,,,,,,,,,,,,,,,,,,,chembl_standardizer,,,,,,,,,,False,,,,,,,FAIL
77,77,0.3606898998559311,2024-03-01 18:45:34.666617,2024-03-01 19:33:33.031187,0 days 00:47:58.364570,,,,,,,,,,,,,,,,256.0,,,,,,,,,,,,,,,,,,2.0,,,,,,,,,,,,,,317.0,,,,,,,,,0.0,2.0,,,,,,,,,,,,,,,,,,,,,,,,,,,,,,,,,,,,,,,,,,,,dmpnn_model,deepchem,,,,,,,,,,,,,,,,,,,,,,,,,,,,,,,,,,,,,,chembl_standardizer,,,,,,,,,,,,,,,,,COMPLETE
78,78,,2024-03-01 19:33:33.056074,2024-03-01 22:13:41.105167,0 days 02:40:08.049093,,,,,,,,,,,,,,,,8.0,,,,,,,,,,,,,,,,,,,,,,,,,,,0.25,,,,,499.0,,,,,,,,,,,,,,,,,,,,,,,,,,,,,,,,,,,,,,,,,,,,,,,,,,,,,,weave_model,deepchem,,,,,,,,,,,,,,128.0,,,,200.0,,,,,,,,,,,,,,,,,,,,basic_standardizer,,,,,,,,,,True,,,,,,,FAIL
79,79,0.36344686419378686,2024-03-01 22:13:41.115460,2024-03-01 23:25:27.599578,0 days 01:11:46.484118,,,,,,,,,,,,,,,,8.0,,,,,,,,,,,,,,,,,,3.0,,,,,,,,,,,,,,481.0,,,,,,,,,0.0,1.0,,,,,,,,,,,,,,,,,,,,,,,,,,,,,,,,,,,,,,,,,,,,dmpnn_model,deepchem,,,,,,,,,,,,,,,,,,,,,,,,,,,,,,,,,,,,,,basic_standardizer,,,,,,,,,,,,,,,,,COMPLETE
80,80,-inf,2024-03-01 23:25:27.614687,2024-03-01 23:26:24.841380,0 days 00:00:57.226693,,,keras_bidirectional_rnn,,,,,,,,,,,,,,,,,,,,,,,,,,,tanh,0.4764382627392893,,160.0,,,,,,,,,,,,,,,,,,,2D,,,,,,,,,,,,,,0.4948376882423058,0.0473688672309156,0.4984233298466055,122.0,255.0,256.0,,,,,,,,,,,,,,0.036506632275941586,,,251.0,,,,,,,,,,,,,,,keras,,,,,,,,,,,,,,,3.0,,,,,1.0,,,,,,,,,,,,,,,,,,,,,,,,,,,,,,,,,,,COMPLETE
81,81,,2024-03-01 23:26:24.855076,2024-03-02 00:41:30.630524,0 days 01:15:05.775448,,,,,,,,,,,,,,,,32.0,,,,,,,,,,,,,,,,,,,,,,,,,,,0.25,,,,,306.0,,,,,,,,,,,,,,,,,,,,,,,,,,,,,,,,,,,,,,,,,,,,,,,,,,,,,,weave_model,deepchem,,,,,,,,,,,,,,128.0,,,,200.0,,,,,,,,,,,,,,,,,,,,chembl_standardizer,,,,,,,,,,True,,,,,,,FAIL
82,82,,2024-03-02 00:41:30.640103,2024-03-02 02:08:32.070107,0 days 01:27:01.430004,,,,,,,,,,,,,,,,32.0,,,,,,,,,,,,,,,,,,,,,,,,,,,0.5,,,,,352.0,,,,,,,,,,,,,,,,,,,,,,,,,,,,,,,,,,,,,,,,,,,,,,,,,,,,,,weave_model,deepchem,,,,,,,,,,,,,,256.0,,,,50.0,,,,,,,,,,,,,,,,,,,,chembl_standardizer,,,,,,,,,,False,,,,,,,FAIL
83,83,,2024-03-02 02:08:32.079997,2024-03-02 03:27:06.762099,0 days 01:18:34.682102,,,,,,,,,,,,,,,,32.0,,,,,,,,,,,,,,,,,,,,,,,,,,,0.0,,,,,361.0,,,,,,,,,,,,,,,,,,,,,,,,,,,,,,,,,,,,,,,,,,,,,,,,,,,,,,weave_model,deepchem,,,,,,,,,,,,,,64.0,,,,100.0,,,,,,,,,,,,,,,,,,,,chembl_standardizer,,,,,,,,,,False,,,,,,,FAIL
84,84,,2024-03-02 03:27:06.771838,2024-03-02 04:55:14.629579,0 days 01:28:07.857741,,,,,,,,,,,,,,,,32.0,,,,,,,,,,,,,,,,,,,,,,,,,,,0.25,,,,,348.0,,,,,,,,,,,,,,,,,,,,,,,,,,,,,,,,,,,,,,,,,,,,,,,,,,,,,,weave_model,deepchem,,,,,,,,,,,,,,256.0,,,,200.0,,,,,,,,,,,,,,,,,,,,chembl_standardizer,,,,,,,,,,True,,,,,,,FAIL
85,85,,2024-03-02 04:55:14.639992,2024-03-02 06:23:42.488116,0 days 01:28:27.848124,,,,,,,,,,,,,,,,32.0,,,,,,,,,,,,,,,,,,,,,,,,,,,0.25,,,,,357.0,,,,,,,,,,,,,,,,,,,,,,,,,,,,,,,,,,,,,,,,,,,,,,,,,,,,,,weave_model,deepchem,,,,,,,,,,,,,,256.0,,,,50.0,,,,,,,,,,,,,,,,,,,,chembl_standardizer,,,,,,,,,,False,,,,,,,FAIL
86,86,,2024-03-02 06:23:42.497757,2024-03-02 07:45:19.975279,0 days 01:21:37.477522,,,,,,,,,,,,,,,,32.0,,,,,,,,,,,,,,,,,,,,,,,,,,,0.0,,,,,377.0,,,,,,,,,,,,,,,,,,,,,,,,,,,,,,,,,,,,,,,,,,,,,,,,,,,,,,weave_model,deepchem,,,,,,,,,,,,,,64.0,,,,100.0,,,,,,,,,,,,,,,,,,,,chembl_standardizer,,,,,,,,,,False,,,,,,,FAIL
87,87,,2024-03-02 07:45:19.985164,2024-03-02 09:10:34.428976,0 days 01:25:14.443812,,,,,,,,,,,,,,,,32.0,,,,,,,,,,,,,,,,,,,,,,,,,,,0.5,,,,,359.0,,,,,,,,,,,,,,,,,,,,,,,,,,,,,,,,,,,,,,,,,,,,,,,,,,,,,,weave_model,deepchem,,,,,,,,,,,,,,128.0,,,,50.0,,,,,,,,,,,,,,,,,,,,chembl_standardizer,,,,,,,,,,True,,,,,,,FAIL
88,88,,2024-03-02 09:10:34.440298,2024-03-02 10:45:02.445501,0 days 01:34:28.005203,,,,,,,,,,,,,,,,32.0,,,,,,,,,,,,,,,,,,,,,,,,,,,0.25,,,,,388.0,,,,,,,,,,,,,,,,,,,,,,,,,,,,,,,,,,,,,,,,,,,,,,,,,,,,,,weave_model,deepchem,,,,,,,,,,,,,,256.0,,,,50.0,,,,,,,,,,,,,,,,,,,,chembl_standardizer,,,,,,,,,,True,,,,,,,FAIL
89,89,,2024-03-02 10:45:02.455297,2024-03-02 12:04:23.020336,0 days 01:19:20.565039,,,,,,,,,,,,,,,,32.0,,,,,,,,,,,,,,,,,,,,,,,,,,,0.25,,,,,355.0,,,,,,,,,,,,,,,,,,,,,,,,,,,,,,,,,,,,,,,,,,,,,,,,,,,,,,weave_model,deepchem,,,,,,,,,,,,,,64.0,,,,50.0,,,,,,,,,,,,,,,,,,,,chembl_standardizer,,,,,,,,,,True,,,,,,,FAIL
90,90,,2024-03-02 12:04:23.030076,2024-03-02 13:35:32.527211,0 days 01:31:09.497135,,,,,,,,,,,,,,,,32.0,,,,,,,,,,,,,,,,,,,,,,,,,,,0.25,,,,,351.0,,,,,,,,,,,,,,,,,,,,,,,,,,,,,,,,,,,,,,,,,,,,,,,,,,,,,,weave_model,deepchem,,,,,,,,,,,,,,256.0,,,,100.0,,,,,,,,,,,,,,,,,,,,chembl_standardizer,,,,,,,,,,False,,,,,,,FAIL
91,91,-inf,2024-03-02 13:35:32.537068,2024-03-02 16:35:32.614908,0 days 03:00:00.077840,,,,,,,,,,,,,,,,32.0,,,,,,,,,,,,,,,,,,,,,,,,,,,,,32.0,,,347.0,,,,,,,,32.0,,,,,,,,,,,,,,,,,,,,,,,7.0,,,,,,,,,,,,,,,,,,,,,,,smiles_to_vec_model,deepchem,,,,,,,,,,,,,,,,,,,,,,,,,,,,,,,,,,,,,,chembl_standardizer,,,3.0,,,,,,,,,,,,,,COMPLETE
92,92,-inf,2024-03-02 16:35:32.634763,2024-03-02 16:38:10.344535,0 days 00:02:37.709772,,,,,,,,,,,,,,,,512.0,,,,,,,,,,,,,,,,,,,,,,,,,,,,0.0,,,0.0,251.0,,,,,0.0,,,,,,,,0.0,3.0,,,,,,,,,,,,,,,,,,,,,,,,,,,,,,,,,,,,,,,,mat_model,deepchem,,,,,,,,10.0,,,,,,,,,,,3.0,,,,,,,,,,,,,,,0.5,,,,chembl_standardizer,,,,,,,,,,,,,,,,,COMPLETE
93,93,,2024-03-02 16:38:10.361711,2024-03-02 18:50:35.468217,0 days 02:12:25.106506,,,,,,,,,,,,,,,,64.0,,,,,,,,,,,,,,,,,,,,,,,,,,,0.0,,,,,870.0,,,,,,,,,,,,,,,,,,,,,,,,,,,,,,,,,,,,,,,,,,,,,,,,,,,,,,weave_model,deepchem,,,,,,,,,,,,,,256.0,,,,50.0,,,,,,,,,,,,,,,,,,,,pass_through_standardizer,,,,,,,,,,True,,,,,,,FAIL
94,94,,2024-03-02 18:50:35.480432,2024-03-02 20:03:25.916876,0 days 01:12:50.436444,,,,,,,,,,,,,,,,64.0,,,,,,,,,,,,,,,,,,,,,,,,,,,0.5,,,,,464.0,,,,,,,,,,,,,,,,,,,,,,,,,,,,,,,,,,,,,,,,,,,,,,,,,,,,,,weave_model,deepchem,,,,,,,,,,,,,,64.0,,,,200.0,,,,,,,,,,,,,,,,,,,,pass_through_standardizer,,,,,,,,,,True,,,,,,,FAIL
95,95,,2024-03-02 20:03:25.927409,2024-03-02 21:17:00.239759,0 days 01:13:34.312350,,,,,,,,,,,,,,,,64.0,,,,,,,,,,,,,,,,,,,,,,,,,,,0.25,,,,,473.0,,,,,,,,,,,,,,,,,,,,,,,,,,,,,,,,,,,,,,,,,,,,,,,,,,,,,,weave_model,deepchem,,,,,,,,,,,,,,64.0,,,,100.0,,,,,,,,,,,,,,,,,,,,pass_through_standardizer,,,,,,,,,,True,,,,,,,FAIL
96,96,,2024-03-02 21:17:00.249765,2024-03-02 22:29:18.805592,0 days 01:12:18.555827,,,,,,,,,,,,,,,,64.0,,,,,,,,,,,,,,,,,,,,,,,,,,,0.25,,,,,465.0,,,,,,,,,,,,,,,,,,,,,,,,,,,,,,,,,,,,,,,,,,,,,,,,,,,,,,weave_model,deepchem,,,,,,,,,,,,,,64.0,,,,50.0,,,,,,,,,,,,,,,,,,,,pass_through_standardizer,,,,,,,,,,False,,,,,,,FAIL
97,97,0.37252114880105097,2024-03-02 22:29:18.815373,2024-03-03 01:28:41.329443,0 days 02:59:22.514070,,,,,,,,,,,,,,,,64.0,,,,,,,,,,,,,,,,,,,,,,,,0.5,,,,,,,,862.0,,,,,,,,,,,,,,,,,,,,,,,,,,,,,,,,,,,,,,,,,,,,,,,,19.0,,,,,,pagtn_model,deepchem,,,,,,,,,,,,,,,,,,,,,,,2.0,,5.0,,,,,,,,,,,,,pass_through_standardizer,,,,,,,,,,,,,,,,,COMPLETE
