,number,value,datetime_start,datetime_complete,duration,params_1D_featurizer,params_1d_model,params_2d_model,params_C_linear_svc,params_Cs_logistic_regression_cv,params_algorithm_kneighbors_classifier,params_alpha_complement_nb,params_alpha_multinomial_nb,params_alpha_ridge_classifier_cv,params_attention_dropout_0,params_attention_dropout_1,params_attention_dropout_2,params_attention_dropout_3,params_attention_key_dim_0,params_attention_key_dim_1,params_attention_key_dim_2,params_attention_key_dim_3,params_base_filters,params_batch_normalization_0,params_batch_normalization_1,params_batch_normalization_2,params_batch_normalization_3,params_batch_size_1d_conv,params_batch_size_bi_rnn,params_batch_size_deepchem,params_batch_size_fcnn,params_batch_size_rnn,params_batch_size_simple_rnn,params_batch_size_tabular_transformer,params_batchnorm,params_classification_model,params_conv_activation_0,params_conv_activation_1,params_conv_batch_norm_0,params_conv_batch_norm_1,params_conv_dropout_0,params_conv_dropout_1,params_criterion_decision_tree,params_degree_one_class_svm,params_dense_activation,params_dense_dropout,params_dense_layer_size,params_dense_units,params_depth_dmpnn,params_dropout,params_dropout_attentive_fp,params_dropout_dag,params_dropout_gcn,params_dropout_graph_conv,params_dropout_pagtn,params_dropout_text_cnn,params_dropouts_weave,params_embedding_dim,params_embedding_output_dim,params_epochs_1d_conv,params_epochs_bi_rnn,params_epochs_deepchem,params_epochs_fcnn,params_epochs_rnn,params_epochs_simple_rnn,params_epochs_tabular_transformer,params_f1,params_f2,params_feature_selector,params_featurizer_type,params_filter_0,params_filter_1,params_filters,params_fnn_dropout_p,params_fnn_layers,params_fpSize,params_g_noise,params_gamma_one_class_svm,params_graph_conv_layers_conv_model,params_graph_conv_layers_gcn,params_graph_feat_size_attentive_fp,params_gru_dropout_0,params_gru_dropout_1,params_gru_dropout_2,params_gru_units_0,params_gru_units_1,params_gru_units_2,params_hidden_activation_0,params_hidden_activation_1,params_hidden_activation_2,params_hidden_activation_3,params_hidden_dropout_0,params_hidden_dropout_1,params_hidden_dropout_2,params_hidden_dropout_3,params_hidden_layer_units_0,params_hidden_layer_units_1,params_hidden_layer_units_2,params_hidden_layer_units_3,params_k,params_kernel_one_class_svm,params_kernel_size_0,params_kernel_size_1,params_kernel_size_smiles_to_vec,params_l1_0,params_l1_1,params_l1_2,params_l1_3,params_l2_0,params_l2_1,params_l2_2,params_l2_3,params_layer_sizes_dag,params_layer_sizes_gather,params_leaf_size_kneighbors_classifier,params_lstm_dropout_0,params_lstm_dropout_1,params_lstm_dropout_2,params_lstm_units_0,params_lstm_units_1,params_lstm_units_2,params_master_atom,params_maxLength,params_maxPath,params_max_length_pagtn,params_max_path,params_metric,params_minLength,params_minPath,params_min_path,params_model_steps,params_model_type,params_nBits,params_n_attention_heads,params_n_attention_layers,params_n_bits,params_n_conv_layers,params_n_embedding_text_cnn,params_n_estimators,params_n_graph_feat_dag,params_n_graph_feat_weave,params_n_gru_layers,params_n_hidden_layers,params_n_hidden_weave,params_n_lstm_layers,params_n_neighbors_kneighbors_classifier,params_n_rnn_layers,params_norm,params_nu_one_class_svm,params_num_heads,params_num_layers_attentive_fp,params_num_layers_pagtn,params_p,params_percentile,params_predictor_dropout_gcn,params_radius,params_rnn_dropouts_0,params_rnn_dropouts_1,params_rnn_dropouts_2,params_rnn_units_0,params_rnn_units_1,params_rnn_units_2,params_scaler,params_standardization_type,params_standardizer,params_stride_0,params_stride_1,params_strides,params_support_weak,params_threshold,params_use_chirality_attentive_fp,params_use_chirality_gat,params_use_chirality_gcn,params_use_chirality_graph_conv,params_use_chirality_weave,params_use_edges_gat,params_use_edges_gcn,params_use_partial_charge_attentive_fp,params_use_partial_charge_gat,params_use_partial_charge_gcn,params_weights_kneighbors_classifier,state
85,85,0.9337852912492203,2023-12-31 18:33:23.621741,2023-12-31 19:49:29.816883,0 days 01:16:06.195142,,,,,,,,,,,,,,,,,,,,,,,,,128.0,,,,,,,,,,,,,,,,,,,,,0.25,,,,,,,,,,,460.0,,,,,,,,,,,,,,,,,,,200.0,,,,,,,,,,,,,,,,,,,,,,,,,,,,,,,,,,,,,,,,,,,,,,,,,,attentive_fp_model,deepchem,,,,,,,,,,,,,,,,,,,2.0,,,,,,,,,,,,,heavy_standardisation,custom_standardizer,,,,,,False,,,,,,,True,,,,COMPLETE
86,86,0.947065407359525,2023-12-31 19:49:29.840494,2023-12-31 21:04:26.803801,0 days 01:14:56.963307,,,,,,,,,,,,,,,,,,,,,,,,,128.0,,,,,,,,,,,,,,,,,,,,,0.25,,,,,,,,,,,462.0,,,,,,,,,,,,,,,,,,,200.0,,,,,,,,,,,,,,,,,,,,,,,,,,,,,,,,,,,,,,,,,,,,,,,,,,attentive_fp_model,deepchem,,,,,,,,,,,,,,,,,,,2.0,,,,,,,,,,,,,heavy_standardisation,custom_standardizer,,,,,,False,,,,,,,True,,,,COMPLETE
87,87,-inf,2023-12-31 21:04:26.823648,2023-12-31 22:04:26.977816,0 days 01:00:00.154168,,,,,,,,,,,,,,,,,,,,,,,,,128.0,,,,,,,,,,,,,,,,,,,,,0.25,,,,,,,,,,,471.0,,,,,,,,,,,,,,,,,,,200.0,,,,,,,,,,,,,,,,,,,,,,,,,,,,,,,,,,,,,,,,,,,,,,,,,,attentive_fp_model,deepchem,,,,,,,,,,,,,,,,,,,2.0,,,,,,,,,,,,,heavy_standardisation,custom_standardizer,,,,,,False,,,,,,,True,,,,COMPLETE
88,88,0.8897767618577829,2023-12-31 22:04:27.009608,2023-12-31 22:57:07.101841,0 days 00:52:40.092233,maccs,,,,,,,,0.275435527988928,,,,,,,,,,,,,,,,,,,,,,ridge_classifier_cv_model,,,,,,,,,,,,,,,,,,,,,,,,,,,,,,,,,select_from_model_fs,,,,,,,,,,,,,,,,,,,,,,,,,,,,,,,,,,,,,,,,,,,,,,,,,,,,,,,,,,,,,,,sklearn,,,,,,,114.0,,,,,,,,,,,,,,,,,,,,,,,,,heavy_standardisation,custom_standardizer,,,,,,,,,,,,,,,,,COMPLETE
89,89,0.9619192734342569,2023-12-31 22:57:07.126366,2024-01-01 00:36:19.530030,0 days 01:39:12.403664,,,,,,,,,,,,,,,,,,,,,,,,,128.0,,,,,,,,,,,,,,,,,,,,,0.25,,,,,,,,,,,518.0,,,,,,,,,,,,,,,,,,,300.0,,,,,,,,,,,,,,,,,,,,,,,,,,,,,,,,,,,,,,,,,,,,,,,,,,attentive_fp_model,deepchem,,,,,,,,,,,,,,,,,,,3.0,,,,,,,,,,,,,heavy_standardisation,custom_standardizer,,,,,,False,,,,,,,True,,,,COMPLETE
90,90,-inf,2024-01-01 00:36:19.549793,2024-01-01 01:36:19.708266,0 days 01:00:00.158473,,,,,,,,,,,,,,,,,,,,,,,,,128.0,,,,,,,,,,,,,,,,,,,,,0.0,,,,,,,,,,,519.0,,,,,,,,,,,,,,,,,,,200.0,,,,,,,,,,,,,,,,,,,,,,,,,,,,,,,,,,,,,,,,,,,,,,,,,,attentive_fp_model,deepchem,,,,,,,,,,,,,,,,,,,2.0,,,,,,,,,,,,,heavy_standardisation,custom_standardizer,,,,,,False,,,,,,,True,,,,COMPLETE
91,91,0.9156726091246215,2024-01-01 01:36:19.800143,2024-01-01 03:12:55.845279,0 days 01:36:36.045136,,,,,,,,,,,,,,,,,,,,,,,,,128.0,,,,,,,,,,,,,,,,,,,,,0.25,,,,,,,,,,,393.0,,,,,,,,,,,,,,,,,,,300.0,,,,,,,,,,,,,,,,,,,,,,,,,,,,,,,,,,,,,,,,,,,,,,,,,,attentive_fp_model,deepchem,,,,,,,,,,,,,,,,,,,3.0,,,,,,,,,,,,,heavy_standardisation,custom_standardizer,,,,,,False,,,,,,,True,,,,COMPLETE
92,92,-inf,2024-01-01 03:12:55.869234,2024-01-01 04:12:59.259953,0 days 01:00:03.390719,,,,,,,,,,,,,,,,,,,,,,,,,128.0,,,,,,,,,,,,,,,,,,,,,0.25,,,,,,,,,,,490.0,,,,,,,,,,,,,,,,,,,300.0,,,,,,,,,,,,,,,,,,,,,,,,,,,,,,,,,,,,,,,,,,,,,,,,,,attentive_fp_model,deepchem,,,,,,,,,,,,,,,,,,,3.0,,,,,,,,,,,,,heavy_standardisation,custom_standardizer,,,,,,False,,,,,,,True,,,,COMPLETE
93,93,0.9471991577167114,2024-01-01 04:12:59.339816,2024-01-01 06:36:05.605157,0 days 02:23:06.265341,,,,,,,,,,,,,,,,,,,,,,,,,128.0,,,,,,,,,,,,,,,,,,,,,0.25,,,,,,,,,,,579.0,,,,,,,,,,,,,,,,,,,400.0,,,,,,,,,,,,,,,,,,,,,,,,,,,,,,,,,,,,,,,,,,,,,,,,,,attentive_fp_model,deepchem,,,,,,,,,,,,,,,,,,,4.0,,,,,,,,,,,,,heavy_standardisation,custom_standardizer,,,,,,False,,,,,,,True,,,,COMPLETE
94,94,-inf,2024-01-01 06:36:05.627054,2024-01-01 07:36:05.749439,0 days 01:00:00.122385,,,,,,,,,,,,,,,,,,,,,,,,,128.0,,,,,,,,,,,,,,,,,,,,,0.25,,,,,,,,,,,559.0,,,,,,,,,,,,,,,,,,,400.0,,,,,,,,,,,,,,,,,,,,,,,,,,,,,,,,,,,,,,,,,,,,,,,,,,attentive_fp_model,deepchem,,,,,,,,,,,,,,,,,,,4.0,,,,,,,,,,,,,heavy_standardisation,custom_standardizer,,,,,,False,,,,,,,True,,,,COMPLETE
95,95,-inf,2024-01-01 07:36:05.774042,2024-01-01 08:36:05.996198,0 days 01:00:00.222156,,,,,,,,,,,,,,,,,,,,,,,,,128.0,,,,,,,,,,,,,,,,,,,,,0.25,,,,,,,,,,,663.0,,,,,,,,,,,,,,,,,,,400.0,,,,,,,,,,,,,,,,,,,,,,,,,,,,,,,,,,,,,,,,,,,,,,,,,,attentive_fp_model,deepchem,,,,,,,,,,,,,,,,,,,4.0,,,,,,,,,,,,,heavy_standardisation,custom_standardizer,,,,,,False,,,,,,,True,,,,COMPLETE
96,96,-inf,2024-01-01 08:36:06.031945,2024-01-01 09:36:06.047471,0 days 01:00:00.015526,mixed,,,,,,,,,,,,,,,,,,,,,,,,,,,,,,,,,,,,,,,,,,,,,,,,,,,,,,,,,,,,,atom_pair,atom_pair,,1D,,,,,,,,,,,,,,,,,,,,,,,,,,,,,,,,,,,,,,,,,,,,,,,,,,,,,,,,,,,,,,keras,,,,,,,,,,,,,,,,,,,,,,,,,,,,,,,,,,,,,,,,,,,,,,,,,,COMPLETE
97,97,-inf,2024-01-01 09:36:06.073459,2024-01-01 10:36:06.191236,0 days 01:00:00.117777,,,,,,,,,,,,,,,,,,,,,,,,,128.0,,,,,,,,,,,,,,,,,,,,,0.0,,,,,,,,,,,582.0,,,,,,,,,,,,,,,,,,,100.0,,,,,,,,,,,,,,,,,,,,,,,,,,,,,,,,,,,,,,,,,,,,,,,,,,attentive_fp_model,deepchem,,,,,,,,,,,,,,,,,,,1.0,,,,,,,,,,,,,heavy_standardisation,custom_standardizer,,,,,,False,,,,,,,True,,,,COMPLETE
98,98,-inf,2024-01-01 10:36:06.211719,2024-01-01 11:36:06.458742,0 days 01:00:00.247023,,,,,,,,,,,,,,,,,,,,,,,,,128.0,,,,,,,,,,,,,,,,,,,,,0.5,,,,,,,,,,,526.0,,,,,,,,,,,,,,,,,,,200.0,,,,,,,,,,,,,,,,,,,,,,,,,,,,,,,,,,,,,,,,,,,,,,,,,,attentive_fp_model,deepchem,,,,,,,,,,,,,,,,,,,2.0,,,,,,,,,,,,,heavy_standardisation,custom_standardizer,,,,,,False,,,,,,,True,,,,COMPLETE
99,99,-inf,2024-01-01 11:36:06.489680,2024-01-01 12:05:54.474880,0 days 00:29:47.985200,,,,,,,,,,,,,,,,,,,,,,,,,128.0,,,,,,,,,,,,,,,,,,,,,,,,,,,,128.0,,,,423.0,,,,,,,,,,,128.0,,,,,,,,,,,,,,,,,,,,,,,,,,,,,,,5.0,,,,,,,,,,,,,,,,,,,,,,,,,,,smiles_to_vec_model,deepchem,,,,,,,,,,,,,,,,,,,,,,,,,,,,,,,,heavy_standardisation,custom_standardizer,,,3.0,,,,,,,,,,,,,,COMPLETE
