,number,value,datetime_start,datetime_complete,duration,params_1D_featurizer,params_1d_model,params_2d_model,params_C_linear_svc,params_C_logistic_regression,params_C_passive_aggressive_classifier,params_C_svc,params_Cs_logistic_regression_cv,params_activation_mlp_classifier,params_algorithm_ada_boost_classifier,params_algorithm_kneighbors_classifier,params_algorithm_radius_neighbors_classifier,params_alpha_bernoulli_nb,params_alpha_complement_nb,params_alpha_mlp_classifier,params_alpha_multinomial_nb,params_alpha_perceptron,params_alpha_ridge_classifier,params_alpha_ridge_classifier_cv,params_alpha_sgd_classifier,params_attention_dropout_0,params_attention_dropout_1,params_attention_dropout_2,params_attention_dropout_3,params_attention_key_dim_0,params_attention_key_dim_1,params_attention_key_dim_2,params_attention_key_dim_3,params_base_estimator_bagging_classifier,params_base_filters,params_batch_normalization_0,params_batch_normalization_1,params_batch_normalization_2,params_batch_normalization_3,params_batch_size_1d_conv,params_batch_size_bi_rnn,params_batch_size_deepchem,params_batch_size_fcnn,params_batch_size_rnn,params_batch_size_simple_rnn,params_batch_size_tabular_transformer,params_batchnorm,params_bootstrap_bagging_classifier,params_bootstrap_extra_trees_classifier,params_bootstrap_features,params_bootstrap_random_forest_classifier,params_classification_model,params_conv_activation_0,params_conv_activation_1,params_conv_activation_2,params_conv_batch_norm_0,params_conv_batch_norm_1,params_conv_batch_norm_2,params_conv_dropout_0,params_conv_dropout_1,params_conv_dropout_2,params_criterion_decision_tree,params_criterion_extra_trees_classifier,params_criterion_gradient_boosting_classifier,params_criterion_random_forest_classifier,params_degree_nu_svc,params_degree_one_class_svm,params_degree_svc,params_dense_activation,params_dense_dropout,params_dense_layer_size,params_dense_units,params_depth_dmpnn,params_dropout,params_dropout_attentive_fp,params_dropout_dag,params_dropout_gcn,params_dropout_graph_conv,params_dropout_pagtn,params_dropout_text_cnn,params_dropouts_weave,params_embedding_dim,params_embedding_output_dim,params_epochs_1d_conv,params_epochs_bi_rnn,params_epochs_deepchem,params_epochs_fcnn,params_epochs_rnn,params_epochs_simple_rnn,params_epochs_tabular_transformer,params_epsilon_sgd_classifier,params_f1,params_f2,params_feature_selector,params_featurizer_type,params_filter_0,params_filter_1,params_filter_2,params_filters,params_fnn_dropout_p,params_fnn_layers,params_fpSize,params_g_noise,params_gamma_nu_svc,params_gamma_one_class_svm,params_gamma_svc,params_graph_conv_layers_conv_model,params_graph_conv_layers_gcn,params_graph_feat_size_attentive_fp,params_gru_dropout_0,params_gru_dropout_1,params_gru_dropout_2,params_gru_units_0,params_gru_units_1,params_gru_units_2,params_hidden_activation_0,params_hidden_activation_1,params_hidden_activation_2,params_hidden_activation_3,params_hidden_dropout_0,params_hidden_dropout_1,params_hidden_dropout_2,params_hidden_dropout_3,params_hidden_layer_sizes_mlp_classifier,params_hidden_layer_units_0,params_hidden_layer_units_1,params_hidden_layer_units_2,params_hidden_layer_units_3,params_k,params_kernel_nu_svc,params_kernel_one_class_svm,params_kernel_size_0,params_kernel_size_1,params_kernel_size_2,params_kernel_size_smiles_to_vec,params_kernel_svc,params_l1_0,params_l1_1,params_l1_2,params_l1_3,params_l1_ratio_sgd_classifier,params_l2_0,params_l2_1,params_l2_2,params_l2_3,params_layer_sizes_dag,params_layer_sizes_gather,params_leaf_size_kneighbors_classifier,params_leaf_size_radius_neighbors_classifier,params_learning_rate_ada_boost_classifier,params_learning_rate_gradient_boosting_classifier,params_learning_rate_hist_gradient_boosting_classifier,params_loss_gradient_boosting_classifier,params_lstm_dropout_0,params_lstm_dropout_1,params_lstm_dropout_2,params_lstm_units_0,params_lstm_units_1,params_lstm_units_2,params_master_atom,params_maxLength,params_maxPath,params_max_features_extra_trees_classifier,params_max_features_gradient_boosting_classifier,params_max_features_random_forest_classifier,params_max_length_pagtn,params_max_path,params_metric,params_minLength,params_minPath,params_min_path,params_model_steps,params_model_type,params_nBits,params_n_attention_heads,params_n_attention_layers,params_n_bits,params_n_conv_layers,params_n_embedding_text_cnn,params_n_estimators,params_n_estimators_ada_boost_classifier,params_n_estimators_bagging_classifier,params_n_estimators_extra_trees_classifier,params_n_estimators_gradient_boosting_classifier,params_n_estimators_random_forest_classifier,params_n_graph_feat_dag,params_n_graph_feat_weave,params_n_gru_layers,params_n_hidden_layers,params_n_hidden_weave,params_n_lstm_layers,params_n_neighbors_kneighbors_classifier,params_n_rnn_layers,params_norm,params_nu_nu_svc,params_nu_one_class_svm,params_nu_sgd_one_class_svm,params_num_heads,params_num_layers_attentive_fp,params_num_layers_pagtn,params_p,params_penalty,params_percentile,params_predictor_dropout_gcn,params_radius,params_radius_n_radius_neighbors_classifier,params_reg_param,params_rnn_dropouts_0,params_rnn_units_0,params_scaler,params_solver,params_standardization_type,params_standardizer,params_stride_0,params_stride_1,params_stride_2,params_strides,params_support_weak,params_threshold,params_tol,params_use_chirality_attentive_fp,params_use_chirality_gat,params_use_chirality_gcn,params_use_chirality_graph_conv,params_use_chirality_weave,params_use_edges_gat,params_use_edges_gcn,params_use_partial_charge_attentive_fp,params_use_partial_charge_gat,params_use_partial_charge_gcn,params_weight_gbr,params_weight_lr,params_weight_mlp,params_weight_rfr,params_weight_svc,params_weights_kneighbors_classifier,params_weights_radius_neighbors_classifier,params_with_mean,params_with_std,state
55,55,0.5858940900741905,2023-12-30 04:45:58.836292,2023-12-30 05:38:52.349476,0 days 00:52:53.513184,,,keras_bidirectional_rnn,,,,,,,,,,,,,,,,,,,,,,,,,,,,,,,,,128.0,,,,,,,,,,,,,,,,,,,,,,,,,,,,tanh,0.4177623470459267,,176.0,,,,,,,,,,,,,50.0,,,,,,,,,,2D,,,,,,,,,,,,,,,0.49677894480443524,,,24.0,,,,,,,,,,,,,,,,,,,,,,,,,,,,,,,,,,,,,,,,,0.49958585009413564,0.013108636255854511,0.35080256976208685,197.0,255.0,121.0,,,,,,,,,,,,,,keras,,,,,,,,,,,,,,,1.0,,,3.0,,,,,,,,,,,,,,,,,,,,,simple_standardisation,custom_standardizer,,,,,,,,,,,,,,,,,,,,,,,,,,,COMPLETE
56,56,0.6535975220901025,2023-12-30 05:38:52.371236,2023-12-30 06:48:35.276676,0 days 01:09:42.905440,mixed,keras_1d_cnn,,,,,,,,,,,,,,,,,,,,,,,,,,,,,,,,,64.0,,,,,,,,,,,,,tanh,,,False,,,0.23166426494820547,,,,,,,,,,tanh,,,96.0,,0.48235644446391696,,,,,,,,,,100.0,,,,,,,,maccs,layered,,1D,13.0,,,,,,,0.037133377945888155,,,,,,,,,,,,,,,,,,,,,,,,,,,,,54.0,,,,,,,,,,,,,,,,,,,,,,,,,,,,,,,,,,,,,,,,,keras,,,,,1.0,,,,,,,,,,,,,,,,,,,,,,,,,,,,,,,,,,heavy_standardisation,custom_standardizer,1.0,,,,,,,,,,,,,,,,,,,,,,,,,,COMPLETE
57,57,0.6326005424951192,2023-12-30 06:48:35.302058,2023-12-30 07:47:56.242536,0 days 00:59:20.940478,mixed,keras_1d_cnn,,,,,,,,,,,,,,,,,,,,,,,,,,,,,,,,,64.0,,,,,,,,,,,,,tanh,,,False,,,0.22241814970670212,,,,,,,,,,tanh,,,96.0,,0.4705366401766461,,,,,,,,,,100.0,,,,,,,,maccs,layered,,1D,14.0,,,,,,,0.03651423841425769,,,,,,,,,,,,,,,,,,,,,,,,,,,,,54.0,,,,,,,,,,,,,,,,,,,,,,,,,,,,,,,,,,,,,,,,,keras,,,,,1.0,,,,,,,,,,,,,,,,,,,,,,,,,,,,,,,,,,heavy_standardisation,custom_standardizer,1.0,,,,,,,,,,,,,,,,,,,,,,,,,,COMPLETE
58,58,0.6160961241606058,2023-12-30 07:47:56.266472,2023-12-30 08:44:53.607645,0 days 00:56:57.341173,mixed,keras_1d_cnn,,,,,,,,,,,,,,,,,,,,,,,,,,,,,,,,,256.0,,,,,,,,,,,,,tanh,tanh,,False,False,,0.43527663982904796,0.19631311283614514,,,,,,,,,tanh,,,160.0,,0.29367563095595156,,,,,,,,,,100.0,,,,,,,,morgan,layered,,1D,9.0,6.0,,,,,,0.03140442605234369,,,,,,,,,,,,,,,,,,,,,,,,,,,,,55.0,30.0,,,,,,,,,,,,,,,,,,,,,,,,,,,,,,,,,,,,,,,,keras,,,,,2.0,,,,,,,,,,,,,,,,,,,,,,,,,,,,,,,,,,heavy_standardisation,custom_standardizer,1.0,2.0,,,,,,,,,,,,,,,,,,,,,,,,,COMPLETE
59,59,0.6222370444757549,2023-12-30 08:44:53.645268,2023-12-30 09:51:40.964842,0 days 01:06:47.319574,morgan,keras_1d_cnn,,,,,,,,,,,,,,,,,,,,,,,,,,,,,,,,,32.0,,,,,,,,,,,,,tanh,,,False,,,0.16750326305728835,,,,,,,,,,tanh,,,64.0,,0.7282657277345835,,,,,,,,,,200.0,,,,,,,,,,,1D,21.0,,,,,,,0.05798693128628689,,,,,,,,,,,,,,,,,,,,,,,,,,,,,17.0,,,,,,,,,,,,,,,,,,,,,,,,,,,,,,,,,,,,,,,,,keras,,,,1024.0,1.0,,,,,,,,,,,,,,,,,,,,,,,,,,,2.0,,,,,,,heavy_standardisation,custom_standardizer,1.0,,,,,,,,,,,,,,,,,,,,,,,,,,COMPLETE
60,60,0.635463530198771,2023-12-30 09:51:40.985490,2023-12-30 10:43:13.677691,0 days 00:51:32.692201,mixed,keras_1d_cnn,,,,,,,,,,,,,,,,,,,,,,,,,,,,,,,,,64.0,,,,,,,,,,,,,relu,tanh,,False,False,,0.4079951270322433,0.2493262562259584,,,,,,,,,tanh,,,128.0,,0.47749082076965177,,,,,,,,,,30.0,,,,,,,,layered,morgan,,1D,18.0,22.0,,,,,,0.02776372926688784,,,,,,,,,,,,,,,,,,,,,,,,,,,,,40.0,64.0,,,,,,,,,,,,,,,,,,,,,,,,,,,,,,,,,,,,,,,,keras,,,,,2.0,,,,,,,,,,,,,,,,,,,,,,,,,,,,,,,,,,heavy_standardisation,custom_standardizer,1.0,2.0,,,,,,,,,,,,,,,,,,,,,,,,,COMPLETE
61,61,0.6311253305389635,2023-12-30 10:43:13.700508,2023-12-30 12:00:44.838319,0 days 01:17:31.137811,atom_pair,keras_1d_cnn,,,,,,,,,,,,,,,,,,,,,,,,,,,,,,,,,32.0,,,,,,,,,,,,,tanh,,,False,,,0.011118653024130232,,,,,,,,,,tanh,,,64.0,,0.20261469364400678,,,,,,,,,,500.0,,,,,,,,,,,1D,7.0,,,,,,,0.05076236765896355,,,,,,,,,,,,,,,,,,,,,,,,,,,,,55.0,,,,,,,,,,,,,,,,,,,,,,,,,,,,,40.0,,,,,,,,3.0,,,,keras,2048.0,,,,1.0,,,,,,,,,,,,,,,,,,,,,,,,,,,,,,,,,,heavy_standardisation,custom_standardizer,1.0,,,,,,,,,,,,,,,,,,,,,,,,,,COMPLETE
62,62,-inf,2023-12-30 12:00:44.869699,2023-12-30 13:00:44.965696,0 days 01:00:00.095997,morgan,keras_tabular_transformer,,,,,,,,,,,,,,,,,,,0.03789935404884953,,,,4.0,,,,,,,,,,,,,,,,16.0,,,,,,,,,,,,,,,,,,,,,,,relu,0.18576626285062756,,112.0,,,,,,,,,,,64.0,,,,,,,300.0,,,,,1D,,,,,,,,,,,,,,,,,,,,,,,,,,,,,,,,,,,,,,,,,,,,,,,,,,,,,,,,,,,,,,,,,,,,,,,,,,,,,,keras,,2.0,1.0,2048.0,,,,,,,,,,,,,,,,,,,,,,,,,,,,2.0,,,,,,,simple_standardisation,custom_standardizer,,,,,,,,,,,,,,,,,,,,,,,,,,,COMPLETE
63,63,0.6535939273253782,2023-12-30 13:00:45.002489,2023-12-30 13:59:29.739173,0 days 00:58:44.736684,atom_pair,,,,,,,,,,,,,,,,,,,,,,,,,,,,svc,,,,,,,,,,,,,,True,,True,,bagging_classifier_model,,,,,,,,,,,,,,,,,,,,,,,,,,,,,,,,,,,,,,,,,,low_variance_fs,,,,,,,,,,,,,,,,,,,,,,,,,,,,,,,,,,,,,,,,,,,,,,,,,,,,,,,,,,,,,,,,,,,50.0,,,,,,,,3.0,,,,sklearn,2048.0,,,,,,,,450.0,,,,,,,,,,,,,,,,,,,,,,,,,,,,,,heavy_standardisation,custom_standardizer,,,,,,0.002297265900917447,,,,,,,,,,,,,,,,,,,,,COMPLETE
64,64,0.6582168534188926,2023-12-30 13:59:29.770865,2023-12-30 14:52:23.792651,0 days 00:52:54.021786,atom_pair,,,,,,,,,,,,,,,,,,,,,,,,,,,,svc,,,,,,,,,,,,,,True,,True,,bagging_classifier_model,,,,,,,,,,,,,,,,,,,,,,,,,,,,,,,,,,,,,,,,,,low_variance_fs,,,,,,,,,,,,,,,,,,,,,,,,,,,,,,,,,,,,,,,,,,,,,,,,,,,,,,,,,,,,,,,,,,,50.0,,,,,,,,3.0,,,,sklearn,2048.0,,,,,,,,450.0,,,,,,,,,,,,,,,,,,,,,,,,,,,,,,heavy_standardisation,custom_standardizer,,,,,,0.007352565595911794,,,,,,,,,,,,,,,,,,,,,COMPLETE
65,65,0.6483776185796576,2023-12-30 14:52:23.812145,2023-12-30 15:33:20.686452,0 days 00:40:56.874307,atom_pair,,,,,,,,,,,,,,,,,,,,,,,,,,,,svc,,,,,,,,,,,,,,True,,True,,bagging_classifier_model,,,,,,,,,,,,,,,,,,,,,,,,,,,,,,,,,,,,,,,,,,low_variance_fs,,,,,,,,,,,,,,,,,,,,,,,,,,,,,,,,,,,,,,,,,,,,,,,,,,,,,,,,,,,,,,,,,,,50.0,,,,,,,,3.0,,,,sklearn,2048.0,,,,,,,,450.0,,,,,,,,,,,,,,,,,,,,,,,,,,,,,,heavy_standardisation,custom_standardizer,,,,,,0.004225291112763131,,,,,,,,,,,,,,,,,,,,,COMPLETE
66,66,0.665699485729111,2023-12-30 15:33:20.709478,2023-12-30 16:15:07.365570,0 days 00:41:46.656092,atom_pair,,,,,,,,,,,,,,,,,,,,,,,,,,,,svc,,,,,,,,,,,,,,True,,True,,bagging_classifier_model,,,,,,,,,,,,,,,,,,,,,,,,,,,,,,,,,,,,,,,,,,low_variance_fs,,,,,,,,,,,,,,,,,,,,,,,,,,,,,,,,,,,,,,,,,,,,,,,,,,,,,,,,,,,,,,,,,,,50.0,,,,,,,,3.0,,,,sklearn,2048.0,,,,,,,,450.0,,,,,,,,,,,,,,,,,,,,,,,,,,,,,,heavy_standardisation,custom_standardizer,,,,,,0.003799666732368298,,,,,,,,,,,,,,,,,,,,,COMPLETE
67,67,0.6505295981454303,2023-12-30 16:15:07.392640,2023-12-30 16:55:56.290138,0 days 00:40:48.897498,atom_pair,,,,,,,,,,,,,,,,,,,,,,,,,,,,svc,,,,,,,,,,,,,,True,,True,,bagging_classifier_model,,,,,,,,,,,,,,,,,,,,,,,,,,,,,,,,,,,,,,,,,,low_variance_fs,,,,,,,,,,,,,,,,,,,,,,,,,,,,,,,,,,,,,,,,,,,,,,,,,,,,,,,,,,,,,,,,,,,50.0,,,,,,,,3.0,,,,sklearn,2048.0,,,,,,,,450.0,,,,,,,,,,,,,,,,,,,,,,,,,,,,,,heavy_standardisation,custom_standardizer,,,,,,0.0031642338873372465,,,,,,,,,,,,,,,,,,,,,COMPLETE
68,68,0.6561580298894808,2023-12-30 16:55:56.310362,2023-12-30 17:34:55.944227,0 days 00:38:59.633865,atom_pair,,,,,,,,,,,,,,,,,,,,,,,,,,,,svc,,,,,,,,,,,,,,True,,True,,bagging_classifier_model,,,,,,,,,,,,,,,,,,,,,,,,,,,,,,,,,,,,,,,,,,low_variance_fs,,,,,,,,,,,,,,,,,,,,,,,,,,,,,,,,,,,,,,,,,,,,,,,,,,,,,,,,,,,,,,,,,,,50.0,,,,,,,,3.0,,,,sklearn,2048.0,,,,,,,,450.0,,,,,,,,,,,,,,,,,,,,,,,,,,,,,,heavy_standardisation,custom_standardizer,,,,,,0.005061215545519049,,,,,,,,,,,,,,,,,,,,,COMPLETE
69,69,0.6664402615560937,2023-12-30 17:34:55.965040,2023-12-30 18:15:32.975658,0 days 00:40:37.010618,atom_pair,,,,,,,,,,,,,,,,,,,,,,,,,,,,svc,,,,,,,,,,,,,,True,,True,,bagging_classifier_model,,,,,,,,,,,,,,,,,,,,,,,,,,,,,,,,,,,,,,,,,,low_variance_fs,,,,,,,,,,,,,,,,,,,,,,,,,,,,,,,,,,,,,,,,,,,,,,,,,,,,,,,,,,,,,,,,,,,50.0,,,,,,,,3.0,,,,sklearn,2048.0,,,,,,,,450.0,,,,,,,,,,,,,,,,,,,,,,,,,,,,,,heavy_standardisation,custom_standardizer,,,,,,0.0060028345496873714,,,,,,,,,,,,,,,,,,,,,COMPLETE
70,70,0.644279467285499,2023-12-30 18:15:32.997520,2023-12-30 19:07:53.388412,0 days 00:52:20.390892,2d_descriptors,,,,,,,,,,,,,,,,,,,,,,,,,,,,svc,,,,,,,,,,,,,,True,,True,,bagging_classifier_model,,,,,,,,,,,,,,,,,,,,,,,,,,,,,,,,,,,,,,,,,,low_variance_fs,,,,,,,,,,,,,,,,,,,,,,,,,,,,,,,,,,,,,,,,,,,,,,,,,,,,,,,,,,,,,,,,,,,,,,,,,,,,,,,sklearn,,,,,,,,,450.0,,,,,,,,,,,,,,,,,,,,,,,,,,,,standard_scaler,,heavy_standardisation,custom_standardizer,,,,,,0.018785030866198392,,,,,,,,,,,,,,,,,,,False,True,COMPLETE
71,71,0.672680198386401,2023-12-30 19:07:53.471726,2023-12-30 20:10:12.002876,0 days 01:02:18.531150,atom_pair,,,,,,,,,,,,,,,,,,,,,,,,,,,,svc,,,,,,,,,,,,,,True,,True,,bagging_classifier_model,,,,,,,,,,,,,,,,,,,,,,,,,,,,,,,,,,,,,,,,,,low_variance_fs,,,,,,,,,,,,,,,,,,,,,,,,,,,,,,,,,,,,,,,,,,,,,,,,,,,,,,,,,,,,,,,,,,,50.0,,,,,,,,3.0,,,,sklearn,2048.0,,,,,,,,450.0,,,,,,,,,,,,,,,,,,,,,,,,,,,,,,heavy_standardisation,custom_standardizer,,,,,,0.0064641482369995375,,,,,,,,,,,,,,,,,,,,,COMPLETE
72,72,0.677401857164855,2023-12-30 20:10:12.024335,2023-12-30 20:56:30.472338,0 days 00:46:18.448003,atom_pair,,,,,,,,,,,,,,,,,,,,,,,,,,,,svc,,,,,,,,,,,,,,True,,True,,bagging_classifier_model,,,,,,,,,,,,,,,,,,,,,,,,,,,,,,,,,,,,,,,,,,low_variance_fs,,,,,,,,,,,,,,,,,,,,,,,,,,,,,,,,,,,,,,,,,,,,,,,,,,,,,,,,,,,,,,,,,,,50.0,,,,,,,,3.0,,,,sklearn,2048.0,,,,,,,,450.0,,,,,,,,,,,,,,,,,,,,,,,,,,,,,,heavy_standardisation,custom_standardizer,,,,,,0.021241878246305863,,,,,,,,,,,,,,,,,,,,,COMPLETE
73,73,0.6754997287921383,2023-12-30 20:56:30.496782,2023-12-30 21:42:33.299281,0 days 00:46:02.802499,atom_pair,,,,,,,,,,,,,,,,,,,,,,,,,,,,svc,,,,,,,,,,,,,,True,,True,,bagging_classifier_model,,,,,,,,,,,,,,,,,,,,,,,,,,,,,,,,,,,,,,,,,,low_variance_fs,,,,,,,,,,,,,,,,,,,,,,,,,,,,,,,,,,,,,,,,,,,,,,,,,,,,,,,,,,,,,,,,,,,50.0,,,,,,,,3.0,,,,sklearn,2048.0,,,,,,,,450.0,,,,,,,,,,,,,,,,,,,,,,,,,,,,,,heavy_standardisation,custom_standardizer,,,,,,0.01098872342592432,,,,,,,,,,,,,,,,,,,,,COMPLETE
74,74,0.6823421108346912,2023-12-30 21:42:33.322523,2023-12-30 22:28:45.230949,0 days 00:46:11.908426,atom_pair,,,,,,,,,,,,,,,,,,,,,,,,,,,,svc,,,,,,,,,,,,,,True,,True,,bagging_classifier_model,,,,,,,,,,,,,,,,,,,,,,,,,,,,,,,,,,,,,,,,,,low_variance_fs,,,,,,,,,,,,,,,,,,,,,,,,,,,,,,,,,,,,,,,,,,,,,,,,,,,,,,,,,,,,,,,,,,,50.0,,,,,,,,3.0,,,,sklearn,2048.0,,,,,,,,450.0,,,,,,,,,,,,,,,,,,,,,,,,,,,,,,heavy_standardisation,custom_standardizer,,,,,,0.02463005847000414,,,,,,,,,,,,,,,,,,,,,COMPLETE
75,75,0.6788938349726222,2023-12-30 22:28:45.257549,2023-12-30 22:53:49.940880,0 days 00:25:04.683331,atom_pair,,,,,,,,,,,,,,,,,,,,,,,,,,,,svc,,,,,,,,,,,,,,True,,True,,bagging_classifier_model,,,,,,,,,,,,,,,,,,,,,,,,,,,,,,,,,,,,,,,,,,low_variance_fs,,,,,,,,,,,,,,,,,,,,,,,,,,,,,,,,,,,,,,,,,,,,,,,,,,,,,,,,,,,,,,,,,,,50.0,,,,,,,,3.0,,,,sklearn,2048.0,,,,,,,,450.0,,,,,,,,,,,,,,,,,,,,,,,,,,,,,,,pass_through_standardizer,,,,,,0.0325908585338579,,,,,,,,,,,,,,,,,,,,,COMPLETE
76,76,0.6786384071309876,2023-12-30 22:53:49.972561,2023-12-30 23:17:39.304421,0 days 00:23:49.331860,atom_pair,,,,,,,,,,,,,,,,,,,,,,,,,,,,svc,,,,,,,,,,,,,,True,,True,,bagging_classifier_model,,,,,,,,,,,,,,,,,,,,,,,,,,,,,,,,,,,,,,,,,,low_variance_fs,,,,,,,,,,,,,,,,,,,,,,,,,,,,,,,,,,,,,,,,,,,,,,,,,,,,,,,,,,,,,,,,,,,50.0,,,,,,,,3.0,,,,sklearn,2048.0,,,,,,,,450.0,,,,,,,,,,,,,,,,,,,,,,,,,,,,,,,pass_through_standardizer,,,,,,0.033137974679765224,,,,,,,,,,,,,,,,,,,,,COMPLETE
77,77,0.6786384071309876,2023-12-30 23:17:39.323869,2023-12-30 23:40:39.414998,0 days 00:23:00.091129,atom_pair,,,,,,,,,,,,,,,,,,,,,,,,,,,,svc,,,,,,,,,,,,,,True,,False,,bagging_classifier_model,,,,,,,,,,,,,,,,,,,,,,,,,,,,,,,,,,,,,,,,,,low_variance_fs,,,,,,,,,,,,,,,,,,,,,,,,,,,,,,,,,,,,,,,,,,,,,,,,,,,,,,,,,,,,,,,,,,,50.0,,,,,,,,3.0,,,,sklearn,2048.0,,,,,,,,350.0,,,,,,,,,,,,,,,,,,,,,,,,,,,,,,,pass_through_standardizer,,,,,,0.03239943121815175,,,,,,,,,,,,,,,,,,,,,COMPLETE
78,78,0.6082966200002071,2023-12-30 23:40:39.435524,2023-12-30 23:59:50.733898,0 days 00:19:11.298374,atom_pair,,,,,,,,,,,,0.20505882329797953,,,,,,,,,,,,,,,,,,,,,,,,,,,,,,,,,,bernoulli_nb_model,,,,,,,,,,,,,,,,,,,,,,,,,,,,,,,,,,,,,,,,,,low_variance_fs,,,,,,,,,,,,,,,,,,,,,,,,,,,,,,,,,,,,,,,,,,,,,,,,,,,,,,,,,,,,,,,,,,,50.0,,,,,,,,3.0,,,,sklearn,2048.0,,,,,,,,,,,,,,,,,,,,,,,,,,,,,,,,,,,,,,,pass_through_standardizer,,,,,,0.03533259937732501,,,,,,,,,,,,,,,,,,,,,COMPLETE
79,79,0.6210607050683915,2023-12-30 23:59:50.752981,2023-12-31 00:26:40.051135,0 days 00:26:49.298154,mol2vec,,,,,,,8.0,,,,,,,,,,,,,,,,,,,,,,,,,,,,,,,,,,,,,,,logistic_regression_cv_model,,,,,,,,,,,,,,,,,,,,,,,,,,,,,,,,,,,,,,,,,,low_variance_fs,,,,,,,,,,,,,,,,,,,,,,,,,,,,,,,,,,,,,,,,,,,,,,,,,,,,,,,,,,,,,,,,,,,,,,,,,,,,,,,sklearn,,,,,,,,,,,,,,,,,,,,,,,,,,,,,,,,,,,,,,,,pass_through_standardizer,,,,,,0.0314561963693177,,,,,,,,,,,,,,,,,,,,,COMPLETE
80,80,0.6451379059260451,2023-12-31 00:26:40.088966,2023-12-31 00:57:25.294737,0 days 00:30:45.205771,rdk,,,,,,,,,,,,,,,,,,,,,,,,,,,,,,,,,,,,,,,,,,,,,,nu_svc_model,,,,,,,,,,,,,,4.0,,,,,,,,,,,,,,,,,,,,,,,,,,,,low_variance_fs,,,,,,,,1024.0,,0.7584265639893986,,,,,,,,,,,,,,,,,,,,,,,,,,poly,,,,,,,,,,,,,,,,,,,,,,,,,,,,,,,,,,,,,6.0,,,,3.0,,sklearn,,,,,,,,,,,,,,,,,,,,,,0.47577049298196,,,,,,,,,,,,,,,,,,pass_through_standardizer,,,,,,0.03311774857140541,,,,,,,,,,,,,,,,,,,,,COMPLETE
81,81,0.672626028704816,2023-12-31 00:57:25.374931,2023-12-31 01:31:20.635976,0 days 00:33:55.261045,atom_pair,,,,,,,,,,,,,,,,,,,,,,,,,,,,svc,,,,,,,,,,,,,,True,,False,,bagging_classifier_model,,,,,,,,,,,,,,,,,,,,,,,,,,,,,,,,,,,,,,,,,,low_variance_fs,,,,,,,,,,,,,,,,,,,,,,,,,,,,,,,,,,,,,,,,,,,,,,,,,,,,,,,,,,,,,,,,,,,50.0,,,,,,,,3.0,,,,sklearn,2048.0,,,,,,,,350.0,,,,,,,,,,,,,,,,,,,,,,,,,,,,,,,pass_through_standardizer,,,,,,0.027193222676443484,,,,,,,,,,,,,,,,,,,,,COMPLETE
82,82,0.6252244283222719,2023-12-31 01:31:20.666762,2023-12-31 01:50:29.930984,0 days 00:19:09.264222,atom_pair,,,,,,,,,,,,,,,,,,,,,,,,,,,,,,,,,,,,,,,,,,,,,,nearest_centroid_model,,,,,,,,,,,,,,,,,,,,,,,,,,,,,,,,,,,,,,,,,,low_variance_fs,,,,,,,,,,,,,,,,,,,,,,,,,,,,,,,,,,,,,,,,,,,,,,,,,,,,,,,,,,,,,,,,,,,50.0,,,,,,,euclidean,3.0,,,,sklearn,2048.0,,,,,,,,,,,,,,,,,,,,,,,,,,,,,,,,,,,,,,,pass_through_standardizer,,,,,,0.02956478835814889,,,,,,,,,,,,,,,,,,,,,COMPLETE
83,83,0.607416195686453,2023-12-31 01:50:29.950377,2023-12-31 02:09:23.569775,0 days 00:18:53.619398,maccs,,,,1.9858337551248408,,,,,,,,,,,,,,,,,,,,,,,,,,,,,,,,,,,,,,,,,,logistic_regression_model,,,,,,,,,,,,,,,,,,,,,,,,,,,,,,,,,,,,,,,,,,percentil_fs,,,,,,,,,,,,,,,,,,,,,,,,,,,,,,,,,,,,,,,,,,,,,,,,,,,,,,,,,,,,,,,,,,,,,,,,,,,,,,,sklearn,,,,,,,,,,,,,,,,,,,,,,,,,,,,,,0.0,,,,,,,,,,pass_through_standardizer,,,,,,,,,,,,,,,,,,,,,,,,,,,COMPLETE
84,84,0.6259099876079699,2023-12-31 02:09:23.599833,2023-12-31 02:27:44.231709,0 days 00:18:20.631876,atom_pair,,,,,,,,,SAMME,,,,,,,,,,,,,,,,,,,,,,,,,,,,,,,,,,,,,ada_boost_classifier_model,,,,,,,,,,,,,,,,,,,,,,,,,,,,,,,,,,,,,,,,,,low_variance_fs,,,,,,,,,,,,,,,,,,,,,,,,,,,,,,,,,,,,,,,,,,,,,,,,,,,,,,,,0.6031392799683899,,,,,,,,,,,50.0,,,,,,,,3.0,,,,sklearn,2048.0,,,,,,,50.0,,,,,,,,,,,,,,,,,,,,,,,,,,,,,,,,pass_through_standardizer,,,,,,0.025474473318072524,,,,,,,,,,,,,,,,,,,,,COMPLETE
85,85,0.603212791008777,2023-12-31 02:27:44.255775,2023-12-31 02:44:52.672659,0 days 00:17:08.416884,atom_pair,,,,,,,,,,,,,,,,,3.4049920690201603,,,,,,,,,,,,,,,,,,,,,,,,,,,,,ridge_classifier_model,,,,,,,,,,,,,,,,,,,,,,,,,,,,,,,,,,,,,,,,,,low_variance_fs,,,,,,,,,,,,,,,,,,,,,,,,,,,,,,,,,,,,,,,,,,,,,,,,,,,,,,,,,,,,,,,,,,,50.0,,,,,,,,3.0,,,,sklearn,2048.0,,,,,,,,,,,,,,,,,,,,,,,,,,,,,,,,,,,,,,,pass_through_standardizer,,,,,,0.04015161264380771,,,,,,,,,,,,,,,,,,,,,COMPLETE
86,86,0.6389152252758531,2023-12-31 02:44:52.699143,2023-12-31 03:01:47.022084,0 days 00:16:54.322941,atom_pair,,,,,,,,,,,,,,,,,,,,,,,,,,,,,,,,,,,,,,,,,,,,,,gradient_boosting_classifier_model,,,,,,,,,,,,friedman_mse,,,,,,,,,,,,,,,,,,,,,,,,,,,,,,pass_through_transformer,,,,,,,,,,,,,,,,,,,,,,,,,,,,,,,,,,,,,,,,,,,,,,,,,,,,,,,,,0.15366495248236067,,exponential,,,,,,,,50.0,,,auto,,,,,3.0,,,,sklearn,2048.0,,,,,,,,,,100.0,,,,,,,,,,,,,,,,,,,,,,,,,,,,,pass_through_standardizer,,,,,,,,,,,,,,,,,,,,,,,,,,,COMPLETE
