,number,value,datetime_start,datetime_complete,duration,params_1D_featurizer,params_1d_model,params_2d_model,params_C_linear_svc,params_C_logistic_regression,params_C_passive_aggressive_classifier,params_C_svc,params_Cs_logistic_regression_cv,params_activation_mlp_classifier,params_algorithm_ada_boost_classifier,params_algorithm_kneighbors_classifier,params_algorithm_radius_neighbors_classifier,params_alpha_bernoulli_nb,params_alpha_complement_nb,params_alpha_mlp_classifier,params_alpha_multinomial_nb,params_alpha_perceptron,params_alpha_ridge_classifier,params_alpha_ridge_classifier_cv,params_alpha_sgd_classifier,params_attention_dropout_0,params_attention_dropout_1,params_attention_dropout_2,params_attention_dropout_3,params_attention_key_dim_0,params_attention_key_dim_1,params_attention_key_dim_2,params_attention_key_dim_3,params_base_estimator_bagging_classifier,params_base_filters,params_batch_normalization_0,params_batch_normalization_1,params_batch_normalization_2,params_batch_normalization_3,params_batch_size_1d_conv,params_batch_size_bi_rnn,params_batch_size_deepchem,params_batch_size_fcnn,params_batch_size_rnn,params_batch_size_simple_rnn,params_batch_size_tabular_transformer,params_batchnorm,params_bootstrap_bagging_classifier,params_bootstrap_extra_trees_classifier,params_bootstrap_features,params_bootstrap_random_forest_classifier,params_classification_model,params_conv_activation_0,params_conv_activation_1,params_conv_activation_2,params_conv_batch_norm_0,params_conv_batch_norm_1,params_conv_batch_norm_2,params_conv_dropout_0,params_conv_dropout_1,params_conv_dropout_2,params_criterion_decision_tree,params_criterion_extra_trees_classifier,params_criterion_gradient_boosting_classifier,params_criterion_random_forest_classifier,params_degree_nu_svc,params_degree_one_class_svm,params_degree_svc,params_dense_activation,params_dense_dropout,params_dense_layer_size,params_dense_units,params_depth_dmpnn,params_dropout,params_dropout_attentive_fp,params_dropout_dag,params_dropout_gcn,params_dropout_graph_conv,params_dropout_pagtn,params_dropout_text_cnn,params_dropouts_weave,params_embedding_dim,params_embedding_output_dim,params_epochs_1d_conv,params_epochs_bi_rnn,params_epochs_deepchem,params_epochs_fcnn,params_epochs_rnn,params_epochs_simple_rnn,params_epochs_tabular_transformer,params_epsilon_sgd_classifier,params_f1,params_f2,params_feature_selector,params_featurizer_type,params_filter_0,params_filter_1,params_filter_2,params_filters,params_fnn_dropout_p,params_fnn_layers,params_fpSize,params_g_noise,params_gamma_nu_svc,params_gamma_one_class_svm,params_gamma_svc,params_graph_conv_layers_conv_model,params_graph_conv_layers_gcn,params_graph_feat_size_attentive_fp,params_gru_dropout_0,params_gru_dropout_1,params_gru_dropout_2,params_gru_units_0,params_gru_units_1,params_gru_units_2,params_hidden_activation_0,params_hidden_activation_1,params_hidden_activation_2,params_hidden_activation_3,params_hidden_dropout_0,params_hidden_dropout_1,params_hidden_dropout_2,params_hidden_dropout_3,params_hidden_layer_sizes_mlp_classifier,params_hidden_layer_units_0,params_hidden_layer_units_1,params_hidden_layer_units_2,params_hidden_layer_units_3,params_k,params_kernel_nu_svc,params_kernel_one_class_svm,params_kernel_size_0,params_kernel_size_1,params_kernel_size_2,params_kernel_size_smiles_to_vec,params_kernel_svc,params_l1_0,params_l1_1,params_l1_2,params_l1_3,params_l1_ratio_sgd_classifier,params_l2_0,params_l2_1,params_l2_2,params_l2_3,params_layer_sizes_dag,params_layer_sizes_gather,params_leaf_size_kneighbors_classifier,params_leaf_size_radius_neighbors_classifier,params_learning_rate_ada_boost_classifier,params_learning_rate_gradient_boosting_classifier,params_learning_rate_hist_gradient_boosting_classifier,params_loss_gradient_boosting_classifier,params_lstm_dropout_0,params_lstm_dropout_1,params_lstm_dropout_2,params_lstm_units_0,params_lstm_units_1,params_lstm_units_2,params_master_atom,params_maxLength,params_maxPath,params_max_features_extra_trees_classifier,params_max_features_gradient_boosting_classifier,params_max_features_random_forest_classifier,params_max_length_pagtn,params_max_path,params_metric,params_minLength,params_minPath,params_min_path,params_model_steps,params_model_type,params_nBits,params_n_attention_heads,params_n_attention_layers,params_n_bits,params_n_conv_layers,params_n_embedding_text_cnn,params_n_estimators,params_n_estimators_ada_boost_classifier,params_n_estimators_bagging_classifier,params_n_estimators_extra_trees_classifier,params_n_estimators_gradient_boosting_classifier,params_n_estimators_random_forest_classifier,params_n_graph_feat_dag,params_n_graph_feat_weave,params_n_gru_layers,params_n_hidden_layers,params_n_hidden_weave,params_n_lstm_layers,params_n_neighbors_kneighbors_classifier,params_n_rnn_layers,params_norm,params_nu_nu_svc,params_nu_one_class_svm,params_nu_sgd_one_class_svm,params_num_heads,params_num_layers_attentive_fp,params_num_layers_pagtn,params_p,params_penalty,params_percentile,params_predictor_dropout_gcn,params_radius,params_radius_n_radius_neighbors_classifier,params_reg_param,params_rnn_dropouts_0,params_rnn_units_0,params_scaler,params_solver,params_standardization_type,params_standardizer,params_stride_0,params_stride_1,params_stride_2,params_strides,params_support_weak,params_threshold,params_tol,params_use_chirality_attentive_fp,params_use_chirality_gat,params_use_chirality_gcn,params_use_chirality_graph_conv,params_use_chirality_weave,params_use_edges_gat,params_use_edges_gcn,params_use_partial_charge_attentive_fp,params_use_partial_charge_gat,params_use_partial_charge_gcn,params_weight_gbr,params_weight_lr,params_weight_mlp,params_weight_rfr,params_weight_svc,params_weights_kneighbors_classifier,params_weights_radius_neighbors_classifier,params_with_mean,params_with_std,state
0,0,0.5756256735585763,2023-12-28 21:19:29.393301,2023-12-28 22:00:11.085318,0 days 00:40:41.692017,,,,,,,,,,,,,,,,,,,,,,,,,,,,,,,,,,,,,8.0,,,,,,,,,,,,,,,,,,,,,,,,,,,,,,,,,,,,,,0.25,,,,,,786.0,,,,,,,,,,,,,,,,,,,,,,,,,,,,,,,,,,,,,,,,,,,,,,,,,,,,,,,,,,,,,,,,,,,,,,,,,,,,,,,,,,,,,,text_cnn_model,deepchem,,,,,,75.0,,,,,,,,,,,,,,,,,,,,,,,,,,,,,,,,,,pass_through_standardizer,,,,,,,,,,,,,,,,,,,,,,,,,,,COMPLETE
1,1,0.6383954563737312,2023-12-28 22:00:11.113143,2023-12-28 22:35:36.363846,0 days 00:35:25.250703,,,,,,,,,,,,,,,,,,,,,,,,,,,,,,,,,,,,,8.0,,,,,,,,,,,,,,,,,,,,,,,,,,,,,,,,,,,,,,0.0,,,,,,503.0,,,,,,,,,,,,,,,,,,,,,,,,,,,,,,,,,,,,,,,,,,,,,,,,,,,,,,,,,,,,,,,,,,,,,,,,,,,,,,,,,,,,,,text_cnn_model,deepchem,,,,,,100.0,,,,,,,,,,,,,,,,,,,,,,,,,,,,,,,,,simple_standardisation,custom_standardizer,,,,,,,,,,,,,,,,,,,,,,,,,,,COMPLETE
2,2,0.5920019195798527,2023-12-28 22:35:36.387001,2023-12-28 22:37:19.046122,0 days 00:01:42.659121,morgan,,,,,,,,,,,,,0.028471128887854302,,,,,,,,,,,,,,,,,,,,,,,,,,,,,,,,,complement_nb_model,,,,,,,,,,,,,,,,,,,,,,,,,,,,,,,,,,,,,,,,,,percentil_fs,,,,,,,,,,,,,,,,,,,,,,,,,,,,,,,,,,,,,,,,,,,,,,,,,,,,,,,,,,,,,,,,,,,,,,,,,,,,,,,sklearn,,,,2048.0,,,,,,,,,,,,,,,,,,,,,,,,,,78.0,,4.0,,,,,,,,pass_through_standardizer,,,,,,,,,,,,,,,,,,,,,,,,,,,COMPLETE
3,3,-inf,2023-12-28 22:37:19.075391,2023-12-28 23:37:19.621301,0 days 01:00:00.545910,,,,,,,,,,,,,,,,,,,,,,,,,,,,,,,,,,,,,16.0,,,,,,,,,,,,,,,,,,,,,,,,,,,,,,,,,0.0,,,,,,,,,,,170.0,,,,,,,,,,,,,,,,,,,,,,,400.0,,,,,,,,,,,,,,,,,,,,,,,,,,,,,,,,,,,,,,,,,,,,,,,,,,,,,,,,,,,,,,,attentive_fp_model,deepchem,,,,,,,,,,,,,,,,,,,,,,,,,,4.0,,,,,,,,,,,,,heavy_standardisation,custom_standardizer,,,,,,,,True,,,,,,,False,,,,,,,,,,,,COMPLETE
4,4,0.5199912239562073,2023-12-28 23:37:19.671766,2023-12-28 23:42:05.730760,0 days 00:04:46.058994,morgan,,,,,,,,,,ball_tree,,,,,,,,,,,,,,,,,,,,,,,,,,,,,,,,,,,,kneighbors_classifier_model,,,,,,,,,,,,,,,,,,,,,,,,,,,,,,,,,,,,,,,,,,percentil_fs,,,,,,,,,,,,,,,,,,,,,,,,,,,,,,,,,,,,,,,,,,,,,,,,,,,,,,9.0,,,,,,,,,,,,,,,,,,,,,,,,,sklearn,,,,1024.0,,,,,,,,,,,,,,,5.0,,,,,,,,,9.0,,31.0,,6.0,,,,,,,heavy_standardisation,custom_standardizer,,,,,,,,,,,,,,,,,,,,,,,distance,,,,COMPLETE
5,5,0.546471729955236,2023-12-28 23:42:05.749982,2023-12-29 00:16:16.284772,0 days 00:34:10.534790,,,,,,,,,,,,,,,,,,,,,,,,,,,,,,32.0,,,,,,,64.0,,,,,,,,,,,,,,,,,,,,,,,,,,,,,,,,,,,,,,,,,,,,935.0,,,,,,,,,,,,,,,,,,,,,,,,,,,,,,,,,,,,,,,,,,,,,,,,,,,,,,,,,,,,,,,,,,,,,,,,,,,,,,,,,,,,,,chem_ception_model,deepchem,,,,,,,,,,,,,,,,,,,,,,,,,,,,,,,,,,,,,,,,chembl_standardizer,,,,,,,,,,,,,,,,,,,,,,,,,,,COMPLETE
6,6,0.5395283909989792,2023-12-29 00:16:16.305922,2023-12-29 00:26:20.923961,0 days 00:10:04.618039,mol2vec,keras_tabular_transformer,,,,,,,,,,,,,,,,,,,0.19023634052176686,0.4059693089330172,0.21317051551390137,0.1673962918321199,2.0,8.0,16.0,16.0,,,,,,,,,,,,,64.0,,,,,,,,,,,,,,,,,,,,,,,relu,0.058224461433588115,,32.0,,,,,,,,,,,16.0,,,,,,,30.0,,,,,1D,,,,,,,,,,,,,,,,,,,,,,,,,,,,,,,,,,,,,,,,,,,,,,,,,,,,,,,,,,,,,,,,,,,,,,,,,,,,,,keras,,4.0,4.0,,,,,,,,,,,,,,,,,,,,,,,,,,,,,,,,,,,,,pass_through_standardizer,,,,,,,,,,,,,,,,,,,,,,,,,,,COMPLETE
7,7,0.5313055169271139,2023-12-29 00:26:20.995657,2023-12-29 00:45:20.373502,0 days 00:18:59.377845,rdk,keras_dense,,,,,,,,,,,,,,,,,,,,,,,,,,,,,True,False,True,True,,,,16.0,,,,,,,,,,,,,,,,,,,,,,,,,,,,,,,,,,,,,,,,,,,,150.0,,,,,,,,1D,,,,,,,1024.0,,,,,,,,,,,,,,tanh,relu,relu,relu,0.20772666919115804,0.3167039395444975,0.37257915337672165,0.24515425227899856,,59.0,23.0,47.0,20.0,,,,,,,,,6.851873923491506e-06,0.00031006560955994635,0.0004256822373992559,0.0003422051040797686,,3.3596787433009085e-05,0.00012346837548106682,0.0015416433800834568,1.7198636082185355e-06,,,,,,,,,,,,,,,,,,,,,,9.0,,,,1.0,,keras,,,,,,,,,,,,,,,,4.0,,,,,,,,,,,,,,,,,,,,,,,,chembl_standardizer,,,,,,,,,,,,,,,,,,,,,,,,,,,COMPLETE
8,8,0.5,2023-12-29 00:45:20.402077,2023-12-29 01:05:42.892474,0 days 00:20:22.490397,2d_descriptors,keras_dense,,,,,,,,,,,,,,,,,,,,,,,,,,,,,False,True,False,,,,,16.0,,,,,,,,,,,,,,,,,,,,,,,,,,,,,,,,,,,,,,,,,,,,200.0,,,,,,,,1D,,,,,,,,,,,,,,,,,,,,,tanh,relu,tanh,,0.448815652497744,0.7402126574929024,0.07156139821504022,,,60.0,24.0,33.0,,,,,,,,,,1.6586641430825727e-06,0.005140648300017814,0.00020279631284351567,,,1.7593001619170305e-05,2.056417402309856e-05,0.000908048291782541,,,,,,,,,,,,,,,,,,,,,,,,,,,,,keras,,,,,,,,,,,,,,,,3.0,,,,,,,,,,,,,,,,,,,,,pass_through_transformer,,simple_standardisation,custom_standardizer,,,,,,,,,,,,,,,,,,,,,,,,,,,COMPLETE
9,9,0.567205934246609,2023-12-29 01:05:42.922405,2023-12-29 01:11:55.557352,0 days 00:06:12.634947,2d_descriptors,,,,,,,,,,,,,,,,,,,,,,,,,,,,,,,,,,,,,,,,,,,,,,decision_tree_classifier_model,,,,,,,,,,gini,,,,,,,,,,,,,,,,,,,,,,,,,,,,,,,,select_from_model_fs,,,,,,,,,,,,,,,,,,,,,,,,,,,,,,,,,,,,,,,,,,,,,,,,,,,,,,,,,,,,,,,,,,,,,,,,,,,,,,,sklearn,,,,,,,957.0,,,,,,,,,,,,,,max,,,,,,,,,,,,,,,,normalizer,,,pass_through_standardizer,,,,,,,,,,,,,,,,,,,,,,,,,,,COMPLETE
10,10,0.6041416788139325,2023-12-29 01:11:55.576075,2023-12-29 01:22:31.761572,0 days 00:10:36.185497,,,,,,,,,,,,,,,,,,,,,,,,,,,,,,,,,,,,,512.0,,,,,,,,,,,,,,,,,,,,,,,,,,,,,,,,,,,,,,0.0,,,,,,397.0,,,,,,,,,,,,,,,,,,,,,,,,,,,,,,,,,,,,,,,,,,,,,,,,,,,,,,,,,,,,,,,,,,,,,,,,,,,,,,,,,,,,,,text_cnn_model,deepchem,,,,,,100.0,,,,,,,,,,,,,,,,,,,,,,,,,,,,,,,,,,basic_standardizer,,,,,,,,,,,,,,,,,,,,,,,,,,,COMPLETE
11,11,0.6070039429687664,2023-12-29 01:22:31.831514,2023-12-29 01:33:59.808473,0 days 00:11:27.976959,,,,,,,,,,,,,,,,,,,,,,,,,,,,,,,,,,,,,512.0,,,,,,,,,,,,,,,,,,,,,,,,,,,,,,,,,,,,,,0.0,,,,,,416.0,,,,,,,,,,,,,,,,,,,,,,,,,,,,,,,,,,,,,,,,,,,,,,,,,,,,,,,,,,,,,,,,,,,,,,,,,,,,,,,,,,,,,,text_cnn_model,deepchem,,,,,,100.0,,,,,,,,,,,,,,,,,,,,,,,,,,,,,,,,,,basic_standardizer,,,,,,,,,,,,,,,,,,,,,,,,,,,COMPLETE
12,12,-inf,2023-12-29 01:33:59.827641,2023-12-29 02:33:59.909322,0 days 01:00:00.081681,,,,,,,,,,,,,,,,,,,,,,,,,,,,,,,,,,,,,8.0,,,,,,,,,,,,,,,,,,,,,,,,,,,,,,,,,,,,,,,0.0,,,,,499.0,,,,,,,,,,,,,,,,,,,,,,,,,,,,,,,,,,,,,,,,,,,,,,,,,,,,,,,,,,,,,,,,,,,,,,,,,,,,,,,,,,,,,,weave_model,deepchem,,,,,,,,,,,,,,128.0,,,50.0,,,,,,,,,,,,,,,,,,,,,,,basic_standardizer,,,,,,,,,,,,True,,,,,,,,,,,,,,,COMPLETE
13,13,0.5848633071217677,2023-12-29 02:33:59.931333,2023-12-29 03:06:15.941928,0 days 00:32:16.010595,,,,,,,,,,,,,,,,,,,,,,,,,,,,,,,,,,,,,32.0,,,,,,,,,,,,,,,,,,,,,,,,,,,,,,,2.0,,,,,,,,,,,,,338.0,,,,,,,,,,,,,,0.5,3.0,,,,,,,,,,,,,,,,,,,,,,,,,,,,,,,,,,,,,,,,,,,,,,,,,,,,,,,,,,,,,,,,,,,,,,,dmpnn_model,deepchem,,,,,,,,,,,,,,,,,,,,,,,,,,,,,,,,,,,,,,,,basic_standardizer,,,,,,,,,,,,,,,,,,,,,,,,,,,COMPLETE
14,14,0.6029201048468156,2023-12-29 03:06:15.963666,2023-12-29 03:47:08.458378,0 days 00:40:52.494712,,,,,,,,,,,,,,,,,,,,,,,,,,,,,,,,,,,,,512.0,,,,,True,,,,,,,,,,,,,,,,,,,,,,,,,,,,,,0.0,,,,,,,,,657.0,,,,,,,,,,,,,,,,,,,,,,"[64, 64]",,,,,,,,,,,,,,,,,,,,,,,,,,,,,,,,,,,,,,,,,,,,,,,,,,,,,,,,,,,,,,,,gcn_model,deepchem,,,,,,,,,,,,,,,,,,,,,,,,,,,,,,,0.0,,,,,,,,,basic_standardizer,,,,,,,,,,False,,,,True,,,False,,,,,,,,,,COMPLETE
15,15,0.6433102885651728,2023-12-29 03:47:08.481108,2023-12-29 04:02:53.001889,0 days 00:15:44.520781,,,,,,,,,,,,,,,,,,,,,,,,,,,,,,,,,,,,,128.0,,,,,,,,,,,,,,,,,,,,,,,,,,,,,,,,,,,,,,0.0,,,,,,604.0,,,,,,,,,,,,,,,,,,,,,,,,,,,,,,,,,,,,,,,,,,,,,,,,,,,,,,,,,,,,,,,,,,,,,,,,,,,,,,,,,,,,,,text_cnn_model,deepchem,,,,,,100.0,,,,,,,,,,,,,,,,,,,,,,,,,,,,,,,,,simple_standardisation,custom_standardizer,,,,,,,,,,,,,,,,,,,,,,,,,,,COMPLETE
16,16,0.5897679027416404,2023-12-29 04:02:53.021282,2023-12-29 04:24:46.395856,0 days 00:21:53.374574,,,,,,,,,,,,,,,,,,,,,,,,,,,,,,,,,,,,,128.0,,,,,,,,,,,,,,,,,,,,,,,,,,,,,512.0,,,,,,,0.0,,,,,,,,651.0,,,,,,,,,,,,,,,,,,,,,"[256, 128, 64]",,,,,,,,,,,,,,,,,,,,,,,,,,,,,,,,,,,,,,,,,,,,,,,,,,,,,False,,,,,,,,,,,,graph_conv_model,deepchem,,,,,,,,,,,,,,,,,,,,,,,,,,,,,,,,,,,,,,,simple_standardisation,custom_standardizer,,,,,,,,,,,True,,,,,,,,,,,,,,,,COMPLETE
17,17,-inf,2023-12-29 04:24:46.417048,2023-12-29 04:24:46.530683,0 days 00:00:00.113635,,,,,,,,,,,,,,,,,,,,,,,,,,,,,,,,,,,,,256.0,,,,,,,,,,,,,,,,,,,,,,,,,,,,,,,,,,,,,,,,,,,,601.0,,,,,,,,,,,,,,,,,,,,,,,,,,,,,,,,,,,,,,,,,,,,,,,,,,,,,,,,,,,,,,,,,,,,,,,,,,,,,,,,,,,,,,gat_model,deepchem,,,,,,,,,,,,,,,,,,,,,,,,,,,,,,,,,,,,,,,simple_standardisation,custom_standardizer,,,,,,,,,True,,,,True,,,True,,,,,,,,,,,COMPLETE
18,18,-inf,2023-12-29 04:24:46.546858,2023-12-29 04:25:43.788626,0 days 00:00:57.241768,mixed,,,,,,,,,,,,,,,0.6472870341189028,,,,,,,,,,,,,,,,,,,,,,,,,,,,,,,multinomial_nb_model,,,,,,,,,,,,,,,,,,,,,,,,,,,,,,,,,,,,,,,,atom_pair,mol2vec,pass_through_transformer,,,,,,,,,,,,,,,,,,,,,,,,,,,,,,,,,,,,,,,,,,,,,,,,,,,,,,,,,,,,,,,,,,,,,,,,,,,,,,,sklearn,,,,,,,,,,,,,,,,,,,,,,,,,,,,,,,,,,,,,,,simple_standardisation,custom_standardizer,,,,,,,,,,,,,,,,,,,,,,,,,,,COMPLETE
19,19,0.5536583391875908,2023-12-29 04:25:43.835683,2023-12-29 04:49:53.782993,0 days 00:24:09.947310,,,keras_rnn,,,,,,,,,,,,,,,,,,,,,,,,,,,,,,,,,,,,32.0,,,,,,,,,,,,,,,,,,,,,,,,,tanh,0.49495189850198074,,240.0,,,,,,,,,,,,,,,,100.0,,,,,,,2D,,,,,,,,,,,,,,,0.21637093454838338,0.09592293979733951,,78.0,60.0,,,,,,,,,,,,,,,,,,,,,,,,,,,,,,,,,,,,,,,,0.2874109288171366,0.3140292865677432,,44.0,67.0,,,,,,,,,,,,,,,keras,,,,,,,,,,,,,,,2.0,,,2.0,,,,,,,,,,,,,,,,,,,,,simple_standardisation,custom_standardizer,,,,,,,,,,,,,,,,,,,,,,,,,,,COMPLETE
20,20,-inf,2023-12-29 04:49:53.803780,2023-12-29 05:49:54.196454,0 days 01:00:00.392674,,,,,,,,,,,,,,,,,,,,,,,,,,,,,,,,,,,,,128.0,,,,,,,,,,,,,,,,,,,,,,,,,,,,,,,,,,,,,0.5,,,,,,,831.0,,,,,,,,,,,,,,,,,,,,,,,,,,,,,,,,,,,,,,,,,,,,,,,,,,,,,,,,,,,,,,,,,,,,,,,,,,,,,,,,7.0,,,,,,pagtn_model,deepchem,,,,,,,,,,,,,,,,,,,,,,,,,1.0,,4.0,,,,,,,,,,,,simple_standardisation,custom_standardizer,,,,,,,,,,,,,,,,,,,,,,,,,,,COMPLETE
21,21,0.6034557634320098,2023-12-29 05:49:54.228531,2023-12-29 06:06:24.194318,0 days 00:16:29.965787,,,,,,,,,,,,,,,,,,,,,,,,,,,,,,,,,,,,,512.0,,,,,,,,,,,,,,,,,,,,,,,,,,,,,,,,,,,,,,0.0,,,,,,453.0,,,,,,,,,,,,,,,,,,,,,,,,,,,,,,,,,,,,,,,,,,,,,,,,,,,,,,,,,,,,,,,,,,,,,,,,,,,,,,,,,,,,,,text_cnn_model,deepchem,,,,,,100.0,,,,,,,,,,,,,,,,,,,,,,,,,,,,,,,,,,basic_standardizer,,,,,,,,,,,,,,,,,,,,,,,,,,,COMPLETE
