,number,value,datetime_start,datetime_complete,duration,params_1D_featurizer,params_1d_model,params_2d_model,params_C_logistic_regression,params_C_passive_aggressive_classifier,params_activation_mlp_classifier,params_algorithm_ada_boost_classifier,params_algorithm_radius_neighbors_classifier,params_alpha_bernoulli_nb,params_alpha_complement_nb,params_alpha_mlp_classifier,params_alpha_multinomial_nb,params_alpha_perceptron,params_alpha_ridge_classifier,params_alpha_ridge_classifier_cv,params_alpha_sgd_classifier,params_attention_dropout_0,params_attention_dropout_1,params_attention_dropout_2,params_attention_dropout_3,params_attention_key_dim_0,params_attention_key_dim_1,params_attention_key_dim_2,params_attention_key_dim_3,params_base_estimator_bagging_classifier,params_base_filters,params_batch_normalization_0,params_batch_normalization_1,params_batch_normalization_2,params_batch_normalization_3,params_batch_normalization_4,params_batch_size_1d_conv,params_batch_size_bi_rnn,params_batch_size_deepchem,params_batch_size_fcnn,params_batch_size_rnn,params_batch_size_simple_rnn,params_batch_size_tabular_transformer,params_batchnorm,params_bootstrap_bagging_classifier,params_bootstrap_extra_trees_classifier,params_bootstrap_features,params_bootstrap_random_forest_classifier,params_classification_model,params_conv_activation_0,params_conv_activation_1,params_conv_activation_2,params_conv_batch_norm_0,params_conv_batch_norm_1,params_conv_batch_norm_2,params_conv_dropout_0,params_conv_dropout_1,params_conv_dropout_2,params_criterion_decision_tree,params_criterion_extra_trees_classifier,params_criterion_gradient_boosting_classifier,params_criterion_random_forest_classifier,params_degree_nu_svc,params_degree_one_class_svm,params_dense_activation,params_dense_dropout,params_dense_layer_size,params_dense_units,params_depth_dmpnn,params_dropout,params_dropout_attentive_fp,params_dropout_dag,params_dropout_gcn,params_dropout_graph_conv,params_dropout_pagtn,params_dropout_text_cnn,params_dropouts_weave,params_embedding_dim,params_embedding_output_dim,params_epochs_1d_conv,params_epochs_bi_rnn,params_epochs_deepchem,params_epochs_fcnn,params_epochs_rnn,params_epochs_simple_rnn,params_epochs_tabular_transformer,params_epsilon_sgd_classifier,params_f1,params_f2,params_feature_selector,params_featurizer_type,params_filter_0,params_filter_1,params_filter_2,params_filters,params_fnn_dropout_p,params_fnn_layers,params_fpSize,params_g_noise,params_gamma_nu_svc,params_gamma_one_class_svm,params_graph_conv_layers_conv_model,params_graph_conv_layers_gcn,params_graph_feat_size_attentive_fp,params_gru_dropout_0,params_gru_dropout_1,params_gru_dropout_2,params_gru_units_0,params_gru_units_1,params_gru_units_2,params_hidden_activation_0,params_hidden_activation_1,params_hidden_activation_2,params_hidden_activation_3,params_hidden_activation_4,params_hidden_dropout_0,params_hidden_dropout_1,params_hidden_dropout_2,params_hidden_dropout_3,params_hidden_dropout_4,params_hidden_layer_sizes_mlp_classifier,params_hidden_layer_units_0,params_hidden_layer_units_1,params_hidden_layer_units_2,params_hidden_layer_units_3,params_hidden_layer_units_4,params_k,params_kernel_nu_svc,params_kernel_one_class_svm,params_kernel_size_0,params_kernel_size_1,params_kernel_size_2,params_kernel_size_smiles_to_vec,params_l1_0,params_l1_1,params_l1_2,params_l1_3,params_l1_4,params_l1_ratio_sgd_classifier,params_l2_0,params_l2_1,params_l2_2,params_l2_3,params_l2_4,params_layer_sizes_dag,params_layer_sizes_gather,params_leaf_size_radius_neighbors_classifier,params_learning_rate_ada_boost_classifier,params_learning_rate_gradient_boosting_classifier,params_learning_rate_hist_gradient_boosting_classifier,params_loss_gradient_boosting_classifier,params_lstm_dropout_0,params_lstm_dropout_1,params_lstm_dropout_2,params_lstm_units_0,params_lstm_units_1,params_lstm_units_2,params_master_atom,params_maxLength,params_maxPath,params_max_features_extra_trees_classifier,params_max_features_gradient_boosting_classifier,params_max_features_random_forest_classifier,params_max_length_pagtn,params_max_path,params_method,params_metric,params_minLength,params_minPath,params_min_path,params_model_steps,params_model_type,params_nBits,params_n_attention_heads,params_n_attention_layers,params_n_bits,params_n_conv_layers,params_n_embedding_text_cnn,params_n_estimators,params_n_estimators_ada_boost_classifier,params_n_estimators_bagging_classifier,params_n_estimators_extra_trees_classifier,params_n_estimators_gradient_boosting_classifier,params_n_estimators_random_forest_classifier,params_n_graph_feat_dag,params_n_graph_feat_weave,params_n_gru_layers,params_n_hidden_layers,params_n_hidden_weave,params_n_lstm_layers,params_n_quantiles,params_n_rnn_layers,params_nu_nu_svc,params_nu_one_class_svm,params_nu_sgd_one_class_svm,params_num_heads,params_num_layers_attentive_fp,params_num_layers_pagtn,params_output_distribution,params_p,params_penalty,params_percentile,params_predictor_dropout_gcn,params_quantile_range,params_radius,params_radius_n_radius_neighbors_classifier,params_reg_param,params_rnn_dropouts_0,params_rnn_dropouts_1,params_rnn_dropouts_2,params_rnn_units_0,params_rnn_units_1,params_rnn_units_2,params_scaler,params_solver,params_standardization_type,params_standardize,params_standardizer,params_stride_0,params_stride_1,params_stride_2,params_strides,params_support_weak,params_threshold,params_tol,params_use_chirality_attentive_fp,params_use_chirality_gat,params_use_chirality_gcn,params_use_chirality_graph_conv,params_use_chirality_weave,params_use_edges_gat,params_use_edges_gcn,params_use_partial_charge_attentive_fp,params_use_partial_charge_gat,params_use_partial_charge_gcn,params_weight_gbr,params_weight_lr,params_weight_mlp,params_weight_rfr,params_weight_svc,params_weights_radius_neighbors_classifier,params_with_centering,params_with_mean,params_with_scaling,params_with_std,state
88,88,0.7837050589376171,2023-12-30 13:33:53.147747,2023-12-30 14:23:44.621227,0 days 00:49:51.473480,maccs,,,,,,,,,,,,,,,,,,,,,,,,,,,,,,,,,,,,,,,,,,,gaussian_process_classifier_model,,,,,,,,,,,,,,,,,,,,,,,,,,,,,,,,,,,,,,,,,select_from_model_fs,,,,,,,,,,,,,,,,,,,,,,,,,,,,,,,,,,,,,,,,,,,,,,,,,,,,,,,,,,,,,,,,,,,,,,,,,,,,,,,,,,sklearn,,,,,,,24.0,,,,,,,,,,,,,,,,,,,,,,,,,,,,,,,,,,,,,heavy_standardisation,,custom_standardizer,,,,,,,,,,,,,,,,,,,,,,,,,,,,COMPLETE
89,89,0.7726107269130524,2023-12-30 14:23:44.661910,2023-12-30 15:00:23.998521,0 days 00:36:39.336611,maccs,,,,,,,,,,,,,,,,,,,,,,,,,,,,,,,,,,,,,,,,,,,gaussian_process_classifier_model,,,,,,,,,,,,,,,,,,,,,,,,,,,,,,,,,,,,,,,,,select_from_model_fs,,,,,,,,,,,,,,,,,,,,,,,,,,,,,,,,,,,,,,,,,,,,,,,,,,,,,,,,,,,,,,,,,,,,,,,,,,,,,,,,,,sklearn,,,,,,,16.0,,,,,,,,,,,,,,,,,,,,,,,,,,,,,,,,,,,,,heavy_standardisation,,custom_standardizer,,,,,,,,,,,,,,,,,,,,,,,,,,,,COMPLETE
90,90,0.801310063751924,2023-12-30 15:00:24.027923,2023-12-30 15:35:14.440053,0 days 00:34:50.412130,maccs,,,,,,,,,,,,,,,,,,,,,,,,,,,,,,,,,,,,,,,,,,,gaussian_process_classifier_model,,,,,,,,,,,,,,,,,,,,,,,,,,,,,,,,,,,,,,,,,select_from_model_fs,,,,,,,,,,,,,,,,,,,,,,,,,,,,,,,,,,,,,,,,,,,,,,,,,,,,,,,,,,,,,,,,,,,,,,,,,,,,,,,,,,sklearn,,,,,,,41.0,,,,,,,,,,,,,,,,,,,,,,,,,,,,,,,,,,,,,heavy_standardisation,,custom_standardizer,,,,,,,,,,,,,,,,,,,,,,,,,,,,COMPLETE
91,91,0.7917646092064696,2023-12-30 15:35:14.475579,2023-12-30 16:08:16.159236,0 days 00:33:01.683657,maccs,,,,,,,,,,,,,,,,,,,,,,,,,,,,,,,,,,,,,,,,,,,gaussian_process_classifier_model,,,,,,,,,,,,,,,,,,,,,,,,,,,,,,,,,,,,,,,,,select_from_model_fs,,,,,,,,,,,,,,,,,,,,,,,,,,,,,,,,,,,,,,,,,,,,,,,,,,,,,,,,,,,,,,,,,,,,,,,,,,,,,,,,,,sklearn,,,,,,,34.0,,,,,,,,,,,,,,,,,,,,,,,,,,,,,,,,,,,,,heavy_standardisation,,custom_standardizer,,,,,,,,,,,,,,,,,,,,,,,,,,,,COMPLETE
92,92,0.7950565024983629,2023-12-30 16:08:16.192278,2023-12-30 16:40:35.133695,0 days 00:32:18.941417,maccs,,,,,,,,,,,,,,,,,,,,,,,,,,,,,,,,,,,,,,,,,,,gaussian_process_classifier_model,,,,,,,,,,,,,,,,,,,,,,,,,,,,,,,,,,,,,,,,,select_from_model_fs,,,,,,,,,,,,,,,,,,,,,,,,,,,,,,,,,,,,,,,,,,,,,,,,,,,,,,,,,,,,,,,,,,,,,,,,,,,,,,,,,,sklearn,,,,,,,74.0,,,,,,,,,,,,,,,,,,,,,,,,,,,,,,,,,,,,,heavy_standardisation,,custom_standardizer,,,,,,,,,,,,,,,,,,,,,,,,,,,,COMPLETE
93,93,0.790188777630638,2023-12-30 16:40:35.161448,2023-12-30 17:12:29.470403,0 days 00:31:54.308955,maccs,,,,,,,,,,,,,,,,,,,,,,,,,,,,,,,,,,,,,,,,,,,gaussian_process_classifier_model,,,,,,,,,,,,,,,,,,,,,,,,,,,,,,,,,,,,,,,,,select_from_model_fs,,,,,,,,,,,,,,,,,,,,,,,,,,,,,,,,,,,,,,,,,,,,,,,,,,,,,,,,,,,,,,,,,,,,,,,,,,,,,,,,,,sklearn,,,,,,,123.0,,,,,,,,,,,,,,,,,,,,,,,,,,,,,,,,,,,,,heavy_standardisation,,custom_standardizer,,,,,,,,,,,,,,,,,,,,,,,,,,,,COMPLETE
94,94,0.7931999525022781,2023-12-30 17:12:29.498934,2023-12-30 17:44:05.441445,0 days 00:31:35.942511,maccs,,,,,,,,,,,,,,,,,,,,,,,,,,,,,,,,,,,,,,,,,,,gaussian_process_classifier_model,,,,,,,,,,,,,,,,,,,,,,,,,,,,,,,,,,,,,,,,,select_from_model_fs,,,,,,,,,,,,,,,,,,,,,,,,,,,,,,,,,,,,,,,,,,,,,,,,,,,,,,,,,,,,,,,,,,,,,,,,,,,,,,,,,,sklearn,,,,,,,140.0,,,,,,,,,,,,,,,,,,,,,,,,,,,,,,,,,,,,,heavy_standardisation,,custom_standardizer,,,,,,,,,,,,,,,,,,,,,,,,,,,,COMPLETE
95,95,0.8089171422892353,2023-12-30 17:44:05.496329,2023-12-30 18:16:53.986700,0 days 00:32:48.490371,maccs,,,,,,,,,,,,,,,,,,,,,,,,,,,,,,,,,,,,,,,,,,,gaussian_process_classifier_model,,,,,,,,,,,,,,,,,,,,,,,,,,,,,,,,,,,,,,,,,select_from_model_fs,,,,,,,,,,,,,,,,,,,,,,,,,,,,,,,,,,,,,,,,,,,,,,,,,,,,,,,,,,,,,,,,,,,,,,,,,,,,,,,,,,sklearn,,,,,,,170.0,,,,,,,,,,,,,,,,,,,,,,,,,,,,,,,,,,,,,heavy_standardisation,,custom_standardizer,,,,,,,,,,,,,,,,,,,,,,,,,,,,COMPLETE
96,96,0.7951588076006679,2023-12-30 18:16:54.009581,2023-12-30 19:04:00.643928,0 days 00:47:06.634347,maccs,,,,,,,,,,,,,,,,,,,,,,,,,,,,,,,,,,,,,,,,,,,gaussian_process_classifier_model,,,,,,,,,,,,,,,,,,,,,,,,,,,,,,,,,,,,,,,,,select_from_model_fs,,,,,,,,,,,,,,,,,,,,,,,,,,,,,,,,,,,,,,,,,,,,,,,,,,,,,,,,,,,,,,,,,,,,,,,,,,,,,,,,,,sklearn,,,,,,,200.0,,,,,,,,,,,,,,,,,,,,,,,,,,,,,,,,,,,,,heavy_standardisation,,custom_standardizer,,,,,,,,,,,,,,,,,,,,,,,,,,,,COMPLETE
97,97,0.6630317658224636,2023-12-30 19:04:00.692251,2023-12-30 19:52:51.310424,0 days 00:48:50.618173,maccs,,,,1.0911754516134908,,,,,,,,,,,,,,,,,,,,,,,,,,,,,,,,,,,,,,,passive_aggressive_classifier_model,,,,,,,,,,,,,,,,,,,,,,,,,,,,,,,,,,,,,,,,,select_from_model_fs,,,,,,,,,,,,,,,,,,,,,,,,,,,,,,,,,,,,,,,,,,,,,,,,,,,,,,,,,,,,,,,,,,,,,,,,,,,,,,,,,,sklearn,,,,,,,176.0,,,,,,,,,,,,,,,,,,,,,,,,,,,,,,,,,,,,,heavy_standardisation,,custom_standardizer,,,,,,,,,,,,,,,,,,,,,,,,,,,,COMPLETE
98,98,0.6977610933424886,2023-12-30 19:52:51.341221,2023-12-30 20:22:50.709724,0 days 00:29:59.368503,maccs,,,,,,,,,,,,1.1127924861889091,,,,,,,,,,,,,,,,,,,,,,,,,,,,,,,perceptron_model,,,,,,,,,,,,,,,,,,,,,,,,,,,,,,,,,,,,,,,,,select_from_model_fs,,,,,,,,,,,,,,,,,,,,,,,,,,,,,,,,,,,,,,,,,,,,,,,,,,,,,,,,,,,,,,,,,,,,,,,,,,,,,,,,,,sklearn,,,,,,,178.0,,,,,,,,,,,,,,,,,,,,,,,,,,,,,,,,,,,,,heavy_standardisation,,custom_standardizer,,,,,,,,,,,,,,,,,,,,,,,,,,,,COMPLETE
99,99,0.580216940682057,2023-12-30 20:22:50.728803,2023-12-30 20:52:28.515408,0 days 00:29:37.786605,maccs,,,,,,,,,,,,,,,,,,,,,,,,,,,,,,,,,,,,,,,,,,,nearest_centroid_model,,,,,,,,,,,,,,,,,,,,,,,,,,,,,,,,,,,,,,,,,select_from_model_fs,,,,,,,,,,,,,,,,,,,,,,,,,,,,,,,,,,,,,,,,,,,,,,,,,,,,,,,,,,,,,,,,,,,,,,,,,,,,,chebyshev,,,,,sklearn,,,,,,,128.0,,,,,,,,,,,,,,,,,,,,,,,,,,,,,,,,,,,,,heavy_standardisation,,custom_standardizer,,,,,,,,,,,,,,,,,,,,,,,,,,,,COMPLETE
