,number,value,datetime_start,datetime_complete,duration,params_1D_featurizer,params_1d_model,params_2d_model,params_C_linear_svc,params_C_logistic_regression,params_C_passive_aggressive_classifier,params_algorithm_ada_boost_classifier,params_algorithm_kneighbors_classifier,params_algorithm_radius_neighbors_classifier,params_alpha_bernoulli_nb,params_alpha_complement_nb,params_alpha_perceptron,params_alpha_ridge_classifier,params_alpha_ridge_classifier_cv,params_alpha_sgd_classifier,params_attention_dropout_0,params_attention_dropout_1,params_attention_key_dim_0,params_attention_key_dim_1,params_base_estimator_bagging_classifier,params_base_filters,params_batch_normalization_0,params_batch_normalization_1,params_batch_normalization_2,params_batch_size_deepchem,params_batchnorm,params_bootstrap_bagging_classifier,params_bootstrap_extra_trees_classifier,params_bootstrap_features,params_classification_model,params_conv_activation_0,params_conv_activation_1,params_conv_batch_norm_0,params_conv_batch_norm_1,params_conv_dropout_0,params_conv_dropout_1,params_criterion_decision_tree,params_criterion_extra_trees_classifier,params_degree_nu_svc,params_degree_one_class_svm,params_dense_activation,params_dense_dropout,params_dense_layer_size,params_dense_units,params_depth_dmpnn,params_dropout,params_dropout_attentive_fp,params_dropout_dag,params_dropout_gcn,params_dropout_graph_conv,params_dropout_pagtn,params_dropout_text_cnn,params_dropouts_weave,params_embedding_dim,params_embedding_output_dim,params_epochs_deepchem,params_epsilon_sgd_classifier,params_f1,params_f2,params_feature_selector,params_featurizer_type,params_filter_0,params_filter_1,params_filters,params_fnn_dropout_p,params_fnn_layers,params_fpSize,params_g_noise,params_gamma_nu_svc,params_gamma_one_class_svm,params_graph_conv_layers_conv_model,params_graph_conv_layers_gcn,params_graph_feat_size_attentive_fp,params_gru_dropout_0,params_gru_dropout_1,params_gru_dropout_2,params_gru_units_0,params_gru_units_1,params_gru_units_2,params_hidden_activation_0,params_hidden_activation_1,params_hidden_activation_2,params_hidden_dropout_0,params_hidden_dropout_1,params_hidden_dropout_2,params_hidden_layer_units_0,params_hidden_layer_units_1,params_hidden_layer_units_2,params_k,params_kernel_nu_svc,params_kernel_one_class_svm,params_kernel_size_0,params_kernel_size_1,params_kernel_size_smiles_to_vec,params_l1_0,params_l1_1,params_l1_2,params_l1_ratio_sgd_classifier,params_l2_0,params_l2_1,params_l2_2,params_layer_sizes_dag,params_layer_sizes_gather,params_leaf_size_kneighbors_classifier,params_leaf_size_radius_neighbors_classifier,params_learning_rate_ada_boost_classifier,params_learning_rate_hist_gradient_boosting_classifier,params_lstm_dropout_0,params_lstm_dropout_1,params_lstm_dropout_2,params_lstm_units_0,params_lstm_units_1,params_lstm_units_2,params_master_atom,params_maxLength,params_maxPath,params_max_features_extra_trees_classifier,params_max_length_pagtn,params_max_path,params_minLength,params_minPath,params_min_path,params_model_steps,params_model_type,params_nBits,params_n_attention_heads,params_n_attention_layers,params_n_bits,params_n_conv_layers,params_n_embedding_text_cnn,params_n_estimators,params_n_estimators_ada_boost_classifier,params_n_estimators_bagging_classifier,params_n_estimators_extra_trees_classifier,params_n_graph_feat_dag,params_n_graph_feat_weave,params_n_gru_layers,params_n_hidden_layers,params_n_hidden_weave,params_n_lstm_layers,params_n_neighbors_kneighbors_classifier,params_n_quantiles,params_n_rnn_layers,params_nu_nu_svc,params_nu_one_class_svm,params_nu_sgd_one_class_svm,params_num_heads,params_num_layers_attentive_fp,params_num_layers_pagtn,params_output_distribution,params_p,params_penalty,params_percentile,params_predictor_dropout_gcn,params_radius,params_radius_n_radius_neighbors_classifier,params_rnn_dropouts_0,params_rnn_units_0,params_scaler,params_solver,params_standardization_type,params_standardizer,params_stride_0,params_stride_1,params_strides,params_support_weak,params_threshold,params_tol,params_use_chirality_attentive_fp,params_use_chirality_gat,params_use_chirality_gcn,params_use_chirality_graph_conv,params_use_chirality_weave,params_use_edges_gat,params_use_edges_gcn,params_use_partial_charge_attentive_fp,params_use_partial_charge_gat,params_use_partial_charge_gcn,params_weight_gbr,params_weight_lr,params_weight_mlp,params_weight_rfr,params_weight_svc,params_weights_kneighbors_classifier,params_weights_radius_neighbors_classifier,state
31,31,0.7713572303676032,2024-02-16 20:45:35.825470,2024-02-16 20:56:55.413392,0 days 00:11:19.587922,atom_pair,,,,,,,,,,,,,,,,,,,,,,,,,,,,,voting_classifier_model,,,,,,,,,,,,,,,,,,,,,,,,,,,,,,pass_through_transformer,,,,,,,,,,,,,,,,,,,,,,,,,,,,,,,,,,,,,,,,,,,,,,,,,,,,,,,30.0,,,,,2.0,,,,sklearn,2048.0,,,,,,,,,,,,,,,,,,,,,,,,,,,,,,,,,,,,,pass_through_standardizer,,,,,,,,,,,,,,,,,0.00022382335911307755,0.7086790227597088,0.20285032678168627,0.4243125565272256,0.04328956781928628,,,COMPLETE
32,32,0.7792462963045723,2024-02-16 20:56:55.496841,2024-02-16 21:03:57.585713,0 days 00:07:02.088872,atom_pair,,,,0.20897033325110714,,,,,,,,,,,,,,,,,,,,,,,,,logistic_regression_model,,,,,,,,,,,,,,,,,,,,,,,,,,,,,,pass_through_transformer,,,,,,,,,,,,,,,,,,,,,,,,,,,,,,,,,,,,,,,,,,,,,,,,,,,,,,,30.0,,,,,2.0,,,,sklearn,2048.0,,,,,,,,,,,,,,,,,,,,,,,,,,,,,,,,,,,,,pass_through_standardizer,,,,,,,,,,,,,,,,,,,,,,,,COMPLETE
33,33,0.7014500151963442,2024-02-16 21:03:57.652794,2024-02-16 21:10:46.590204,0 days 00:06:48.937410,atom_pair,,,,,,,,,,,,,,,,,,,,,,,,,,,,,decision_tree_classifier_model,,,,,,,entropy,,,,,,,,,,,,,,,,,,,,,,,pass_through_transformer,,,,,,,,,,,,,,,,,,,,,,,,,,,,,,,,,,,,,,,,,,,,,,,,,,,,,,,20.0,,,,,3.0,,,,sklearn,1024.0,,,,,,,,,,,,,,,,,,,,,,,,,,,,,,,,,,,,,pass_through_standardizer,,,,,,,,,,,,,,,,,,,,,,,,COMPLETE
34,34,0.7570834301814623,2024-02-16 21:10:46.654862,2024-02-16 21:18:20.809753,0 days 00:07:34.154891,layered,,,,,,,,,,,,,,,,,,,,,,,,,,,True,,extra_trees_classifier_model,,,,,,,,entropy,,,,,,,,,,,,,,,,,,,,,,select_from_model_fs,,,,,,,2048.0,,,,,,,,,,,,,,,,,,,,,,,,,,,,,,,,,,,,,,,,,,,,,,,,,10.0,sqrt,,,,1.0,,,sklearn,,,,,,,12.0,,,700.0,,,,,,,,,,,,,,,,,,,,,,,,,,,,pass_through_standardizer,,,,,,,,,,,,,,,,,,,,,,,,COMPLETE
35,35,-inf,2024-02-16 21:18:20.878354,2024-02-16 21:18:48.241676,0 days 00:00:27.363322,,,keras_bidirectional_rnn,,,,,,,,,,,,,,,,,,,,,,,,,,,,,,,,,,,,,,tanh,0.23544137234168303,,176.0,,,,,,,,,,,,,,,,,2D,,,,,,,,,,,,,0.01778913192191328,0.47030588660322514,0.26096208547974686,17.0,237.0,106.0,,,,,,,,,,,,,,,,,,,,,,,,,,,,,0.025867543038957552,0.03007736465353328,0.4177461265268717,21.0,252.0,48.0,,,,,,,,,,,keras,,,,,,,,,,,,,3.0,,,3.0,,,,,,,,,,,,,,,,,,,,,,,,,,,,,,,,,,,,,,,,,,,,,,COMPLETE
36,36,-inf,2024-02-16 21:18:48.259514,2024-02-16 21:34:12.032945,0 days 00:15:23.773431,mixed,,,,,,,,,,,,,,0.6838704670525658,,,,,,,,,,,,,,,sgd_classifier_model,,,,,,,,,,,,,,,,,,,,,,,,,,,0.870351846467448,atom_pair,morgan,k_best,,,,,,,,,,,,,,,,,,,,,,,,,,,,,25.0,,,,,,,,,0.5461277531000039,,,,,,,,,,,,,,,,,,,,,,,,,,sklearn,,,,,,,,,,,,,,,,,,,,,,,,,,,,l1,,,,,,,,,,chembl_standardizer,,,,,,,,,,,,,,,,,,,,,,,,COMPLETE
37,37,-inf,2024-02-16 21:34:12.156987,2024-02-17 00:34:12.396036,0 days 03:00:00.239049,,,,,,,,,,,,,,,,,,,,,,,,,64.0,,,,,,,,,,,,,,,,,,,,,,0.0,,,,,,,,,482.0,,,,,,,,,,,,,,,,,500.0,,,,,,,,,,,,,,,,,,,,,,,,,,,,,,,,,,,,,,,,,,,,,,,,,,attentive_fp_model,deepchem,,,,,,,,,,,,,,,,,,,,,,,,1.0,,,,,,,,,,,,,,pass_through_standardizer,,,,,,,True,,,,,,,True,,,,,,,,,,COMPLETE
38,38,-inf,2024-02-17 00:34:12.421030,2024-02-17 00:34:44.173547,0 days 00:00:31.752517,,,keras_rnn,,,,,,,,,,,,,,,,,,,,,,,,,,,,,,,,,,,,,,tanh,0.0007062551038375942,,112.0,,,,,,,,,,,,,,,,,2D,,,,,,,,,,,,,0.4789244067923637,,,81.0,,,,,,,,,,,,,,,,,,,,,,,,,,,,,,,0.49038966630958136,,,255.0,,,,,,,,,,,,,keras,,,,,,,,,,,,,1.0,,,1.0,,,,,,,,,,,,,,,,,,,,,,,,,,,,,,,,,,,,,,,,,,,,,,COMPLETE
39,39,0.7971777952953947,2024-02-17 00:34:44.219114,2024-02-17 00:55:55.563605,0 days 00:21:11.344491,atom_pair,,,,,,,,,,,,,,,,,,,,,,,,,,,,,voting_classifier_model,,,,,,,,,,,,,,,,,,,,,,,,,,,,,,pass_through_transformer,,,,,,,,,,,,,,,,,,,,,,,,,,,,,,,,,,,,,,,,,,,,,,,,,,,,,,,40.0,,,,,1.0,,,,sklearn,2048.0,,,,,,,,,,,,,,,,,,,,,,,,,,,,,,,,,,,,,basic_standardizer,,,,,,,,,,,,,,,,,0.011766440522420624,0.6609890438399484,0.55944593510508,0.43929050954023446,0.16984112289722686,,,COMPLETE
40,40,-inf,2024-02-17 00:55:55.602758,2024-02-17 03:55:55.909077,0 days 03:00:00.306319,,,,,,,,,,,,,,,,,,,,,16.0,,,,16.0,,,,,,,,,,,,,,,,,,,,,,,,,,,,,,,800.0,,,,,,,,,,,,,,,,,,,,,,,,,,,,,,,,,,,,,,,,,,,,,,,,,,,,,,,,,,,,,,,,,,,chem_ception_model,deepchem,,,,,,,,,,,,,,,,,,,,,,,,,,,,,,,,,,,,,,basic_standardizer,,,,,,,,,,,,,,,,,,,,,,,,COMPLETE
41,41,0.7882156534330541,2024-02-17 03:55:55.986267,2024-02-17 04:14:52.589349,0 days 00:18:56.603082,atom_pair,,,,,,,,,,,,,,,,,,,,,,,,,,,,,voting_classifier_model,,,,,,,,,,,,,,,,,,,,,,,,,,,,,,pass_through_transformer,,,,,,,,,,,,,,,,,,,,,,,,,,,,,,,,,,,,,,,,,,,,,,,,,,,,,,,40.0,,,,,1.0,,,,sklearn,2048.0,,,,,,,,,,,,,,,,,,,,,,,,,,,,,,,,,,,,,basic_standardizer,,,,,,,,,,,,,,,,,0.004359872391186875,0.670355708480973,0.6516487840921732,0.4872514796578785,0.18976179946048552,,,COMPLETE
42,42,0.797092840443613,2024-02-17 04:14:52.620714,2024-02-17 04:34:34.561161,0 days 00:19:41.940447,atom_pair,,,,,,,,,,,,,,,,,,,,,,,,,,,,,voting_classifier_model,,,,,,,,,,,,,,,,,,,,,,,,,,,,,,pass_through_transformer,,,,,,,,,,,,,,,,,,,,,,,,,,,,,,,,,,,,,,,,,,,,,,,,,,,,,,,30.0,,,,,1.0,,,,sklearn,2048.0,,,,,,,,,,,,,,,,,,,,,,,,,,,,,,,,,,,,,basic_standardizer,,,,,,,,,,,,,,,,,0.039095389199248466,0.6491565060546387,0.43968640183920304,0.42428420231931735,0.15632542943179115,,,COMPLETE
43,43,-inf,2024-02-17 04:34:34.630571,2024-02-17 04:35:28.704247,0 days 00:00:54.073676,atom_pair,,,,,,,,,,,,,,,,,,,,,,,,,,,,,nu_svc_model,,,,,,,,,4.0,,,,,,,,,,,,,,,,,,,,,pass_through_transformer,,,,,,,,,0.4694844387988492,,,,,,,,,,,,,,,,,,,,,linear,,,,,,,,,,,,,,,,,,,,,,,,,40.0,,,,,1.0,,,,sklearn,2048.0,,,,,,,,,,,,,,,,,,,0.9859241286183011,,,,,,,,,,,,,,,,,,basic_standardizer,,,,,,,,,,,,,,,,,,,,,,,,COMPLETE
44,44,0.7312654540132967,2024-02-17 04:35:28.759635,2024-02-17 04:51:27.898996,0 days 00:15:59.139361,atom_pair,,,,,,,,,,,,,1.9887239870031608,,,,,,,,,,,,,,,,ridge_classifier_cv_model,,,,,,,,,,,,,,,,,,,,,,,,,,,,,,pass_through_transformer,,,,,,,,,,,,,,,,,,,,,,,,,,,,,,,,,,,,,,,,,,,,,,,,,,,,,,,30.0,,,,,1.0,,,,sklearn,2048.0,,,,,,,,,,,,,,,,,,,,,,,,,,,,,,,,,,,,,basic_standardizer,,,,,,,,,,,,,,,,,,,,,,,,COMPLETE
45,45,0.7927464036534321,2024-02-17 04:51:27.956820,2024-02-17 05:08:14.010192,0 days 00:16:46.053372,atom_pair,,,,,,,,,,,,,,,,,,,,,,,,,,,,,gaussian_process_classifier_model,,,,,,,,,,,,,,,,,,,,,,,,,,,,,,pass_through_transformer,,,,,,,,,,,,,,,,,,,,,,,,,,,,,,,,,,,,,,,,,,,,,,,,,,,,,,,40.0,,,,,1.0,,,,sklearn,2048.0,,,,,,,,,,,,,,,,,,,,,,,,,,,,,,,,,,,,,basic_standardizer,,,,,,,,,,,,,,,,,,,,,,,,COMPLETE
46,46,-inf,2024-02-17 05:08:14.045422,2024-02-17 05:08:14.720041,0 days 00:00:00.674619,maccs,keras_1d_cnn,,,,,,,,,,,,,,,,,,,,,,,,,,,,,tanh,relu,False,False,0.7519678570906337,0.20431552739636036,,,,,relu,,,256.0,,0.4904285442412427,,,,,,,,,,,,,,,1D,22.0,17.0,,,,,0.030266362163393446,,,,,,,,,,,,,,,,,,,,,,,,37.0,29.0,,,,,,,,,,,,,,,,,,,,,,,,,,,,,,,keras,,,,,2.0,,,,,,,,,,,,,,,,,,,,,,,,,,,,,,,,,,2.0,2.0,,,,,,,,,,,,,,,,,,,,,,COMPLETE
47,47,0.7712618449250453,2024-02-17 05:08:14.770623,2024-02-17 07:24:43.664212,0 days 02:16:28.893589,atom_pair,,,,,,,,,,,,,,,,,,,,,,,,,,,,,hist_gradient_boosting_classifier_model,,,,,,,,,,,,,,,,,,,,,,,,,,,,,,pass_through_transformer,,,,,,,,,,,,,,,,,,,,,,,,,,,,,,,,,,,,,,,,,,,,,,,0.4042082002896362,,,,,,,,30.0,,,,,1.0,,,,sklearn,2048.0,,,,,,,,,,,,,,,,,,,,,,,,,,,,,,,,,,,,,basic_standardizer,,,,,,,,,,,,,,,,,,,,,,,,COMPLETE
48,48,0.7667632553970343,2024-02-17 07:24:43.710783,2024-02-17 08:16:24.689808,0 days 00:51:40.979025,,,,,,,,,,,,,,,,,,,,,,,,,32.0,,,,,,,,,,,,,,,,,,128.0,,,,,,,0.5,,,,,,326.0,,,,,,,,,,,,,,,"[64, 64]",,,,,,,,,,,,,,,,,,,,,,,,,,,,,,,,,,,,,,,,,,,True,,,,,,,,,graph_conv_model,deepchem,,,,,,,,,,,,,,,,,,,,,,,,,,,,,,,,,,,,,,basic_standardizer,,,,,,,,,,False,,,,,,,,,,,,,,COMPLETE
49,49,0.7392926683132491,2024-02-17 08:16:24.705835,2024-02-17 08:26:23.998758,0 days 00:09:59.292923,rdk,,,7.146766874853009,,,,,,,,,,,,,,,,,,,,,,,,,,linear_svc_model,,,,,,,,,,,,,,,,,,,,,,,,,,,,,,select_from_model_fs,,,,,,,1024.0,,,,,,,,,,,,,,,,,,,,,,,,,,,,,,,,,,,,,,,,,,,,,,,,,,,,5.0,,,1.0,,sklearn,,,,,,,974.0,,,,,,,,,,,,,,,,,,,,,,,,,,,,,,simple_standardisation,custom_standardizer,,,,,,,,,,,,,,,,,,,,,,,,COMPLETE
50,50,0.7711919822973055,2024-02-17 08:26:24.021430,2024-02-17 09:25:11.396886,0 days 00:58:47.375456,layered,,,,,,SAMME.R,,,,,,,,,,,,,,,,,,,,,,,ada_boost_classifier_model,,,,,,,,,,,,,,,,,,,,,,,,,,,,,,boruta_algorithm,,,,,,,2048.0,,,,,,,,,,,,,,,,,,,,,,,,,,,,,,,,,,,,,,,0.5945188219308581,,,,,,,,,,9.0,,,,,3.0,,,sklearn,,,,,,,,100.0,,,,,,,,,,,,,,,,,,,,,,,,,,,,,,basic_standardizer,,,,True,,,,,,,,,,,,,,,,,,,,COMPLETE
51,51,0.7890819367077424,2024-02-17 09:25:11.419830,2024-02-17 09:35:45.974893,0 days 00:10:34.555063,atom_pair,,,,,,,,,,,,,,,,,,,,,,,,,,,,,voting_classifier_model,,,,,,,,,,,,,,,,,,,,,,,,,,,,,,pass_through_transformer,,,,,,,,,,,,,,,,,,,,,,,,,,,,,,,,,,,,,,,,,,,,,,,,,,,,,,,30.0,,,,,2.0,,,,sklearn,2048.0,,,,,,,,,,,,,,,,,,,,,,,,,,,,,,,,,,,,,pass_through_standardizer,,,,,,,,,,,,,,,,,0.029540821172010862,0.6513661621434516,0.5061529277528413,0.44984090158165385,0.13594616364749035,,,COMPLETE
52,52,0.7717716483615047,2024-02-17 09:35:46.032883,2024-02-17 09:41:10.626321,0 days 00:05:24.593438,maccs,,,,,,,,,0.8903629798152574,,,,,,,,,,,,,,,,,,,,bernoulli_nb_model,,,,,,,,,,,,,,,,,,,,,,,,,,,,,,percentil_fs,,,,,,,,,,,,,,,,,,,,,,,,,,,,,,,,,,,,,,,,,,,,,,,,,,,,,,,,,,,,,,,,sklearn,,,,,,,,,,,,,,,,,,,,,,,,,,,,,49.0,,,,,,,,,pass_through_standardizer,,,,,,,,,,,,,,,,,,,,,,,,COMPLETE
53,53,-inf,2024-02-17 09:41:10.645034,2024-02-17 12:41:10.673769,0 days 03:00:00.028735,mixed,,,,,,,,,,,,,,,,,,,,,,,,,,,,,,,,,,,,,,,,,,,,,,,,,,,,,,,,,layered,layered,,,,,,,,,,,,,,,,,,,,,,,,,,,,,,,,,,,,,,,,,,,,,,,,,,,,,,,,,,,,,,,,,sklearn,,,,,,,,,,,,,,,,,,,,,,,,,,,,,,,,,,,,,,,,,,,,,,,,,,,,,,,,,,,,,,COMPLETE
54,54,0.4541640379457645,2024-02-17 12:41:10.702407,2024-02-17 12:52:01.363033,0 days 00:10:50.660626,atom_pair,,,,,,,,,,,,,,,,,,,,,,,,,,,,,sgd_one_class_svm_model,,,,,,,,,,,,,,,,,,,,,,,,,,,,,,pass_through_transformer,,,,,,,,,,,,,,,,,,,,,,,,,,,,,,,,,,,,,,,,,,,,,,,,,,,,,,,30.0,,,,,2.0,,,,sklearn,2048.0,,,,,,,,,,,,,,,,,,,,,0.7847610071851888,,,,,,,,,,,,,,,,chembl_standardizer,,,,,,0.01568971776449013,,,,,,,,,,,,,,,,,,COMPLETE
55,55,0.81524479663322,2024-02-17 12:52:01.386160,2024-02-17 14:38:38.659039,0 days 01:46:37.272879,,,,,,,,,,,,,,,,,,,,,,,,,256.0,,,,,,,,,,,,,,,,,,,,2.0,,,,,,,,,,,554.0,,,,,,,,,0.5,3.0,,,,,,,,,,,,,,,,,,,,,,,,,,,,,,,,,,,,,,,,,,,,,,,,,,,,,,,,,dmpnn_model,deepchem,,,,,,,,,,,,,,,,,,,,,,,,,,,,,,,,,,,,,simple_standardisation,custom_standardizer,,,,,,,,,,,,,,,,,,,,,,,,COMPLETE
56,56,0.8050087303709386,2024-02-17 14:38:38.694075,2024-02-17 17:16:55.653868,0 days 02:38:16.959793,,,,,,,,,,,,,,,,,,,,,,,,,256.0,,,,,,,,,,,,,,,,,,,,2.0,,,,,,,,,,,558.0,,,,,,,,,0.5,3.0,,,,,,,,,,,,,,,,,,,,,,,,,,,,,,,,,,,,,,,,,,,,,,,,,,,,,,,,,dmpnn_model,deepchem,,,,,,,,,,,,,,,,,,,,,,,,,,,,,,,,,,,,,simple_standardisation,custom_standardizer,,,,,,,,,,,,,,,,,,,,,,,,COMPLETE
57,57,0.8076941545783667,2024-02-17 17:16:55.706746,2024-02-17 19:10:01.956506,0 days 01:53:06.249760,,,,,,,,,,,,,,,,,,,,,,,,,256.0,,,,,,,,,,,,,,,,,,,,2.0,,,,,,,,,,,577.0,,,,,,,,,0.5,3.0,,,,,,,,,,,,,,,,,,,,,,,,,,,,,,,,,,,,,,,,,,,,,,,,,,,,,,,,,dmpnn_model,deepchem,,,,,,,,,,,,,,,,,,,,,,,,,,,,,,,,,,,,,simple_standardisation,custom_standardizer,,,,,,,,,,,,,,,,,,,,,,,,COMPLETE
58,58,0.8151754125098094,2024-02-17 19:10:01.982962,2024-02-17 20:50:44.973419,0 days 01:40:42.990457,,,,,,,,,,,,,,,,,,,,,,,,,256.0,,,,,,,,,,,,,,,,,,,,2.0,,,,,,,,,,,566.0,,,,,,,,,0.5,3.0,,,,,,,,,,,,,,,,,,,,,,,,,,,,,,,,,,,,,,,,,,,,,,,,,,,,,,,,,dmpnn_model,deepchem,,,,,,,,,,,,,,,,,,,,,,,,,,,,,,,,,,,,,simple_standardisation,custom_standardizer,,,,,,,,,,,,,,,,,,,,,,,,COMPLETE
59,59,0.7955841002938928,2024-02-17 20:50:44.992284,2024-02-17 22:09:38.614448,0 days 01:18:53.622164,,,,,,,,,,,,,,,,,,,,,,,,,256.0,,,,,,,,,,,,,,,,,,,,2.0,,,,,,,,,,,545.0,,,,,,,,,0.5,3.0,,,,,,,,,,,,,,,,,,,,,,,,,,,,,,,,,,,,,,,,,,,,,,,,,,,,,,,,,dmpnn_model,deepchem,,,,,,,,,,,,,,,,,,,,,,,,,,,,,,,,,,,,,simple_standardisation,custom_standardizer,,,,,,,,,,,,,,,,,,,,,,,,COMPLETE
60,60,0.8121059996851827,2024-02-17 22:09:38.631792,2024-02-17 23:41:47.004583,0 days 01:32:08.372791,,,,,,,,,,,,,,,,,,,,,,,,,256.0,,,,,,,,,,,,,,,,,,,,2.0,,,,,,,,,,,593.0,,,,,,,,,0.5,3.0,,,,,,,,,,,,,,,,,,,,,,,,,,,,,,,,,,,,,,,,,,,,,,,,,,,,,,,,,dmpnn_model,deepchem,,,,,,,,,,,,,,,,,,,,,,,,,,,,,,,,,,,,,simple_standardisation,custom_standardizer,,,,,,,,,,,,,,,,,,,,,,,,COMPLETE
61,61,0.8028669821570672,2024-02-17 23:41:47.030899,2024-02-18 01:31:41.350101,0 days 01:49:54.319202,,,,,,,,,,,,,,,,,,,,,,,,,256.0,,,,,,,,,,,,,,,,,,,,2.0,,,,,,,,,,,603.0,,,,,,,,,0.5,3.0,,,,,,,,,,,,,,,,,,,,,,,,,,,,,,,,,,,,,,,,,,,,,,,,,,,,,,,,,dmpnn_model,deepchem,,,,,,,,,,,,,,,,,,,,,,,,,,,,,,,,,,,,,simple_standardisation,custom_standardizer,,,,,,,,,,,,,,,,,,,,,,,,COMPLETE
62,62,0.8161507039482864,2024-02-18 01:31:41.370162,2024-02-18 03:45:29.712113,0 days 02:13:48.341951,,,,,,,,,,,,,,,,,,,,,,,,,256.0,,,,,,,,,,,,,,,,,,,,2.0,,,,,,,,,,,589.0,,,,,,,,,0.5,3.0,,,,,,,,,,,,,,,,,,,,,,,,,,,,,,,,,,,,,,,,,,,,,,,,,,,,,,,,,dmpnn_model,deepchem,,,,,,,,,,,,,,,,,,,,,,,,,,,,,,,,,,,,,simple_standardisation,custom_standardizer,,,,,,,,,,,,,,,,,,,,,,,,COMPLETE
63,63,0.813749573218978,2024-02-18 03:45:29.751252,2024-02-18 05:18:15.259008,0 days 01:32:45.507756,,,,,,,,,,,,,,,,,,,,,,,,,256.0,,,,,,,,,,,,,,,,,,,,2.0,,,,,,,,,,,552.0,,,,,,,,,0.5,3.0,,,,,,,,,,,,,,,,,,,,,,,,,,,,,,,,,,,,,,,,,,,,,,,,,,,,,,,,,dmpnn_model,deepchem,,,,,,,,,,,,,,,,,,,,,,,,,,,,,,,,,,,,,simple_standardisation,custom_standardizer,,,,,,,,,,,,,,,,,,,,,,,,COMPLETE
64,64,0.8117077495856135,2024-02-18 05:18:15.285954,2024-02-18 06:58:42.080467,0 days 01:40:26.794513,,,,,,,,,,,,,,,,,,,,,,,,,256.0,,,,,,,,,,,,,,,,,,,,2.0,,,,,,,,,,,516.0,,,,,,,,,0.5,3.0,,,,,,,,,,,,,,,,,,,,,,,,,,,,,,,,,,,,,,,,,,,,,,,,,,,,,,,,,dmpnn_model,deepchem,,,,,,,,,,,,,,,,,,,,,,,,,,,,,,,,,,,,,simple_standardisation,custom_standardizer,,,,,,,,,,,,,,,,,,,,,,,,COMPLETE
65,65,0.8058737021335235,2024-02-18 06:58:42.098516,2024-02-18 08:50:04.955259,0 days 01:51:22.856743,,,,,,,,,,,,,,,,,,,,,,,,,256.0,,,,,,,,,,,,,,,,,,,,2.0,,,,,,,,,,,496.0,,,,,,,,,0.5,3.0,,,,,,,,,,,,,,,,,,,,,,,,,,,,,,,,,,,,,,,,,,,,,,,,,,,,,,,,,dmpnn_model,deepchem,,,,,,,,,,,,,,,,,,,,,,,,,,,,,,,,,,,,,simple_standardisation,custom_standardizer,,,,,,,,,,,,,,,,,,,,,,,,COMPLETE
66,66,0.8089854082810388,2024-02-18 08:50:04.987244,2024-02-18 11:01:34.150336,0 days 02:11:29.163092,,,,,,,,,,,,,,,,,,,,,,,,,256.0,,,,,,,,,,,,,,,,,,,,2.0,,,,,,,,,,,649.0,,,,,,,,,0.5,3.0,,,,,,,,,,,,,,,,,,,,,,,,,,,,,,,,,,,,,,,,,,,,,,,,,,,,,,,,,dmpnn_model,deepchem,,,,,,,,,,,,,,,,,,,,,,,,,,,,,,,,,,,,,simple_standardisation,custom_standardizer,,,,,,,,,,,,,,,,,,,,,,,,COMPLETE
67,67,0.7874842378147735,2024-02-18 11:01:34.166200,2024-02-18 12:24:19.652902,0 days 01:22:45.486702,,,,,,,,,,,,,,,,,,,,,,,,,256.0,,,,,,,,,,,,,,,,,,,,2.0,,,,,,,,,,,506.0,,,,,,,,,0.25,2.0,,,,,,,,,,,,,,,,,,,,,,,,,,,,,,,,,,,,,,,,,,,,,,,,,,,,,,,,,dmpnn_model,deepchem,,,,,,,,,,,,,,,,,,,,,,,,,,,,,,,,,,,,,simple_standardisation,custom_standardizer,,,,,,,,,,,,,,,,,,,,,,,,COMPLETE
68,68,0.8186792071537461,2024-02-18 12:24:19.674393,2024-02-18 13:45:42.812388,0 days 01:21:23.137995,,,,,,,,,,,,,,,,,,,,,,,,,256.0,,,,,,,,,,,,,,,,,,,,4.0,,,,,,,,,,,422.0,,,,,,,,,0.5,3.0,,,,,,,,,,,,,,,,,,,,,,,,,,,,,,,,,,,,,,,,,,,,,,,,,,,,,,,,,dmpnn_model,deepchem,,,,,,,,,,,,,,,,,,,,,,,,,,,,,,,,,,,,,simple_standardisation,custom_standardizer,,,,,,,,,,,,,,,,,,,,,,,,COMPLETE
69,69,0.8110594740107739,2024-02-18 13:45:42.845206,2024-02-18 15:07:57.446128,0 days 01:22:14.600922,,,,,,,,,,,,,,,,,,,,,,,,,256.0,,,,,,,,,,,,,,,,,,,,4.0,,,,,,,,,,,413.0,,,,,,,,,0.25,2.0,,,,,,,,,,,,,,,,,,,,,,,,,,,,,,,,,,,,,,,,,,,,,,,,,,,,,,,,,dmpnn_model,deepchem,,,,,,,,,,,,,,,,,,,,,,,,,,,,,,,,,,,,,simple_standardisation,custom_standardizer,,,,,,,,,,,,,,,,,,,,,,,,COMPLETE
70,70,0.8218018584498857,2024-02-18 15:07:57.466788,2024-02-18 16:52:12.322596,0 days 01:44:14.855808,,,,,,,,,,,,,,,,,,,,,,,,,256.0,,,,,,,,,,,,,,,,,,,,4.0,,,,,,,,,,,608.0,,,,,,,,,0.5,3.0,,,,,,,,,,,,,,,,,,,,,,,,,,,,,,,,,,,,,,,,,,,,,,,,,,,,,,,,,dmpnn_model,deepchem,,,,,,,,,,,,,,,,,,,,,,,,,,,,,,,,,,,,,simple_standardisation,custom_standardizer,,,,,,,,,,,,,,,,,,,,,,,,COMPLETE
71,71,0.8084321894096378,2024-02-18 16:52:12.362937,2024-02-18 18:41:38.801454,0 days 01:49:26.438517,,,,,,,,,,,,,,,,,,,,,,,,,256.0,,,,,,,,,,,,,,,,,,,,4.0,,,,,,,,,,,607.0,,,,,,,,,0.5,3.0,,,,,,,,,,,,,,,,,,,,,,,,,,,,,,,,,,,,,,,,,,,,,,,,,,,,,,,,,dmpnn_model,deepchem,,,,,,,,,,,,,,,,,,,,,,,,,,,,,,,,,,,,,simple_standardisation,custom_standardizer,,,,,,,,,,,,,,,,,,,,,,,,COMPLETE
72,72,0.8174018071106877,2024-02-18 18:41:38.823058,2024-02-18 21:16:15.366031,0 days 02:34:36.542973,,,,,,,,,,,,,,,,,,,,,,,,,256.0,,,,,,,,,,,,,,,,,,,,4.0,,,,,,,,,,,717.0,,,,,,,,,0.5,3.0,,,,,,,,,,,,,,,,,,,,,,,,,,,,,,,,,,,,,,,,,,,,,,,,,,,,,,,,,dmpnn_model,deepchem,,,,,,,,,,,,,,,,,,,,,,,,,,,,,,,,,,,,,simple_standardisation,custom_standardizer,,,,,,,,,,,,,,,,,,,,,,,,COMPLETE
73,73,0.8193448016964746,2024-02-18 21:16:15.419250,2024-02-18 23:44:51.841430,0 days 02:28:36.422180,,,,,,,,,,,,,,,,,,,,,,,,,256.0,,,,,,,,,,,,,,,,,,,,4.0,,,,,,,,,,,714.0,,,,,,,,,0.5,3.0,,,,,,,,,,,,,,,,,,,,,,,,,,,,,,,,,,,,,,,,,,,,,,,,,,,,,,,,,dmpnn_model,deepchem,,,,,,,,,,,,,,,,,,,,,,,,,,,,,,,,,,,,,simple_standardisation,custom_standardizer,,,,,,,,,,,,,,,,,,,,,,,,COMPLETE
