,number,value,datetime_start,datetime_complete,duration,params_1D_featurizer,params_1d_model,params_2d_model,params_C_linear_svr,params_C_nu_svr,params_C_passive_aggressive_regressor,params_C_svr,params_activation_mlp_regressor,params_algorithm_kneighbors_regressor,params_algorithm_radius_neighbors_regressor,params_alpha_1,params_alpha_2,params_alpha_bayesian_ridge,params_alpha_elastic_net,params_alpha_gamma_regressor,params_alpha_gaussian_process_regressor,params_alpha_huber_regressor,params_alpha_kernel_ridge,params_alpha_lasso,params_alpha_lasso_cv,params_alpha_mlp_regressor,params_alpha_poisson_regressor,params_alpha_quantile_regressor,params_alpha_ridge_cv,params_alpha_ridge_model,params_alpha_sgd_regressor,params_alpha_tweedie_regressor,params_attention_dropout_0,params_attention_dropout_1,params_attention_dropout_2,params_attention_dropout_3,params_attention_key_dim_0,params_attention_key_dim_1,params_attention_key_dim_2,params_attention_key_dim_3,params_base_estimator_bagging_regressor,params_base_estimator_ransac_regressor,params_base_filters,params_batch_normalization_0,params_batch_normalization_1,params_batch_normalization_2,params_batch_normalization_3,params_batch_normalization_4,params_batch_size_deepchem,params_bootstrap_bagging_regressor,params_bootstrap_extra_trees_regressor,params_bootstrap_features,params_bootstrap_random_forest_regressor,params_conv_activation_0,params_conv_activation_1,params_conv_activation_2,params_conv_batch_norm_0,params_conv_batch_norm_1,params_conv_batch_norm_2,params_conv_dropout_0,params_conv_dropout_1,params_conv_dropout_2,params_criterion_extra_trees_regressor,params_criterion_gradient_boosting_regressor,params_criterion_lasso_lars,params_criterion_random_forest_regressor,params_degree_nu_svr,params_degree_svr,params_dense_activation,params_dense_dropout,params_dense_units,params_depth_dmpnn,params_dropout,params_dropout_attentive_fp,params_dropout_dag,params_dropout_pagtn,params_dropout_text_cnn,params_dropouts_dtnn,params_dropouts_weave,params_embedding_dim,params_embedding_output_dim,params_epochs_deepchem,params_epsilon_huber_regressor,params_epsilon_linear_svr,params_epsilon_sgd_regressor,params_f1,params_f2,params_feature_selector,params_featurizer_type,params_filter_0,params_filter_1,params_filter_2,params_filters,params_fnn_dropout_p,params_fnn_layers,params_fpSize,params_g_noise,params_gamma_kernel_ridge,params_gamma_nu_svr,params_gamma_svr,params_graph_feat_size_attentive_fp,params_gru_dropout_0,params_gru_dropout_1,params_gru_dropout_2,params_gru_units_0,params_gru_units_1,params_gru_units_2,params_hidden_activation_0,params_hidden_activation_1,params_hidden_activation_2,params_hidden_activation_3,params_hidden_activation_4,params_hidden_dropout_0,params_hidden_dropout_1,params_hidden_dropout_2,params_hidden_dropout_3,params_hidden_dropout_4,params_hidden_layer_sizes_mlp_regressor,params_hidden_layer_units_0,params_hidden_layer_units_1,params_hidden_layer_units_2,params_hidden_layer_units_3,params_hidden_layer_units_4,params_k,params_kernel_nu_svr,params_kernel_ridge,params_kernel_size_0,params_kernel_size_1,params_kernel_size_2,params_kernel_size_smiles_to_vec,params_kernel_svr,params_l1_0,params_l1_1,params_l1_2,params_l1_3,params_l1_4,params_l1_ratio_elastic_net,params_l1_ratio_sgd_regressor,params_l2_0,params_l2_1,params_l2_2,params_l2_3,params_l2_4,params_lambda_1_ard_regression,params_lambda_1_bayesian_ridge,params_lambda_2_ard_regression,params_lambda_2_bayesian_ridge,params_layer_sizes_dag,params_layer_sizes_gather,params_leaf_size_kneighbors_regressor,params_leaf_size_radius_neighbors_regressor,params_learning_rate_ada_boost_regressor,params_learning_rate_gradient_boosting_regressor,params_learning_rate_hist_gradient_boosting_regressor,params_loss_ada_boost_regressor,params_loss_gradient_boosting_regressor,params_loss_hist_gradient_boosting_regressor,params_lstm_dropout_0,params_lstm_dropout_1,params_lstm_dropout_2,params_lstm_units_0,params_lstm_units_1,params_lstm_units_2,params_maxLength,params_maxPath,params_max_features_extra_trees_regressor,params_max_features_gradient_boosting_regressor,params_max_features_random_forest_regressor,params_max_length_pagtn,params_max_path,params_minLength,params_minPath,params_min_path,params_min_samples,params_model_steps,params_model_type,params_nBits,params_n_attention_heads,params_n_attention_layers,params_n_bits,params_n_components,params_n_conv_layers,params_n_embedding_dtnn,params_n_embedding_text_cnn,params_n_estimators,params_n_estimators_ada_boost_regressor,params_n_estimators_bagging_regressor,params_n_estimators_extra_trees_regressor,params_n_estimators_gradient_boosting_regressor,params_n_estimators_random_forest_regressor,params_n_graph_feat_dag,params_n_graph_feat_weave,params_n_gru_layers,params_n_hidden_dtnn,params_n_hidden_layers,params_n_hidden_weave,params_n_lstm_layers,params_n_neighbors_kneighbors_regressor,params_n_quantiles,params_n_rnn_layers,params_nu_nu_svr,params_num_heads,params_num_layers_attentive_fp,params_num_layers_pagtn,params_output_distribution,params_p,params_penalty,params_percentile,params_power_tweedie_regressor,params_quantile,params_radius,params_radius_n_radius_neighbors_regressor,params_regression_model,params_rnn_dropouts_0,params_rnn_dropouts_1,params_rnn_dropouts_2,params_rnn_units_0,params_rnn_units_1,params_rnn_units_2,params_scale,params_scaler,params_standardization_type,params_standardizer,params_stride_0,params_stride_1,params_stride_2,params_strides,params_support_weak,params_threshold,params_threshold_lambda,params_use_chirality_attentive_fp,params_use_chirality_gat,params_use_chirality_weave,params_use_edges_gat,params_use_partial_charge_attentive_fp,params_use_partial_charge_gat,params_weight_gbr,params_weight_lr,params_weight_mlp,params_weight_rfr,params_weight_svr,params_weights_kneighbors_regressor,params_weights_radius_neighbors_regressor,params_with_mean,params_with_std,state
88,88,0.6861704727803587,2024-01-21 06:52:43.827550,2024-01-21 07:20:43.703195,0 days 00:27:59.875645,morgan,,,,,,,,,,,,,,,,,,,,,,,,,,,,,,,,,,,,,,,,,,,,,,,,,,,,,,,,,,,,,,,,,,,,,,,,,,,,,,,,,,percentil_fs,,,,,,,,,,,,,,,,,,,,,,,,,,,,,,,,,,,,,,,,,,,,,,,,,,,,,,,,,,,,,,,,,,,,,,,,,,,,,,,,,,,,,,,,sklearn,,,,2048.0,,,,,,,,,,,,,,,,,,,,,,,,,,,,90.0,,,2.0,,stacking_regressor_model,,,,,,,,,heavy_standardisation,custom_standardizer,,,,,,,,,,,,,,,,,,,,,,,COMPLETE
89,89,inf,2024-01-21 07:20:43.716775,2024-01-21 07:20:43.797689,0 days 00:00:00.080914,,,,,,,,,,,,,,,,,,,,,,,,,,,,,,,,,,,,,,,,,,,,32.0,,,,,,,,,,,,,,,,,,,,,,,,,,,,,,,,,828.0,,,,,,,,,,,,,,,,,,,,,,,,,,,,,,,,,,,,,,,,,,,,,,,,,,,,,,,,,,,,,,,,,,,,,,,,,,,,,,,,,,,,,,,,,,,,,gat_model,deepchem,,,,,,,,,,,,,,,,,,,,,,,,,,,,,,,,,,,,,,,,,,,,,,heavy_standardisation,custom_standardizer,,,,,,,,,True,,True,,True,,,,,,,,,,COMPLETE
90,90,0.6842125075157587,2024-01-21 07:20:43.808766,2024-01-21 07:48:52.814388,0 days 00:28:09.005622,morgan,,,,,,,,,,,,,,,,,,,,,,,,,,,,,,,,,,,,,,,,,,,,,,,,,,,,,,,,,,,,,,,,,,,,,,,,,,,,,,,,,,percentil_fs,,,,,,,,,,,,,,,,,,,,,,,,,,,,,,,,,,,,,,,,,,,,,,,,,,,,,,,,,,,,,,,,,,,,,,,,,,,,,,,,,,,,,,,,sklearn,,,,2048.0,,,,,,,,,,,,,,,,,,,,,,,,,,,,90.0,,,2.0,,stacking_regressor_model,,,,,,,,,heavy_standardisation,custom_standardizer,,,,,,,,,,,,,,,,,,,,,,,COMPLETE
91,91,0.6955421325578578,2024-01-21 07:48:52.828375,2024-01-21 08:16:51.807646,0 days 00:27:58.979271,morgan,,,,,,,,,,,,,,,,,,,,,,,,,,,,,,,,,,,,,,,,,,,,,,,,,,,,,,,,,,,,,,,,,,,,,,,,,,,,,,,,,,percentil_fs,,,,,,,,,,,,,,,,,,,,,,,,,,,,,,,,,,,,,,,,,,,,,,,,,,,,,,,,,,,,,,,,,,,,,,,,,,,,,,,,,,,,,,,,sklearn,,,,2048.0,,,,,,,,,,,,,,,,,,,,,,,,,,,,89.0,,,2.0,,stacking_regressor_model,,,,,,,,,heavy_standardisation,custom_standardizer,,,,,,,,,,,,,,,,,,,,,,,COMPLETE
92,92,0.6599531241085581,2024-01-21 08:16:51.823912,2024-01-21 08:44:20.227517,0 days 00:27:28.403605,morgan,,,,,,,,,,,,,,,,,,,,,,,,,,,,,,,,,,,,,,,,,,,,,,,,,,,,,,,,,,,,,,,,,,,,,,,,,,,,,,,,,,percentil_fs,,,,,,,,,,,,,,,,,,,,,,,,,,,,,,,,,,,,,,,,,,,,,,,,,,,,,,,,,,,,,,,,,,,,,,,,,,,,,,,,,,,,,,,,sklearn,,,,2048.0,,,,,,,,,,,,,,,,,,,,,,,,,,,,88.0,,,2.0,,stacking_regressor_model,,,,,,,,,heavy_standardisation,custom_standardizer,,,,,,,,,,,,,,,,,,,,,,,COMPLETE
93,93,0.9598716881066313,2024-01-21 08:44:20.242099,2024-01-21 09:16:01.667244,0 days 00:31:41.425145,morgan,,,,,,,,,,,,,,,,,,,,,,,,,,,,,,,,,,,,,,,,,,,,,,,,,,,,,,,,,,,,,,,,,,,,,,,,,,,,,,,,,,percentil_fs,,,,,,,,,,,,,,,,,,,,,,,,,,,,,,,,,,,,,,,,,,,,,,,,,,,,,,,,,,,,,,,,,,,,,,,,,,,,,,,,,,,,,,,,sklearn,,,,2048.0,,,,,,,,,,,,,,,,,,,,,,,,,,,,100.0,,,2.0,,stacking_regressor_model,,,,,,,,,heavy_standardisation,custom_standardizer,,,,,,,,,,,,,,,,,,,,,,,COMPLETE
94,94,0.6758161241619858,2024-01-21 09:16:01.681194,2024-01-21 09:43:34.603778,0 days 00:27:32.922584,morgan,,,,,,,,,,,,,,,,,,,,,,,,,,,,,,,,,,,,,,,,,,,,,,,,,,,,,,,,,,,,,,,,,,,,,,,,,,,,,,,,,,percentil_fs,,,,,,,,,,,,,,,,,,,,,,,,,,,,,,,,,,,,,,,,,,,,,,,,,,,,,,,,,,,,,,,,,,,,,,,,,,,,,,,,,,,,,,,,sklearn,,,,2048.0,,,,,,,,,,,,,,,,,,,,,,,,,,,,87.0,,,2.0,,stacking_regressor_model,,,,,,,,,heavy_standardisation,custom_standardizer,,,,,,,,,,,,,,,,,,,,,,,COMPLETE
95,95,0.7131216841669216,2024-01-21 09:43:34.616971,2024-01-21 10:10:47.305666,0 days 00:27:12.688695,morgan,,,,,,,,,,,,,,,,,,,,,,,,,,,,,,,,,,,,,,,,,,,,,,,,,,,,,,,,,,,,,,,,,,,,,,,,,,,,,,,,,,percentil_fs,,,,,,,,,,,,,,,,,,,,,,,,,,,,,,,,,,,,,,,,,,,,,,,,,,,,,,,,,,,,,,,,,,,,,,,,,,,,,,,,,,,,,,,,sklearn,,,,2048.0,,,,,,,,,,,,,,,,,,,,,,,,,,,,86.0,,,2.0,,stacking_regressor_model,,,,,,,,,heavy_standardisation,custom_standardizer,,,,,,,,,,,,,,,,,,,,,,,COMPLETE
96,96,0.6753232748891514,2024-01-21 10:10:47.319337,2024-01-21 10:38:18.840905,0 days 00:27:31.521568,morgan,,,,,,,,,,,,,,,,,,,,,,,,,,,,,,,,,,,,,,,,,,,,,,,,,,,,,,,,,,,,,,,,,,,,,,,,,,,,,,,,,,percentil_fs,,,,,,,,,,,,,,,,,,,,,,,,,,,,,,,,,,,,,,,,,,,,,,,,,,,,,,,,,,,,,,,,,,,,,,,,,,,,,,,,,,,,,,,,sklearn,,,,2048.0,,,,,,,,,,,,,,,,,,,,,,,,,,,,87.0,,,2.0,,stacking_regressor_model,,,,,,,,,heavy_standardisation,custom_standardizer,,,,,,,,,,,,,,,,,,,,,,,COMPLETE
97,97,0.9822865091278439,2024-01-21 10:38:18.858335,2024-01-21 10:47:38.416978,0 days 00:09:19.558643,morgan,,,,,,,,,,0.8877538312937747,0.05879336861888285,,,,,,,,,,,,,,,,,,,,,,,,,,,,,,,,,,,,,,,,,,,,,,,,,,,,,,,,,,,,,,,,,,,,,,,percentil_fs,,,,,,,,,,,,,,,,,,,,,,,,,,,,,,,,,,,,,,,,,,,,,,,,,,,,,,,,1.6232318883670042e-08,,3.8632562786954375e-08,,,,,,,,,,,,,,,,,,,,,,,,,,,,,,sklearn,,,,2048.0,,,,,,,,,,,,,,,,,,,,,,,,,,,,84.0,,,2.0,,ard_regression_model,,,,,,,,,heavy_standardisation,custom_standardizer,,,,,,,0.9296431593154724,,,,,,,,,,,,,,,,COMPLETE
98,98,0.7146855388063936,2024-01-21 10:47:38.432248,2024-01-21 11:37:26.063199,0 days 00:49:47.630951,morgan,,,,,,,,,,,,,,,,,,,,,,,,,,,,,,,,,,,mlpr,,,,,,,,,False,,True,,,,,,,,,,,,,,,,,,,,,,,,,,,,,,,,,,,,percentil_fs,,,,,,,,,,,,,,,,,,,,,,,,,,,,,,,,,,,,,,,,,,,,,,,,,,,,,,,,,,,,,,,,,,,,,,,,,,,,,,,,,,,,,,,,sklearn,,,,2048.0,,,,,,,50.0,,,,,,,,,,,,,,,,,,,,,25.0,,,2.0,,bagging_regressor_model,,,,,,,,,heavy_standardisation,custom_standardizer,,,,,,,,,,,,,,,,,,,,,,,COMPLETE
99,99,inf,2024-01-21 11:37:26.077607,2024-01-21 11:37:26.226763,0 days 00:00:00.149156,morgan,keras_1d_cnn,,,,,,,,,,,,,,,,,,,,,,,,,,,,,,,,,,,,,,,,,,,,,,,relu,,,True,,,0.03574527510252146,,,,,,,,,relu,,96.0,,0.7828836340096276,,,,,,,,,,,,,,,,1D,4.0,,,,,,,0.09524058303253875,,,,,,,,,,,,,,,,,,,,,,,,,,,,,,18.0,,,,,,,,,,,,,,,,,,,,,,,,,,,,,,,,,,,,,,,,,,,,,,,,,keras,,,,2048.0,,1.0,,,,,,,,,,,,,,,,,,,,,,,,,,,,,2.0,,,,,,,,,,,,,2.0,,,,,,,,,,,,,,,,,,,,,,COMPLETE
