,number,value,datetime_start,datetime_complete,duration,params_1D_featurizer,params_1d_model,params_2d_model,params_C_linear_svr,params_C_nu_svr,params_C_passive_aggressive_regressor,params_C_svr,params_activation_mlp_regressor,params_algorithm_kneighbors_regressor,params_algorithm_radius_neighbors_regressor,params_alpha_1,params_alpha_2,params_alpha_bayesian_ridge,params_alpha_elastic_net,params_alpha_gamma_regressor,params_alpha_gaussian_process_regressor,params_alpha_huber_regressor,params_alpha_kernel_ridge,params_alpha_lasso,params_alpha_lasso_cv,params_alpha_mlp_regressor,params_alpha_poisson_regressor,params_alpha_quantile_regressor,params_alpha_ridge_cv,params_alpha_ridge_model,params_alpha_sgd_regressor,params_alpha_tweedie_regressor,params_attention_dropout_0,params_attention_dropout_1,params_attention_dropout_2,params_attention_dropout_3,params_attention_key_dim_0,params_attention_key_dim_1,params_attention_key_dim_2,params_attention_key_dim_3,params_base_estimator_bagging_regressor,params_base_estimator_ransac_regressor,params_base_filters,params_batch_normalization_0,params_batch_normalization_1,params_batch_normalization_2,params_batch_normalization_3,params_batch_normalization_4,params_batch_size_deepchem,params_bootstrap_bagging_regressor,params_bootstrap_extra_trees_regressor,params_bootstrap_features,params_bootstrap_random_forest_regressor,params_conv_activation_0,params_conv_activation_1,params_conv_activation_2,params_conv_batch_norm_0,params_conv_batch_norm_1,params_conv_batch_norm_2,params_conv_dropout_0,params_conv_dropout_1,params_conv_dropout_2,params_criterion_extra_trees_regressor,params_criterion_gradient_boosting_regressor,params_criterion_lasso_lars,params_criterion_random_forest_regressor,params_degree_nu_svr,params_degree_svr,params_dense_activation,params_dense_dropout,params_dense_units,params_depth_dmpnn,params_dropout,params_dropout_attentive_fp,params_dropout_dag,params_dropout_pagtn,params_dropout_text_cnn,params_dropouts_dtnn,params_dropouts_weave,params_embedding_dim,params_embedding_output_dim,params_epochs_deepchem,params_epsilon_huber_regressor,params_epsilon_linear_svr,params_epsilon_sgd_regressor,params_f1,params_f2,params_feature_selector,params_featurizer_type,params_filter_0,params_filter_1,params_filter_2,params_filters,params_fnn_dropout_p,params_fnn_layers,params_fpSize,params_g_noise,params_gamma_kernel_ridge,params_gamma_nu_svr,params_gamma_svr,params_graph_feat_size_attentive_fp,params_gru_dropout_0,params_gru_dropout_1,params_gru_dropout_2,params_gru_units_0,params_gru_units_1,params_gru_units_2,params_hidden_activation_0,params_hidden_activation_1,params_hidden_activation_2,params_hidden_activation_3,params_hidden_activation_4,params_hidden_dropout_0,params_hidden_dropout_1,params_hidden_dropout_2,params_hidden_dropout_3,params_hidden_dropout_4,params_hidden_layer_sizes_mlp_regressor,params_hidden_layer_units_0,params_hidden_layer_units_1,params_hidden_layer_units_2,params_hidden_layer_units_3,params_hidden_layer_units_4,params_k,params_kernel_nu_svr,params_kernel_ridge,params_kernel_size_0,params_kernel_size_1,params_kernel_size_2,params_kernel_size_smiles_to_vec,params_kernel_svr,params_l1_0,params_l1_1,params_l1_2,params_l1_3,params_l1_4,params_l1_ratio_elastic_net,params_l1_ratio_sgd_regressor,params_l2_0,params_l2_1,params_l2_2,params_l2_3,params_l2_4,params_lambda_1_ard_regression,params_lambda_1_bayesian_ridge,params_lambda_2_ard_regression,params_lambda_2_bayesian_ridge,params_layer_sizes_dag,params_layer_sizes_gather,params_leaf_size_kneighbors_regressor,params_leaf_size_radius_neighbors_regressor,params_learning_rate_ada_boost_regressor,params_learning_rate_gradient_boosting_regressor,params_learning_rate_hist_gradient_boosting_regressor,params_loss_ada_boost_regressor,params_loss_gradient_boosting_regressor,params_loss_hist_gradient_boosting_regressor,params_lstm_dropout_0,params_lstm_dropout_1,params_lstm_dropout_2,params_lstm_units_0,params_lstm_units_1,params_lstm_units_2,params_maxLength,params_maxPath,params_max_features_extra_trees_regressor,params_max_features_gradient_boosting_regressor,params_max_features_random_forest_regressor,params_max_length_pagtn,params_max_path,params_minLength,params_minPath,params_min_path,params_min_samples,params_model_steps,params_model_type,params_nBits,params_n_attention_heads,params_n_attention_layers,params_n_bits,params_n_components,params_n_conv_layers,params_n_embedding_dtnn,params_n_embedding_text_cnn,params_n_estimators,params_n_estimators_ada_boost_regressor,params_n_estimators_bagging_regressor,params_n_estimators_extra_trees_regressor,params_n_estimators_gradient_boosting_regressor,params_n_estimators_random_forest_regressor,params_n_graph_feat_dag,params_n_graph_feat_weave,params_n_gru_layers,params_n_hidden_dtnn,params_n_hidden_layers,params_n_hidden_weave,params_n_lstm_layers,params_n_neighbors_kneighbors_regressor,params_n_quantiles,params_n_rnn_layers,params_nu_nu_svr,params_num_heads,params_num_layers_attentive_fp,params_num_layers_pagtn,params_output_distribution,params_p,params_penalty,params_percentile,params_power_tweedie_regressor,params_quantile,params_radius,params_radius_n_radius_neighbors_regressor,params_regression_model,params_rnn_dropouts_0,params_rnn_dropouts_1,params_rnn_dropouts_2,params_rnn_units_0,params_rnn_units_1,params_rnn_units_2,params_scale,params_scaler,params_standardization_type,params_standardizer,params_stride_0,params_stride_1,params_stride_2,params_strides,params_support_weak,params_threshold,params_threshold_lambda,params_use_chirality_attentive_fp,params_use_chirality_gat,params_use_chirality_weave,params_use_edges_gat,params_use_partial_charge_attentive_fp,params_use_partial_charge_gat,params_weight_gbr,params_weight_lr,params_weight_mlp,params_weight_rfr,params_weight_svr,params_weights_kneighbors_regressor,params_weights_radius_neighbors_regressor,params_with_mean,params_with_std,state
55,55,1.091643338019106,2024-01-20 05:53:40.184517,2024-01-20 05:59:06.932456,0 days 00:05:26.747939,rdk,,,,,,,,,,,,,,,,,,,,,,,,,,,,,,,,,,,,,,,,,,,,,,,,,,,,,,,,,,,,,,,,,,,,,,,,,,,,,,,,,,percentil_fs,,,,,,,,2048.0,,,,,,,,,,,,,,,,,,,,,,,,,,,,,,,,,,,,,,,,,,,,,,,,,,,,,,,,0.982959600100851,,,square,,,,,,,,,,,,,,,10.0,,,1.0,,,sklearn,,,,,,,,,,50.0,,,,,,,,,,,,,,,,,,,,,,58.0,,,,,ada_boost_regressor_model,,,,,,,,,,pass_through_standardizer,,,,,,,,,,,,,,,,,,,,,,,COMPLETE
56,56,0.8138045742256301,2024-01-20 05:59:06.947593,2024-01-20 06:16:23.985253,0 days 00:17:17.037660,layered,,,,,,,,,,,,4.2063133854217964,,,,,,,,,,,,,,,,,,,,,,,,,,,,,,,,,,,,,,,,,,,,,,,,,,,,,,,,,,,,,,,,,,,,,,pass_through_transformer,,,,,,,,2048.0,,,,,,,,,,,,,,,,,,,,,,,,,,,,,,,,,,,,,,,,,,,,,,,,,6.929791889605616,,8.206739053688198,,,,,,,,,,,,,,,,,,8.0,,,,,,,2.0,,,,sklearn,,,,,,,,,,,,,,,,,,,,,,,,,,,,,,,,,,,,,bayesian_ridge_model,,,,,,,,,,chembl_standardizer,,,,,,,,,,,,,,,,,,,,,,,COMPLETE
57,57,inf,2024-01-20 06:16:24.016590,2024-01-20 09:16:24.278049,0 days 03:00:00.261459,,,,,,,,,,,,,,,,,,,,,,,,,,,,,,,,,,,,,,,,,,,,256.0,,,,,,,,,,,,,,,,,,,,,,,,,,,0.25,,,,,,665.0,,,,,,,,,,,,,,,,,,,,,,,,,,,,,,,,,,,,,,,,,,,,,,,,,,,,,,,,,,,,,,,,,,,,,,,,,,,,,,,,,,,,,,,7.0,,,,,,pagtn_model,deepchem,,,,,,,,,,,,,,,,,,,,,,,,,,1.0,,2.0,,,,,,,,,,,,,,,,,,heavy_standardisation,custom_standardizer,,,,,,,,,,,,,,,,,,,,,,,COMPLETE
58,58,1.5806402966544744,2024-01-20 09:16:24.303089,2024-01-20 09:50:21.399072,0 days 00:33:57.095983,layered,,,,,,,,,,,,,,,,,,,,,,,,,,,,,,,,,,,,,,,,,,,,,,,,,,,,,,,,,,,,,,,,,,,,,,,,,,,,,,,,,,boruta_algorithm,,,,,,,,2048.0,,,,,,,,,,,,,,,,,,,,,,,,,,,,,,,,,,,,,,,,,,,,,,,,,,,,,,,,,,,,,,,,,,,,,9.0,,,,,,,3.0,,,,sklearn,,,,,,,,,,,,,,,,,,,,,,,,,,,,,,,,,,,,,linear_regression_model,,,,,,,,,,pass_through_standardizer,,,,,True,,,,,,,,,,,,,,,,,,COMPLETE
59,59,0.9982551245099023,2024-01-20 09:50:21.418939,2024-01-20 09:56:34.049275,0 days 00:06:12.630336,mixed,,,,,,,,,,,,,,,,,,,4.055392395035366,,,,,,,,,,,,,,,,,,,,,,,,,,,,,,,,,,,,,,,,,,,,,,,,,,,,,,,,,,,,,morgan,rdk,percentil_fs,,,,,,,,,,,,,,,,,,,,,,,,,,,,,,,,,,,,,,,,,,,,,,,,,,,,,,,,,,,,,,,,,,,,,,,,,,,,,,,,,,,,,,,,sklearn,,,,,,,,,,,,,,,,,,,,,,,,,,,,,,,,74.0,,,,,lasso_cv_model,,,,,,,,,,pass_through_standardizer,,,,,,,,,,,,,,,,,,,,,,,COMPLETE
60,60,0.9982551245099023,2024-01-20 09:56:34.062886,2024-01-20 10:23:34.819618,0 days 00:27:00.756732,layered,,,,,,,,,,,,,8.768988234534238,,,,,,,,,,,,,,,,,,,,,,,,,,,,,,,,,,,,,,,,,,,,,,,,,,,,,,,,,,,,,,,,,,,,,boruta_algorithm,,,,,,,,2048.0,,,,,,,,,,,,,,,,,,,,,,,,,,,,,,,,,,,,,,,,,0.29291685980169535,,,,,,,,,,,,,,,,,,,,,,,,,,,,6.0,,,,,,,3.0,,,,sklearn,,,,,,,,,,,,,,,,,,,,,,,,,,,,,,,,,,,,,elastic_net_model,,,,,,,,,,basic_standardizer,,,,,False,,,,,,,,,,,,,,,,,,COMPLETE
61,61,0.7721601124850854,2024-01-20 10:23:34.833708,2024-01-20 11:00:00.944509,0 days 00:36:26.110801,layered,,,,,,,,,,,,,,,,,,,,,,,,,,,,,,,,,,,,,,,,,,,,,,,,,,,,,,,,,,,,,,,,,,,,,,,,,,,,,,,,,,boruta_algorithm,,,,,,,,2048.0,,,,,,,,,,,,,,,,,,,,,,,,,,,,,,,,,,,,,,,,,,,,,,,,,,,,,,,,,,,,,,,,,,,,,7.0,,,,,,,3.0,,,,sklearn,,,,,,,,,,,,,,,,,,,,,,,,,,,,,,,,,,,,,voting_regressor_model,,,,,,,,,,pass_through_standardizer,,,,,True,,,,,,,,,0.6432456868000855,0.02431965259608521,0.1347026875471011,0.9462522170516041,0.5381925234170497,,,,,COMPLETE
62,62,0.8005612001407508,2024-01-20 11:00:00.959465,2024-01-20 11:36:47.783880,0 days 00:36:46.824415,layered,,,,,,,,,,,,,,,,,,,,,,,,,,,,,,,,,,,,,,,,,,,,,,,,,,,,,,,,,,,,,,,,,,,,,,,,,,,,,,,,,,boruta_algorithm,,,,,,,,2048.0,,,,,,,,,,,,,,,,,,,,,,,,,,,,,,,,,,,,,,,,,,,,,,,,,,,,,,,,,,,,,,,,,,,,,7.0,,,,,,,3.0,,,,sklearn,,,,,,,,,,,,,,,,,,,,,,,,,,,,,,,,,,,,,voting_regressor_model,,,,,,,,,,pass_through_standardizer,,,,,True,,,,,,,,,0.7105261805792712,0.1376347323229238,0.26148620575429854,0.3530636619112601,0.5600749189572902,,,,,COMPLETE
63,63,inf,2024-01-20 11:36:47.806538,2024-01-20 11:42:37.716110,0 days 00:05:49.909572,layered,,,,,,,,,,,,,,0.10738194705986093,,,,,,,,,,,,,,,,,,,,,,,,,,,,,,,,,,,,,,,,,,,,,,,,,,,,,,,,,,,,,,,,,,,,boruta_algorithm,,,,,,,,2048.0,,,,,,,,,,,,,,,,,,,,,,,,,,,,,,,,,,,,,,,,,,,,,,,,,,,,,,,,,,,,,,,,,,,,,8.0,,,,,,,3.0,,,,sklearn,,,,,,,,,,,,,,,,,,,,,,,,,,,,,,,,,,,,,gamma_regressor_model,,,,,,,,,,pass_through_standardizer,,,,,True,,,,,,,,,,,,,,,,,,COMPLETE
64,64,0.8012173001019189,2024-01-20 11:42:37.743371,2024-01-20 12:15:39.468507,0 days 00:33:01.725136,layered,,,,,,,,,,,,,,,,,,,,,,,,,,,,,,,,,,,,,,,,,,,,,,,,,,,,,,,,,,,,,,,,,,,,,,,,,,,,,,,,,,boruta_algorithm,,,,,,,,2048.0,,,,,,,,,,,,,,,,,,,,,,,,,,,,,,,,,,,,,,,,,,,,,,,,,,,,,,,,,,,,,,,,,,,,,7.0,,,,,,,2.0,,,,sklearn,,,,,,,,,,,,,,,,,,,,,,,,,,,,,,,,,,,,,voting_regressor_model,,,,,,,,,,pass_through_standardizer,,,,,True,,,,,,,,,0.09042647893299771,0.4363295081321691,0.9780017090299913,0.7975251506225816,0.5707697879106288,,,,,COMPLETE
65,65,inf,2024-01-20 12:15:39.482945,2024-01-20 12:16:01.489281,0 days 00:00:22.006336,2d_descriptors,,,,,,,,,,,,,,,,,,,,,,,,,,,,,,,,,,,,,,,,,,,,,,,,,,,,,,,,,,,,,,,,,,,,,,,,,,,,,,,,,,pass_through_transformer,,,,,,,,,,,,,,,,,,,,,,,,,,,,,,,,,,,,,,,,,,,,,,,,,,,,,,,,,,,,,,,,,,0.2984630752999631,,,poisson,,,,,,,,,,,,,,,,,,,sklearn,,,,,,,,,,,,,,,,,,,,,,,,,,,,,,,,,,,,,hist_gradient_boosting_regressor_model,,,,,,,,standard_scaler,,pass_through_standardizer,,,,,,,,,,,,,,,,,,,,,False,True,COMPLETE
66,66,inf,2024-01-20 12:16:01.505535,2024-01-20 12:16:01.819101,0 days 00:00:00.313566,atom_pair,keras_dense,,,,,,,,,,,,,,,,,,,,,,,,,,,,,,,,,,,,,True,False,False,True,True,,,,,,,,,,,,,,,,,,,,,,,,,,,,,,,,,,,,,,,,,1D,,,,,,,,,,,,,,,,,,,relu,tanh,tanh,tanh,tanh,0.0723219927139036,0.16583594323977274,0.06808504804314303,0.40512325951016703,0.7381174549834176,,11.0,18.0,22.0,30.0,55.0,,,,,,,,,0.009931827209268265,6.138948694909012e-05,0.0018374545444538575,0.0005874434807185708,1.993930231531094e-06,,,0.009243886232858945,1.437215493448914e-06,3.0597133697769005e-06,0.00020698723900952347,0.0006896703170183617,,,,,,,,,,,,,,,,,,,,,20.0,,,,,,,3.0,,,,,keras,2048.0,,,,,,,,,,,,,,,,,,5.0,,,,,,,,,,,,,,,,,,,,,,,,,,,,,,,,,,,,,,,,,,,,,,,,,,,COMPLETE
67,67,inf,2024-01-20 12:16:01.831803,2024-01-20 15:16:03.222823,0 days 03:00:01.391020,layered,,,,,,,,,,,,,,,,,,,,,,,,,,,,,,,,,,,,,,,,,,,,,,,,,,,,,,,,,,,,,,,,,,,,,,,,,,,,,,,,,,low_variance_fs,,,,,,,,2048.0,,,,,,,,,,,,,,,,,,,,,,,,,,,,,,,,,,,,,,,,,,,,,,,,,,,,,,,,,,,,,,,,,,,,,6.0,,,,,,,2.0,,,,sklearn,,,,,,,,,,,,,,,,,,,,,,,,,,,,,,,,,,,,,theil_sen_regressor_model,,,,,,,,,,pass_through_standardizer,,,,,,0.05696811145926356,,,,,,,,,,,,,,,,,COMPLETE
68,68,1.1067161014097242,2024-01-20 15:16:03.254505,2024-01-20 17:13:34.320622,0 days 01:57:31.066117,mol2vec,,,,,,,,,,,,,,,0.2676185475112234,,,,,,,,,,,,,,,,,,,,,,,,,,,,,,,,,,,,,,,,,,,,,,,,,,,,,,,,,,,,,,,,,,,select_from_model_fs,,,,,,,,,,,,,,,,,,,,,,,,,,,,,,,,,,,,,,,,,,,,,,,,,,,,,,,,,,,,,,,,,,,,,,,,,,,,,,,,,,,,,,,,sklearn,,,,,,,,,980.0,,,,,,,,,,,,,,,,,,,,,,,,,,,,gaussian_process_regressor_model,,,,,,,,,simple_standardisation,custom_standardizer,,,,,,,,,,,,,,,,,,,,,,,COMPLETE
69,69,inf,2024-01-20 17:13:34.391863,2024-01-20 20:13:34.549650,0 days 03:00:00.157787,,,,,,,,,,,,,,,,,,,,,,,,,,,,,,,,,,,,,,,,,,,,8.0,,,,,,,,,,,,,,,,,,,,,,,,,,,,,,,64.0,,298.0,,,,,,,,,,,32.0,,,,,,,,,,,,,,,,,,,,,,,,,,,,,,,,,,,,,5.0,,,,,,,,,,,,,,,,,,,,,,,,,,,,,,,,,,,,,,,,,,,,,smiles_to_vec_model,deepchem,,,,,,,,,,,,,,,,,,,,,,,,,,,,,,,,,,,,,,,,,,,,,,,pass_through_standardizer,,,,2.0,,,,,,,,,,,,,,,,,,,COMPLETE
70,70,0.8229112333333329,2024-01-20 20:13:34.641509,2024-01-20 20:50:18.350517,0 days 00:36:43.709008,layered,,,,,,,,,,,,,,,,,,,,,,,,,,,,,,,,,,,,,,,,,,,,,,,False,,,,,,,,,,,,,absolute_error,,,,,,,,,,,,,,,,,,,,,,boruta_algorithm,,,,,,,,2048.0,,,,,,,,,,,,,,,,,,,,,,,,,,,,,,,,,,,,,,,,,,,,,,,,,,,,,,,,,,,,,,,,,,,,,8.0,,,log2,,,,3.0,,,,sklearn,,,,,,,,,,,,,,500.0,,,,,,,,,,,,,,,,,,,,,,,random_forest_regressor_model,,,,,,,,,,chembl_standardizer,,,,,True,,,,,,,,,,,,,,,,,,COMPLETE
71,71,0.7685801705291775,2024-01-20 20:50:18.365444,2024-01-20 21:19:37.053515,0 days 00:29:18.688071,layered,,,,,,,,,,,,,,,,,,,,,,,,,,,,,,,,,,,,,,,,,,,,,,,,,,,,,,,,,,,,,,,,,,,,,,,,,,,,,,,,,,boruta_algorithm,,,,,,,,2048.0,,,,,,,,,,,,,,,,,,,,,,,,,,,,,,,,,,,,,,,,,,,,,,,,,,,,,,,,,,,,,,,,,,,,,7.0,,,,,,,3.0,,,,sklearn,,,,,,,,,,,,,,,,,,,,,,,,,,,,,,,,,,,,,voting_regressor_model,,,,,,,,,,pass_through_standardizer,,,,,True,,,,,,,,,0.6672287675888071,0.022590849824206338,0.13473844503519541,0.9616737839879413,0.8025443478281895,,,,,COMPLETE
72,72,0.7955706976662876,2024-01-20 21:19:37.068086,2024-01-20 21:48:23.090415,0 days 00:28:46.022329,layered,,,,,,,,,,,,,,,,,,,,,,,,,,,,,,,,,,,,,,,,,,,,,,,,,,,,,,,,,,,,,,,,,,,,,,,,,,,,,,,,,,boruta_algorithm,,,,,,,,2048.0,,,,,,,,,,,,,,,,,,,,,,,,,,,,,,,,,,,,,,,,,,,,,,,,,,,,,,,,,,,,,,,,,,,,,7.0,,,,,,,3.0,,,,sklearn,,,,,,,,,,,,,,,,,,,,,,,,,,,,,,,,,,,,,voting_regressor_model,,,,,,,,,,pass_through_standardizer,,,,,True,,,,,,,,,0.7187435311110281,0.16787537214704595,0.18207821288141487,0.8690144515556957,0.6935370553030702,,,,,COMPLETE
73,73,0.8215661615490915,2024-01-20 21:48:23.104845,2024-01-20 22:09:49.969275,0 days 00:21:26.864430,layered,,,,,,,,,,,,,,,,,,,,,,,,,,,,,,,,,,,,,,,,,,,,,,,,,,,,,,,,,,,bic,,,,,,,,,,,,,,,,,,,,,,,boruta_algorithm,,,,,,,,2048.0,,,,,,,,,,,,,,,,,,,,,,,,,,,,,,,,,,,,,,,,,,,,,,,,,,,,,,,,,,,,,,,,,,,,,7.0,,,,,,,3.0,,,,sklearn,,,,,,,,,,,,,,,,,,,,,,,,,,,,,,,,,,,,,lasso_lars_ic_model,,,,,,,,,,pass_through_standardizer,,,,,True,,,,,,,,,,,,,,,,,,COMPLETE
74,74,0.8446934415848768,2024-01-20 22:09:49.983464,2024-01-20 22:14:19.654553,0 days 00:04:29.671089,maccs,,,,,,,,,,,,,,,,,,,,,,,,,,,,,,,,,,,,,,,,,,,,,,,,,,,,,,,,,,,,,,,,,,,,,,,,,,,,,,,,,,k_best,,,,,,,,,,,,,,,,,,,,,,,,,,,,,,,,,,,,5.0,,,,,,,,,,,,,,,,,,,,,,,,,,,,,,,,,,,,,,,,,,,,,,,,,,,,sklearn,,,,,,,,,,,,,,,,,,,,,,,,,,,,,,,,,,,,,decision_tree_regressor_model,,,,,,,,,,pass_through_standardizer,,,,,,,,,,,,,,,,,,,,,,,COMPLETE
75,75,inf,2024-01-20 22:14:19.668333,2024-01-21 01:14:19.683731,0 days 03:00:00.015398,mixed,,,,,,,,,,,,,,,,,,,,,,,,,,,,,,,,,,,,,,,,,,,,,,,,,,,,,,,,,,,,,,,,,,,,,,,,,,,,,,,,maccs,maccs,,,,,,,,,,,,,,,,,,,,,,,,,,,,,,,,,,,,,,,,,,,,,,,,,,,,,,,,,,,,,,,,,,,,,,,,,,,,,,,,,,,,,,,,,sklearn,,,,,,,,,,,,,,,,,,,,,,,,,,,,,,,,,,,,,,,,,,,,,,,,,,,,,,,,,,,,,,,,,,,,,,COMPLETE
76,76,0.7155854829613869,2024-01-21 01:14:19.704939,2024-01-21 01:38:55.538430,0 days 00:24:35.833491,morgan,,,,,,,,,,,,,,,,,,,,,,,,,,,,,,,,,,,,,,,,,,,,,,,,,,,,,,,,,,,,,,,,,,,,,,,,,,,,,,,,,,boruta_algorithm,,,,,,,,,,,,,,,,,,,,,,,,,,,,,,,,,,,,,,,,,,,,,,,,,,,,,,,,,,,,,,,,,,,,,,,,,,,,,,,,,,,,,,,,sklearn,,,,2048.0,,,,,,,,,,,,,,,,,,,,,,,,,,,,,,,2.0,,voting_regressor_model,,,,,,,,,,pass_through_standardizer,,,,,True,,,,,,,,,0.7224033181980495,2.8785241224092706e-05,0.17607006384569268,0.8378606129417059,0.3386115135013143,,,,,COMPLETE
77,77,0.7051837332796087,2024-01-21 01:38:55.601103,2024-01-21 02:22:14.568640,0 days 00:43:18.967537,morgan,,,,,,,,,,,,,,,,,,,,,,,,,,,,,,,,,,,,,,,,,,,,,,,,,,,,,,,,,,,,,,,,,,,,,,,,,,,,,,,,,,percentil_fs,,,,,,,,,,,,,,,,,,,,,,,,,,,,,,,,,,,,,,,,,,,,,,,,,,,,,,,,,,,,,,,,,,,,,,,,,,,,,,,,,,,,,,,,sklearn,,,,2048.0,,,,,,,,,,,,,,,,,,,,,,,,,,,,91.0,,,2.0,,stacking_regressor_model,,,,,,,,,heavy_standardisation,custom_standardizer,,,,,,,,,,,,,,,,,,,,,,,COMPLETE
78,78,inf,2024-01-21 02:22:14.626393,2024-01-21 02:22:55.120005,0 days 00:00:40.493612,,,keras_simple_rnn,,,,,,,,,,,,,,,,,,,,,,,,,,,,,,,,,,,,,,,,,,,,,,,,,,,,,,,,,,,,,tanh,0.22888430862477788,224.0,,,,,,,,,,,,,,,,,,2D,,,,,,,,,,,,,,,,,,,,,,,,,,,,,,,,,,,,,,,,,,,,,,,,,,,,,,,,,,,,,,,,,,,,,,,,,,,,,,,,,,,,,,,keras,,,,,,,,,,,,,,,,,,,,,,,,1.0,,,,,,,,,,,,,,0.49779075736901457,,,49.0,,,,,,,,,,,,,,,,,,,,,,,,,,,,,COMPLETE
79,79,0.7069748850810803,2024-01-21 02:22:55.168210,2024-01-21 03:08:23.429070,0 days 00:45:28.260860,morgan,,,,,,,,,,,,,,,,,,,,,,,,,,,,,,,,,,,,,,,,,,,,,,,,,,,,,,,,,,,,,,,,,,,,,,,,,,,,,,,,,,percentil_fs,,,,,,,,,,,,,,,,,,,,,,,,,,,,,,,,,,,,,,,,,,,,,,,,,,,,,,,,,,,,,,,,,,,,,,,,,,,,,,,,,,,,,,,,sklearn,,,,2048.0,,,,,,,,,,,,,,,,,,,,,,,,,,,,91.0,,,2.0,,stacking_regressor_model,,,,,,,,,heavy_standardisation,custom_standardizer,,,,,,,,,,,,,,,,,,,,,,,COMPLETE
80,80,0.6755100936828631,2024-01-21 03:08:23.442704,2024-01-21 03:45:50.278873,0 days 00:37:26.836169,morgan,,,,,,,,,,,,,,,,,,,,,,,,,,,,,,,,,,,,,,,,,,,,,,,,,,,,,,,,,,,,,,,,,,,,,,,,,,,,,,,,,,percentil_fs,,,,,,,,,,,,,,,,,,,,,,,,,,,,,,,,,,,,,,,,,,,,,,,,,,,,,,,,,,,,,,,,,,,,,,,,,,,,,,,,,,,,,,,,sklearn,,,,2048.0,,,,,,,,,,,,,,,,,,,,,,,,,,,,90.0,,,2.0,,stacking_regressor_model,,,,,,,,,heavy_standardisation,custom_standardizer,,,,,,,,,,,,,,,,,,,,,,,COMPLETE
81,81,0.7375920434790266,2024-01-21 03:45:50.292950,2024-01-21 04:20:19.497016,0 days 00:34:29.204066,morgan,,,,,,,,,,,,,,,,,,,,,,,,,,,,,,,,,,,,,,,,,,,,,,,,,,,,,,,,,,,,,,,,,,,,,,,,,,,,,,,,,,percentil_fs,,,,,,,,,,,,,,,,,,,,,,,,,,,,,,,,,,,,,,,,,,,,,,,,,,,,,,,,,,,,,,,,,,,,,,,,,,,,,,,,,,,,,,,,sklearn,,,,2048.0,,,,,,,,,,,,,,,,,,,,,,,,,,,,91.0,,,2.0,,stacking_regressor_model,,,,,,,,,heavy_standardisation,custom_standardizer,,,,,,,,,,,,,,,,,,,,,,,COMPLETE
82,82,0.6757771718290405,2024-01-21 04:20:19.511090,2024-01-21 04:48:54.301367,0 days 00:28:34.790277,morgan,,,,,,,,,,,,,,,,,,,,,,,,,,,,,,,,,,,,,,,,,,,,,,,,,,,,,,,,,,,,,,,,,,,,,,,,,,,,,,,,,,percentil_fs,,,,,,,,,,,,,,,,,,,,,,,,,,,,,,,,,,,,,,,,,,,,,,,,,,,,,,,,,,,,,,,,,,,,,,,,,,,,,,,,,,,,,,,,sklearn,,,,2048.0,,,,,,,,,,,,,,,,,,,,,,,,,,,,91.0,,,2.0,,stacking_regressor_model,,,,,,,,,heavy_standardisation,custom_standardizer,,,,,,,,,,,,,,,,,,,,,,,COMPLETE
83,83,0.6864185708050978,2024-01-21 04:48:54.315619,2024-01-21 05:17:07.021758,0 days 00:28:12.706139,morgan,,,,,,,,,,,,,,,,,,,,,,,,,,,,,,,,,,,,,,,,,,,,,,,,,,,,,,,,,,,,,,,,,,,,,,,,,,,,,,,,,,percentil_fs,,,,,,,,,,,,,,,,,,,,,,,,,,,,,,,,,,,,,,,,,,,,,,,,,,,,,,,,,,,,,,,,,,,,,,,,,,,,,,,,,,,,,,,,sklearn,,,,2048.0,,,,,,,,,,,,,,,,,,,,,,,,,,,,92.0,,,2.0,,stacking_regressor_model,,,,,,,,,heavy_standardisation,custom_standardizer,,,,,,,,,,,,,,,,,,,,,,,COMPLETE
84,84,0.6950281911134201,2024-01-21 05:17:07.036200,2024-01-21 05:45:20.856855,0 days 00:28:13.820655,morgan,,,,,,,,,,,,,,,,,,,,,,,,,,,,,,,,,,,,,,,,,,,,,,,,,,,,,,,,,,,,,,,,,,,,,,,,,,,,,,,,,,percentil_fs,,,,,,,,,,,,,,,,,,,,,,,,,,,,,,,,,,,,,,,,,,,,,,,,,,,,,,,,,,,,,,,,,,,,,,,,,,,,,,,,,,,,,,,,sklearn,,,,2048.0,,,,,,,,,,,,,,,,,,,,,,,,,,,,92.0,,,2.0,,stacking_regressor_model,,,,,,,,,heavy_standardisation,custom_standardizer,,,,,,,,,,,,,,,,,,,,,,,COMPLETE
85,85,inf,2024-01-21 05:45:20.871611,2024-01-21 05:55:49.380995,0 days 00:10:28.509384,morgan,,,,,,,,,ball_tree,,,,,,,,,,,,,,,,,,,,,,,,,,,,,,,,,,,,,,,,,,,,,,,,,,,,,,,,,,,,,,,,,,,,,,,,,percentil_fs,,,,,,,,,,,,,,,,,,,,,,,,,,,,,,,,,,,,,,,,,,,,,,,,,,,,,,,,,,,,,,,2.0,,,,,,,,,,,,,,,,,,,,,,,,,sklearn,,,,2048.0,,,,,,,,,,,,,,,,,,,,,,,,,,6.0,,95.0,,,2.0,0.03529436533353447,radius_neighbors_regressor_model,,,,,,,,,heavy_standardisation,custom_standardizer,,,,,,,,,,,,,,,,,,,,uniform,,,COMPLETE
86,86,0.6849752125076284,2024-01-21 05:55:49.398695,2024-01-21 06:24:16.815349,0 days 00:28:27.416654,morgan,,,,,,,,,,,,,,,,,,,,,,,,,,,,,,,,,,,,,,,,,,,,,,,,,,,,,,,,,,,,,,,,,,,,,,,,,,,,,,,,,,percentil_fs,,,,,,,,,,,,,,,,,,,,,,,,,,,,,,,,,,,,,,,,,,,,,,,,,,,,,,,,,,,,,,,,,,,,,,,,,,,,,,,,,,,,,,,,sklearn,,,,2048.0,,,,,,,,,,,,,,,,,,,,,,,,,,,,91.0,,,2.0,,stacking_regressor_model,,,,,,,,,heavy_standardisation,custom_standardizer,,,,,,,,,,,,,,,,,,,,,,,COMPLETE
87,87,0.6874370990229787,2024-01-21 06:24:16.832697,2024-01-21 06:52:43.813035,0 days 00:28:26.980338,morgan,,,,,,,,,,,,,,,,,,,,,,,,,,,,,,,,,,,,,,,,,,,,,,,,,,,,,,,,,,,,,,,,,,,,,,,,,,,,,,,,,,percentil_fs,,,,,,,,,,,,,,,,,,,,,,,,,,,,,,,,,,,,,,,,,,,,,,,,,,,,,,,,,,,,,,,,,,,,,,,,,,,,,,,,,,,,,,,,sklearn,,,,2048.0,,,,,,,,,,,,,,,,,,,,,,,,,,,,91.0,,,2.0,,stacking_regressor_model,,,,,,,,,heavy_standardisation,custom_standardizer,,,,,,,,,,,,,,,,,,,,,,,COMPLETE
