,number,value,datetime_start,datetime_complete,duration,params_1D_featurizer,params_1d_model,params_2d_model,params_C_linear_svr,params_C_nu_svr,params_C_passive_aggressive_regressor,params_C_svr,params_activation_mlp_regressor,params_agg_modes,params_algorithm_kneighbors_regressor,params_algorithm_radius_neighbors_regressor,params_alpha_1,params_alpha_2,params_alpha_bayesian_ridge,params_alpha_elastic_net,params_alpha_gamma_regressor,params_alpha_gaussian_process_regressor,params_alpha_huber_regressor,params_alpha_kernel_ridge,params_alpha_lasso,params_alpha_lasso_cv,params_alpha_mlp_regressor,params_alpha_poisson_regressor,params_alpha_quantile_regressor,params_alpha_ridge_cv,params_alpha_ridge_model,params_alpha_sgd_regressor,params_alpha_tweedie_regressor,params_base_estimator_bagging_regressor,params_base_estimator_ransac_regressor,params_batch_normalization_0,params_batch_normalization_1,params_batch_normalization_2,params_batch_normalization_3,params_batch_normalization_4,params_batch_size_deepchem,params_bootstrap_bagging_regressor,params_bootstrap_extra_trees_regressor,params_bootstrap_features,params_bootstrap_random_forest_regressor,params_conv_activation_0,params_conv_activation_1,params_conv_activation_2,params_conv_batch_norm_0,params_conv_batch_norm_1,params_conv_batch_norm_2,params_conv_dropout_0,params_conv_dropout_1,params_conv_dropout_2,params_criterion_extra_trees_regressor,params_criterion_gradient_boosting_regressor,params_criterion_lasso_lars,params_criterion_random_forest_regressor,params_degree_nu_svr,params_degree_svr,params_dense_activation,params_dense_dropout,params_dense_layer_size,params_dense_units,params_depth_dmpnn,params_dropout,params_dropout_attentive_fp,params_dropout_dag,params_dropout_gat,params_dropout_graph_conv,params_dropouts_dtnn,params_dropouts_weave,params_embed_dropout_p,params_embedding_dim,params_embedding_output_dim,params_encoder_dropout_p,params_epochs_deepchem,params_epsilon_huber_regressor,params_epsilon_linear_svr,params_epsilon_sgd_regressor,params_f1,params_f2,params_feature_selector,params_featurizer_type,params_ff_dropout_p,params_filter_0,params_filter_1,params_filter_2,params_filters,params_fnn_dropout_p,params_fnn_layers,params_fpSize,params_g_noise,params_gamma_kernel_ridge,params_gamma_nu_svr,params_gamma_svr,params_gen_dropout_p,params_gen_n_layers,params_graph_conv_layers_conv_model,params_graph_feat_size_attentive_fp,params_gru_dropout_0,params_gru_dropout_1,params_gru_dropout_2,params_gru_units_0,params_gru_units_1,params_gru_units_2,params_hidden_activation_0,params_hidden_activation_1,params_hidden_activation_2,params_hidden_activation_3,params_hidden_activation_4,params_hidden_dropout_0,params_hidden_dropout_1,params_hidden_dropout_2,params_hidden_dropout_3,params_hidden_dropout_4,params_hidden_layer_sizes_mlp_regressor,params_hidden_layer_units_0,params_hidden_layer_units_1,params_hidden_layer_units_2,params_hidden_layer_units_3,params_hidden_layer_units_4,params_k,params_kernel_nu_svr,params_kernel_ridge,params_kernel_size_0,params_kernel_size_1,params_kernel_size_2,params_kernel_size_smiles_to_vec,params_kernel_svr,params_l1_0,params_l1_1,params_l1_2,params_l1_3,params_l1_4,params_l1_ratio_elastic_net,params_l1_ratio_sgd_regressor,params_l2_0,params_l2_1,params_l2_2,params_l2_3,params_l2_4,params_lambda_1_ard_regression,params_lambda_1_bayesian_ridge,params_lambda_2_ard_regression,params_lambda_2_bayesian_ridge,params_layer_sizes_dag,params_layer_sizes_gather,params_leaf_size_kneighbors_regressor,params_leaf_size_radius_neighbors_regressor,params_learning_rate_ada_boost_regressor,params_learning_rate_gradient_boosting_regressor,params_learning_rate_hist_gradient_boosting_regressor,params_loss_ada_boost_regressor,params_loss_gradient_boosting_regressor,params_loss_hist_gradient_boosting_regressor,params_lstm_dropout_0,params_lstm_dropout_1,params_lstm_dropout_2,params_lstm_units_0,params_lstm_units_1,params_lstm_units_2,params_master_atom,params_maxLength,params_maxPath,params_max_features_extra_trees_regressor,params_max_features_gradient_boosting_regressor,params_max_features_random_forest_regressor,params_max_path,params_method,params_minLength,params_minPath,params_min_path,params_min_samples,params_model_steps,params_model_type,params_nBits,params_n_attention_heads,params_n_attention_layers,params_n_bits,params_n_components,params_n_conv_layers,params_n_embedding_dtnn,params_n_encoders,params_n_estimators,params_n_estimators_ada_boost_regressor,params_n_estimators_bagging_regressor,params_n_estimators_extra_trees_regressor,params_n_estimators_gradient_boosting_regressor,params_n_estimators_random_forest_regressor,params_n_graph_feat_dag,params_n_graph_feat_weave,params_n_gru_layers,params_n_hidden_dtnn,params_n_hidden_layers,params_n_hidden_weave,params_n_layers,params_n_lstm_layers,params_n_neighbors_kneighbors_regressor,params_n_quantiles,params_n_rnn_layers,params_norm,params_nu_nu_svr,params_num_layers_attentive_fp,params_output_distribution,params_p,params_penalty,params_percentile,params_power_tweedie_regressor,params_predictor_dropout_gat,params_quantile,params_quantile_range,params_radius,params_radius_n_radius_neighbors_regressor,params_regression_model,params_rnn_dropouts_0,params_rnn_dropouts_1,params_rnn_dropouts_2,params_rnn_units_0,params_rnn_units_1,params_rnn_units_2,params_sa_dropout_p,params_scale,params_scaler,params_standardization_type,params_standardize,params_standardizer,params_stride_0,params_stride_1,params_stride_2,params_strides,params_support_weak,params_threshold,params_threshold_lambda,params_use_chirality_attentive_fp,params_use_chirality_gat,params_use_chirality_graph_conv,params_use_chirality_weave,params_use_edges_gat,params_use_partial_charge_attentive_fp,params_use_partial_charge_gat,params_weight_gbr,params_weight_lr,params_weight_mlp,params_weight_rfr,params_weight_svr,params_weights_kneighbors_regressor,params_weights_radius_neighbors_regressor,params_with_centering,params_with_mean,params_with_scaling,params_with_std,state
0,0,11.394257174153273,2024-01-22 09:31:50.980530,2024-01-22 09:33:00.525425,0 days 00:01:09.544895,2d_descriptors,,,,,,,,,,,,,,,,,,,,,,,,1.3496514001150708,,,,,,,,,,,,,,,,,,,,,,,,,,,,,,,,,,,,,,,,,,,,,,,,,,,,,k_best,,,,,,,,,,,,,,,,,,,,,,,,,,,,,,,,,,,,,,,,15.0,,,,,,,,,,,,,,,,,,,,,,,,,,,,,,,,,,,,,,,,,,,,,,,,,,,,,sklearn,,,,,,,,,,,,,,,,,,,,,,,,,,,,,,,,,,,,,,,ridge_cv_model,,,,,,,,,max_abs_scaler,simple_standardisation,,custom_standardizer,,,,,,,,,,,,,,,,,,,,,,,,,,COMPLETE
1,1,13.242501372744105,2024-01-22 09:33:00.548847,2024-01-22 09:34:06.473139,0 days 00:01:05.924292,morgan,,,,,,,,,,,,,,,,,,,,,,,,,,,,,,,,,,,,,,,,,,,,,,,,,,,,,,,,,,,,,,,,,,,,,,,,,,,,,low_variance_fs,,,,,,,,,,,,,,,,,,,,,,,,,,,,,,,,,,,,,,,,,,,,,,,,,,,,,,,,,,,,,,,,,,,,,,,,,,,,,,,,,,,,,,,,,,,,,sklearn,,,,1024.0,,,,,,,,,,,,,,,,,,,,,,,,,,,,,,,,,6.0,,ortogonal_matching_pursuit_model,,,,,,,,,,,,basic_standardizer,,,,,,0.1464677058673909,,,,,,,,,,,,,,,,,,,,COMPLETE
2,2,inf,2024-01-22 09:34:06.509197,2024-01-22 12:34:06.614491,0 days 03:00:00.105294,,,,,,,,,,,,,,,,,,,,,,,,,,,,,,,,,,,,16.0,,,,,,,,,,,,,,,,,,,,,,,,,,0.25,,,,,,,,,,976.0,,,,,,,,,,,,,,,,,,,,,,,100.0,,,,,,,,,,,,,,,,,,,,,,,,,,,,,,,,,,,,,,,,,,,,,,,,,,,,,,,,,,,,,,,,,,,,,,,,,,,attentive_fp_model,deepchem,,,,,,,,,,,,,,,,,,,,,,,,,,,,3.0,,,,,,,,,,,,,,,,,,,,,heavy_standardisation,,custom_standardizer,,,,,,,,True,,,,,True,,,,,,,,,,,,,COMPLETE
3,3,inf,2024-01-22 12:34:06.650139,2024-01-22 15:34:06.753547,0 days 03:00:00.103408,,,,,,,,,,,,,,,,,,,,,,,,,,,,,,,,,,,,32.0,,,,,,,,,,,,,,,,,,,,,,,,,,0.0,,,,,,,,,,811.0,,,,,,,,,,,,,,,,,,,,,,,500.0,,,,,,,,,,,,,,,,,,,,,,,,,,,,,,,,,,,,,,,,,,,,,,,,,,,,,,,,,,,,,,,,,,,,,,,,,,,attentive_fp_model,deepchem,,,,,,,,,,,,,,,,,,,,,,,,,,,,3.0,,,,,,,,,,,,,,,,,,,,,,,pass_through_standardizer,,,,,,,,False,,,,,False,,,,,,,,,,,,,COMPLETE
4,4,inf,2024-01-22 15:34:06.787603,2024-01-22 18:34:07.021174,0 days 03:00:00.233571,,,,,,,,,['flatten'],,,,,,,,,,,,,,,,,,,,,,,,,,,32.0,,,,,,,,,,,,,,,,,,,,,,,,,,,,0.0,,,,,,,,509.0,,,,,,,,,,,,,,,,,,,,,,,,,,,,,,,,,,,,,,,,,,,,,,,,,,,,,,,,,,,,,,,,,,,,,,,,,,,,,,,,,,,,,,,,,,,,,,,,,,gat_model,deepchem,,6.0,,,,,,,,,,,,,,,,,,,,,,,,,,,,,,,,0.5,,,,,,,,,,,,,,,heavy_standardisation,,custom_standardizer,,,,,,,,,False,,,True,,True,,,,,,,,,,,,COMPLETE
5,5,inf,2024-01-22 18:34:07.059608,2024-01-22 18:34:13.023808,0 days 00:00:05.964200,,,keras_rnn,,,,,,,,,,,,,,,,,,,,,,,,,,,,,,,,,,,,,,,,,,,,,,,,,,,,,relu,0.35760108575459737,,256.0,,,,,,,,,,,,,,,,,,,,2D,,,,,,,,,,,,,,,,,0.259387014788786,,,89.0,,,,,,,,,,,,,,,,,,,,,,,,,,,,,,,,,,,,,,,,,,,,,,,,,,,,,0.3807381098648095,,,198.0,,,,,,,,,,,,,,,,keras,,,,,,,,,,,,,,,,,1.0,,,,,1.0,,,,,,,,,,,,,,,,,,,,,,,,,,,,,,,,,,,,,,,,,,,,,,,,,,,,,,,COMPLETE
6,6,inf,2024-01-22 18:34:13.041978,2024-01-22 21:34:13.051833,0 days 03:00:00.009855,mixed,,,,,,,,,,,,,,,,,,,,,,,,,,,,,,,,,,,,,,,,,,,,,,,,,,,,,,,,,,,,,,,,,,,,,,,,,,,atom_pair,atom_pair,,,,,,,,,,,,,,,,,,,,,,,,,,,,,,,,,,,,,,,,,,,,,,,,,,,,,,,,,,,,,,,,,,,,,,,,,,,,,,,,,,,,,,,,,,,,,,sklearn,,,,,,,,,,,,,,,,,,,,,,,,,,,,,,,,,,,,,,,,,,,,,,,,,,,,,,,,,,,,,,,,,,,,,,,,,,,,,COMPLETE
7,7,14.279382145051034,2024-01-22 21:34:13.075570,2024-01-22 21:43:48.915038,0 days 00:09:35.839468,morgan,,,,,,,,,,,,,,,,,,,2.2505872921623133,,,,,,,,,,,,,,,,,,,,,,,,,,,,,,,,,,,,,,,,,,,,,,,,,,,,,,,,,,boruta_algorithm,,,,,,,,,,,,,,,,,,,,,,,,,,,,,,,,,,,,,,,,,,,,,,,,,,,,,,,,,,,,,,,,,,,,,,,,,,,,,,,,,,,,,,,,,,,,,sklearn,,,,1024.0,,,,,,,,,,,,,,,,,,,,,,,,,,,,,,,,,6.0,,lasso_model,,,,,,,,,,,,basic_standardizer,,,,,True,,,,,,,,,,,,,,,,,,,,,COMPLETE
8,8,inf,2024-01-22 21:43:48.931677,2024-01-22 21:43:49.091531,0 days 00:00:00.159854,morgan,keras_dense,,,,,,,,,,,,,,,,,,,,,,,,,,,,,False,False,False,,,,,,,,,,,,,,,,,,,,,,,,,,,,,,,,,,,,,,,,,,,,,,1D,,,,,,,,,,,,,,,,,,,,,,,relu,relu,tanh,,,0.44036713632998215,0.6726960340435508,0.2436885681903016,,,,22.0,35.0,29.0,,,,,,,,,,,0.00011883475011920953,3.4585602140055815e-05,0.00010541202706355471,,,,,8.831912334379672e-05,5.797192405777077e-06,0.00028716604423627214,,,,,,,,,,,,,,,,,,,,,,,,,,,,,,,,,,,,keras,,,,1024.0,,,,,,,,,,,,,,,3.0,,,,,,,,,,,,,,,,,,4.0,,,,,,,,,,,,,,,,,,,,,,,,,,,,,,,,,,,,,,,,COMPLETE
9,9,inf,2024-01-22 21:43:49.104277,2024-01-22 21:43:49.333221,0 days 00:00:00.228944,rdk,keras_dense,,,,,,,,,,,,,,,,,,,,,,,,,,,,,False,False,True,True,True,,,,,,,,,,,,,,,,,,,,,,,,,,,,,,,,,,,,,,,,,,,,1D,,,,,,,,2048.0,,,,,,,,,,,,,,,tanh,tanh,relu,tanh,tanh,0.3165102701886661,0.41946701995342145,0.4133836211188351,0.7153049257925246,0.7771503644265634,,25.0,43.0,62.0,26.0,45.0,,,,,,,,,0.0012230948677058372,9.192305579587231e-05,3.445948461987022e-06,5.5309846162324814e-05,0.0045723669755485296,,,3.244543022275076e-06,8.387119348894531e-05,0.0007769538558778637,1.910250915217939e-06,7.2989091009831334e-06,,,,,,,,,,,,,,,,,,,,,,,,,,,8.0,,,,3.0,,,keras,,,,,,,,,,,,,,,,,,,5.0,,,,,,,,,,,,,,,,,,,,,,,,,,,,,,,,,,,,,,,,,,,,,,,,,,,,,,,,,,COMPLETE
10,10,11.689993921783332,2024-01-22 21:43:49.345761,2024-01-22 21:47:16.745446,0 days 00:03:27.399685,2d_descriptors,,,,,,,,,,,,,,,,,,,,,,,,0.8057064948038803,,,,,,,,,,,,,,,,,,,,,,,,,,,,,,,,,,,,,,,,,,,,,,,,,,,,,k_best,,,,,,,,,,,,,,,,,,,,,,,,,,,,,,,,,,,,,,,,15.0,,,,,,,,,,,,,,,,,,,,,,,,,,,,,,,,,,,,,,,,,,,,,,,,,,,,,sklearn,,,,,,,,,,,,,,,,,,,,,,,,,,,,,,,,,,,,,,,ridge_cv_model,,,,,,,,,max_abs_scaler,,,chembl_standardizer,,,,,,,,,,,,,,,,,,,,,,,,,,COMPLETE
11,11,11.686083482369572,2024-01-22 21:47:16.786815,2024-01-22 21:51:18.054971,0 days 00:04:01.268156,2d_descriptors,,,,,,,,,,,,,,,,,,,,,,,,0.646935094720987,,,,,,,,,,,,,,,,,,,,,,,,,,,,,,,,,,,,,,,,,,,,,,,,,,,,,k_best,,,,,,,,,,,,,,,,,,,,,,,,,,,,,,,,,,,,,,,,15.0,,,,,,,,,,,,,,,,,,,,,,,,,,,,,,,,,,,,,,,,,,,,,,,,,,,,,sklearn,,,,,,,,,,,,,,,,,,,,,,,,,,,,,,,,,,,,,,,ridge_cv_model,,,,,,,,,max_abs_scaler,,,chembl_standardizer,,,,,,,,,,,,,,,,,,,,,,,,,,COMPLETE
12,12,11.306366308243728,2024-01-22 21:51:18.089189,2024-01-22 21:54:54.466862,0 days 00:03:36.377673,2d_descriptors,,,,,,,,,auto,,,,,,,,,,,,,,,,,,,,,,,,,,,,,,,,,,,,,,,,,,,,,,,,,,,,,,,,,,,,,,,,,,,,k_best,,,,,,,,,,,,,,,,,,,,,,,,,,,,,,,,,,,,,,,,15.0,,,,,,,,,,,,,,,,,,,,,,,,,,7.0,,,,,,,,,,,,,,,,,,,,,,,,,,,sklearn,,,,,,,,,,,,,,,,,,,,,,,10.0,,,,,,,7.0,,,,,,,,,kneighbors_regressor_model,,,,,,,,,max_abs_scaler,,,chembl_standardizer,,,,,,,,,,,,,,,,,,,,uniform,,,,,,COMPLETE
13,13,75.10098668192389,2024-01-22 21:54:54.484692,2024-01-22 21:57:48.437767,0 days 00:02:53.953075,maccs,,,,,,,,,,,,,,,,0.26844056578940056,,,,,,,,,,,,,,,,,,,,,,,,,,,,,,,,,,,,,,,,,,,,,,,,,,,,,,,,,,,,,select_from_model_fs,,,,,,,,,,,,,,,,,,,,,,,,,,,,,,,,,,,,,,,,,,,,,,,,,,,,,,,,,,,,,,,,,,,,,,,,,,,,,,,,,,,,,,,,,,,,,sklearn,,,,,,,,,93.0,,,,,,,,,,,,,,,,,,,,,,,,,,,,,,gaussian_process_regressor_model,,,,,,,,,,simple_standardisation,,custom_standardizer,,,,,,,,,,,,,,,,,,,,,,,,,,COMPLETE
14,14,12.6068229390681,2024-01-22 21:57:48.459759,2024-01-22 22:01:58.191022,0 days 00:04:09.731263,atom_pair,,,,,,,,,auto,,,,,,,,,,,,,,,,,,,,,,,,,,,,,,,,,,,,,,,,,,,,,,,,,,,,,,,,,,,,,,,,,,,,k_best,,,,,,,,,,,,,,,,,,,,,,,,,,,,,,,,,,,,,,,,9.0,,,,,,,,,,,,,,,,,,,,,,,,,,7.0,,,,,,,,,,,,,,,30.0,,,,,,,3.0,,,,,sklearn,1024.0,,,,,,,,,,,,,,,,,,,,,,10.0,,,,,,,7.0,,,,,,,,,kneighbors_regressor_model,,,,,,,,,,,,chembl_standardizer,,,,,,,,,,,,,,,,,,,,uniform,,,,,,COMPLETE
15,15,10.93848038080687,2024-01-22 22:01:58.224668,2024-01-22 22:04:01.497530,0 days 00:02:03.272862,2d_descriptors,,,,,,,,,,,,,4.487368604097357,,,,,,,,,,,,,,,,,,,,,,,,,,,,,,,,,,,,,,,,,,,,,,,,,,,,,,,,,,,,,,,,percentil_fs,,,,,,,,,,,,,,,,,,,,,,,,,,,,,,,,,,,,,,,,,,,,,,,,,,,,,,,,,,,,,9.852936392404416,,6.677822321652919,,,,,,,,,,,,,,,,,,,,,,,,,,,,,,sklearn,,,,,,,,,,,,,,,,,,,,,,,,,,,,,,,,52.0,,,,,,,bayesian_ridge_model,,,,,,,,,max_abs_scaler,,,pass_through_standardizer,,,,,,,,,,,,,,,,,,,,,,,,,,COMPLETE
16,16,12.049010128992004,2024-01-22 22:04:01.534892,2024-01-22 22:05:27.966457,0 days 00:01:26.431565,layered,,,,,,,,,,,,,4.407043159697536,,,,,,,,,,,,,,,,,,,,,,,,,,,,,,,,,,,,,,,,,,,,,,,,,,,,,,,,,,,,,,,,percentil_fs,,,,,,,,,1024.0,,,,,,,,,,,,,,,,,,,,,,,,,,,,,,,,,,,,,,,,,,,,,,,,,,,,9.499756037928739,,6.850670642924576,,,,,,,,,,,,,,,,,,,5.0,,,,,,,3.0,,,,sklearn,,,,,,,,,,,,,,,,,,,,,,,,,,,,,,,,53.0,,,,,,,bayesian_ridge_model,,,,,,,,,,,,pass_through_standardizer,,,,,,,,,,,,,,,,,,,,,,,,,,COMPLETE
17,17,11.53356211446525,2024-01-22 22:05:27.979466,2024-01-22 22:09:18.584883,0 days 00:03:50.605417,2d_descriptors,,,,,,,,,,,,,,,,,,,,,,,,,,,,svr,,,,,,,,True,,False,,,,,,,,,,,,,,,,,,,,,,,,,,,,,,,,,,,,,,,pass_through_transformer,,,,,,,,,,,,,,,,,,,,,,,,,,,,,,,,,,,,,,,,,,,,,,,,,,,,,,,,,,,,,,,,,,,,,,,,,,,,,,,,,,,,,,,,,,,,,sklearn,,,,,,,,,,,50.0,,,,,,,,,,,,,,,l2,,,,,,,,,,,,,bagging_regressor_model,,,,,,,,,normalizer,,,pass_through_standardizer,,,,,,,,,,,,,,,,,,,,,,,,,,COMPLETE
18,18,inf,2024-01-22 22:09:18.602603,2024-01-22 22:09:26.813314,0 days 00:00:08.210711,,,keras_simple_rnn,,,,,,,,,,,,,,,,,,,,,,,,,,,,,,,,,,,,,,,,,,,,,,,,,,,,,tanh,0.01582800566041115,,32.0,,,,,,,,,,,,,,,,,,,,2D,,,,,,,,,,,,,,,,,,,,,,,,,,,,,,,,,,,,,,,,,,,,,,,,,,,,,,,,,,,,,,,,,,,,,,,,,,,,,,,,,,,,,,,,,,,,keras,,,,,,,,,,,,,,,,,,,,,,,,,1.0,,,,,,,,,,,,,,,0.47957953752629406,,,42.0,,,,,,,,,,,,,,,,,,,,,,,,,,,,,,,,,,COMPLETE
19,19,inf,2024-01-22 22:09:26.851248,2024-01-23 01:09:28.781607,0 days 03:00:01.930359,,,,,,,,,,,,,,,,,,,,,,,,,,,,,,,,,,,,128.0,,,,,,,,,,,,,,,,,,,,,,,,,,,,,,,,,64.0,,,123.0,,,,,,,,,,,,64.0,,,,,,,,,,,,,,,,,,,,,,,,,,,,,,,,,,,,,,,,3.0,,,,,,,,,,,,,,,,,,,,,,,,,,,,,,,,,,,,,,,,,,,,,,smiles_to_vec_model,deepchem,,,,,,,,,,,,,,,,,,,,,,,,,,,,,,,,,,,,,,,,,,,,,,,,,,,pass_through_standardizer,,,,1.0,,,,,,,,,,,,,,,,,,,,,,COMPLETE
