,number,value,datetime_start,datetime_complete,duration,params_1D_featurizer,params_1d_model,params_2d_model,params_C_linear_svr,params_C_nu_svr,params_C_passive_aggressive_regressor,params_C_svr,params_activation_mlp_regressor,params_agg_modes,params_algorithm_kneighbors_regressor,params_algorithm_radius_neighbors_regressor,params_alpha_1,params_alpha_2,params_alpha_bayesian_ridge,params_alpha_elastic_net,params_alpha_gamma_regressor,params_alpha_gaussian_process_regressor,params_alpha_huber_regressor,params_alpha_kernel_ridge,params_alpha_lasso,params_alpha_lasso_cv,params_alpha_mlp_regressor,params_alpha_poisson_regressor,params_alpha_quantile_regressor,params_alpha_ridge_cv,params_alpha_ridge_model,params_alpha_sgd_regressor,params_alpha_tweedie_regressor,params_base_estimator_bagging_regressor,params_base_estimator_ransac_regressor,params_batch_normalization_0,params_batch_normalization_1,params_batch_normalization_2,params_batch_normalization_3,params_batch_normalization_4,params_batch_size_deepchem,params_bootstrap_bagging_regressor,params_bootstrap_extra_trees_regressor,params_bootstrap_features,params_bootstrap_random_forest_regressor,params_conv_activation_0,params_conv_activation_1,params_conv_activation_2,params_conv_batch_norm_0,params_conv_batch_norm_1,params_conv_batch_norm_2,params_conv_dropout_0,params_conv_dropout_1,params_conv_dropout_2,params_criterion_extra_trees_regressor,params_criterion_gradient_boosting_regressor,params_criterion_lasso_lars,params_criterion_random_forest_regressor,params_degree_nu_svr,params_degree_svr,params_dense_activation,params_dense_dropout,params_dense_layer_size,params_dense_units,params_depth_dmpnn,params_dropout,params_dropout_attentive_fp,params_dropout_dag,params_dropout_gat,params_dropout_graph_conv,params_dropouts_dtnn,params_dropouts_weave,params_embed_dropout_p,params_embedding_dim,params_embedding_output_dim,params_encoder_dropout_p,params_epochs_deepchem,params_epsilon_huber_regressor,params_epsilon_linear_svr,params_epsilon_sgd_regressor,params_f1,params_f2,params_feature_selector,params_featurizer_type,params_ff_dropout_p,params_filter_0,params_filter_1,params_filter_2,params_filters,params_fnn_dropout_p,params_fnn_layers,params_fpSize,params_g_noise,params_gamma_kernel_ridge,params_gamma_nu_svr,params_gamma_svr,params_gen_dropout_p,params_gen_n_layers,params_graph_conv_layers_conv_model,params_graph_feat_size_attentive_fp,params_gru_dropout_0,params_gru_dropout_1,params_gru_dropout_2,params_gru_units_0,params_gru_units_1,params_gru_units_2,params_hidden_activation_0,params_hidden_activation_1,params_hidden_activation_2,params_hidden_activation_3,params_hidden_activation_4,params_hidden_dropout_0,params_hidden_dropout_1,params_hidden_dropout_2,params_hidden_dropout_3,params_hidden_dropout_4,params_hidden_layer_sizes_mlp_regressor,params_hidden_layer_units_0,params_hidden_layer_units_1,params_hidden_layer_units_2,params_hidden_layer_units_3,params_hidden_layer_units_4,params_k,params_kernel_nu_svr,params_kernel_ridge,params_kernel_size_0,params_kernel_size_1,params_kernel_size_2,params_kernel_size_smiles_to_vec,params_kernel_svr,params_l1_0,params_l1_1,params_l1_2,params_l1_3,params_l1_4,params_l1_ratio_elastic_net,params_l1_ratio_sgd_regressor,params_l2_0,params_l2_1,params_l2_2,params_l2_3,params_l2_4,params_lambda_1_ard_regression,params_lambda_1_bayesian_ridge,params_lambda_2_ard_regression,params_lambda_2_bayesian_ridge,params_layer_sizes_dag,params_layer_sizes_gather,params_leaf_size_kneighbors_regressor,params_leaf_size_radius_neighbors_regressor,params_learning_rate_ada_boost_regressor,params_learning_rate_gradient_boosting_regressor,params_learning_rate_hist_gradient_boosting_regressor,params_loss_ada_boost_regressor,params_loss_gradient_boosting_regressor,params_loss_hist_gradient_boosting_regressor,params_lstm_dropout_0,params_lstm_dropout_1,params_lstm_dropout_2,params_lstm_units_0,params_lstm_units_1,params_lstm_units_2,params_master_atom,params_maxLength,params_maxPath,params_max_features_extra_trees_regressor,params_max_features_gradient_boosting_regressor,params_max_features_random_forest_regressor,params_max_path,params_method,params_minLength,params_minPath,params_min_path,params_min_samples,params_model_steps,params_model_type,params_nBits,params_n_attention_heads,params_n_attention_layers,params_n_bits,params_n_components,params_n_conv_layers,params_n_embedding_dtnn,params_n_encoders,params_n_estimators,params_n_estimators_ada_boost_regressor,params_n_estimators_bagging_regressor,params_n_estimators_extra_trees_regressor,params_n_estimators_gradient_boosting_regressor,params_n_estimators_random_forest_regressor,params_n_graph_feat_dag,params_n_graph_feat_weave,params_n_gru_layers,params_n_hidden_dtnn,params_n_hidden_layers,params_n_hidden_weave,params_n_layers,params_n_lstm_layers,params_n_neighbors_kneighbors_regressor,params_n_quantiles,params_n_rnn_layers,params_norm,params_nu_nu_svr,params_num_layers_attentive_fp,params_output_distribution,params_p,params_penalty,params_percentile,params_power_tweedie_regressor,params_predictor_dropout_gat,params_quantile,params_quantile_range,params_radius,params_radius_n_radius_neighbors_regressor,params_regression_model,params_rnn_dropouts_0,params_rnn_dropouts_1,params_rnn_dropouts_2,params_rnn_units_0,params_rnn_units_1,params_rnn_units_2,params_sa_dropout_p,params_scale,params_scaler,params_standardization_type,params_standardize,params_standardizer,params_stride_0,params_stride_1,params_stride_2,params_strides,params_support_weak,params_threshold,params_threshold_lambda,params_use_chirality_attentive_fp,params_use_chirality_gat,params_use_chirality_graph_conv,params_use_chirality_weave,params_use_edges_gat,params_use_partial_charge_attentive_fp,params_use_partial_charge_gat,params_weight_gbr,params_weight_lr,params_weight_mlp,params_weight_rfr,params_weight_svr,params_weights_kneighbors_regressor,params_weights_radius_neighbors_regressor,params_with_centering,params_with_mean,params_with_scaling,params_with_std,state
83,83,11.26101367406264,2024-01-24 01:40:45.022782,2024-01-24 01:49:04.929774,0 days 00:08:19.906992,2d_descriptors,,,,,,,,,,,,,,,,,,,,,,,,,,,,,,,,,,,,,,,,,,,,,,,,,,,,,,,,,,,,,,,,,,,,,,,,,,,,,low_variance_fs,,,,,,,,,,,,,,,,,,,,,,,,,,,,,,,,,,,,,,,,,,,,,,,,,,,,,,,,,,,,,,,,,,,,,,,,,,,,,,,,,,,,,,,yeo-johnson,,,,,,sklearn,,,,,,,,,,,,,,,,,,,,,,,,,,,,,,,,,,,,,,,ortogonal_matching_pursuit_model,,,,,,,,,power_transformer,,False,basic_standardizer,,,,,,0.018006560987252087,,,,,,,,,,,,,,,,,,,,COMPLETE
84,84,12.900513161138395,2024-01-24 01:49:04.945923,2024-01-24 01:57:37.778035,0 days 00:08:32.832112,2d_descriptors,,,,,,,,,,,,,,,,,,,,,,,,,,,0.769069645147693,,,,,,,,,,,,,,,,,,,,,,,,,,,,,,,,,,,,,,,,,,,,,,,,,,pass_through_transformer,,,,,,,,,,,,,,,,,,,,,,,,,,,,,,,,,,,,,,,,,,,,,,,,,,,,,,,,,,,,,,,,,,,,,,,,,,,,,,,,,,,,,,,,,,,,,sklearn,,,,,,,,,,,,,,,,,,,,,,,,,,max,,,,,,,0.8815249798037046,,,,,,tweedie_regressor_model,,,,,,,,,normalizer,,,basic_standardizer,,,,,,,,,,,,,,,,,,,,,,,,,,COMPLETE
85,85,9.91593432349635,2024-01-24 01:57:37.798230,2024-01-24 02:12:27.155640,0 days 00:14:49.357410,2d_descriptors,,,,,,,,,,,,,,,,,,,,,,,,,,,,,,,,,,,,,,,,,,,,,,,,,,,,,,,,,,,,,,,,,,,,,,,,,,,,,percentil_fs,,,,,,,,,,,,,,,,,,,,,,,,,,,,,,,,,,,,,,,,,,,,,,,,,,,,,,,,,,,,,,,,,,,,,,,,,,,,,,,,,,,,,,,yeo-johnson,,,,,,sklearn,,,,,,,,,,,,,,,,,,,,,,,,,,,,,,,,87.0,,,,,,,stacking_regressor_model,,,,,,,,,power_transformer,,False,basic_standardizer,,,,,,,,,,,,,,,,,,,,,,,,,,COMPLETE
86,86,33.25551123246479,2024-01-24 02:12:27.170355,2024-01-24 02:39:40.493102,0 days 00:27:13.322747,morgan,,,,,,,,,,,,,,,,,,,,,,,,,,,,,,,,,,,,,,,,,,,,,,,,,,,,,,,,,,,,,,,,,,,,,,,,,,,,,percentil_fs,,,,,,,,,,,,,,,,,,,,,,,,,,,,,,,,,,,,,,,,,,,,,,,,,,,,,,,,,,,,,,,,,,,,,,,,,,,,,,,,,,,,,,,,,,,,,sklearn,,,,2048.0,,,,,,,,,,,,,,,,,,,,,,,,,,,,88.0,,,,,4.0,,stacking_regressor_model,,,,,,,,,,simple_standardisation,,custom_standardizer,,,,,,,,,,,,,,,,,,,,,,,,,,COMPLETE
87,87,inf,2024-01-24 02:39:40.506680,2024-01-24 05:39:40.642657,0 days 03:00:00.135977,,,,,,,,,,,,,,,,,,,,,,,,,,,,,,,,,,,,16.0,,,,,,,,,,,,,,,,,,,,,,,,2.0,,,,,,,,,,,,990.0,,,,,,,,,,,,,0.0,2.0,,,,,,,,,,,,,,,,,,,,,,,,,,,,,,,,,,,,,,,,,,,,,,,,,,,,,,,,,,,,,,,,,,,,,,,,,,,,,,,,,,,,dmpnn_model,deepchem,,,,,,,,,,,,,,,,,,,,,,,,,,,,,,,,,,,,,,,,,,,,,,,,,,,pass_through_standardizer,,,,,,,,,,,,,,,,,,,,,,,,,,COMPLETE
88,88,9.714498424071383,2024-01-24 05:39:40.715396,2024-01-24 05:53:13.025972,0 days 00:13:32.310576,2d_descriptors,,,,,,,,,,,,,,,,,,,,,,,,,,,,,,,,,,,,,,,,,,,,,,,,,,,,,,,,,,,,,,,,,,,,,,,,,,,,,percentil_fs,,,,,,,,,,,,,,,,,,,,,,,,,,,,,,,,,,,,,,,,,,,,,,,,,,,,,,,,,,,,,,,,,,,,,,,,,,,,,,,,,,,,,,,yeo-johnson,,,,,,sklearn,,,,,,,,,,,,,,,,,,,,,,,,,,,,,,,,64.0,,,,,,,stacking_regressor_model,,,,,,,,,power_transformer,heavy_standardisation,False,custom_standardizer,,,,,,,,,,,,,,,,,,,,,,,,,,COMPLETE
89,89,9.606984223476207,2024-01-24 05:53:13.041374,2024-01-24 06:06:44.342971,0 days 00:13:31.301597,2d_descriptors,,,,,,,,,,,,,,,,,,,,,,,,,,,,,,,,,,,,,,,,,,,,,,,,,,,,,,,,,,,,,,,,,,,,,,,,,,,,,percentil_fs,,,,,,,,,,,,,,,,,,,,,,,,,,,,,,,,,,,,,,,,,,,,,,,,,,,,,,,,,,,,,,,,,,,,,,,,,,,,,,,,,,,,,,,,,,,,,sklearn,,,,,,,,,,,,,,,,,,,,,,,,,,,,,,,,65.0,,,,,,,stacking_regressor_model,,,,,,,,,pass_through_transformer,simple_standardisation,,custom_standardizer,,,,,,,,,,,,,,,,,,,,,,,,,,COMPLETE
90,90,9.464431374657082,2024-01-24 06:06:44.356775,2024-01-24 06:20:05.141083,0 days 00:13:20.784308,2d_descriptors,,,,,,,,,,,,,,,,,,,,,,,,,,,,,,,,,,,,,,,,,,,,,,,,,,,,,,,,,,,,,,,,,,,,,,,,,,,,,percentil_fs,,,,,,,,,,,,,,,,,,,,,,,,,,,,,,,,,,,,,,,,,,,,,,,,,,,,,,,,,,,,,,,,,,,,,,,,,,,,,,,,,,,,,,,,,,,,,sklearn,,,,,,,,,,,,,,,,,,,,,,,,,,,,,,,,62.0,,,,,,,stacking_regressor_model,,,,,,,,,pass_through_transformer,simple_standardisation,,custom_standardizer,,,,,,,,,,,,,,,,,,,,,,,,,,COMPLETE
91,91,9.588955361016755,2024-01-24 06:20:05.158693,2024-01-24 06:33:30.881143,0 days 00:13:25.722450,2d_descriptors,,,,,,,,,,,,,,,,,,,,,,,,,,,,,,,,,,,,,,,,,,,,,,,,,,,,,,,,,,,,,,,,,,,,,,,,,,,,,percentil_fs,,,,,,,,,,,,,,,,,,,,,,,,,,,,,,,,,,,,,,,,,,,,,,,,,,,,,,,,,,,,,,,,,,,,,,,,,,,,,,,,,,,,,,,,,,,,,sklearn,,,,,,,,,,,,,,,,,,,,,,,,,,,,,,,,64.0,,,,,,,stacking_regressor_model,,,,,,,,,pass_through_transformer,simple_standardisation,,custom_standardizer,,,,,,,,,,,,,,,,,,,,,,,,,,COMPLETE
92,92,9.50208247163798,2024-01-24 06:33:30.895561,2024-01-24 06:47:02.936519,0 days 00:13:32.040958,2d_descriptors,,,,,,,,,,,,,,,,,,,,,,,,,,,,,,,,,,,,,,,,,,,,,,,,,,,,,,,,,,,,,,,,,,,,,,,,,,,,,percentil_fs,,,,,,,,,,,,,,,,,,,,,,,,,,,,,,,,,,,,,,,,,,,,,,,,,,,,,,,,,,,,,,,,,,,,,,,,,,,,,,,,,,,,,,,,,,,,,sklearn,,,,,,,,,,,,,,,,,,,,,,,,,,,,,,,,62.0,,,,,,,stacking_regressor_model,,,,,,,,,pass_through_transformer,simple_standardisation,,custom_standardizer,,,,,,,,,,,,,,,,,,,,,,,,,,COMPLETE
93,93,9.684181686386871,2024-01-24 06:47:02.957740,2024-01-24 07:00:28.237256,0 days 00:13:25.279516,2d_descriptors,,,,,,,,,,,,,,,,,,,,,,,,,,,,,,,,,,,,,,,,,,,,,,,,,,,,,,,,,,,,,,,,,,,,,,,,,,,,,percentil_fs,,,,,,,,,,,,,,,,,,,,,,,,,,,,,,,,,,,,,,,,,,,,,,,,,,,,,,,,,,,,,,,,,,,,,,,,,,,,,,,,,,,,,,,,,,,,,sklearn,,,,,,,,,,,,,,,,,,,,,,,,,,,,,,,,63.0,,,,,,,stacking_regressor_model,,,,,,,,,pass_through_transformer,simple_standardisation,,custom_standardizer,,,,,,,,,,,,,,,,,,,,,,,,,,COMPLETE
94,94,9.763029166992409,2024-01-24 07:00:28.261292,2024-01-24 07:13:45.396730,0 days 00:13:17.135438,2d_descriptors,,,,,,,,,,,,,,,,,,,,,,,,,,,,,,,,,,,,,,,,,,,,,,,,,,,,,,,,,,,,,,,,,,,,,,,,,,,,,percentil_fs,,,,,,,,,,,,,,,,,,,,,,,,,,,,,,,,,,,,,,,,,,,,,,,,,,,,,,,,,,,,,,,,,,,,,,,,,,,,,,,,,,,,,,,,,,,,,sklearn,,,,,,,,,,,,,,,,,,,,,,,,,,,,,,,,63.0,,,,,,,stacking_regressor_model,,,,,,,,,pass_through_transformer,simple_standardisation,,custom_standardizer,,,,,,,,,,,,,,,,,,,,,,,,,,COMPLETE
95,95,9.549454634499128,2024-01-24 07:13:45.411801,2024-01-24 07:27:10.554771,0 days 00:13:25.142970,2d_descriptors,,,,,,,,,,,,,,,,,,,,,,,,,,,,,,,,,,,,,,,,,,,,,,,,,,,,,,,,,,,,,,,,,,,,,,,,,,,,,percentil_fs,,,,,,,,,,,,,,,,,,,,,,,,,,,,,,,,,,,,,,,,,,,,,,,,,,,,,,,,,,,,,,,,,,,,,,,,,,,,,,,,,,,,,,,,,,,,,sklearn,,,,,,,,,,,,,,,,,,,,,,,,,,,,,,,,63.0,,,,,,,stacking_regressor_model,,,,,,,,,pass_through_transformer,simple_standardisation,,custom_standardizer,,,,,,,,,,,,,,,,,,,,,,,,,,COMPLETE
96,96,9.608384879629822,2024-01-24 07:27:10.569497,2024-01-24 07:40:25.477428,0 days 00:13:14.907931,2d_descriptors,,,,,,,,,,,,,,,,,,,,,,,,,,,,,,,,,,,,,,,,,,,,,,,,,,,,,,,,,,,,,,,,,,,,,,,,,,,,,percentil_fs,,,,,,,,,,,,,,,,,,,,,,,,,,,,,,,,,,,,,,,,,,,,,,,,,,,,,,,,,,,,,,,,,,,,,,,,,,,,,,,,,,,,,,,,,,,,,sklearn,,,,,,,,,,,,,,,,,,,,,,,,,,,,,,,,62.0,,,,,,,stacking_regressor_model,,,,,,,,,pass_through_transformer,simple_standardisation,,custom_standardizer,,,,,,,,,,,,,,,,,,,,,,,,,,COMPLETE
97,97,inf,2024-01-24 07:40:25.495140,2024-01-24 07:40:42.047461,0 days 00:00:16.552321,,,keras_simple_rnn,,,,,,,,,,,,,,,,,,,,,,,,,,,,,,,,,,,,,,,,,,,,,,,,,,,,,relu,0.2498600857123415,,256.0,,,,,,,,,,,,,,,,,,,,2D,,,,,,,,,,,,,,,,,,,,,,,,,,,,,,,,,,,,,,,,,,,,,,,,,,,,,,,,,,,,,,,,,,,,,,,,,,,,,,,,,,,,,,,,,,,,keras,,,,,,,,,,,,,,,,,,,,,,,,,3.0,,,,,,,,,,,,,,,0.009123440545795891,0.03934942938691466,0.13801008600087694,245.0,93.0,232.0,,,,,,,,,,,,,,,,,,,,,,,,,,,,,,,,COMPLETE
98,98,12.66359747265603,2024-01-24 07:40:42.060724,2024-01-24 08:13:28.477549,0 days 00:32:46.416825,mixed,,,,,,,,,,,,,,,,,,,,,,,,,,,,,,,,,,,,,,,,,,,,,,,,,,,,,,,,,,,,,,,,,,,,,,,,,,,rdk,layered,percentil_fs,,,,,,,,,,,,,,,,,,,,,,,,,,,,,,,,,,,,,,,,,,,,,,,,,,,,,,,,,,,,,,,,,,,,,,,,,,,,,,,,,,,,,,,,,,,,,sklearn,,,,,,,,,,,,,,,,,,,,,,,,,,,,,,,,63.0,,,,,,,stacking_regressor_model,,,,,,,,,,simple_standardisation,,custom_standardizer,,,,,,,,,,,,,,,,,,,,,,,,,,COMPLETE
99,99,9.549755018332414,2024-01-24 08:13:28.492054,2024-01-24 08:26:58.934994,0 days 00:13:30.442940,2d_descriptors,,,,,,,,,,,,,,,,,,,,,,,,,,,,,,,,,,,,,,,,,,,,,,,,,,,,,,,,,,,,,,,,,,,,,,,,,,,,,percentil_fs,,,,,,,,,,,,,,,,,,,,,,,,,,,,,,,,,,,,,,,,,,,,,,,,,,,,,,,,,,,,,,,,,,,,,,,,,,,,,,,,,,,,,,,,,,,,,sklearn,,,,,,,,,,,,,,,,,,,,,,,,,,,,,,,,63.0,,,,,,,stacking_regressor_model,,,,,,,,,pass_through_transformer,simple_standardisation,,custom_standardizer,,,,,,,,,,,,,,,,,,,,,,,,,,COMPLETE
