,number,value,datetime_start,datetime_complete,duration,params_1D_featurizer,params_1d_model,params_2d_model,params_algorithm_radius_neighbors_classifier,params_alpha_perceptron,params_alpha_ridge_classifier,params_alpha_sgd_classifier,params_attention_dropout_0,params_attention_dropout_1,params_attention_key_dim_0,params_attention_key_dim_1,params_base_estimator_bagging_classifier,params_base_filters,params_batch_normalization_0,params_batch_normalization_1,params_batch_normalization_2,params_batch_normalization_3,params_batch_normalization_4,params_batch_size_deepchem,params_batchnorm,params_bootstrap_bagging_classifier,params_bootstrap_extra_trees_classifier,params_bootstrap_features,params_classification_model,params_conv_activation_0,params_conv_activation_1,params_conv_activation_2,params_conv_batch_norm_0,params_conv_batch_norm_1,params_conv_batch_norm_2,params_conv_dropout_0,params_conv_dropout_1,params_conv_dropout_2,params_criterion_extra_trees_classifier,params_criterion_gradient_boosting_classifier,params_degree_one_class_svm,params_dense_activation,params_dense_dropout,params_dense_layer_size,params_dense_units,params_depth_dmpnn,params_dropout,params_dropout_attentive_fp,params_dropout_dag,params_dropout_gcn,params_dropout_graph_conv,params_dropout_pagtn,params_dropout_text_cnn,params_dropouts_weave,params_embedding_dim,params_embedding_output_dim,params_epochs_deepchem,params_epsilon_sgd_classifier,params_f1,params_f2,params_feature_selector,params_featurizer_type,params_filter_0,params_filter_1,params_filter_2,params_filters,params_fnn_dropout_p,params_fnn_layers,params_fpSize,params_g_noise,params_gamma_one_class_svm,params_graph_conv_layers_conv_model,params_graph_conv_layers_gcn,params_graph_feat_size_attentive_fp,params_gru_dropout_0,params_gru_dropout_1,params_gru_dropout_2,params_gru_units_0,params_gru_units_1,params_gru_units_2,params_hidden_activation_0,params_hidden_activation_1,params_hidden_activation_2,params_hidden_activation_3,params_hidden_activation_4,params_hidden_dropout_0,params_hidden_dropout_1,params_hidden_dropout_2,params_hidden_dropout_3,params_hidden_dropout_4,params_hidden_layer_units_0,params_hidden_layer_units_1,params_hidden_layer_units_2,params_hidden_layer_units_3,params_hidden_layer_units_4,params_k,params_kernel_one_class_svm,params_kernel_size_0,params_kernel_size_1,params_kernel_size_2,params_kernel_size_smiles_to_vec,params_l1_0,params_l1_1,params_l1_2,params_l1_3,params_l1_4,params_l1_ratio_sgd_classifier,params_l2_0,params_l2_1,params_l2_2,params_l2_3,params_l2_4,params_layer_sizes_dag,params_layer_sizes_gather,params_leaf_size_radius_neighbors_classifier,params_learning_rate_gradient_boosting_classifier,params_loss_gradient_boosting_classifier,params_lstm_dropout_0,params_lstm_dropout_1,params_lstm_dropout_2,params_lstm_units_0,params_lstm_units_1,params_lstm_units_2,params_master_atom,params_maxLength,params_maxPath,params_max_features_extra_trees_classifier,params_max_features_gradient_boosting_classifier,params_max_length_pagtn,params_max_path,params_minLength,params_minPath,params_min_path,params_model_steps,params_model_type,params_nBits,params_n_attention_heads,params_n_attention_layers,params_n_bits,params_n_conv_layers,params_n_embedding_text_cnn,params_n_estimators,params_n_estimators_bagging_classifier,params_n_estimators_extra_trees_classifier,params_n_estimators_gradient_boosting_classifier,params_n_graph_feat_dag,params_n_graph_feat_weave,params_n_gru_layers,params_n_hidden_layers,params_n_hidden_weave,params_n_lstm_layers,params_n_rnn_layers,params_nu_one_class_svm,params_nu_sgd_one_class_svm,params_num_heads,params_num_layers_attentive_fp,params_num_layers_pagtn,params_p,params_penalty,params_percentile,params_predictor_dropout_gcn,params_radius,params_radius_n_radius_neighbors_classifier,params_reg_param,params_rnn_dropouts_0,params_rnn_dropouts_1,params_rnn_dropouts_2,params_rnn_units_0,params_rnn_units_1,params_rnn_units_2,params_scaler,params_standardization_type,params_standardizer,params_stride_0,params_stride_1,params_stride_2,params_strides,params_support_weak,params_threshold,params_tol,params_use_chirality_attentive_fp,params_use_chirality_gat,params_use_chirality_gcn,params_use_chirality_graph_conv,params_use_chirality_weave,params_use_edges_gat,params_use_edges_gcn,params_use_partial_charge_attentive_fp,params_use_partial_charge_gat,params_use_partial_charge_gcn,params_weights_radius_neighbors_classifier,state
80,80,-inf,2024-03-03 00:46:27.519666,2024-03-03 03:46:28.510162,0 days 03:00:00.990496,,,,,,,,,,,,,,,,,,,8.0,,,,,,,,,,,,,,,,,,,,,,,,,0.5,,,,,,,,968.0,,,,,,,,,,,,,,,,,,,,,,,,,,,,,,,,,,,,,,,,,,,,,,,,,,,,,,,,[50],[50],,,,,,,,,,,,,,,,,,,,dag_model,deepchem,,,,,,,,,,,128.0,,,,,,,,,,,,,,,,,,,,,,,,,,,chembl_standardizer,,,,,,,,,,,,,,,,,,,COMPLETE
81,81,0.6585404650007377,2024-03-03 03:46:28.607186,2024-03-03 05:55:10.777796,0 days 02:08:42.170610,,,,,,,,,,,,,,,,,,,256.0,,,,,,,,,,,,,,,,,,,,512.0,,,,,,,0.0,,,,,,932.0,,,,,,,,,,,,,,,"[256, 128]",,,,,,,,,,,,,,,,,,,,,,,,,,,,,,,,,,,,,,,,,,,,,,,,,,,,False,,,,,,,,,,graph_conv_model,deepchem,,,,,,,,,,,,,,,,,,,,,,,,,,,,,,,,,,,,,,basic_standardizer,,,,,,,,,,,True,,,,,,,,COMPLETE
82,82,0.6612077070011926,2024-03-03 05:55:10.830511,2024-03-03 08:05:01.947138,0 days 02:09:51.116627,,,,,,,,,,,,,,,,,,,256.0,,,,,,,,,,,,,,,,,,,,512.0,,,,,,,0.0,,,,,,931.0,,,,,,,,,,,,,,,"[256, 128]",,,,,,,,,,,,,,,,,,,,,,,,,,,,,,,,,,,,,,,,,,,,,,,,,,,,False,,,,,,,,,,graph_conv_model,deepchem,,,,,,,,,,,,,,,,,,,,,,,,,,,,,,,,,,,,,,basic_standardizer,,,,,,,,,,,True,,,,,,,,COMPLETE
83,83,0.6478109413582264,2024-03-03 08:05:02.005425,2024-03-03 10:16:19.429843,0 days 02:11:17.424418,,,,,,,,,,,,,,,,,,,256.0,,,,,,,,,,,,,,,,,,,,512.0,,,,,,,0.0,,,,,,929.0,,,,,,,,,,,,,,,"[256, 128]",,,,,,,,,,,,,,,,,,,,,,,,,,,,,,,,,,,,,,,,,,,,,,,,,,,,False,,,,,,,,,,graph_conv_model,deepchem,,,,,,,,,,,,,,,,,,,,,,,,,,,,,,,,,,,,,,basic_standardizer,,,,,,,,,,,True,,,,,,,,COMPLETE
84,84,0.6619477215972007,2024-03-03 10:16:19.488503,2024-03-03 12:24:01.693909,0 days 02:07:42.205406,,,,,,,,,,,,,,,,,,,256.0,,,,,,,,,,,,,,,,,,,,512.0,,,,,,,0.0,,,,,,869.0,,,,,,,,,,,,,,,"[256, 128]",,,,,,,,,,,,,,,,,,,,,,,,,,,,,,,,,,,,,,,,,,,,,,,,,,,,False,,,,,,,,,,graph_conv_model,deepchem,,,,,,,,,,,,,,,,,,,,,,,,,,,,,,,,,,,,,,basic_standardizer,,,,,,,,,,,True,,,,,,,,COMPLETE
85,85,0.657214473896546,2024-03-03 12:24:01.752378,2024-03-03 14:32:24.528974,0 days 02:08:22.776596,,,,,,,,,,,,,,,,,,,256.0,,,,,,,,,,,,,,,,,,,,512.0,,,,,,,0.0,,,,,,865.0,,,,,,,,,,,,,,,"[256, 128]",,,,,,,,,,,,,,,,,,,,,,,,,,,,,,,,,,,,,,,,,,,,,,,,,,,,False,,,,,,,,,,graph_conv_model,deepchem,,,,,,,,,,,,,,,,,,,,,,,,,,,,,,,,,,,,,,basic_standardizer,,,,,,,,,,,True,,,,,,,,COMPLETE
86,86,0.6571971060039891,2024-03-03 14:32:24.583845,2024-03-03 16:20:19.401264,0 days 01:47:54.817419,,,,,,,,,,,,,,,,,,,256.0,,,,,,,,,,,,,,,,,,,,512.0,,,,,,,0.0,,,,,,933.0,,,,,,,,,,,,,,,"[256, 128]",,,,,,,,,,,,,,,,,,,,,,,,,,,,,,,,,,,,,,,,,,,,,,,,,,,,False,,,,,,,,,,graph_conv_model,deepchem,,,,,,,,,,,,,,,,,,,,,,,,,,,,,,,,,,,,,,pass_through_standardizer,,,,,,,,,,,True,,,,,,,,COMPLETE
87,87,0.6576023406718432,2024-03-03 16:20:19.449860,2024-03-03 18:40:52.030208,0 days 02:20:32.580348,,,,,,,,,,,,,,,,,,,256.0,,,,,,,,,,,,,,,,,,,,512.0,,,,,,,0.0,,,,,,974.0,,,,,,,,,,,,,,,"[256, 128]",,,,,,,,,,,,,,,,,,,,,,,,,,,,,,,,,,,,,,,,,,,,,,,,,,,,False,,,,,,,,,,graph_conv_model,deepchem,,,,,,,,,,,,,,,,,,,,,,,,,,,,,,,,,,,,,,basic_standardizer,,,,,,,,,,,True,,,,,,,,COMPLETE
88,88,-inf,2024-03-03 18:40:52.088963,2024-03-03 21:40:52.693566,0 days 03:00:00.604603,,,,,,,,,,,,,,,,,,,256.0,,,,,,,,,,,,,,,,,,,,,,,,,,,,,,,32.0,,907.0,,,,,,,,,128.0,,,,,,,,,,,,,,,,,,,,,,,,,,,,,,,,,,,5.0,,,,,,,,,,,,,,,,,,,,,,,,,,,,,,,,,smiles_to_vec_model,deepchem,,,,,,,,,,,,,,,,,,,,,,,,,,,,,,,,,,,,,,basic_standardizer,,,,2.0,,,,,,,,,,,,,,,COMPLETE
89,89,0.6615025402409225,2024-03-03 21:40:52.763819,2024-03-03 23:50:23.457751,0 days 02:09:30.693932,,,,,,,,,,,,,,,,,,,256.0,,,,,,,,,,,,,,,,,,,,512.0,,,,,,,0.0,,,,,,829.0,,,,,,,,,,,,,,,"[256, 128]",,,,,,,,,,,,,,,,,,,,,,,,,,,,,,,,,,,,,,,,,,,,,,,,,,,,False,,,,,,,,,,graph_conv_model,deepchem,,,,,,,,,,,,,,,,,,,,,,,,,,,,,,,,,,,,,,basic_standardizer,,,,,,,,,,,True,,,,,,,,COMPLETE
90,90,-inf,2024-03-03 23:50:23.524377,2024-03-03 23:52:17.402785,0 days 00:01:53.878408,,,keras_simple_rnn,,,,,,,,,,,,,,,,,,,,,,,,,,,,,,,,,,relu,0.17111760350349423,,96.0,,,,,,,,,,,,,,,,,2D,,,,,,,,,,,,,,,,,,,,,,,,,,,,,,,,,,,,,,,,,,,,,,,,,,,,,,,,,,,,,,,,,,,,,,,,,keras,,,,,,,,,,,,,,,,,3.0,,,,,,,,,,,,,0.25384065519285404,0.3802184853190122,0.2526984694760281,203.0,191.0,102.0,,,,,,,,,,,,,,,,,,,,,,COMPLETE
91,91,0.663622518962381,2024-03-03 23:52:17.440507,2024-03-04 02:11:47.886827,0 days 02:19:30.446320,,,,,,,,,,,,,,,,,,,256.0,,,,,,,,,,,,,,,,,,,,512.0,,,,,,,0.0,,,,,,945.0,,,,,,,,,,,,,,,"[256, 128]",,,,,,,,,,,,,,,,,,,,,,,,,,,,,,,,,,,,,,,,,,,,,,,,,,,,False,,,,,,,,,,graph_conv_model,deepchem,,,,,,,,,,,,,,,,,,,,,,,,,,,,,,,,,,,,,,basic_standardizer,,,,,,,,,,,True,,,,,,,,COMPLETE
92,92,0.6566678286645686,2024-03-04 02:11:47.932905,2024-03-04 04:22:17.313642,0 days 02:10:29.380737,,,,,,,,,,,,,,,,,,,256.0,,,,,,,,,,,,,,,,,,,,512.0,,,,,,,0.0,,,,,,823.0,,,,,,,,,,,,,,,"[256, 128]",,,,,,,,,,,,,,,,,,,,,,,,,,,,,,,,,,,,,,,,,,,,,,,,,,,,False,,,,,,,,,,graph_conv_model,deepchem,,,,,,,,,,,,,,,,,,,,,,,,,,,,,,,,,,,,,,basic_standardizer,,,,,,,,,,,True,,,,,,,,COMPLETE
93,93,0.6652003010677415,2024-03-04 04:22:17.359763,2024-03-04 06:10:26.646223,0 days 01:48:09.286460,,,,,,,,,,,,,,,,,,,256.0,,,,,,,,,,,,,,,,,,,,512.0,,,,,,,0.0,,,,,,533.0,,,,,,,,,,,,,,,"[256, 128]",,,,,,,,,,,,,,,,,,,,,,,,,,,,,,,,,,,,,,,,,,,,,,,,,,,,False,,,,,,,,,,graph_conv_model,deepchem,,,,,,,,,,,,,,,,,,,,,,,,,,,,,,,,,,,,,,basic_standardizer,,,,,,,,,,,True,,,,,,,,COMPLETE
94,94,-inf,2024-03-04 06:10:26.693261,2024-03-04 09:10:27.367620,0 days 03:00:00.674359,,,,,,,,,,,,,,,,,,,256.0,True,,,,,,,,,,,,,,,,,,,,,,,,,0.5,,,,,,,516.0,,,,,,,,,,,,,,,,"[32, 64]",,,,,,,,,,,,,,,,,,,,,,,,,,,,,,,,,,,,,,,,,,,,,,,,,,,,,,,,,,,,,gcn_model,deepchem,,,,,,,,,,,,,,,,,,,,,,,,,,0.5,,,,,,,,,,,,basic_standardizer,,,,,,,,,,True,,,,False,,,False,,COMPLETE
95,95,0.6464047796973278,2024-03-04 09:10:27.448784,2024-03-04 16:32:39.160159,0 days 07:22:11.711375,,,,,,,,,,,,,,,,,,,16.0,,,,,,,,,,,,,,,,,,,,512.0,,,,,,,0.0,,,,,,490.0,,,,,,,,,,,,,,,"[256, 128]",,,,,,,,,,,,,,,,,,,,,,,,,,,,,,,,,,,,,,,,,,,,,,,,,,,,False,,,,,,,,,,graph_conv_model,deepchem,,,,,,,,,,,,,,,,,,,,,,,,,,,,,,,,,,,,,,basic_standardizer,,,,,,,,,,,True,,,,,,,,COMPLETE
96,96,0.6612222482659169,2024-03-04 16:32:39.209674,2024-03-04 18:36:13.858176,0 days 02:03:34.648502,,,,,,,,,,,,,,,,,,,256.0,,,,,,,,,,,,,,,,,,,,512.0,,,,,,,0.0,,,,,,527.0,,,,,,,,,,,,,,,"[256, 128, 64]",,,,,,,,,,,,,,,,,,,,,,,,,,,,,,,,,,,,,,,,,,,,,,,,,,,,False,,,,,,,,,,graph_conv_model,deepchem,,,,,,,,,,,,,,,,,,,,,,,,,,,,,,,,,,,,,,basic_standardizer,,,,,,,,,,,True,,,,,,,,COMPLETE
97,97,-inf,2024-03-04 18:36:13.906331,2024-03-04 19:58:20.962171,0 days 01:22:07.055840,,,,,,,,,,,,,,,,,,,256.0,,,,,,,,,,,,,,,,,,,,,,,,,,,,,0.0,,,,557.0,,,,,,,,,,,,,,,,,,,,,,,,,,,,,,,,,,,,,,,,,,,,,,,,,,,,,,,,,,,,,,,,,,,,,,,,,,,,,text_cnn_model,deepchem,,,,,,50.0,,,,,,,,,,,,,,,,,,,,,,,,,,,,,,,,basic_standardizer,,,,,,,,,,,,,,,,,,,COMPLETE
98,98,0.4435367559421258,2024-03-04 19:58:20.996647,2024-03-04 21:02:36.400890,0 days 01:04:15.404243,morgan,,,auto,,,,,,,,,,,,,,,,,,,,radius_neighbors_classifier_model,,,,,,,,,,,,,,,,,,,,,,,,,,,,,,,,k_best,,,,,,,,,,,,,,,,,,,,,,,,,,,,,,,,,,,2.0,,,,,,,,,,,,,,,,,,,5.0,,,,,,,,,,,,,,,,,,,,sklearn,,,,1024.0,,,,,,,,,,,,,,,,,,,7.0,,,,6.0,10.0,,,,,,,,,,basic_standardizer,,,,,,,,,,,,,,,,,,distance,COMPLETE
99,99,0.6656412900802262,2024-03-04 21:02:36.440493,2024-03-04 23:11:24.646687,0 days 02:08:48.206194,,,,,,,,,,,,,,,,,,,256.0,,,,,,,,,,,,,,,,,,,,512.0,,,,,,,0.0,,,,,,592.0,,,,,,,,,,,,,,,"[256, 128, 64]",,,,,,,,,,,,,,,,,,,,,,,,,,,,,,,,,,,,,,,,,,,,,,,,,,,,False,,,,,,,,,,graph_conv_model,deepchem,,,,,,,,,,,,,,,,,,,,,,,,,,,,,,,,,,,,,,chembl_standardizer,,,,,,,,,,,True,,,,,,,,COMPLETE
