,number,value,datetime_start,datetime_complete,duration,params_1D_featurizer,params_1d_model,params_2d_model,params_C_linear_svc,params_C_logistic_regression,params_C_passive_aggressive_classifier,params_C_svc,params_Cs_logistic_regression_cv,params_activation_mlp_classifier,params_agg_modes,params_algorithm_ada_boost_classifier,params_algorithm_kneighbors_classifier,params_algorithm_radius_neighbors_classifier,params_alpha_bernoulli_nb,params_alpha_complement_nb,params_alpha_mlp_classifier,params_alpha_multinomial_nb,params_alpha_perceptron,params_alpha_ridge_classifier,params_alpha_ridge_classifier_cv,params_alpha_sgd_classifier,params_base_estimator_bagging_classifier,params_base_filters,params_batch_normalization_0,params_batch_normalization_1,params_batch_normalization_2,params_batch_normalization_3,params_batch_size_1d_conv,params_batch_size_bi_rnn,params_batch_size_deepchem,params_batch_size_fcnn,params_batch_size_rnn,params_batch_size_simple_rnn,params_batchnorm,params_bootstrap_bagging_classifier,params_bootstrap_extra_trees_classifier,params_bootstrap_features,params_bootstrap_random_forest_classifier,params_classification_model,params_conv_activation_0,params_conv_activation_1,params_conv_activation_2,params_conv_batch_norm_0,params_conv_batch_norm_1,params_conv_batch_norm_2,params_conv_dropout_0,params_conv_dropout_1,params_conv_dropout_2,params_criterion_decision_tree,params_criterion_extra_trees_classifier,params_criterion_gradient_boosting_classifier,params_criterion_random_forest_classifier,params_degree_nu_svc,params_degree_one_class_svm,params_degree_svc,params_dense_activation,params_dense_dropout,params_dense_layer_size,params_dense_units,params_depth_dmpnn,params_dropout,params_dropout_attentive_fp,params_dropout_dag,params_dropout_gat,params_dropout_gcn,params_dropout_graph_conv,params_dropout_pagtn,params_dropout_text_cnn,params_dropouts_weave,params_embedding_dim,params_embedding_output_dim,params_epochs_1d_conv,params_epochs_bi_rnn,params_epochs_deepchem,params_epochs_fcnn,params_epochs_rnn,params_epochs_simple_rnn,params_epsilon_sgd_classifier,params_f1,params_f2,params_feature_selector,params_featurizer_type,params_filter_0,params_filter_1,params_filter_2,params_filters,params_fnn_dropout_p,params_fnn_layers,params_fpSize,params_g_noise,params_gamma_nu_svc,params_gamma_one_class_svm,params_gamma_svc,params_graph_conv_layers_conv_model,params_graph_conv_layers_gcn,params_graph_feat_size_attentive_fp,params_gru_dropout_0,params_gru_dropout_1,params_gru_dropout_2,params_gru_units_0,params_gru_units_1,params_gru_units_2,params_hidden_activation_0,params_hidden_activation_1,params_hidden_activation_2,params_hidden_activation_3,params_hidden_dropout_0,params_hidden_dropout_1,params_hidden_dropout_2,params_hidden_dropout_3,params_hidden_layer_sizes_mlp_classifier,params_hidden_layer_units_0,params_hidden_layer_units_1,params_hidden_layer_units_2,params_hidden_layer_units_3,params_k,params_kernel_nu_svc,params_kernel_one_class_svm,params_kernel_size_0,params_kernel_size_1,params_kernel_size_2,params_kernel_size_smiles_to_vec,params_kernel_svc,params_l1_0,params_l1_1,params_l1_2,params_l1_3,params_l1_ratio_sgd_classifier,params_l2_0,params_l2_1,params_l2_2,params_l2_3,params_layer_sizes_dag,params_layer_sizes_gather,params_leaf_size_kneighbors_classifier,params_leaf_size_radius_neighbors_classifier,params_learning_rate_ada_boost_classifier,params_learning_rate_gradient_boosting_classifier,params_learning_rate_hist_gradient_boosting_classifier,params_loss_gradient_boosting_classifier,params_lstm_dropout_0,params_lstm_dropout_1,params_lstm_dropout_2,params_lstm_units_0,params_lstm_units_1,params_lstm_units_2,params_master_atom,params_maxLength,params_maxPath,params_max_features_extra_trees_classifier,params_max_features_gradient_boosting_classifier,params_max_features_random_forest_classifier,params_max_length_pagtn,params_max_path,params_method,params_metric,params_minLength,params_minPath,params_min_path,params_model,params_model_steps,params_model_type,params_nBits,params_n_attention_heads,params_n_attention_layers,params_n_bits,params_n_conv_layers,params_n_embedding_text_cnn,params_n_estimators,params_n_estimators_ada_boost_classifier,params_n_estimators_bagging_classifier,params_n_estimators_extra_trees_classifier,params_n_estimators_gradient_boosting_classifier,params_n_estimators_random_forest_classifier,params_n_graph_feat_dag,params_n_graph_feat_weave,params_n_gru_layers,params_n_hidden_layers,params_n_hidden_weave,params_n_lstm_layers,params_n_neighbors_kneighbors_classifier,params_n_rnn_layers,params_norm,params_nu_nu_svc,params_nu_one_class_svm,params_nu_sgd_one_class_svm,params_num_heads,params_num_layers_attentive_fp,params_num_layers_pagtn,params_p,params_penalty,params_percentile,params_predictor_dropout_gat,params_predictor_dropout_gcn,params_radius,params_radius_n_radius_neighbors_classifier,params_reg_param,params_rnn_dropouts_0,params_rnn_dropouts_1,params_rnn_units_0,params_rnn_units_1,params_scaler,params_solver,params_standardization_type,params_standardize,params_standardizer,params_stride_0,params_stride_1,params_stride_2,params_strides,params_support_weak,params_threshold,params_tol,params_use_chirality_attentive_fp,params_use_chirality_gat,params_use_chirality_gcn,params_use_chirality_graph_conv,params_use_chirality_weave,params_use_edges_gat,params_use_edges_gcn,params_use_partial_charge_attentive_fp,params_use_partial_charge_gat,params_use_partial_charge_gcn,params_weight_gbr,params_weight_lr,params_weight_mlp,params_weight_rfr,params_weight_svc,params_weights_kneighbors_classifier,params_weights_radius_neighbors_classifier,state
0,0,0.5749489448604493,2024-11-12 17:45:35.725982,2024-11-12 17:46:50.964714,0 days 00:01:15.238732,,,,,,,,,,,,,,,,,,,,,,,,,,,,,,8.0,,,,,,,,,,,,,,,,,,,,,,,,,,,,,,,,,,,,,,,,128.0,,,,27.0,,,,,,,,,,,,128.0,,,,,,,,,,,,,,,,,,,,,,,,,,,,,,,,,,,,7.0,,,,,,,,,,,,,,,,,,,,,,,,,,,,,,,,,,,,,,,smiles_to_vec_model,deepchem,,,,,,,,,,,,,,,,,,,,,,,,,,,,,,,,,,,,,,,,,,,,basic_standardizer,,,,2.0,,,,,,,,,,,,,,,,,,,,,COMPLETE
1,1,0.5149761742682096,2024-11-12 17:46:51.013524,2024-11-12 17:47:12.039733,0 days 00:00:21.026209,layered,,,,,,,,,,,,,,,,0.10083032961214822,,,,,,,,,,,,,,,,,,,,,,multinomial_nb_model,,,,,,,,,,,,,,,,,,,,,,,,,,,,,,,,,,,,,,,,,,pass_through_transformer,,,,,,,,1024.0,,,,,,,,,,,,,,,,,,,,,,,,,,,,,,,,,,,,,,,,,,,,,,,,,,,,,,,,,,,,9.0,,,,,,,,,1.0,,,,sklearn,,,,,,,,,,,,,,,,,,,,,,,,,,,,,,,,,,,,,,,,,,,,chembl_standardizer,,,,,,,,,,,,,,,,,,,,,,,,,COMPLETE
2,2,0.6211027910142954,2024-11-12 17:47:12.134508,2024-11-12 17:50:40.302462,0 days 00:03:28.167954,2d_descriptors,,,,1.684161592349663,,,,,,,,,,,,,,,,,,,,,,,,,,,,,,,,,,logistic_regression_model,,,,,,,,,,,,,,,,,,,,,,,,,,,,,,,,,,,,,,,,,,boruta_algorithm,,,,,,,,,,,,,,,,,,,,,,,,,,,,,,,,,,,,,,,,,,,,,,,,,,,,,,,,,,,,,,,,,,,,,,,,,,box-cox,,,,,,,sklearn,,,,,,,,,,,,,,,,,,,,,,,,,,,,,,,,,,,,,,,,power_transformer,,simple_standardisation,False,custom_standardizer,,,,,False,,,,,,,,,,,,,,,,,,,,COMPLETE
3,3,0.7119128658951668,2024-11-12 17:50:40.335436,2024-11-12 17:55:55.398901,0 days 00:05:15.063465,morgan,,,,,,,,,,,,,0.308150346832885,,,,,,,,,,,,,,,,,,,,,,,,,bernoulli_nb_model,,,,,,,,,,,,,,,,,,,,,,,,,,,,,,,,,,,,,,,,,,boruta_algorithm,,,,,,,,,,,,,,,,,,,,,,,,,,,,,,,,,,,,,,,,,,,,,,,,,,,,,,,,,,,,,,,,,,,,,,,,,,,,,,,,,sklearn,,,,2048.0,,,,,,,,,,,,,,,,,,,,,,,,,,,,,6.0,,,,,,,,,simple_standardisation,,custom_standardizer,,,,,False,,,,,,,,,,,,,,,,,,,,COMPLETE
4,4,0.7156909462219196,2024-11-12 17:55:55.427127,2024-11-12 17:56:26.243951,0 days 00:00:30.816824,2d_descriptors,,,,,,,,,,,kd_tree,,,,,,,,,,,,,,,,,,,,,,,,,,,kneighbors_classifier_model,,,,,,,,,,,,,,,,,,,,,,,,,,,,,,,,,,,,,,,,,,k_best,,,,,,,,,,,,,,,,,,,,,,,,,,,,,,,,,,,6.0,,,,,,,,,,,,,,,,,,,7.0,,,,,,,,,,,,,,,,,,,,,,,,,,,sklearn,,,,,,,,,,,,,,,,,,,3.0,,,,,,,,,5.0,,,,,,,,,,,,pass_through_transformer,,,,pass_through_standardizer,,,,,,,,,,,,,,,,,,,,,,,distance,,COMPLETE
5,5,0.5084411164057182,2024-11-12 17:56:26.273281,2024-11-12 17:56:58.067137,0 days 00:00:31.793856,2d_descriptors,,,,,,,,,,,,,,,,,,,,,,,,,,,,,,,,,,,,,,quadradic_discriminant_analysis_model,,,,,,,,,,,,,,,,,,,,,,,,,,,,,,,,,,,,,,,,,,low_variance_fs,,,,,,,,,,,,,,,,,,,,,,,,,,,,,,,,,,,,,,,,,,,,,,,,,,,,,,,,,,,,,,,,,,,,,,,,,,,,,,,,,sklearn,,,,,,,,,,,,,,,,,,,,,,,,,,,,,,,,,,,0.7451320497112733,,,,,pass_through_transformer,,,,basic_standardizer,,,,,,0.06687802730949725,,,,,,,,,,,,,,,,,,,COMPLETE
6,6,0.5878488767869299,2024-11-12 17:56:58.149099,2024-11-12 17:59:51.755956,0 days 00:02:53.606857,,,,,,,,,,,,,,,,,,,,,,,,,,,,,,64.0,,,,,,,,,,,,,,,,,,,,,,,,,,,,,,,,0.25,,,,,,,,,,,,38.0,,,,,,,,,,,,,,,,,,,,,,500.0,,,,,,,,,,,,,,,,,,,,,,,,,,,,,,,,,,,,,,,,,,,,,,,,,,,,,,,,,,,,,,,,,attentive_fp_model,deepchem,,,,,,,,,,,,,,,,,,,,,,,,,,5.0,,,,,,,,,,,,,,,,,,chembl_standardizer,,,,,,,,False,,,,,,,False,,,,,,,,,,COMPLETE
7,7,0.6509189925119129,2024-11-12 17:59:51.810365,2024-11-12 18:00:53.275173,0 days 00:01:01.464808,,,,,,,,,,['flatten'],,,,,,,,,,,,,,,,,,,,128.0,,,,,,,,,,,,,,,,,,,,,,,,,,,,,,,,,,0.0,,,,,,,,,,44.0,,,,,,,,,,,,,,,,,,,,,,,,,,,,,,,,,,,,,,,,,,,,,,,,,,,,,,,,,,,,,,,,,,,,,,,,,,,,,,,,,,,,,,,gat_model,deepchem,,6.0,,,,,,,,,,,,,,,,,,,,,,,,,,,,,0.0,,,,,,,,,,,,,pass_through_standardizer,,,,,,,,,False,,,,False,,,False,,,,,,,,,COMPLETE
8,8,0.5809053778080326,2024-11-12 18:00:53.307294,2024-11-12 18:01:41.542781,0 days 00:00:48.235487,,,,,,,,,,,,,,,,,,,,,,,,,,,,,,512.0,,,,,,,,,,,,,,,,,,,,,,,,,,,,,,,,,,,,,,0.5,,,,,,124.0,,,,,,,,,,,,,,,,,,,,,,,,,,,,,,,,,,,,,,,,,,,,,,,,,,,,,,,,,,,,,,,,,,,,,,,,,,,,,,,,,,,,,,,text_cnn_model,deepchem,,,,,,100.0,,,,,,,,,,,,,,,,,,,,,,,,,,,,,,,,,,,,,,chembl_standardizer,,,,,,,,,,,,,,,,,,,,,,,,,COMPLETE
9,9,0.5,2024-11-12 18:01:41.572896,2024-11-12 18:02:59.606303,0 days 00:01:18.033407,mhfp,keras_dense,,,,,,,,,,,,,,,,,,,,,,False,False,True,True,,,,256.0,,,,,,,,,,,,,,,,,,,,,,,,,,,,,,,,,,,,,,,,,,,,500.0,,,,,,,1D,,,,,,,,,,,,,,,,,,,,,relu,tanh,tanh,relu,0.07728201579851524,0.13970586070875754,0.46875038442850275,0.41892118633613595,,40.0,55.0,44.0,62.0,,,,,,,,,3.8777567037063745e-05,0.002641938756270017,0.000373939829971098,0.002170917952991389,,2.745680683243469e-06,1.198546808392764e-05,0.003150258576884671,2.4746940083208415e-05,,,,,,,,,,,,,,,,,,,,,,,,,,,,,,keras,,,,,,,,,,,,,,,,4.0,,,,,,,,,,,,,,,,,,,,,,,,,,,,chembl_standardizer,,,,,,,,,,,,,,,,,,,,,,,,,COMPLETE
10,10,0.6718515997277059,2024-11-12 18:02:59.637096,2024-11-12 18:04:02.451816,0 days 00:01:02.814720,,,keras_rnn,,,,,,,,,,,,,,,,,,,,,,,,,,,,,64.0,,,,,,,,,,,,,,,,,,,,,,,,tanh,0.06362296821957081,,256.0,,,,,,,,,,,,,,,,,50.0,,,,,,2D,,,,,,,,,,,,,,,0.45849067517147046,0.0441701102332101,0.2825260456506081,26.0,152.0,192.0,,,,,,,,,,,,,,,,,,,,,,,,,,,,,,,,,,,,,,,0.06406507780998916,0.3681891828910153,,219.0,210.0,,,,,,,,,,,,,,,,,keras,,,,,,,,,,,,,,,3.0,,,2.0,,,,,,,,,,,,,,,,,,,,,,,,,,pass_through_standardizer,,,,,,,,,,,,,,,,,,,,,,,,,COMPLETE
11,11,0.6438393464942137,2024-11-12 18:04:02.480587,2024-11-12 18:04:06.558727,0 days 00:00:04.078140,morgan,,,,,,,,,,,kd_tree,,,,,,,,,,,,,,,,,,,,,,,,,,,kneighbors_classifier_model,,,,,,,,,,,,,,,,,,,,,,,,,,,,,,,,,,,,,,,,,,k_best,,,,,,,,,,,,,,,,,,,,,,,,,,,,,,,,,,,5.0,,,,,,,,,,,,,,,,,,,7.0,,,,,,,,,,,,,,,,,,,,,,,,,,,sklearn,,,,2048.0,,,,,,,,,,,,,,,3.0,,,,,,,,,5.0,,,,,6.0,,,,,,,,,simple_standardisation,,custom_standardizer,,,,,,,,,,,,,,,,,,,,,,,distance,,COMPLETE
12,12,0.6611300204220558,2024-11-12 18:04:06.587576,2024-11-12 18:06:26.175321,0 days 00:02:19.587745,neural_npfp,,,,,,,,,,,,,0.3052164383096316,,,,,,,,,,,,,,,,,,,,,,,,,bernoulli_nb_model,,,,,,,,,,,,,,,,,,,,,,,,,,,,,,,,,,,,,,,,,,boruta_algorithm,,,,,,,,,,,,,,,,,,,,,,,,,,,,,,,,,,,,,,,,,,,,,,,,,,,,,,,,,,,,,,,,,,,,,,,,,,,,,,,aux,,sklearn,,,,,,,,,,,,,,,,,,,,,,,,,,,,,,,,,,,,,,,,,,,,pass_through_standardizer,,,,,True,,,,,,,,,,,,,,,,,,,,COMPLETE
13,13,0.5699115044247788,2024-11-12 18:06:26.202194,2024-11-12 18:06:38.569668,0 days 00:00:12.367474,mol2vec,,,,,,,,,,,brute,,,,,,,,,,,,,,,,,,,,,,,,,,,kneighbors_classifier_model,,,,,,,,,,,,,,,,,,,,,,,,,,,,,,,,,,,,,,,,,,k_best,,,,,,,,,,,,,,,,,,,,,,,,,,,,,,,,,,,19.0,,,,,,,,,,,,,,,,,,,3.0,,,,,,,,,,,,,,,,,,,,,,,,,,,sklearn,,,,,,,,,,,,,,,,,,,2.0,,,,,,,,,7.0,,,,,,,,,,,,,,heavy_standardisation,,custom_standardizer,,,,,,,,,,,,,,,,,,,,,,,uniform,,COMPLETE
14,14,0.6309394145677332,2024-11-12 18:06:38.599465,2024-11-12 18:06:40.079069,0 days 00:00:01.479604,np_classifier_fp,,,,,,,,,,,,,,,,,,,,,,,,,,,,,,,,,,,,,,decision_tree_classifier_model,,,,,,,,,,gini,,,,,,,,,,,,,,,,,,,,,,,,,,,,,,,,percentil_fs,,,,,,,,,,,,,,,,,,,,,,,,,,,,,,,,,,,,,,,,,,,,,,,,,,,,,,,,,,,,,,,,,,,,,,,,,,,,,,,,,sklearn,,,,,,,,,,,,,,,,,,,,,,,,,,,,,,0.0,,,,,,,,,,,,,,pass_through_standardizer,,,,,,,,,,,,,,,,,,,,,,,,,COMPLETE
15,15,0.5,2024-11-12 18:06:40.107072,2024-11-12 18:06:45.879817,0 days 00:00:05.772745,maccs,,,,,,,,,,,,auto,,,,,,,,,,,,,,,,,,,,,,,,,,radius_neighbors_classifier_model,,,,,,,,,,,,,,,,,,,,,,,,,,,,,,,,,,,,,,,,,,select_from_model_fs,,,,,,,,,,,,,,,,,,,,,,,,,,,,,,,,,,,,,,,,,,,,,,,,,,,,,,,7.0,,,,,,,,,,,,,,,,,,,,,,,,,,sklearn,,,,,,,443.0,,,,,,,,,,,,,,,,,,,,,2.0,,,,,,8.0,,,,,,,,simple_standardisation,,custom_standardizer,,,,,,,,,,,,,,,,,,,,,,,,uniform,COMPLETE
16,16,0.6995915588835943,2024-11-12 18:06:45.906714,2024-11-12 18:11:02.046179,0 days 00:04:16.139465,,,keras_bidirectional_rnn,,,,,,,,,,,,,,,,,,,,,,,,,,64.0,,,,,,,,,,,,,,,,,,,,,,,,,,,relu,0.48490752341078885,,16.0,,,,,,,,,,,,,,1000.0,,,,,,,,,2D,,,,,,,,,,,,,,,0.00871208591912892,,,253.0,,,,,,,,,,,,,,,,,,,,,,,,,,,,,,,,,,,,,,,,,0.4943888051604718,,,31.0,,,,,,,,,,,,,,,,,,keras,,,,,,,,,,,,,,,1.0,,,1.0,,,,,,,,,,,,,,,,,,,,,,,,heavy_standardisation,,custom_standardizer,,,,,,,,,,,,,,,,,,,,,,,,,COMPLETE
17,17,0.7292035398230089,2024-11-12 18:11:02.074547,2024-11-12 18:11:05.447815,0 days 00:00:03.373268,atom_pair,,,,,,,,,,,,,,,,,,,,,,,,,,,,,,,,,,,,,,gradient_boosting_classifier_model,,,,,,,,,,,,squared_error,,,,,,,,,,,,,,,,,,,,,,,,,,,,,,k_best,,,,,,,,,,,,,,,,,,,,,,,,,,,,,,,,,,,1.0,,,,,,,,,,,,,,,,,,,,,,0.30956418974219374,,exponential,,,,,,,,40.0,,,log2,,,,,,2.0,,,,,sklearn,2048.0,,,,,,,,,,400.0,,,,,,,,,,,,,,,,,,,,,,,,,,,,,,,,,pass_through_standardizer,,,,,,,,,,,,,,,,,,,,,,,,,COMPLETE
18,18,0.7292035398230089,2024-11-12 18:11:05.474710,2024-11-12 18:11:08.813695,0 days 00:00:03.338985,atom_pair,,,,,,,,,,,,,,,,,,,,,,,,,,,,,,,,,,,,,,gradient_boosting_classifier_model,,,,,,,,,,,,squared_error,,,,,,,,,,,,,,,,,,,,,,,,,,,,,,k_best,,,,,,,,,,,,,,,,,,,,,,,,,,,,,,,,,,,1.0,,,,,,,,,,,,,,,,,,,,,,0.26411903145924853,,exponential,,,,,,,,40.0,,,log2,,,,,,2.0,,,,,sklearn,2048.0,,,,,,,,,,400.0,,,,,,,,,,,,,,,,,,,,,,,,,,,,,,,,,pass_through_standardizer,,,,,,,,,,,,,,,,,,,,,,,,,COMPLETE
19,19,0.6491831177671885,2024-11-12 18:11:08.842375,2024-11-12 18:11:21.855787,0 days 00:00:13.013412,atom_pair,keras_1d_cnn,,,,,,,,,,,,,,,,,,,,,,,,,,256.0,,,,,,,,,,,,tanh,tanh,tanh,False,True,False,0.3791214083133944,0.15353476481447892,0.4764223506330657,,,,,,,,relu,,,96.0,,0.5055729125263957,,,,,,,,,,,50.0,,,,,,,,,,1D,6.0,7.0,11.0,,,,,0.026244356608363318,,,,,,,,,,,,,,,,,,,,,,,,,,,,,45.0,34.0,42.0,,,,,,,,,,,,,,,,,,,,,,,,,,,40.0,,,,,,,,,2.0,,,,,keras,2048.0,,,,3.0,,,,,,,,,,,,,,,,,,,,,,,,,,,,,,,,,,,,,,,pass_through_standardizer,2.0,2.0,1.0,,,,,,,,,,,,,,,,,,,,,,COMPLETE
20,20,0.7292035398230089,2024-11-12 18:11:21.950311,2024-11-12 18:11:25.363757,0 days 00:00:03.413446,atom_pair,,,,,,,,,,,,,,,,,,,,,,,,,,,,,,,,,,,,,,gradient_boosting_classifier_model,,,,,,,,,,,,squared_error,,,,,,,,,,,,,,,,,,,,,,,,,,,,,,k_best,,,,,,,,,,,,,,,,,,,,,,,,,,,,,,,,,,,1.0,,,,,,,,,,,,,,,,,,,,,,0.2569162369003015,,exponential,,,,,,,,40.0,,,log2,,,,,,2.0,,,,,sklearn,2048.0,,,,,,,,,,400.0,,,,,,,,,,,,,,,,,,,,,,,,,,,,,,,,,pass_through_standardizer,,,,,,,,,,,,,,,,,,,,,,,,,COMPLETE
21,21,0.7292035398230089,2024-11-12 18:11:25.392171,2024-11-12 18:11:28.858701,0 days 00:00:03.466530,atom_pair,,,,,,,,,,,,,,,,,,,,,,,,,,,,,,,,,,,,,,gradient_boosting_classifier_model,,,,,,,,,,,,squared_error,,,,,,,,,,,,,,,,,,,,,,,,,,,,,,k_best,,,,,,,,,,,,,,,,,,,,,,,,,,,,,,,,,,,1.0,,,,,,,,,,,,,,,,,,,,,,0.301658801885725,,exponential,,,,,,,,40.0,,,log2,,,,,,2.0,,,,,sklearn,2048.0,,,,,,,,,,400.0,,,,,,,,,,,,,,,,,,,,,,,,,,,,,,,,,pass_through_standardizer,,,,,,,,,,,,,,,,,,,,,,,,,COMPLETE
