,number,value,datetime_start,datetime_complete,duration,params_1D_featurizer,params_1d_model,params_2d_model,params_C_linear_svc,params_C_logistic_regression,params_C_passive_aggressive_classifier,params_C_svc,params_Cs_logistic_regression_cv,params_activation_mlp_classifier,params_agg_modes,params_algorithm_ada_boost_classifier,params_algorithm_kneighbors_classifier,params_algorithm_radius_neighbors_classifier,params_alpha_bernoulli_nb,params_alpha_complement_nb,params_alpha_mlp_classifier,params_alpha_multinomial_nb,params_alpha_perceptron,params_alpha_ridge_classifier,params_alpha_ridge_classifier_cv,params_alpha_sgd_classifier,params_base_estimator_bagging_classifier,params_base_filters,params_batch_normalization_0,params_batch_normalization_1,params_batch_normalization_2,params_batch_normalization_3,params_batch_size_1d_conv,params_batch_size_bi_rnn,params_batch_size_deepchem,params_batch_size_fcnn,params_batch_size_rnn,params_batch_size_simple_rnn,params_batchnorm,params_bootstrap_bagging_classifier,params_bootstrap_extra_trees_classifier,params_bootstrap_features,params_bootstrap_random_forest_classifier,params_classification_model,params_conv_activation_0,params_conv_activation_1,params_conv_activation_2,params_conv_batch_norm_0,params_conv_batch_norm_1,params_conv_batch_norm_2,params_conv_dropout_0,params_conv_dropout_1,params_conv_dropout_2,params_criterion_decision_tree,params_criterion_extra_trees_classifier,params_criterion_gradient_boosting_classifier,params_criterion_random_forest_classifier,params_degree_nu_svc,params_degree_one_class_svm,params_degree_svc,params_dense_activation,params_dense_dropout,params_dense_layer_size,params_dense_units,params_depth_dmpnn,params_dropout,params_dropout_attentive_fp,params_dropout_dag,params_dropout_gat,params_dropout_gcn,params_dropout_graph_conv,params_dropout_pagtn,params_dropout_text_cnn,params_dropouts_weave,params_embedding_dim,params_embedding_output_dim,params_epochs_1d_conv,params_epochs_bi_rnn,params_epochs_deepchem,params_epochs_fcnn,params_epochs_rnn,params_epochs_simple_rnn,params_epsilon_sgd_classifier,params_f1,params_f2,params_feature_selector,params_featurizer_type,params_filter_0,params_filter_1,params_filter_2,params_filters,params_fnn_dropout_p,params_fnn_layers,params_fpSize,params_g_noise,params_gamma_nu_svc,params_gamma_one_class_svm,params_gamma_svc,params_graph_conv_layers_conv_model,params_graph_conv_layers_gcn,params_graph_feat_size_attentive_fp,params_gru_dropout_0,params_gru_dropout_1,params_gru_dropout_2,params_gru_units_0,params_gru_units_1,params_gru_units_2,params_hidden_activation_0,params_hidden_activation_1,params_hidden_activation_2,params_hidden_activation_3,params_hidden_dropout_0,params_hidden_dropout_1,params_hidden_dropout_2,params_hidden_dropout_3,params_hidden_layer_sizes_mlp_classifier,params_hidden_layer_units_0,params_hidden_layer_units_1,params_hidden_layer_units_2,params_hidden_layer_units_3,params_k,params_kernel_nu_svc,params_kernel_one_class_svm,params_kernel_size_0,params_kernel_size_1,params_kernel_size_2,params_kernel_size_smiles_to_vec,params_kernel_svc,params_l1_0,params_l1_1,params_l1_2,params_l1_3,params_l1_ratio_sgd_classifier,params_l2_0,params_l2_1,params_l2_2,params_l2_3,params_layer_sizes_dag,params_layer_sizes_gather,params_leaf_size_kneighbors_classifier,params_leaf_size_radius_neighbors_classifier,params_learning_rate_ada_boost_classifier,params_learning_rate_gradient_boosting_classifier,params_learning_rate_hist_gradient_boosting_classifier,params_loss_gradient_boosting_classifier,params_lstm_dropout_0,params_lstm_dropout_1,params_lstm_dropout_2,params_lstm_units_0,params_lstm_units_1,params_lstm_units_2,params_master_atom,params_maxLength,params_maxPath,params_max_features_extra_trees_classifier,params_max_features_gradient_boosting_classifier,params_max_features_random_forest_classifier,params_max_length_pagtn,params_max_path,params_method,params_metric,params_minLength,params_minPath,params_min_path,params_model,params_model_steps,params_model_type,params_nBits,params_n_attention_heads,params_n_attention_layers,params_n_bits,params_n_conv_layers,params_n_embedding_text_cnn,params_n_estimators,params_n_estimators_ada_boost_classifier,params_n_estimators_bagging_classifier,params_n_estimators_extra_trees_classifier,params_n_estimators_gradient_boosting_classifier,params_n_estimators_random_forest_classifier,params_n_graph_feat_dag,params_n_graph_feat_weave,params_n_gru_layers,params_n_hidden_layers,params_n_hidden_weave,params_n_lstm_layers,params_n_neighbors_kneighbors_classifier,params_n_rnn_layers,params_norm,params_nu_nu_svc,params_nu_one_class_svm,params_nu_sgd_one_class_svm,params_num_heads,params_num_layers_attentive_fp,params_num_layers_pagtn,params_p,params_penalty,params_percentile,params_predictor_dropout_gat,params_predictor_dropout_gcn,params_radius,params_radius_n_radius_neighbors_classifier,params_reg_param,params_rnn_dropouts_0,params_rnn_dropouts_1,params_rnn_units_0,params_rnn_units_1,params_scaler,params_solver,params_standardization_type,params_standardize,params_standardizer,params_stride_0,params_stride_1,params_stride_2,params_strides,params_support_weak,params_threshold,params_tol,params_use_chirality_attentive_fp,params_use_chirality_gat,params_use_chirality_gcn,params_use_chirality_graph_conv,params_use_chirality_weave,params_use_edges_gat,params_use_edges_gcn,params_use_partial_charge_attentive_fp,params_use_partial_charge_gat,params_use_partial_charge_gcn,params_weight_gbr,params_weight_lr,params_weight_mlp,params_weight_rfr,params_weight_svc,params_weights_kneighbors_classifier,params_weights_radius_neighbors_classifier,state
22,22,0.5,2024-11-12 18:11:28.886337,2024-11-12 18:11:36.301476,0 days 00:00:07.415139,atom_pair,,,,,,,1.0,,,,,,,,,,,,,,,,,,,,,,,,,,,,,,,logistic_regression_cv_model,,,,,,,,,,,,,,,,,,,,,,,,,,,,,,,,,,,,,,,,,,k_best,,,,,,,,,,,,,,,,,,,,,,,,,,,,,,,,,,,1.0,,,,,,,,,,,,,,,,,,,,,,,,,,,,,,,,40.0,,,,,,,,,2.0,,,,,sklearn,2048.0,,,,,,,,,,,,,,,,,,,,,,,,,,,,,,,,,,,,,,,,,,,pass_through_standardizer,,,,,,,,,,,,,,,,,,,,,,,,,COMPLETE
23,23,0.6997617426820967,2024-11-12 18:11:36.335842,2024-11-12 18:11:40.578318,0 days 00:00:04.242476,atom_pair,,,,,,,,,,,,,,,,,,,,,,,,,,,,,,,,,,,,,,gradient_boosting_classifier_model,,,,,,,,,,,,squared_error,,,,,,,,,,,,,,,,,,,,,,,,,,,,,,k_best,,,,,,,,,,,,,,,,,,,,,,,,,,,,,,,,,,,9.0,,,,,,,,,,,,,,,,,,,,,,0.26726231931725475,,exponential,,,,,,,,40.0,,,log2,,,,,,1.0,,,,,sklearn,2048.0,,,,,,,,,,400.0,,,,,,,,,,,,,,,,,,,,,,,,,,,,,,,,,pass_through_standardizer,,,,,,,,,,,,,,,,,,,,,,,,,COMPLETE
24,24,0.6175970047651463,2024-11-12 18:11:40.617220,2024-11-12 18:11:51.019767,0 days 00:00:10.402547,mixed,,,,,,,,,,,,,,,,,,,,,,,,,,,,,,,,,,,,,,gradient_boosting_classifier_model,,,,,,,,,,,,squared_error,,,,,,,,,,,,,,,,,,,,,,,,,,,,atom_pair,neural_npfp,k_best,,,,,,,,,,,,,,,,,,,,,,,,,,,,,,,,,,,1.0,,,,,,,,,,,,,,,,,,,,,,0.2725755907584836,,exponential,,,,,,,,,,,log2,,,,,,,,,,,sklearn,,,,,,,,,,,400.0,,,,,,,,,,,,,,,,,,,,,,,,,,,,,,,,,pass_through_standardizer,,,,,,,,,,,,,,,,,,,,,,,,,COMPLETE
25,25,0.5860789652825051,2024-11-12 18:11:51.049861,2024-11-12 18:12:15.656870,0 days 00:00:24.607009,rdk,,,,,,,,,,,,,,,,,,,,,rfr,,,,,,,,,,,,,True,,True,,bagging_classifier_model,,,,,,,,,,,,,,,,,,,,,,,,,,,,,,,,,,,,,,,,,,low_variance_fs,,,,,,,,2048.0,,,,,,,,,,,,,,,,,,,,,,,,,,,,,,,,,,,,,,,,,,,,,,,,,,,,,,,,,,,,,,,,,9.0,,,,,1.0,,,sklearn,,,,,,,,,200.0,,,,,,,,,,,,,,,,,,,,,,,,,,,,,,,,,,,basic_standardizer,,,,,,0.14796905374969999,,,,,,,,,,,,,,,,,,,COMPLETE
26,26,0.6499659632402995,2024-11-12 18:12:15.689750,2024-11-12 18:12:17.715010,0 days 00:00:02.025260,atom_pair,,,,,,,,,,,,,,,,,0.3203288005015885,,,,,,,,,,,,,,,,,,,,,perceptron_model,,,,,,,,,,,,,,,,,,,,,,,,,,,,,,,,,,,,,,,,,,percentil_fs,,,,,,,,,,,,,,,,,,,,,,,,,,,,,,,,,,,,,,,,,,,,,,,,,,,,,,,,,,,,,,,,,,,20.0,,,,,,,,,3.0,,,,,sklearn,1024.0,,,,,,,,,,,,,,,,,,,,,,,,,,,,,99.0,,,,,,,,,,,,,,pass_through_standardizer,,,,,,,,,,,,,,,,,,,,,,,,,COMPLETE
27,27,0.7697753573859769,2024-11-12 18:12:17.784899,2024-11-12 18:12:32.109770,0 days 00:00:14.324871,atom_pair,,,,,,,,,,,,,,,,,,,,,,,,,,,,,,,,,,,,,,stacking_classifier_model,,,,,,,,,,,,,,,,,,,,,,,,,,,,,,,,,,,,,,,,,,select_from_model_fs,,,,,,,,,,,,,,,,,,,,,,,,,,,,,,,,,,,,,,,,,,,,,,,,,,,,,,,,,,,,,,,,,,,50.0,,,,,,,,,2.0,,,,,sklearn,2048.0,,,,,,969.0,,,,,,,,,,,,,,,,,,,,,,,,,,,,,,,,,,,,,pass_through_standardizer,,,,,,,,,,,,,,,,,,,,,,,,,COMPLETE
28,28,0.6339686861810756,2024-11-12 18:12:32.140237,2024-11-12 18:16:25.978449,0 days 00:03:53.838212,,,,,,,,,,,,,,,,,,,,,,,32.0,,,,,,,16.0,,,,,,,,,,,,,,,,,,,,,,,,,,,,,,,,,,,,,,,,,,,,199.0,,,,,,,,,,,,,,,,,,,,,,,,,,,,,,,,,,,,,,,,,,,,,,,,,,,,,,,,,,,,,,,,,,,,,,,,,,,,,,,,,,,,,,,chem_ception_model,deepchem,,,,,,,,,,,,,,,,,,,,,,,,,,,,,,,,,,,,,,,,,,,,pass_through_standardizer,,,,,,,,,,,,,,,,,,,,,,,,,COMPLETE
29,29,0.654356705241661,2024-11-12 18:16:26.039739,2024-11-12 18:18:39.012313,0 days 00:02:12.972574,,,keras_simple_rnn,,,,,,,,,,,,,,,,,,,,,,,,,,,,,,128.0,,,,,,,,,,,,,,,,,,,,,,,tanh,0.0658016956137194,,256.0,,,,,,,,,,,,,,,,,,500.0,,,,,2D,,,,,,,,,,,,,,,,,,,,,,,,,,,,,,,,,,,,,,,,,,,,,,,,,,,,,,,,,,,,,,,,,,,,,,,,,,,,,,,,keras,,,,,,,,,,,,,,,,,,,,2.0,,,,,,,,,,,,,,,,0.2609788974159607,0.34251156880758993,46.0,88.0,,,,,basic_standardizer,,,,,,,,,,,,,,,,,,,,,,,,,COMPLETE
30,30,0.7047651463580666,2024-11-12 18:18:39.042906,2024-11-12 18:21:06.239414,0 days 00:02:27.196508,,,,,,,,,,,,,,,,,,,,,,,,,,,,,,256.0,,,,False,,,,,,,,,,,,,,,,,,,,,,,,,,,,,,,0.25,,,,,,,,,129.0,,,,,,,,,,,,,,,,,,,,,"[32, 64]",,,,,,,,,,,,,,,,,,,,,,,,,,,,,,,,,,,,,,,,,,,,,,,,,,,,,,,,,,,,,,,,,,gcn_model,deepchem,,,,,,,,,,,,,,,,,,,,,,,,,,,,,,,,0.0,,,,,,,,,,,,pass_through_standardizer,,,,,,,,,,False,,,,True,,,True,,,,,,,,COMPLETE
31,31,0.6678352620830498,2024-11-12 18:21:06.269863,2024-11-12 18:21:15.972576,0 days 00:00:09.702713,atom_pair,,,,,,,,,,,,,,,,,,,6.870769911764251,,,,,,,,,,,,,,,,,,,ridge_classifier_cv_model,,,,,,,,,,,,,,,,,,,,,,,,,,,,,,,,,,,,,,,,,,select_from_model_fs,,,,,,,,,,,,,,,,,,,,,,,,,,,,,,,,,,,,,,,,,,,,,,,,,,,,,,,,,,,,,,,,,,,50.0,,,,,,,,,2.0,,,,,sklearn,2048.0,,,,,,943.0,,,,,,,,,,,,,,,,,,,,,,,,,,,,,,,,,,,,,pass_through_standardizer,,,,,,,,,,,,,,,,,,,,,,,,,COMPLETE
32,32,0.7691967324710687,2024-11-12 18:21:16.035658,2024-11-12 18:21:35.789099,0 days 00:00:19.753441,atom_pair,,,,,,,,,,,,,,,,,,,,,,,,,,,,,,,,,,,,,,stacking_classifier_model,,,,,,,,,,,,,,,,,,,,,,,,,,,,,,,,,,,,,,,,,,select_from_model_fs,,,,,,,,,,,,,,,,,,,,,,,,,,,,,,,,,,,,,,,,,,,,,,,,,,,,,,,,,,,,,,,,,,,50.0,,,,,,,,,2.0,,,,,sklearn,2048.0,,,,,,969.0,,,,,,,,,,,,,,,,,,,,,,,,,,,,,,,,,,,,,pass_through_standardizer,,,,,,,,,,,,,,,,,,,,,,,,,COMPLETE
33,33,0.770932607215793,2024-11-12 18:21:35.818808,2024-11-12 18:21:50.433885,0 days 00:00:14.615077,atom_pair,,,,,,,,,,,,,,,,,,,,,,,,,,,,,,,,,,,,,,stacking_classifier_model,,,,,,,,,,,,,,,,,,,,,,,,,,,,,,,,,,,,,,,,,,select_from_model_fs,,,,,,,,,,,,,,,,,,,,,,,,,,,,,,,,,,,,,,,,,,,,,,,,,,,,,,,,,,,,,,,,,,,50.0,,,,,,,,,3.0,,,,,sklearn,2048.0,,,,,,957.0,,,,,,,,,,,,,,,,,,,,,,,,,,,,,,,,,,,,,pass_through_standardizer,,,,,,,,,,,,,,,,,,,,,,,,,COMPLETE
34,34,0.7280462899931927,2024-11-12 18:21:50.462333,2024-11-12 18:22:02.373674,0 days 00:00:11.911341,atom_pair,,,,,,,,,,,,,,,,,,,,,,,,,,,,,,,,,,,,,,stacking_classifier_model,,,,,,,,,,,,,,,,,,,,,,,,,,,,,,,,,,,,,,,,,,select_from_model_fs,,,,,,,,,,,,,,,,,,,,,,,,,,,,,,,,,,,,,,,,,,,,,,,,,,,,,,,,,,,,,,,,,,,50.0,,,,,,,,,3.0,,,,,sklearn,1024.0,,,,,,957.0,,,,,,,,,,,,,,,,,,,,,,,,,,,,,,,,,,,,,pass_through_standardizer,,,,,,,,,,,,,,,,,,,,,,,,,COMPLETE
35,35,0.5030292716133424,2024-11-12 18:22:02.444531,2024-11-12 18:22:15.979948,0 days 00:00:13.535417,rdk,,,,,,,,,,,,,,,,,,,,,,,,,,,,,,,,,,,,,,stacking_classifier_model,,,,,,,,,,,,,,,,,,,,,,,,,,,,,,,,,,,,,,,,,,select_from_model_fs,,,,,,,,1024.0,,,,,,,,,,,,,,,,,,,,,,,,,,,,,,,,,,,,,,,,,,,,,,,,,,,,,,,,,,,,,,,,,5.0,,,,,3.0,,,sklearn,,,,,,,995.0,,,,,,,,,,,,,,,,,,,,,,,,,,,,,,,,,,,,,basic_standardizer,,,,,,,,,,,,,,,,,,,,,,,,,COMPLETE
36,36,0.529782164737917,2024-11-12 18:22:16.033267,2024-11-12 18:22:31.496609,0 days 00:00:15.463342,layered,,,,,,,,,,,,,,,,,,,,,,,,,,,,,,,,,,,,,,stacking_classifier_model,,,,,,,,,,,,,,,,,,,,,,,,,,,,,,,,,,,,,,,,,,select_from_model_fs,,,,,,,,2048.0,,,,,,,,,,,,,,,,,,,,,,,,,,,,,,,,,,,,,,,,,,,,,,,,,,,,,,,,,,,,5.0,,,,,,,,,3.0,,,,sklearn,,,,,,,797.0,,,,,,,,,,,,,,,,,,,,,,,,,,,,,,,,,,,,,pass_through_standardizer,,,,,,,,,,,,,,,,,,,,,,,,,COMPLETE
37,37,0.44959155888359426,2024-11-12 18:22:31.550972,2024-11-12 18:22:58.821926,0 days 00:00:27.270954,mhfp,,,,,,,,,,,,,,,,,,,,,,,,,,,,,,,,,,,,,,one_class_svm_model,,,,,,,,,,,,,,,2.0,,,,,,,,,,,,,,,,,,,,,,,,,,,select_from_model_fs,,,,,,,,,,,0.628181562899856,,,,,,,,,,,,,,,,,,,,,,,,,,linear,,,,,,,,,,,,,,,,,,,,,,,,,,,,,,,,,,,,,,,,,,,,sklearn,,,,,,,145.0,,,,,,,,,,,,,,,,0.8625069469242636,,,,,,,,,,,,,,,,,,,,,chembl_standardizer,,,,,,,,,,,,,,,,,,,,,,,,,COMPLETE
38,38,0.7509530292716132,2024-11-12 18:22:58.853275,2024-11-12 18:23:09.004906,0 days 00:00:10.151631,np_classifier_fp,,,,,,,,,,,,,,,,,,,,,,,,,,,,,,,,,,,,,,nu_svc_model,,,,,,,,,,,,,,3.0,,,,,,,,,,,,,,,,,,,,,,,,,,,,select_from_model_fs,,,,,,,,,,0.30913390149590103,,,,,,,,,,,,,,,,,,,,,,,,,,linear,,,,,,,,,,,,,,,,,,,,,,,,,,,,,,,,,,,,,,,,,,,,,sklearn,,,,,,,698.0,,,,,,,,,,,,,,,0.7482311156011419,,,,,,,,,,,,,,,,,,,,,,pass_through_standardizer,,,,,,,,,,,,,,,,,,,,,,,,,COMPLETE
39,39,0.7509530292716132,2024-11-12 18:23:09.035580,2024-11-12 18:23:18.680434,0 days 00:00:09.644854,np_classifier_fp,,,,,,,,,,,,,,,,,,,,,,,,,,,,,,,,,,,,,,nu_svc_model,,,,,,,,,,,,,,3.0,,,,,,,,,,,,,,,,,,,,,,,,,,,,select_from_model_fs,,,,,,,,,,0.2727098748543753,,,,,,,,,,,,,,,,,,,,,,,,,,linear,,,,,,,,,,,,,,,,,,,,,,,,,,,,,,,,,,,,,,,,,,,,,sklearn,,,,,,,670.0,,,,,,,,,,,,,,,0.7630488993889123,,,,,,,,,,,,,,,,,,,,,,pass_through_standardizer,,,,,,,,,,,,,,,,,,,,,,,,,COMPLETE
40,40,-inf,2024-11-12 18:23:18.709467,2024-11-12 18:23:20.896953,0 days 00:00:02.187486,,,,,,,,,,,,,,,,,,,,,,,,,,,,,,32.0,,,,,,,,,,,,,,,,,,,,,,,,,,,,,,,,,,,,,,,0.25,,,,,194.0,,,,,,,,,,,,,,,,,,,,,,,,,,,,,,,,,,,,,,,,,,,,,,,,,,,,,,,,,,,,,,,,,,,,,,,,,,,,,,,,,,,,,,,weave_model,deepchem,,,,,,,,,,,,,,128.0,,,100.0,,,,,,,,,,,,,,,,,,,,,,,,,,,chembl_standardizer,,,,,,,,,,,,True,,,,,,,,,,,,,COMPLETE
41,41,0.7553778080326752,2024-11-12 18:23:20.949900,2024-11-12 18:23:31.105370,0 days 00:00:10.155470,np_classifier_fp,,,,,,,,,,,,,,,,,,,,,,,,,,,,,,,,,,,,,,nu_svc_model,,,,,,,,,,,,,,3.0,,,,,,,,,,,,,,,,,,,,,,,,,,,,select_from_model_fs,,,,,,,,,,0.28644056693591974,,,,,,,,,,,,,,,,,,,,,,,,,,linear,,,,,,,,,,,,,,,,,,,,,,,,,,,,,,,,,,,,,,,,,,,,,sklearn,,,,,,,661.0,,,,,,,,,,,,,,,0.794169981527392,,,,,,,,,,,,,,,,,,,,,,pass_through_standardizer,,,,,,,,,,,,,,,,,,,,,,,,,COMPLETE
42,42,0.5815180394826412,2024-11-12 18:23:31.207383,2024-11-12 18:23:51.483556,0 days 00:00:20.276173,np_classifier_fp,,,,,,,,relu,,,,,,,0.0003353474101812683,,,,,,,,,,,,,,,,,,,,,,,mlp_classifier_model,,,,,,,,,,,,,,,,,,,,,,,,,,,,,,,,,,,,,,,,,,select_from_model_fs,,,,,,,,,,,,,,,,,,,,,,,,,,,,,,"(100,)",,,,,,,,,,,,,,,,,,,,,,,,,,,,,,,,,,,,,,,,,,,,,,,,,,,sklearn,,,,,,,638.0,,,,,,,,,,,,,,,,,,,,,,,,,,,,,,,,,,,,,pass_through_standardizer,,,,,,,,,,,,,,,,,,,,,,,,,COMPLETE
43,43,0.7397208985704561,2024-11-12 18:23:51.533842,2024-11-12 18:23:52.956222,0 days 00:00:01.422380,np_classifier_fp,,,,,,,,,,,,,,,,,,,,,,,,,,,,,,,,,,,,,,sgd_one_class_svm_model,,,,,,,,,,,,,,,,,,,,,,,,,,,,,,,,,,,,,,,,,,pass_through_transformer,,,,,,,,,,,,,,,,,,,,,,,,,,,,,,,,,,,,,,,,,,,,,,,,,,,,,,,,,,,,,,,,,,,,,,,,,,,,,,,,,sklearn,,,,,,,,,,,,,,,,,,,,,,,,0.44132722974347804,,,,,,,,,,,,,,,,,,,,pass_through_standardizer,,,,,,,0.5533561507576905,,,,,,,,,,,,,,,,,,COMPLETE
44,44,0.7553778080326752,2024-11-12 18:23:53.017175,2024-11-12 18:24:08.476819,0 days 00:00:15.459644,np_classifier_fp,,,,,,,,,,,,,,,,,,,,,,,,,,,,,,,,,,,,,,nu_svc_model,,,,,,,,,,,,,,3.0,,,,,,,,,,,,,,,,,,,,,,,,,,,,select_from_model_fs,,,,,,,,,,0.3091538352527641,,,,,,,,,,,,,,,,,,,,,,,,,,linear,,,,,,,,,,,,,,,,,,,,,,,,,,,,,,,,,,,,,,,,,,,,,sklearn,,,,,,,812.0,,,,,,,,,,,,,,,0.8235514712375932,,,,,,,,,,,,,,,,,,,,,,pass_through_standardizer,,,,,,,,,,,,,,,,,,,,,,,,,COMPLETE
45,45,0.6517018379850238,2024-11-12 18:24:08.514300,2024-11-12 18:24:36.904758,0 days 00:00:28.390458,mixed,,,,,,,,,,SAMME,,,,,,,,,,,,,,,,,,,,,,,,,,,,ada_boost_classifier_model,,,,,,,,,,,,,,,,,,,,,,,,,,,,,,,,,,,,,,,,mol2vec,rdk,select_from_model_fs,,,,,,,,,,,,,,,,,,,,,,,,,,,,,,,,,,,,,,,,,,,,,,,,,,,,,,,,0.9463703652536637,,,,,,,,,,,,,,,,,,,,,,,,,sklearn,,,,,,,846.0,100.0,,,,,,,,,,,,,,,,,,,,,,,,,,,,,,,,,,,,basic_standardizer,,,,,,,,,,,,,,,,,,,,,,,,,COMPLETE
46,46,0.6153505786249148,2024-11-12 18:24:36.945209,2024-11-12 18:24:52.981946,0 days 00:00:16.036737,neural_npfp,,,,,,,,,,,,,,,,,,,,,,,,,,,,,,,,,,,,,,gaussian_process_classifier_model,,,,,,,,,,,,,,,,,,,,,,,,,,,,,,,,,,,,,,,,,,select_from_model_fs,,,,,,,,,,,,,,,,,,,,,,,,,,,,,,,,,,,,,,,,,,,,,,,,,,,,,,,,,,,,,,,,,,,,,,,,,,,,,,,ae,,sklearn,,,,,,,848.0,,,,,,,,,,,,,,,,,,,,,,,,,,,,,,,,,,,,,pass_through_standardizer,,,,,,,,,,,,,,,,,,,,,,,,,COMPLETE
47,47,-inf,2024-11-12 18:24:53.038423,2024-11-12 18:24:53.219441,0 days 00:00:00.181018,maccs,keras_tabular_transformer,,,,,,,,,,,,,,,,,,,,,,,,,,,,,,,,,,,,,,,,,,,,,,,,,,,,,,,,,,,,,,,,,,,,,32.0,,,,,,,,,,,1D,,,,,,,,,,,,,,,,,,,,,,,,,,,,,,,,,,,,,,,,,,,,,,,,,,,,,,,,,,,,,,,,,,,,,,,,,,,,,,,,keras,,,1.0,,,,,,,,,,,,,,,,,,,,,,,,,,,,,,,,,,,,,,,,,,,,,,,,,,,,,,,,,,,,,,,,,,COMPLETE
48,48,0.6666780122532335,2024-11-12 18:24:53.250861,2024-11-12 18:27:10.590716,0 days 00:02:17.339855,,,,,,,,,,,,,,,,,,,,,,,,,,,,,,64.0,,,,,,,,,,,,,,,,,,,,,,,,,,,,,,2.0,,,,,,,,,,,,,,81.0,,,,,,,,,,,,,0.25,2.0,,,,,,,,,,,,,,,,,,,,,,,,,,,,,,,,,,,,,,,,,,,,,,,,,,,,,,,,,,,,,,,,,,,,,,,,,dmpnn_model,deepchem,,,,,,,,,,,,,,,,,,,,,,,,,,,,,,,,,,,,,,,,,,,,pass_through_standardizer,,,,,,,,,,,,,,,,,,,,,,,,,COMPLETE
49,49,0.6423757658270932,2024-11-12 18:27:10.630537,2024-11-12 18:27:38.759575,0 days 00:00:28.129038,mol2vec,,,,,,9.72127649300698,,,,,,,,,,,,,,,,,,,,,,,,,,,,,,,,svc_model,,,,,,,,,,,,,,,,3.0,,,,,,,,,,,,,,,,,,,,,,,,,,pass_through_transformer,,,,,,,,,,,,0.7567503229552995,,,,,,,,,,,,,,,,,,,,,,,,,,,,,,linear,,,,,,,,,,,,,,,,,,,,,,,,,,,,,,,,,,,,,,,sklearn,,,,,,,,,,,,,,,,,,,,,,,,,,,,,,,,,,,,,,,,,,,,chembl_standardizer,,,,,,,,,,,,,,,,,,,,,,,,,COMPLETE
50,50,0.5737916950306331,2024-11-12 18:27:38.835283,2024-11-12 18:28:01.702450,0 days 00:00:22.867167,morgan,,,,,,,,,,,,,,,,,,,,,,,,,,,,,,,,,,,,,,gaussian_nb_model,,,,,,,,,,,,,,,,,,,,,,,,,,,,,,,,,,,,,,,,,,select_from_model_fs,,,,,,,,,,,,,,,,,,,,,,,,,,,,,,,,,,,,,,,,,,,,,,,,,,,,,,,,,,,,,,,,,,,,,,,,,,,,,,,,,sklearn,,,,1024.0,,,870.0,,,,,,,,,,,,,,,,,,,,,,,,,,2.0,,,,,,,,,heavy_standardisation,,custom_standardizer,,,,,,,,,,,,,,,,,,,,,,,,,COMPLETE
51,51,0.7553778080326752,2024-11-12 18:28:01.778645,2024-11-12 18:28:23.468823,0 days 00:00:21.690178,np_classifier_fp,,,,,,,,,,,,,,,,,,,,,,,,,,,,,,,,,,,,,,nu_svc_model,,,,,,,,,,,,,,3.0,,,,,,,,,,,,,,,,,,,,,,,,,,,,select_from_model_fs,,,,,,,,,,0.3093718125541799,,,,,,,,,,,,,,,,,,,,,,,,,,linear,,,,,,,,,,,,,,,,,,,,,,,,,,,,,,,,,,,,,,,,,,,,,sklearn,,,,,,,635.0,,,,,,,,,,,,,,,0.8206503515419125,,,,,,,,,,,,,,,,,,,,,,pass_through_standardizer,,,,,,,,,,,,,,,,,,,,,,,,,COMPLETE
52,52,0.7817222600408441,2024-11-12 18:28:23.543247,2024-11-12 18:28:39.374875,0 days 00:00:15.831628,np_classifier_fp,,,,,,,,,,,,,,,,,,,,,,,,,,,,,,,,,,,,,,nu_svc_model,,,,,,,,,,,,,,3.0,,,,,,,,,,,,,,,,,,,,,,,,,,,,select_from_model_fs,,,,,,,,,,0.31529958143225195,,,,,,,,,,,,,,,,,,,,,,,,,,linear,,,,,,,,,,,,,,,,,,,,,,,,,,,,,,,,,,,,,,,,,,,,,sklearn,,,,,,,517.0,,,,,,,,,,,,,,,0.9251947514827112,,,,,,,,,,,,,,,,,,,,,,pass_through_standardizer,,,,,,,,,,,,,,,,,,,,,,,,,COMPLETE
53,53,0.5970047651463581,2024-11-12 18:28:39.410765,2024-11-12 18:29:16.282230,0 days 00:00:36.871465,2d_descriptors,,,,,,,,,,,,,,,,,,0.8036196239914544,,,,,,,,,,,,,,,,,,,,ridge_classifier_model,,,,,,,,,,,,,,,,,,,,,,,,,,,,,,,,,,,,,,,,,,select_from_model_fs,,,,,,,,,,,,,,,,,,,,,,,,,,,,,,,,,,,,,,,,,,,,,,,,,,,,,,,,,,,,,,,,,,,,,,,,,,,,,,,,,sklearn,,,,,,,479.0,,,,,,,,,,,,,,max,,,,,,,,,,,,,,,,,,,normalizer,,,,pass_through_standardizer,,,,,,,,,,,,,,,,,,,,,,,,,COMPLETE
54,54,0.6103812117086453,2024-11-12 18:29:16.347103,2024-11-12 18:33:51.055164,0 days 00:04:34.708061,np_classifier_fp,,,,,,,,,,,,,,,,,,,,,,,,,,,,,,,,,,,,,True,random_forest_classifier_model,,,,,,,,,,,,,entropy,,,,,,,,,,,,,,,,,,,,,,,,,,,,,boruta_algorithm,,,,,,,,,,,,,,,,,,,,,,,,,,,,,,,,,,,,,,,,,,,,,,,,,,,,,,,,,,,,,,,,,,,,,,,log2,,,,,,,,,,sklearn,,,,,,,,,,,,400.0,,,,,,,,,,,,,,,,,,,,,,,,,,,,,,,,pass_through_standardizer,,,,,True,,,,,,,,,,,,,,,,,,,,COMPLETE
55,55,0.4894145677331518,2024-11-12 18:33:51.089894,2024-11-12 18:34:00.663165,0 days 00:00:09.573271,layered,,,,,,,,,,,,,,,,,,,,,,,,,,,,,,,,,,,,,,nearest_centroid_model,,,,,,,,,,,,,,,,,,,,,,,,,,,,,,,,,,,,,,,,,,select_from_model_fs,,,,,,,,1024.0,,,,,,,,,,,,,,,,,,,,,,,,,,,,,,,,,,,,,,,,,,,,,,,,,,,,,,,,,,,,6.0,,,,,,,chebyshev,,1.0,,,,sklearn,,,,,,,981.0,,,,,,,,,,,,,,,,,,,,,,,,,,,,,,,,,,,,,pass_through_standardizer,,,,,,,,,,,,,,,,,,,,,,,,,COMPLETE
56,56,0.7386317222600409,2024-11-12 18:34:00.700533,2024-11-12 18:36:16.896754,0 days 00:02:16.196221,np_classifier_fp,keras_dense,,,,,,,,,,,,,,,,,,,,,,True,,,,,,,64.0,,,,,,,,,,,,,,,,,,,,,,,,,,,,,,,,,,,,,,,,,,,,1000.0,,,,,,,1D,,,,,,,,,,,,,,,,,,,,,tanh,,,,0.7863169845187541,,,,,9.0,,,,,,,,,,,,0.006944790841773334,,,,,0.0027176380238690175,,,,,,,,,,,,,,,,,,,,,,,,,,,,,,,,,keras,,,,,,,,,,,,,,,,1.0,,,,,,,,,,,,,,,,,,,,,,,,,,,,pass_through_standardizer,,,,,,,,,,,,,,,,,,,,,,,,,COMPLETE
57,57,0.6459496255956434,2024-11-12 18:36:16.931792,2024-11-12 18:36:27.425488,0 days 00:00:10.493696,np_classifier_fp,,,,,7.996711605812521,,,,,,,,,,,,,,,,,,,,,,,,,,,,,,,,,passive_aggressive_classifier_model,,,,,,,,,,,,,,,,,,,,,,,,,,,,,,,,,,,,,,,,,,select_from_model_fs,,,,,,,,,,,,,,,,,,,,,,,,,,,,,,,,,,,,,,,,,,,,,,,,,,,,,,,,,,,,,,,,,,,,,,,,,,,,,,,,,sklearn,,,,,,,369.0,,,,,,,,,,,,,,,,,,,,,,,,,,,,,,,,,,,heavy_standardisation,,custom_standardizer,,,,,,,,,,,,,,,,,,,,,,,,,COMPLETE
