,number,value,datetime_start,datetime_complete,duration,params_1D_featurizer,params_1d_model,params_2d_model,params_C_linear_svr,params_C_nu_svr,params_C_passive_aggressive_regressor,params_C_svr,params_activation_mlp_regressor,params_algorithm_kneighbors_regressor,params_algorithm_radius_neighbors_regressor,params_alpha_1,params_alpha_2,params_alpha_bayesian_ridge,params_alpha_elastic_net,params_alpha_gamma_regressor,params_alpha_gaussian_process_regressor,params_alpha_huber_regressor,params_alpha_kernel_ridge,params_alpha_lasso,params_alpha_lasso_cv,params_alpha_mlp_regressor,params_alpha_poisson_regressor,params_alpha_quantile_regressor,params_alpha_ridge_cv,params_alpha_ridge_model,params_alpha_sgd_regressor,params_alpha_tweedie_regressor,params_attention_dropout_0,params_attention_dropout_1,params_attention_dropout_2,params_attention_dropout_3,params_attention_key_dim_0,params_attention_key_dim_1,params_attention_key_dim_2,params_attention_key_dim_3,params_base_estimator_bagging_regressor,params_base_estimator_ransac_regressor,params_batch_normalization_0,params_batch_normalization_1,params_batch_normalization_2,params_batch_normalization_3,params_batch_normalization_4,params_batch_size_deepchem,params_batchnorm,params_bootstrap_bagging_regressor,params_bootstrap_extra_trees_regressor,params_bootstrap_features,params_bootstrap_random_forest_regressor,params_conv_activation_0,params_conv_activation_1,params_conv_activation_2,params_conv_batch_norm_0,params_conv_batch_norm_1,params_conv_batch_norm_2,params_conv_dropout_0,params_conv_dropout_1,params_conv_dropout_2,params_criterion_extra_trees_regressor,params_criterion_gradient_boosting_regressor,params_criterion_lasso_lars,params_criterion_random_forest_regressor,params_degree_nu_svr,params_degree_svr,params_dense_activation,params_dense_dropout,params_dense_layer_size,params_dense_units,params_depth_dmpnn,params_dropout,params_dropout_attentive_fp,params_dropout_dag,params_dropout_gcn,params_dropout_graph_conv,params_dropout_pagtn,params_dropout_text_cnn,params_dropouts_dtnn,params_embed_dropout_p,params_embedding_output_dim,params_encoder_dropout_p,params_epochs_deepchem,params_epsilon_huber_regressor,params_epsilon_linear_svr,params_epsilon_sgd_regressor,params_f1,params_f2,params_feature_selector,params_featurizer_type,params_ff_dropout_p,params_filter_0,params_filter_1,params_filter_2,params_fnn_dropout_p,params_fnn_layers,params_fpSize,params_g_noise,params_gamma_kernel_ridge,params_gamma_nu_svr,params_gamma_svr,params_gen_dropout_p,params_gen_n_layers,params_graph_conv_layers_conv_model,params_graph_conv_layers_gcn,params_graph_feat_size_attentive_fp,params_gru_dropout_0,params_gru_dropout_1,params_gru_dropout_2,params_gru_units_0,params_gru_units_1,params_gru_units_2,params_hidden_activation_0,params_hidden_activation_1,params_hidden_activation_2,params_hidden_activation_3,params_hidden_activation_4,params_hidden_dropout_0,params_hidden_dropout_1,params_hidden_dropout_2,params_hidden_dropout_3,params_hidden_dropout_4,params_hidden_layer_sizes_mlp_regressor,params_hidden_layer_units_0,params_hidden_layer_units_1,params_hidden_layer_units_2,params_hidden_layer_units_3,params_hidden_layer_units_4,params_k,params_kernel_nu_svr,params_kernel_ridge,params_kernel_size_0,params_kernel_size_1,params_kernel_size_2,params_kernel_svr,params_l1_0,params_l1_1,params_l1_2,params_l1_3,params_l1_4,params_l1_ratio_elastic_net,params_l1_ratio_sgd_regressor,params_l2_0,params_l2_1,params_l2_2,params_l2_3,params_l2_4,params_lambda_1_ard_regression,params_lambda_1_bayesian_ridge,params_lambda_2_ard_regression,params_lambda_2_bayesian_ridge,params_layer_sizes_dag,params_layer_sizes_gather,params_leaf_size_kneighbors_regressor,params_leaf_size_radius_neighbors_regressor,params_learning_rate_ada_boost_regressor,params_learning_rate_gradient_boosting_regressor,params_learning_rate_hist_gradient_boosting_regressor,params_loss_ada_boost_regressor,params_loss_gradient_boosting_regressor,params_loss_hist_gradient_boosting_regressor,params_lstm_dropout_0,params_lstm_dropout_1,params_lstm_dropout_2,params_lstm_units_0,params_lstm_units_1,params_lstm_units_2,params_master_atom,params_maxLength,params_maxPath,params_max_features_extra_trees_regressor,params_max_features_gradient_boosting_regressor,params_max_features_random_forest_regressor,params_max_length_pagtn,params_max_path,params_minLength,params_minPath,params_min_path,params_min_samples,params_model_steps,params_model_type,params_nBits,params_n_attention_heads,params_n_attention_layers,params_n_bits,params_n_components,params_n_conv_layers,params_n_embedding_dtnn,params_n_embedding_text_cnn,params_n_encoders,params_n_estimators,params_n_estimators_ada_boost_regressor,params_n_estimators_bagging_regressor,params_n_estimators_extra_trees_regressor,params_n_estimators_gradient_boosting_regressor,params_n_estimators_random_forest_regressor,params_n_graph_feat_dag,params_n_gru_layers,params_n_hidden_dtnn,params_n_hidden_layers,params_n_layers,params_n_lstm_layers,params_n_neighbors_kneighbors_regressor,params_n_quantiles,params_n_rnn_layers,params_nu_nu_svr,params_num_heads,params_num_layers_attentive_fp,params_num_layers_pagtn,params_output_distribution,params_p,params_penalty,params_percentile,params_power_tweedie_regressor,params_predictor_dropout_gcn,params_quantile,params_quantile_range,params_radius,params_radius_n_radius_neighbors_regressor,params_regression_model,params_rnn_dropouts_0,params_rnn_dropouts_1,params_rnn_dropouts_2,params_rnn_units_0,params_rnn_units_1,params_rnn_units_2,params_sa_dropout_p,params_scale,params_scaler,params_standardization_type,params_standardizer,params_stride_0,params_stride_1,params_stride_2,params_support_weak,params_threshold,params_threshold_lambda,params_use_chirality_attentive_fp,params_use_chirality_gat,params_use_chirality_gcn,params_use_chirality_graph_conv,params_use_edges_gat,params_use_edges_gcn,params_use_partial_charge_attentive_fp,params_use_partial_charge_gat,params_use_partial_charge_gcn,params_weight_gbr,params_weight_lr,params_weight_mlp,params_weight_rfr,params_weight_svr,params_weights_kneighbors_regressor,params_weights_radius_neighbors_regressor,params_with_centering,params_with_scaling,state
81,81,0.5175572232900608,2024-02-08 18:16:30.058457,2024-02-08 19:15:16.493812,0 days 00:58:46.435355,layered,,,,,,,,,,,,,,,,,,,,,,,,,,,,,,,,,,,,,,,,,,,,,,,,,,,,,,,,,,,,,,,,,,,,,,,,,,,,,,,,,,,,,boruta_algorithm,,,,,,,,2048.0,,,,,,,,,,,,,,,,,,,,,,,,,,,,,,,,,,,,,,,,,,,,,,,,,,,,,,,,,,,,,,,,,,,,,,,,,8.0,,,,,,,2.0,,,,sklearn,,,,,,,,,,,,,,,,,,,,,,,,,,,,,,,,,,,,,,,voting_regressor_model,,,,,,,,,,,pass_through_standardizer,,,,True,,,,,,,,,,,,0.41352810933236506,0.002107964798240537,0.17009397776852525,0.7315349447397977,0.3787235545992606,,,,,COMPLETE
82,82,0.6994044792567867,2024-02-08 19:15:16.526320,2024-02-08 19:48:03.611252,0 days 00:32:47.084932,layered,,,,,,,,,,,,,,,,,,9.961927512397654,,,,,,,,,,,,,,,,,,,,,,,,,,,,,,,,,,,,,,,,,,,,,,,,,,,,,,,,,,,,,,,,,,,boruta_algorithm,,,,,,,,2048.0,,,,,,,,,,,,,,,,,,,,,,,,,,,,,,,,,,,,,,,,,,,,,,,,,,,,,,,,,,,,,,,,,,,,,,,,,8.0,,,,,,,2.0,,,,sklearn,,,,,,,,,,,,,,,,,,,,,,,,,,,,,,,,,,,,,,,lasso_model,,,,,,,,,,simple_standardisation,custom_standardizer,,,,True,,,,,,,,,,,,,,,,,,,,,COMPLETE
83,83,inf,2024-02-08 19:48:03.625343,2024-02-08 20:56:35.823610,0 days 01:08:32.198267,layered,,,,,,,,,kd_tree,,,,,,,,,,,,,,,,,,,,,,,,,,,,,,,,,,,,,,,,,,,,,,,,,,,,,,,,,,,,,,,,,,,,,,,,,,,,boruta_algorithm,,,,,,,,2048.0,,,,,,,,,,,,,,,,,,,,,,,,,,,,,,,,,,,,,,,,,,,,,,,,,,,,,,,,,,2.0,,,,,,,,,,,,,,,8.0,,,,,,,2.0,,,,sklearn,,,,,,,,,,,,,,,,,,,,,,,,,,,,,,6.0,,,,,,,,0.052279591025604866,radius_neighbors_regressor_model,,,,,,,,,,simple_standardisation,custom_standardizer,,,,True,,,,,,,,,,,,,,,,,,uniform,,,COMPLETE
84,84,0.6574564729580608,2024-02-08 20:56:35.946202,2024-02-08 22:28:20.486176,0 days 01:31:44.539974,layered,,,,,,,,,,,,,,,,,,,,,,,,,,,,,,,,,,,,,,,,,,,,,,,,,,,,,,,,,,,,,,,,,,,,,,,,,,,,,,,,,,,,,boruta_algorithm,,,,,,,,2048.0,,,,,,,,,,,,,,,,,,,,,,,,,,,,,,,,,,,,,,,,,,,,,,,,,,,,,,,,,,,,,,,,,,,,,,,,,5.0,,,,,,,1.0,,,,sklearn,,,,,,,,,,,,,,,,,,,,,,,,,,,,,,,,,,,,,,,voting_regressor_model,,,,,,,,,,heavy_standardisation,custom_standardizer,,,,False,,,,,,,,,,,,0.44746762461697953,0.0006771294683275979,0.17545175626118736,0.5701584909715297,0.44920506495983337,,,,,COMPLETE
85,85,inf,2024-02-08 22:28:20.505517,2024-02-08 22:35:46.032089,0 days 00:07:25.526572,rdk,,,,,,,,,,,,,,,,,,,,,,,,,,,,,,,,,,,,,,,,,,,,,,,,,,,,,,,,,,friedman_mse,,,,,,,,,,,,,,,,,,,,,,,,,,,boruta_algorithm,,,,,,,,2048.0,,,,,,,,,,,,,,,,,,,,,,,,,,,,,,,,,,,,,,,,,,,,,,,,,,,,,,,,,,,,0.026683362669932542,,,ls,,,,,,,,,,,,log2,,,5.0,,,1.0,,,sklearn,,,,,,,,,,,,,,500.0,,,,,,,,,,,,,,,,,,,,,,,,,gradient_boosting_regressor_model,,,,,,,,,,,pass_through_standardizer,,,,True,,,,,,,,,,,,,,,,,,,,,COMPLETE
86,86,1.25467395796132,2024-02-08 22:35:46.052624,2024-02-08 23:24:33.456746,0 days 00:48:47.404122,layered,,,,,,,,,,,,,,,,,,,,,,,,,,,,,,,,,,,,,,,,,,,,,,,,,,,,,,,,,,,,,,,,,,,,,,,,,,,,,,,,,,,,,boruta_algorithm,,,,,,,,2048.0,,,,,,,,,,,,,,,,,,,,,,,,,,,,,,,,,,,,,,,,,,,,,,,,,,,,,,,,,,,,,,,,,,,,,,,,,6.0,,,,,,,2.0,,,,sklearn,,,,,,,,,,,,,,,,,,,,,,,,,,,,,,,,,,,,,,,voting_regressor_model,,,,,,,,,,heavy_standardisation,custom_standardizer,,,,True,,,,,,,,,,,,0.27858957412756985,0.09780772090812348,0.1568640634693343,0.33080371167041744,0.27283938085531684,,,,,COMPLETE
87,87,0.6964691190015299,2024-02-08 23:24:33.472234,2024-02-08 23:38:23.234500,0 days 00:13:49.762266,rdk,,,,,,,,,,,,,,,,,,,,,,,,,0.9941451071089477,,,,,,,,,,,,,,,,,,,,,,,,,,,,,,,,,,,,,,,,,,,,,,,,,,,,,,,,,0.008148537276990053,,,pass_through_transformer,,,,,,,,2048.0,,,,,,,,,,,,,,,,,,,,,,,,,,,,,,,,,,,,,,,,,,,,,0.11861948783759257,,,,,,,,,,,,,,,,,,,,,,,,,,,,,,,,,6.0,,,1.0,,,sklearn,,,,,,,,,,,,,,,,,,,,,,,,,,,,,,,elasticnet,,,,,,,,sgd_regressor_model,,,,,,,,,,,basic_standardizer,,,,,,,,,,,,,,,,,,,,,,,,,COMPLETE
88,88,0.5243275711742705,2024-02-08 23:38:23.270231,2024-02-09 00:43:20.427291,0 days 01:04:57.157060,layered,,,,,,,,,,,,,,,,,,,,,,,,,,,,,,,,,,,,,,,,,,,,,,,,,,,,,,,,,,,,,,,,,,,,,,,,,,,,,,,,,,,,,select_from_model_fs,,,,,,,,1024.0,,,,,,,,,,,,,,,,,,,,,,,,,,,,,,,,,,,,,,,,,,,,,,,,,,,,,,,,,,,,,,,,,,,,,,,,,8.0,,,,,,,1.0,,,,sklearn,,,,,,,,,,555.0,,,,,,,,,,,,,,,,,,,,,,,,,,,,,voting_regressor_model,,,,,,,,,,heavy_standardisation,custom_standardizer,,,,,,,,,,,,,,,,0.45190641263143944,0.09304835340867022,0.40202477959783844,0.7660631894263006,0.7216439762674397,,,,,COMPLETE
89,89,0.9838478600061871,2024-02-09 00:43:20.457318,2024-02-09 01:33:34.436800,0 days 00:50:13.979482,,,,,,,,,,,,,,,,,,,,,,,,,,,,,,,,,,,,,,,,,,,512.0,,,,,,,,,,,,,,,,,,,,,,,128.0,,,,,,,0.5,,,,,,,741.0,,,,,,,,,,,,,,,,,,,,,"[64, 64]",,,,,,,,,,,,,,,,,,,,,,,,,,,,,,,,,,,,,,,,,,,,,,,,,,,,,,,,,,,,,,,,True,,,,,,,,,,,,graph_conv_model,deepchem,,,,,,,,,,,,,,,,,,,,,,,,,,,,,,,,,,,,,,,,,,,,,,,,,,pass_through_standardizer,,,,,,,,,,False,,,,,,,,,,,,,,,COMPLETE
90,90,0.5988609421839909,2024-02-09 01:33:34.455308,2024-02-09 01:43:23.239968,0 days 00:09:48.784660,atom_pair,,,,,,,,,,,,,,,,,,,,,,,,,,,,,,,,,,,,,,,,,,,,,,,,,,,,,,,,,,,,,,,,,,,,,,,,,,,,,,,,,,,,,percentil_fs,,,,,,,,,,,,,,,,,,,,,,,,,,,,,,,,,,,,,,,,,,,,,,,,,,,,,,,,,,,,,,,,,,,,,,,,,,,,,,,,40.0,,,,,,,1.0,,,,,sklearn,1024.0,,,,,,,,,,,,,,,,,,,,,,,,,,,,,,,42.0,,,,,,,lasso_lars_cv_model,,,,,,,,,,simple_standardisation,custom_standardizer,,,,,,,,,,,,,,,,,,,,,,,,,COMPLETE
91,91,0.5120936873188733,2024-02-09 01:43:23.312958,2024-02-09 02:02:48.914631,0 days 00:19:25.601673,layered,,,,,,,,,,,,,,,,,,,,,,,,,,,,,,,,,,,,,,,,,,,,,,,,,,,,,,,,,,,,,,,,,,,,,,,,,,,,,,,,,,,,,percentil_fs,,,,,,,,2048.0,,,,,,,,,,,,,,,,,,,,,,,,,,,,,,,,,,,,,,,,,,,,,,,,,,,,,,,,,,,,,,,,,,,,,,,,,7.0,,,,,,,2.0,,,,sklearn,,,,,,,,,,,,,,,,,,,,,,,,,,,,,,,,70.0,,,,,,,voting_regressor_model,,,,,,,,,,heavy_standardisation,custom_standardizer,,,,,,,,,,,,,,,,0.3102066411274095,0.0017340587783690855,0.1450828225868692,0.6394427577856211,0.4730598419718375,,,,,COMPLETE
92,92,0.6994044792567867,2024-02-09 02:02:48.975387,2024-02-09 02:12:48.438021,0 days 00:09:59.462634,layered,,,,,,,,,,0.5989673846811021,0.933752913114121,,,,,,,,,,,,,,,,,,,,,,,,,,,,,,,,,,,,,,,,,,,,,,,,,,,,,,,,,,,,,,,,,,,,,,,,,,percentil_fs,,,,,,,,2048.0,,,,,,,,,,,,,,,,,,,,,,,,,,,,,,,,,,,,,,,,,,,,,,,,,,,1.3054620023154339e-08,,1.981681675432675e-08,,,,,,,,,,,,,,,,,,,,6.0,,,,,,,2.0,,,,sklearn,,,,,,,,,,,,,,,,,,,,,,,,,,,,,,,,71.0,,,,,,,ard_regression_model,,,,,,,,,,heavy_standardisation,custom_standardizer,,,,,,0.4998368880862192,,,,,,,,,,,,,,,,,,,COMPLETE
93,93,0.5131645192117428,2024-02-09 02:12:48.464833,2024-02-09 02:34:32.469497,0 days 00:21:44.004664,layered,,,,,,,,,,,,,,,,,,,,,,,,,,,,,,,,,,,,,,,,,,,,,,,,,,,,,,,,,,,,,,,,,,,,,,,,,,,,,,,,,,,,,percentil_fs,,,,,,,,2048.0,,,,,,,,,,,,,,,,,,,,,,,,,,,,,,,,,,,,,,,,,,,,,,,,,,,,,,,,,,,,,,,,,,,,,,,,,7.0,,,,,,,2.0,,,,sklearn,,,,,,,,,,,,,,,,,,,,,,,,,,,,,,,,54.0,,,,,,,voting_regressor_model,,,,,,,,,,heavy_standardisation,custom_standardizer,,,,,,,,,,,,,,,,0.3085772044901687,0.005386517644056855,0.1391422219162075,0.6313199989542132,0.5015067505558171,,,,,COMPLETE
94,94,0.5130683316177207,2024-02-09 02:34:32.497965,2024-02-09 03:03:09.677738,0 days 00:28:37.179773,layered,,,,,,,,,,,,,,,,,,,,,,,,,,,,,,,,,,,,,,,,,,,,,,,,,,,,,,,,,,,,,,,,,,,,,,,,,,,,,,,,,,,,,percentil_fs,,,,,,,,2048.0,,,,,,,,,,,,,,,,,,,,,,,,,,,,,,,,,,,,,,,,,,,,,,,,,,,,,,,,,,,,,,,,,,,,,,,,,7.0,,,,,,,2.0,,,,sklearn,,,,,,,,,,,,,,,,,,,,,,,,,,,,,,,,54.0,,,,,,,voting_regressor_model,,,,,,,,,,heavy_standardisation,custom_standardizer,,,,,,,,,,,,,,,,0.3064315885795674,0.08330892924976649,0.144238390854185,0.6386164731313257,0.4813217367139515,,,,,COMPLETE
95,95,1.889314836324281,2024-02-09 03:03:09.692520,2024-02-09 03:17:33.698783,0 days 00:14:24.006263,2d_descriptors,,,,,,,,,,,,,,,,,,,,,,,,,,,,,,,,,,,,linear,,,,,,,,,,,,,,,,,,,,,,,,,,,,,,,,,,,,,,,,,,,,,,,,,percentil_fs,,,,,,,,,,,,,,,,,,,,,,,,,,,,,,,,,,,,,,,,,,,,,,,,,,,,,,,,,,,,,,,,,,,,,,,,,,,,,,,,,,,,,,,,,,0.10757823065736605,,sklearn,,,,,,,,,,,,,,,,,,,,,,,,,,,,,,,,71.0,,,,,,,ransac_regressor_model,,,,,,,,,pass_through_transformer,heavy_standardisation,custom_standardizer,,,,,,,,,,,,,,,,,,,,,,,,,COMPLETE
96,96,0.5682661232499113,2024-02-09 03:17:33.726631,2024-02-09 03:31:04.029898,0 days 00:13:30.303267,maccs,,,,,,,,,,,,,,,,,,,,,,,,,,,,,,,,,,,,,,,,,,,,,False,,,,,,,,,,,,absolute_error,,,,,,,,,,,,,,,,,,,,,,,,,,,,percentil_fs,,,,,,,,,,,,,,,,,,,,,,,,,,,,,,,,,,,,,,,,,,,,,,,,,,,,,,,,,,,,,,,,,,,,,,,,,,,,,,,,,,log2,,,,,,,,,,sklearn,,,,,,,,,,,,,100.0,,,,,,,,,,,,,,,,,,,25.0,,,,,,,extra_trees_regressor_model,,,,,,,,,,heavy_standardisation,custom_standardizer,,,,,,,,,,,,,,,,,,,,,,,,,COMPLETE
97,97,0.5142628037563198,2024-02-09 03:31:04.048544,2024-02-09 03:43:09.091248,0 days 00:12:05.042704,layered,,,,,,,,,,,,,,,,,,,,,,,,,,,,,,,,,,,,,,,,,,,,,,,False,,,,,,,,,,,,,friedman_mse,,,,,,,,,,,,,,,,,,,,,,,,,percentil_fs,,,,,,,,2048.0,,,,,,,,,,,,,,,,,,,,,,,,,,,,,,,,,,,,,,,,,,,,,,,,,,,,,,,,,,,,,,,,,,,,,,,,,7.0,,,sqrt,,,,2.0,,,,sklearn,,,,,,,,,,,,,,,100.0,,,,,,,,,,,,,,,,,83.0,,,,,,,random_forest_regressor_model,,,,,,,,,,heavy_standardisation,custom_standardizer,,,,,,,,,,,,,,,,,,,,,,,,,COMPLETE
98,98,inf,2024-02-09 03:43:09.110716,2024-02-09 03:43:09.335548,0 days 00:00:00.224832,rdk,keras_tabular_transformer,,,,,,,,,,,,,,,,,,,,,,,,,,0.47660886839027794,0.49541567290352406,,,8.0,8.0,,,,,,,,,,,,,,,,,,,,,,,,,,,,,,,relu,0.2334801478095474,,40.0,,,,,,,,,,,128.0,,,,,,,,,1D,,,,,,,2048.0,,,,,,,,,,,,,,,,,,,,,,,,,,,,,,,,,,,,,,,,,,,,,,,,,,,,,,,,,,,,,,,,,,,,,,,,,,,,,,5.0,,,2.0,,,keras,,1.0,2.0,,,,,,,,,,,,,,,,,,,,,,,,,,,,,,,,,,,,,,,,,,,,,,,,,,,,,,,,,,,,,,,,,,,,,,,,COMPLETE
99,99,inf,2024-02-09 03:43:09.351898,2024-02-09 06:43:10.570196,0 days 03:00:01.218298,mol2vec,,,,,,,,,,,,,,,,,,,,,,,,,,,,,,,,,,,rfr,,,,,,,,,False,,True,,,,,,,,,,,,,,,,,,,,,,,,,,,,,,,,,,,,,,,low_variance_fs,,,,,,,,,,,,,,,,,,,,,,,,,,,,,,,,,,,,,,,,,,,,,,,,,,,,,,,,,,,,,,,,,,,,,,,,,,,,,,,,,,,,,,,,,,,,sklearn,,,,,,,,,,,,50.0,,,,,,,,,,,,,,,,,,,,,,,,,,,bagging_regressor_model,,,,,,,,,,heavy_standardisation,custom_standardizer,,,,,0.08014817882985828,,,,,,,,,,,,,,,,,,,,COMPLETE
