,number,value,datetime_start,datetime_complete,duration,params_1D_featurizer,params_1d_model,params_2d_model,params_C_linear_svr,params_C_nu_svr,params_C_passive_aggressive_regressor,params_C_svr,params_activation_mlp_regressor,params_algorithm_kneighbors_regressor,params_algorithm_radius_neighbors_regressor,params_alpha_1,params_alpha_2,params_alpha_bayesian_ridge,params_alpha_elastic_net,params_alpha_gamma_regressor,params_alpha_gaussian_process_regressor,params_alpha_huber_regressor,params_alpha_kernel_ridge,params_alpha_lasso,params_alpha_lasso_cv,params_alpha_mlp_regressor,params_alpha_poisson_regressor,params_alpha_quantile_regressor,params_alpha_ridge_cv,params_alpha_ridge_model,params_alpha_sgd_regressor,params_alpha_tweedie_regressor,params_attention_dropout_0,params_attention_dropout_1,params_attention_key_dim_0,params_attention_key_dim_1,params_base_estimator_bagging_regressor,params_base_estimator_ransac_regressor,params_base_filters,params_batch_normalization_0,params_batch_normalization_1,params_batch_normalization_2,params_batch_normalization_3,params_batch_normalization_4,params_batch_size_deepchem,params_batchnorm,params_bootstrap_bagging_regressor,params_bootstrap_extra_trees_regressor,params_bootstrap_features,params_bootstrap_random_forest_regressor,params_conv_activation_0,params_conv_activation_1,params_conv_batch_norm_0,params_conv_batch_norm_1,params_conv_dropout_0,params_conv_dropout_1,params_criterion_extra_trees_regressor,params_criterion_gradient_boosting_regressor,params_criterion_lasso_lars,params_criterion_random_forest_regressor,params_degree_nu_svr,params_degree_svr,params_dense_activation,params_dense_dropout,params_dense_units,params_depth_dmpnn,params_dropout,params_dropout_dag,params_dropout_gcn,params_dropout_pagtn,params_dropout_text_cnn,params_dropouts_dtnn,params_dropouts_weave,params_embed_dropout_p,params_embedding_output_dim,params_encoder_dropout_p,params_epochs_deepchem,params_epsilon_huber_regressor,params_epsilon_linear_svr,params_epsilon_sgd_regressor,params_f1,params_f2,params_feature_selector,params_featurizer_type,params_ff_dropout_p,params_filter_0,params_filter_1,params_fnn_dropout_p,params_fnn_layers,params_fpSize,params_g_noise,params_gamma_kernel_ridge,params_gamma_nu_svr,params_gamma_svr,params_gen_dropout_p,params_gen_n_layers,params_graph_conv_layers_gcn,params_gru_dropout_0,params_gru_dropout_1,params_gru_dropout_2,params_gru_units_0,params_gru_units_1,params_gru_units_2,params_hidden_activation_0,params_hidden_activation_1,params_hidden_activation_2,params_hidden_activation_3,params_hidden_activation_4,params_hidden_dropout_0,params_hidden_dropout_1,params_hidden_dropout_2,params_hidden_dropout_3,params_hidden_dropout_4,params_hidden_layer_sizes_mlp_regressor,params_hidden_layer_units_0,params_hidden_layer_units_1,params_hidden_layer_units_2,params_hidden_layer_units_3,params_hidden_layer_units_4,params_k,params_kernel_nu_svr,params_kernel_ridge,params_kernel_size_0,params_kernel_size_1,params_kernel_svr,params_l1_0,params_l1_1,params_l1_2,params_l1_3,params_l1_4,params_l1_ratio_elastic_net,params_l1_ratio_sgd_regressor,params_l2_0,params_l2_1,params_l2_2,params_l2_3,params_l2_4,params_lambda_1_ard_regression,params_lambda_1_bayesian_ridge,params_lambda_2_ard_regression,params_lambda_2_bayesian_ridge,params_layer_sizes_dag,params_layer_sizes_gather,params_leaf_size_kneighbors_regressor,params_leaf_size_radius_neighbors_regressor,params_learning_rate_ada_boost_regressor,params_learning_rate_gradient_boosting_regressor,params_learning_rate_hist_gradient_boosting_regressor,params_loss_ada_boost_regressor,params_loss_gradient_boosting_regressor,params_loss_hist_gradient_boosting_regressor,params_lstm_dropout_0,params_lstm_dropout_1,params_lstm_dropout_2,params_lstm_units_0,params_lstm_units_1,params_lstm_units_2,params_maxLength,params_maxPath,params_max_features_extra_trees_regressor,params_max_features_gradient_boosting_regressor,params_max_features_random_forest_regressor,params_max_length_pagtn,params_max_path,params_minLength,params_minPath,params_min_path,params_min_samples,params_model_steps,params_model_type,params_nBits,params_n_attention_heads,params_n_attention_layers,params_n_bits,params_n_components,params_n_conv_layers,params_n_embedding_dtnn,params_n_embedding_text_cnn,params_n_encoders,params_n_estimators,params_n_estimators_ada_boost_regressor,params_n_estimators_bagging_regressor,params_n_estimators_extra_trees_regressor,params_n_estimators_gradient_boosting_regressor,params_n_estimators_random_forest_regressor,params_n_graph_feat_dag,params_n_graph_feat_weave,params_n_gru_layers,params_n_hidden_dtnn,params_n_hidden_layers,params_n_hidden_weave,params_n_layers,params_n_lstm_layers,params_n_neighbors_kneighbors_regressor,params_n_quantiles,params_n_rnn_layers,params_nu_nu_svr,params_num_heads,params_num_layers_pagtn,params_output_distribution,params_p,params_penalty,params_percentile,params_power_tweedie_regressor,params_predictor_dropout_gcn,params_quantile,params_radius,params_radius_n_radius_neighbors_regressor,params_regression_model,params_rnn_dropouts_0,params_rnn_dropouts_1,params_rnn_dropouts_2,params_rnn_units_0,params_rnn_units_1,params_rnn_units_2,params_sa_dropout_p,params_scale,params_scaler,params_standardization_type,params_standardizer,params_stride_0,params_stride_1,params_support_weak,params_threshold,params_threshold_lambda,params_use_chirality_gcn,params_use_chirality_weave,params_use_edges_gcn,params_use_partial_charge_gcn,params_weight_gbr,params_weight_lr,params_weight_mlp,params_weight_rfr,params_weight_svr,params_weights_kneighbors_regressor,params_weights_radius_neighbors_regressor,state
58,58,,2024-01-22 13:44:59.095948,2024-01-22 13:53:36.791036,0 days 00:08:37.695088,rdk,,,,,,,,,,,,,,,,,,,,,,,,,,,,,,,,,,,,,,,,,,,,,,,,,,,,,aic,,,,,,,,,,,,,,,,,,,,,,,,select_from_model_fs,,,,,,,1024.0,,,,,,,,,,,,,,,,,,,,,,,,,,,,,,,,,,,,,,,,,,,,,,,,,,,,,,,,,,,,,,,,,,,,,,,,,,7.0,,,1.0,,,sklearn,,,,,,,,,,40.0,,,,,,,,,,,,,,,,,,,,,,,,,,,,,lasso_lars_ic_model,,,,,,,,,,simple_standardisation,custom_standardizer,,,,,,,,,,,,,,,,,FAIL
59,59,0.3670085858755431,2024-01-22 13:53:36.862454,2024-01-22 14:03:24.987150,0 days 00:09:48.124696,rdk,,,,,,,,,,,,,,,,,,,,,,,,,,0.8440393240665056,,,,,,,,,,,,,,,,,,,,,,,,,,,,,,,,,,,,,,,,,,,,,,,,,,,select_from_model_fs,,,,,,,1024.0,,,,,,,,,,,,,,,,,,,,,,,,,,,,,,,,,,,,,,,,,,,,,,,,,,,,,,,,,,,,,,,,,,,,,,,,,,7.0,,,1.0,,,sklearn,,,,,,,,,,106.0,,,,,,,,,,,,,,,,,,,,,,,,0.45635574717249183,,,,,tweedie_regressor_model,,,,,,,,,,simple_standardisation,custom_standardizer,,,,,,,,,,,,,,,,,COMPLETE
60,60,0.3537447100446536,2024-01-22 14:03:25.029652,2024-01-22 14:21:54.373985,0 days 00:18:29.344333,layered,,,,,,,,,,,,,,,,,,,,,,,,,,,,,,,,,,,,,,,,,,,,,,,,,,,,,,,,,,,,,,,,,,,,,,,,,,,,,boruta_algorithm,,,,,,,1024.0,,,,,,,,,,,,,,,,,,,,,,,,,,,,,,,,,,,,,,,,,,,,,,,,,,,,,,,,,,,,,,,,,,,,,5.0,,,,,,,1.0,,,,sklearn,,,,,,,,,,,,,,,,,,,,,,,,,,,,,,,,,,,,,,,stacking_regressor_model,,,,,,,,,,,chembl_standardizer,,,False,,,,,,,,,,,,,,COMPLETE
61,61,-inf,2024-01-22 14:21:54.409848,2024-01-22 14:26:55.467880,0 days 00:05:01.058032,,,,,,,,,,,,,,,,,,,,,,,,,,,,,,,,,,32.0,,,,,,256.0,,,,,,,,,,,,,,,,,,,,,,,,,,,,,,,,314.0,,,,,,,,,,,,,,,,,,,,,,,,,,,,,,,,,,,,,,,,,,,,,,,,,,,,,,,,,,,,,,,,,,,,,,,,,,,,,,,,,,,,,,,,,,,,chem_ception_model,deepchem,,,,,,,,,,,,,,,,,,,,,,,,,,,,,,,,,,,,,,,,,,,,,,,,,heavy_standardisation,custom_standardizer,,,,,,,,,,,,,,,,,COMPLETE
62,62,0.4055840050047559,2024-01-22 14:26:55.486463,2024-01-22 14:34:49.493123,0 days 00:07:54.006660,maccs,,,,,,,,,,,,,,,,,,0.6198528878688121,,,,,,,,,,,,,,,,,,,,,,,,,,,,,,,,,,,,,,,,,,,,,,,,,,,,,,,,,,,low_variance_fs,,,,,,,,,,,,,,,,,,,,,,,,,,,,,,,,,,,,,,,,,,,,,,,,,,,,,,,,,,,,,,,,,,,,,,,,,,,,,,,,,,,,,,,sklearn,,,,,,,,,,,,,,,,,,,,,,,,,,,,,,,,,,,,,,,lasso_model,,,,,,,,,,,basic_standardizer,,,,0.1283607722320983,,,,,,,,,,,,,COMPLETE
63,63,-inf,2024-01-22 14:34:49.509393,2024-01-22 14:39:49.696745,0 days 00:05:00.187352,layered,,,,,,,,,,,,,,,,,,,,,,,,,,,,,,,,,,,,,,,,,,,,,,,,,,,,,,,,,,,,,,,,,,,,,,,,,,,,,low_variance_fs,,,,,,,1024.0,,,,,,,,,,,,,,,,,,,,,,,,,,,,,,,,,,,,,,,,,,,,,,,,,,,,,,,,,,,,,,,,,,,,,6.0,,,,,,,1.0,,,,sklearn,,,,,,,,,,,,,,,,,,,,,,,,,,,,,,,,,,,,,,,ortogonal_matching_pursuit_model,,,,,,,,,,heavy_standardisation,custom_standardizer,,,,0.1359686737092889,,,,,,,,,,,,,COMPLETE
64,64,-inf,2024-01-22 14:39:49.746167,2024-01-22 14:40:05.054342,0 days 00:00:15.308175,,,keras_simple_rnn,,,,,,,,,,,,,,,,,,,,,,,,,,,,,,,,,,,,,,,,,,,,,,,,,,,,,,,tanh,0.2994028748927359,32.0,,,,,,,,,,,,,,,,,,,2D,,,,,,,,,,,,,,,,,,,,,,,,,,,,,,,,,,,,,,,,,,,,,,,,,,,,,,,,,,,,,,,,,,,,,,,,,,,,,,,,,,,,,,keras,,,,,,,,,,,,,,,,,,,,,,,,,,3.0,,,,,,,,,,,,,,0.4877790491764979,0.27184865888773213,0.3946115507630786,48.0,174.0,233.0,,,,,,,,,,,,,,,,,,,,,,COMPLETE
65,65,0.5515535381732543,2024-01-22 14:40:05.069938,2024-01-22 14:50:02.150372,0 days 00:09:57.080434,layered,,,,,,,,,,,,,,,,,,,,,,,,,,,,,,,,,,,,,,,,,,,,True,,,,,,,,,,absolute_error,,,,,,,,,,,,,,,,,,,,,,,low_variance_fs,,,,,,,1024.0,,,,,,,,,,,,,,,,,,,,,,,,,,,,,,,,,,,,,,,,,,,,,,,,,,,,,,,,,,,,,,,,,,,,,5.0,,,log2,,,,1.0,,,,sklearn,,,,,,,,,,,,,,,1000.0,,,,,,,,,,,,,,,,,,,,,,,,random_forest_regressor_model,,,,,,,,,,heavy_standardisation,custom_standardizer,,,,0.11612757822104626,,,,,,,,,,,,,COMPLETE
66,66,0.5375057320602644,2024-01-22 14:50:02.165752,2024-01-22 14:59:24.695883,0 days 00:09:22.530131,layered,,,,,,,,,,,,,,,,,,,,,,,,,,,,,,,,,,,,,,,,,,,,True,,,,,,,,,,absolute_error,,,,,,,,,,,,,,,,,,,,,,,low_variance_fs,,,,,,,1024.0,,,,,,,,,,,,,,,,,,,,,,,,,,,,,,,,,,,,,,,,,,,,,,,,,,,,,,,,,,,,,,,,,,,,,5.0,,,log2,,,,1.0,,,,sklearn,,,,,,,,,,,,,,,1000.0,,,,,,,,,,,,,,,,,,,,,,,,random_forest_regressor_model,,,,,,,,,,heavy_standardisation,custom_standardizer,,,,0.11640121174191236,,,,,,,,,,,,,COMPLETE
67,67,0.5360435649487251,2024-01-22 14:59:24.711567,2024-01-22 15:08:27.507746,0 days 00:09:02.796179,layered,,,,,,,,,,,,,,,,,,,,,,,,,,,,,,,,,,,,,,,,,,,,True,,,,,,,,,,absolute_error,,,,,,,,,,,,,,,,,,,,,,,low_variance_fs,,,,,,,1024.0,,,,,,,,,,,,,,,,,,,,,,,,,,,,,,,,,,,,,,,,,,,,,,,,,,,,,,,,,,,,,,,,,,,,,5.0,,,log2,,,,1.0,,,,sklearn,,,,,,,,,,,,,,,1000.0,,,,,,,,,,,,,,,,,,,,,,,,random_forest_regressor_model,,,,,,,,,,heavy_standardisation,custom_standardizer,,,,0.1491723155875149,,,,,,,,,,,,,COMPLETE
68,68,0.29241002997772964,2024-01-22 15:08:27.588113,2024-01-22 15:17:56.697816,0 days 00:09:29.109703,layered,,,,,,,,,,,,,,,,,,,,,,,,,,,,,,,,,,,,,,,,,,,,True,,,,,,,,,,absolute_error,,,,,,,,,,,,,,,,,,,,,,,k_best,,,,,,,1024.0,,,,,,,,,,,,,,,,,,,,,,,,,,,,,,25.0,,,,,,,,,,,,,,,,,,,,,,,,,,,,,,,,,,,,,,,5.0,,,log2,,,,1.0,,,,sklearn,,,,,,,,,,,,,,,1000.0,,,,,,,,,,,,,,,,,,,,,,,,random_forest_regressor_model,,,,,,,,,,heavy_standardisation,custom_standardizer,,,,,,,,,,,,,,,,,COMPLETE
69,69,0.2911546601193061,2024-01-22 15:17:56.730409,2024-01-22 15:27:24.007437,0 days 00:09:27.277028,layered,,,,,,,,,,,,,,,,,,,,,,,,,,,,,,,,,,,,,,,,,,,,,,,,,,,,,,,,,,,,,,,,,,,,,,,,,,,,,low_variance_fs,,,,,,,1024.0,,,,,,,,,,,,,,,,,,,,,,,,,,,,,,,,,,,,,,,,,,,,,,,,,,,,,,,,0.8470748373979022,,,square,,,,,,,,,,5.0,,,,,,,1.0,,,,sklearn,,,,,,,,,,,350.0,,,,,,,,,,,,,,,,,,,,,,,,,,,,ada_boost_regressor_model,,,,,,,,,,heavy_standardisation,custom_standardizer,,,,0.11806923512548467,,,,,,,,,,,,,COMPLETE
70,70,0.4333781248450445,2024-01-22 15:27:24.038716,2024-01-22 15:36:33.512049,0 days 00:09:09.473333,layered,,,,,,,,,,,,,,,,,,,,,,,,,,,,,,,,,,,,,,,,,,,,,,,,,,,,,,,,,,,,,,,,,,,,,,,,,,,,,pass_through_transformer,,,,,,,1024.0,,,,,,,,,,,,,,,,,,,,,,,,,,,,,,,,,,,,,,,,,,,,,,,,,,,,,,,,,,,,,,,,,,,,,5.0,,,,,,,1.0,,,,sklearn,,,,,,,,,,,,,,,,,,,,,,,,,,,,,,,,,,,,,,,decision_tree_regressor_model,,,,,,,,,,heavy_standardisation,custom_standardizer,,,,,,,,,,,,,,,,,COMPLETE
71,71,0.5063382788298758,2024-01-22 15:36:33.532443,2024-01-22 15:44:51.524312,0 days 00:08:17.991869,layered,,,,,,,,,,,,,,,,,,,,,,,,,,,,,,,,,,,,,,,,,,False,,,,,,,,,squared_error,,,,,,,,,,,,,,,,,,,,,,,,,,low_variance_fs,,,,,,,1024.0,,,,,,,,,,,,,,,,,,,,,,,,,,,,,,,,,,,,,,,,,,,,,,,,,,,,,,,,,,,,,,,,,,,,,6.0,log2,,,,,,1.0,,,,sklearn,,,,,,,,,,,,,500.0,,,,,,,,,,,,,,,,,,,,,,,,,,extra_trees_regressor_model,,,,,,,,,,heavy_standardisation,custom_standardizer,,,,0.12118514776013387,,,,,,,,,,,,,COMPLETE
72,72,-inf,2024-01-22 15:44:51.545623,2024-01-22 15:49:51.715298,0 days 00:05:00.169675,,,,,,,,,,,,,,,,,,,,,,,,,,,,,,,,,,,,,,,,16.0,,,,,,,,,,,,,,,,,,,,,,,,,0.0,,,,,,,987.0,,,,,,,,,,,,,,,,,,,,,,,,,,,,,,,,,,,,,,,,,,,,,,,,,,,,,,,,,,,,,,,,,,,,,,,,,,,,,,,,,,,,,,12.0,,,,,,pagtn_model,deepchem,,,,,,,,,,,,,,,,,,,,,,,,,,,,2.0,3.0,,,,,,,,,,,,,,,,,,,,heavy_standardisation,custom_standardizer,,,,,,,,,,,,,,,,,COMPLETE
73,73,0.20208373289494425,2024-01-22 15:49:51.749940,2024-01-22 15:59:18.861874,0 days 00:09:27.111934,atom_pair,,,,,,,,,,,,,,,,,,,,,,,,,,,,,,,,,,,,,,,,,,,,,,,,,,,,,aic,,,,,,,,,,,,,,,,,,,,,,,,percentil_fs,,,,,,,,,,,,,,,,,,,,,,,,,,,,,,,,,,,,,,,,,,,,,,,,,,,,,,,,,,,,,,,,,,,,,,,,,,,50.0,,,,,,,1.0,,,,,sklearn,2048.0,,,,,,,,,,,,,,,,,,,,,,,,,,,,,,,,9.0,,,,,,lasso_lars_ic_model,,,,,,,,,,heavy_standardisation,custom_standardizer,,,,,,,,,,,,,,,,,COMPLETE
74,74,-inf,2024-01-22 15:59:18.883763,2024-01-22 16:04:19.097159,0 days 00:05:00.213396,mixed,,,,0.7464517232675032,,,,,,,,,,,,,,,,,,,,,,,,,,,,,,,,,,,,,,,,,,,,,,,,,,,5.0,,,,,,,,,,,,,,,,,,,,morgan,2d_descriptors,boruta_algorithm,,,,,,,,,,0.33840962527117785,,,,,,,,,,,,,,,,,,,,,,,,,,,,rbf,,,,,,,,,,,,,,,,,,,,,,,,,,,,,,,,,,,,,,,,,,,,,,,,,sklearn,,,,,,,,,,,,,,,,,,,,,,,,,,,0.997129543752756,,,,,,,,,,,,nu_svr_model,,,,,,,,,,heavy_standardisation,custom_standardizer,,,True,,,,,,,,,,,,,,COMPLETE
75,75,0.04498637616331981,2024-01-22 16:04:19.128663,2024-01-22 16:13:44.327927,0 days 00:09:25.199264,layered,,,,,,,,,,,,,,,0.17769391860323647,,,,,,,,,,,,,,,,,,,,,,,,,,,,,,,,,,,,,,,,,,,,,,,,,,,,,,,,,,,,,,low_variance_fs,,,,,,,1024.0,,,,,,,,,,,,,,,,,,,,,,,,,,,,,,,,,,,,,,,,,,,,,,,,,,,,,,,,,,,,,,,,,,,,,5.0,,,,,,,2.0,,,,sklearn,,,,,,,,,,,,,,,,,,,,,,,,,,,,,,,,,,,,,,,gaussian_process_regressor_model,,,,,,,,,,simple_standardisation,custom_standardizer,,,,0.111229487865575,,,,,,,,,,,,,COMPLETE
76,76,0.13939217835763612,2024-01-22 16:13:44.360430,2024-01-22 16:29:22.332925,0 days 00:15:37.972495,mol2vec,,,,,,,,,,,,,,,,,,,,,,,,,,,,,,,,,,,,,,,,,,,,True,,,,,,,,,,absolute_error,,,,,,,,,,,,,,,,,,,,,,,low_variance_fs,,,,,,,,,,,,,,,,,,,,,,,,,,,,,,,,,,,,,,,,,,,,,,,,,,,,,,,,,,,,,,,,,,,,,,,,,,,,,,,log2,,,,,,,,sklearn,,,,,,,,,,,,,,,1000.0,,,,,,,,,,,,,,,,,,,,,,,,random_forest_regressor_model,,,,,,,,,,heavy_standardisation,custom_standardizer,,,,0.12682196618059235,,,,,,,,,,,,,COMPLETE
77,77,0.5677785438378287,2024-01-22 16:29:22.399922,2024-01-22 16:40:23.660377,0 days 00:11:01.260455,maccs,,,,,,,,,,,,,,,,,,,,,,,,,,,,,,,,,,,,,,,,,,,,True,,,,,,,,,,poisson,,,,,,,,,,,,,,,,,,,,,,,low_variance_fs,,,,,,,,,,,,,,,,,,,,,,,,,,,,,,,,,,,,,,,,,,,,,,,,,,,,,,,,,,,,,,,,,,,,,,,,,,,,,,,log2,,,,,,,,sklearn,,,,,,,,,,,,,,,1000.0,,,,,,,,,,,,,,,,,,,,,,,,random_forest_regressor_model,,,,,,,,,,,chembl_standardizer,,,,0.10855234591742334,,,,,,,,,,,,,COMPLETE
78,78,-inf,2024-01-22 16:40:23.689864,2024-01-22 16:41:38.493190,0 days 00:01:14.803326,2d_descriptors,,,,,,,,,,,,,,,,,,,,,,,,,,,,,,,,,,,,,,,,,,,,True,,,,,,,,,,poisson,,,,,,,,,,,,,,,,,,,,,,,low_variance_fs,,,,,,,,,,,,,,,,,,,,,,,,,,,,,,,,,,,,,,,,,,,,,,,,,,,,,,,,,,,,,,,,,,,,,,,,,,,,,,,log2,,,,,,,,sklearn,,,,,,,,,,,,,,,1000.0,,,,,,,,,,,,,,,,,,,,,,,,random_forest_regressor_model,,,,,,,,,min_max_scaler,,chembl_standardizer,,,,0.13218959053024093,,,,,,,,,,,,,COMPLETE
79,79,-inf,2024-01-22 16:41:38.518729,2024-01-22 16:46:45.941245,0 days 00:05:07.422516,morgan,,,,,,,,,,0.0026138363596176326,6.110467644057042e-08,,,,,,,,,,,,,,,,,,,,,,,,,,,,,,,,,,,,,,,,,,,,,,,,,,,,,,,,,,,,,,,,,,select_from_model_fs,,,,,,,,,,,,,,,,,,,,,,,,,,,,,,,,,,,,,,,,,,,,,,,,,,,,,,,1.5627986341513659e-06,,0.024755204973270634,,,,,,,,,,,,,,,,,,,,,,,,,,,,,,sklearn,,,,2048.0,,,,,,992.0,,,,,,,,,,,,,,,,,,,,,,,,,,,6.0,,ard_regression_model,,,,,,,,,,,chembl_standardizer,,,,,0.18316924452644706,,,,,,,,,,,,COMPLETE
80,80,-inf,2024-01-22 16:46:46.206133,2024-01-22 16:46:46.682407,0 days 00:00:00.476274,layered,keras_dense,,,,,,,,,,,,,,,,,,,,,,,,,,,,,,,,,True,True,False,False,True,,,,,,,,,,,,,,,,,,,,,,,,,,,,,,,,,,,,,,,,1D,,,,,,1024.0,,,,,,,,,,,,,,tanh,relu,tanh,tanh,relu,0.7326217029676829,0.026129664644133854,0.7996728375702656,0.20300248355931916,0.5784377468986289,,8.0,18.0,62.0,45.0,24.0,,,,,,,1.9860577779312034e-06,1.573363481411513e-06,9.875436589879124e-05,6.221397909492564e-05,0.0009154725693692229,,,0.009659017375473769,2.825160800136257e-05,3.046304046163111e-06,5.6794400951346525e-05,0.00812405879359594,,,,,,,,,,,,,,,,,,,,,,5.0,,,,,,,1.0,,,,keras,,,,,,,,,,,,,,,,,,,,5.0,,,,,,,,,,,,,,,,,,,,,,,,,,,,,,,,,,,,,,,,,,,,,,,COMPLETE
81,81,0.11686685328602257,2024-01-22 16:46:46.705402,2024-01-22 16:57:37.900656,0 days 00:10:51.195254,rdk,,,,,,,,,,,,,,,,,,,,,,,,,,,,,,,svr,,,,,,,,,,True,,True,,,,,,,,,,,,,,,,,,,,,,,,,,,,,,,,,,low_variance_fs,,,,,,,1024.0,,,,,,,,,,,,,,,,,,,,,,,,,,,,,,,,,,,,,,,,,,,,,,,,,,,,,,,,,,,,,,,,,,,,,,,,,,10.0,,,3.0,,,sklearn,,,,,,,,,,,,100.0,,,,,,,,,,,,,,,,,,,,,,,,,,,bagging_regressor_model,,,,,,,,,,,chembl_standardizer,,,,0.11650787809000174,,,,,,,,,,,,,COMPLETE
82,82,-inf,2024-01-22 16:57:37.926852,2024-01-22 17:02:46.070987,0 days 00:05:08.144135,layered,,,,,,,,,,,,,,,,,,,,,,0.03606408994366883,,,,,,,,,,,,,,,,,,,,,,,,,,,,,,,,,,,,,,,,,,,,,,,,,,,,,,,low_variance_fs,,,,,,,1024.0,,,,,,,,,,,,,,,,,,,,,,,,,,,,,,,,,,,,,,,,,,,,,,,,,,,,,,,,,,,,,,,,,,,,,6.0,,,,,,,2.0,,,,sklearn,,,,,,,,,,,,,,,,,,,,,,,,,,,,,,,,,,,,0.19918215846719506,,,quantile_regressor_model,,,,,,,,,,,chembl_standardizer,,,,0.11911364764317382,,,,,,,,,,,,,COMPLETE
83,83,0.5808321343448366,2024-01-22 17:02:46.114980,2024-01-22 17:13:01.591745,0 days 00:10:15.476765,maccs,,,,,,,,,,,,,,,,,,,,,,,,,,,,,,,,,,,,,,,,,,,,True,,,,,,,,,,poisson,,,,,,,,,,,,,,,,,,,,,,,low_variance_fs,,,,,,,,,,,,,,,,,,,,,,,,,,,,,,,,,,,,,,,,,,,,,,,,,,,,,,,,,,,,,,,,,,,,,,,,,,,,,,,log2,,,,,,,,sklearn,,,,,,,,,,,,,,,900.0,,,,,,,,,,,,,,,,,,,,,,,,random_forest_regressor_model,,,,,,,,,,heavy_standardisation,custom_standardizer,,,,0.10828457607276741,,,,,,,,,,,,,COMPLETE
84,84,0.5803867526727549,2024-01-22 17:13:01.614484,2024-01-22 17:23:22.466672,0 days 00:10:20.852188,maccs,,,,,,,,kd_tree,,,,,,,,,,,,,,,,,,,,,,,,,,,,,,,,,,,,,,,,,,,,,,,,,,,,,,,,,,,,,,,,,,,,,low_variance_fs,,,,,,,,,,,,,,,,,,,,,,,,,,,,,,,,,,,,,,,,,,,,,,,,,,,,,,,,,,,,,2.0,,,,,,,,,,,,,,,,,,,,,,,,,,sklearn,,,,,,,,,,,,,,,,,,,,,,,,10.0,,,,,,,6.0,,,,,,,,kneighbors_regressor_model,,,,,,,,,,heavy_standardisation,custom_standardizer,,,,0.10750702422134592,,,,,,,,,,,uniform,,COMPLETE
85,85,-inf,2024-01-22 17:23:22.487004,2024-01-22 17:28:22.716441,0 days 00:05:00.229437,maccs,,,,,,,,,,,,,,,,,,,,,,,,,,,,,,,,,,,,,,,,,,,,,,,,,,,,,,,,,,,,,,,,,,,,,,,,,,,,,low_variance_fs,,,,,,,,,,,,,,,,,,,,,,,,,,,,,,,,,,,,,,,,,,,,,,,,,,,,,,,,,,,,,,,,,0.011719141206703976,,,poisson,,,,,,,,,,,,,,,,,,,sklearn,,,,,,,,,,,,,,,,,,,,,,,,,,,,,,,,,,,,,,,hist_gradient_boosting_regressor_model,,,,,,,,,,heavy_standardisation,custom_standardizer,,,,0.10605507580051102,,,,,,,,,,,,,COMPLETE
86,86,0.5809547025189007,2024-01-22 17:28:22.967788,2024-01-22 17:39:07.705128,0 days 00:10:44.737340,maccs,,,,,,,,kd_tree,,,,,,,,,,,,,,,,,,,,,,,,,,,,,,,,,,,,,,,,,,,,,,,,,,,,,,,,,,,,,,,,,,,,,low_variance_fs,,,,,,,,,,,,,,,,,,,,,,,,,,,,,,,,,,,,,,,,,,,,,,,,,,,,,,,,,,,,,2.0,,,,,,,,,,,,,,,,,,,,,,,,,,sklearn,,,,,,,,,,,,,,,,,,,,,,,,10.0,,,,,,,6.0,,,,,,,,kneighbors_regressor_model,,,,,,,,,,heavy_standardisation,custom_standardizer,,,,0.10901824718729658,,,,,,,,,,,uniform,,COMPLETE
87,87,0.5980698305207366,2024-01-22 17:39:07.728171,2024-01-22 17:50:19.955172,0 days 00:11:12.227001,maccs,,,,,,,,kd_tree,,,,,,,,,,,,,,,,,,,,,,,,,,,,,,,,,,,,,,,,,,,,,,,,,,,,,,,,,,,,,,,,,,,,,low_variance_fs,,,,,,,,,,,,,,,,,,,,,,,,,,,,,,,,,,,,,,,,,,,,,,,,,,,,,,,,,,,,,2.0,,,,,,,,,,,,,,,,,,,,,,,,,,sklearn,,,,,,,,,,,,,,,,,,,,,,,,10.0,,,,,,,6.0,,,,,,,,kneighbors_regressor_model,,,,,,,,,,heavy_standardisation,custom_standardizer,,,,0.0930281377765041,,,,,,,,,,,uniform,,COMPLETE
88,88,0.5804293440447352,2024-01-22 17:50:19.983620,2024-01-22 18:01:43.823668,0 days 00:11:23.840048,maccs,,,,,,,,kd_tree,,,,,,,,,,,,,,,,,,,,,,,,,,,,,,,,,,,,,,,,,,,,,,,,,,,,,,,,,,,,,,,,,,,,,low_variance_fs,,,,,,,,,,,,,,,,,,,,,,,,,,,,,,,,,,,,,,,,,,,,,,,,,,,,,,,,,,,,,2.0,,,,,,,,,,,,,,,,,,,,,,,,,,sklearn,,,,,,,,,,,,,,,,,,,,,,,,10.0,,,,,,,6.0,,,,,,,,kneighbors_regressor_model,,,,,,,,,,heavy_standardisation,custom_standardizer,,,,0.08716574718716619,,,,,,,,,,,uniform,,COMPLETE
89,89,0.5753433560884277,2024-01-22 18:01:43.847499,2024-01-22 18:12:13.426894,0 days 00:10:29.579395,maccs,,,,,,,,kd_tree,,,,,,,,,,,,,,,,,,,,,,,,,,,,,,,,,,,,,,,,,,,,,,,,,,,,,,,,,,,,,,,,,,,,,low_variance_fs,,,,,,,,,,,,,,,,,,,,,,,,,,,,,,,,,,,,,,,,,,,,,,,,,,,,,,,,,,,,,2.0,,,,,,,,,,,,,,,,,,,,,,,,,,sklearn,,,,,,,,,,,,,,,,,,,,,,,,10.0,,,,,,,6.0,,,,,,,,kneighbors_regressor_model,,,,,,,,,,heavy_standardisation,custom_standardizer,,,,0.08660074273526455,,,,,,,,,,,uniform,,COMPLETE
90,90,0.5868741389855127,2024-01-22 18:12:13.448426,2024-01-22 18:22:28.159039,0 days 00:10:14.710613,maccs,,,,,,,,kd_tree,,,,,,,,,,,,,,,,,,,,,,,,,,,,,,,,,,,,,,,,,,,,,,,,,,,,,,,,,,,,,,,,,,,,,low_variance_fs,,,,,,,,,,,,,,,,,,,,,,,,,,,,,,,,,,,,,,,,,,,,,,,,,,,,,,,,,,,,,2.0,,,,,,,,,,,,,,,,,,,,,,,,,,sklearn,,,,,,,,,,,,,,,,,,,,,,,,10.0,,,,,,,6.0,,,,,,,,kneighbors_regressor_model,,,,,,,,,,heavy_standardisation,custom_standardizer,,,,0.08549391329098467,,,,,,,,,,,uniform,,COMPLETE
91,91,0.5804293440447352,2024-01-22 18:22:28.182008,2024-01-22 18:33:23.346835,0 days 00:10:55.164827,maccs,,,,,,,,kd_tree,,,,,,,,,,,,,,,,,,,,,,,,,,,,,,,,,,,,,,,,,,,,,,,,,,,,,,,,,,,,,,,,,,,,,low_variance_fs,,,,,,,,,,,,,,,,,,,,,,,,,,,,,,,,,,,,,,,,,,,,,,,,,,,,,,,,,,,,,2.0,,,,,,,,,,,,,,,,,,,,,,,,,,sklearn,,,,,,,,,,,,,,,,,,,,,,,,10.0,,,,,,,6.0,,,,,,,,kneighbors_regressor_model,,,,,,,,,,heavy_standardisation,custom_standardizer,,,,0.08753271144127384,,,,,,,,,,,uniform,,COMPLETE
