,number,value,datetime_start,datetime_complete,duration,params_1D_featurizer,params_1d_model,params_2d_model,params_C_linear_svc,params_activation_mlp_classifier,params_agg_modes,params_algorithm_ada_boost_classifier,params_alpha_bernoulli_nb,params_alpha_mlp_classifier,params_alpha_ridge_classifier,params_base_estimator_bagging_classifier,params_base_filters,params_batch_normalization_0,params_batch_normalization_1,params_batch_normalization_2,params_batch_size_1d_conv,params_batch_size_bi_rnn,params_batch_size_deepchem,params_batch_size_fcnn,params_batch_size_rnn,params_batch_size_simple_rnn,params_batchnorm,params_bootstrap_bagging_classifier,params_bootstrap_extra_trees_classifier,params_bootstrap_features,params_classification_model,params_conv_activation_0,params_conv_activation_1,params_conv_activation_2,params_conv_batch_norm_0,params_conv_batch_norm_1,params_conv_batch_norm_2,params_conv_dropout_0,params_conv_dropout_1,params_conv_dropout_2,params_criterion_extra_trees_classifier,params_degree_one_class_svm,params_dense_activation,params_dense_dropout,params_dense_layer_size,params_dense_units,params_depth_dmpnn,params_dropout,params_dropout_attentive_fp,params_dropout_dag,params_dropout_gat,params_dropout_gcn,params_dropout_graph_conv,params_dropout_pagtn,params_dropout_text_cnn,params_dropouts_weave,params_embedding_dim,params_embedding_output_dim,params_epochs_1d_conv,params_epochs_bi_rnn,params_epochs_deepchem,params_epochs_fcnn,params_epochs_rnn,params_epochs_simple_rnn,params_f1,params_f2,params_feature_selector,params_featurizer_type,params_filter_0,params_filter_1,params_filter_2,params_filters,params_fnn_dropout_p,params_fnn_layers,params_fpSize,params_g_noise,params_gamma_one_class_svm,params_graph_conv_layers_conv_model,params_graph_conv_layers_gcn,params_graph_feat_size_attentive_fp,params_gru_dropout_0,params_gru_dropout_1,params_gru_dropout_2,params_gru_units_0,params_gru_units_1,params_gru_units_2,params_hidden_activation_0,params_hidden_activation_1,params_hidden_activation_2,params_hidden_dropout_0,params_hidden_dropout_1,params_hidden_dropout_2,params_hidden_layer_sizes_mlp_classifier,params_hidden_layer_units_0,params_hidden_layer_units_1,params_hidden_layer_units_2,params_k,params_kernel_one_class_svm,params_kernel_size_0,params_kernel_size_1,params_kernel_size_2,params_kernel_size_smiles_to_vec,params_l1_0,params_l1_1,params_l1_2,params_l2_0,params_l2_1,params_l2_2,params_layer_sizes_dag,params_layer_sizes_gather,params_learning_rate_ada_boost_classifier,params_learning_rate_hist_gradient_boosting_classifier,params_lstm_dropout_0,params_lstm_dropout_1,params_lstm_dropout_2,params_lstm_units_0,params_lstm_units_1,params_lstm_units_2,params_master_atom,params_maxLength,params_maxPath,params_max_features_extra_trees_classifier,params_max_length_pagtn,params_max_path,params_metric,params_minLength,params_minPath,params_min_path,params_model_steps,params_model_type,params_nBits,params_n_attention_heads,params_n_attention_layers,params_n_bits,params_n_conv_layers,params_n_embedding_text_cnn,params_n_estimators,params_n_estimators_ada_boost_classifier,params_n_estimators_bagging_classifier,params_n_estimators_extra_trees_classifier,params_n_graph_feat_dag,params_n_graph_feat_weave,params_n_gru_layers,params_n_hidden_layers,params_n_hidden_weave,params_n_lstm_layers,params_n_rnn_layers,params_nu_one_class_svm,params_num_heads,params_num_layers_attentive_fp,params_num_layers_pagtn,params_percentile,params_predictor_dropout_gat,params_predictor_dropout_gcn,params_radius,params_rnn_dropouts_0,params_rnn_dropouts_1,params_rnn_dropouts_2,params_rnn_units_0,params_rnn_units_1,params_rnn_units_2,params_scaler,params_solver,params_standardization_type,params_standardizer,params_stride_0,params_stride_1,params_stride_2,params_strides,params_support_weak,params_threshold,params_use_chirality_attentive_fp,params_use_chirality_gat,params_use_chirality_gcn,params_use_chirality_graph_conv,params_use_chirality_weave,params_use_edges_gat,params_use_edges_gcn,params_use_partial_charge_attentive_fp,params_use_partial_charge_gat,params_use_partial_charge_gcn,params_weight_gbr,params_weight_lr,params_weight_mlp,params_weight_rfr,params_weight_svc,params_with_mean,params_with_std,state
34,34,0.6825241918623856,2023-12-29 10:34:12.346002,2023-12-29 11:09:20.271907,0 days 00:35:07.925905,,,,,,,,,,,,,,,,,,64.0,,,,,,,,,,,,,,,,,,,,,,,,2.0,,,,,,,,,,,,,,412.0,,,,,,,,,,,,0.0,3.0,,,,,,,,,,,,,,,,,,,,,,,,,,,,,,,,,,,,,,,,,,,,,,,,,,,,,,,dmpnn_model,deepchem,,,,,,,,,,,,,,,,,,,,,,,,,,,,,,,,,,,pass_through_standardizer,,,,,,,,,,,,,,,,,,,,,,,,COMPLETE
35,35,0.734859453781443,2023-12-29 11:09:20.294748,2023-12-29 11:31:19.500551,0 days 00:21:59.205803,,,,,,,,,,,,,,,,,,64.0,,,,,,,,,,,,,,,,,,,,,,,,3.0,,,,,,,,,,,,,,236.0,,,,,,,,,,,,0.0,3.0,,,,,,,,,,,,,,,,,,,,,,,,,,,,,,,,,,,,,,,,,,,,,,,,,,,,,,,dmpnn_model,deepchem,,,,,,,,,,,,,,,,,,,,,,,,,,,,,,,,,,,pass_through_standardizer,,,,,,,,,,,,,,,,,,,,,,,,COMPLETE
36,36,0.7461774042219711,2023-12-29 11:31:19.521926,2023-12-29 11:54:14.460568,0 days 00:22:54.938642,,,,,,,,,,,,,,,,,,64.0,,,,,,,,,,,,,,,,,,,,,,,,3.0,,,,,,,,,,,,,,233.0,,,,,,,,,,,,0.0,3.0,,,,,,,,,,,,,,,,,,,,,,,,,,,,,,,,,,,,,,,,,,,,,,,,,,,,,,,dmpnn_model,deepchem,,,,,,,,,,,,,,,,,,,,,,,,,,,,,,,,,,,pass_through_standardizer,,,,,,,,,,,,,,,,,,,,,,,,COMPLETE
37,37,0.7119294003047896,2023-12-29 11:54:14.482624,2023-12-29 12:22:05.171424,0 days 00:27:50.688800,,,,,,,,,,,,,,,,,,64.0,,,,,,,,,,,,,,,,,,,,,,,,2.0,,,,,,,,,,,,,,315.0,,,,,,,,,,,,0.0,2.0,,,,,,,,,,,,,,,,,,,,,,,,,,,,,,,,,,,,,,,,,,,,,,,,,,,,,,,dmpnn_model,deepchem,,,,,,,,,,,,,,,,,,,,,,,,,,,,,,,,,,,pass_through_standardizer,,,,,,,,,,,,,,,,,,,,,,,,COMPLETE
38,38,0.7040404607300383,2023-12-29 12:22:05.219781,2023-12-29 12:59:49.230065,0 days 00:37:44.010284,,,,,,,,,,,,,,,,,,64.0,,,,,,,,,,,,,,,,,,,,,,,,3.0,,,,,,,,,,,,,,402.0,,,,,,,,,,,,0.0,2.0,,,,,,,,,,,,,,,,,,,,,,,,,,,,,,,,,,,,,,,,,,,,,,,,,,,,,,,dmpnn_model,deepchem,,,,,,,,,,,,,,,,,,,,,,,,,,,,,,,,,,,pass_through_standardizer,,,,,,,,,,,,,,,,,,,,,,,,COMPLETE
39,39,0.714425172834286,2023-12-29 12:59:49.255818,2023-12-29 13:05:53.970009,0 days 00:06:04.714191,,,,,,,,,,,,,,,,,,32.0,,,,,,,,,,,,,,,,,,,,,,,,,,,,,,,,0.5,,,,,,188.0,,,,,,,,,,,,,,,,,,,,,,,,,,,,,,,,,,,,,,,,,,,,,,,,,,,,,,,,,,,,,,,,,,,,text_cnn_model,deepchem,,,,,,50.0,,,,,,,,,,,,,,,,,,,,,,,,,,,,,pass_through_standardizer,,,,,,,,,,,,,,,,,,,,,,,,COMPLETE
40,40,-inf,2023-12-29 13:05:53.989657,2023-12-29 14:05:54.203820,0 days 01:00:00.214163,,,,,,,,,,,,,,,,,,16.0,,,,,,,,,,,,,,,,,,,,,,,,,,,,,,,0.5,,,,,,,296.0,,,,,,,,,,,,,,,,,,,,,,,,,,,,,,,,,,,,,,,,,,,,,,,,,,,,,,,,,,,,,,20.0,,,,,,pagtn_model,deepchem,,,,,,,,,,,,,,,,,,,2.0,,2.0,,,,,,,,,,,,,simple_standardisation,custom_standardizer,,,,,,,,,,,,,,,,,,,,,,,,COMPLETE
41,41,0.7118479000021118,2023-12-29 14:05:54.232952,2023-12-29 14:32:18.407717,0 days 00:26:24.174765,,,,,,,,,,,,,,,,,,64.0,,,,,,,,,,,,,,,,,,,,,,,,3.0,,,,,,,,,,,,,,216.0,,,,,,,,,,,,0.0,3.0,,,,,,,,,,,,,,,,,,,,,,,,,,,,,,,,,,,,,,,,,,,,,,,,,,,,,,,dmpnn_model,deepchem,,,,,,,,,,,,,,,,,,,,,,,,,,,,,,,,,,,pass_through_standardizer,,,,,,,,,,,,,,,,,,,,,,,,COMPLETE
42,42,0.6919698744849929,2023-12-29 14:32:18.432386,2023-12-29 15:03:22.488241,0 days 00:31:04.055855,,,,,,,,,,,,,,,,,,64.0,,,,,,,,,,,,,,,,,,,,,,,,3.0,,,,,,,,,,,,,,270.0,,,,,,,,,,,,0.25,3.0,,,,,,,,,,,,,,,,,,,,,,,,,,,,,,,,,,,,,,,,,,,,,,,,,,,,,,,dmpnn_model,deepchem,,,,,,,,,,,,,,,,,,,,,,,,,,,,,,,,,,,pass_through_standardizer,,,,,,,,,,,,,,,,,,,,,,,,COMPLETE
43,43,0.7264284726809576,2023-12-29 15:03:22.586618,2023-12-29 15:22:15.941423,0 days 00:18:53.354805,,,,,,,,,,,,,,,,,,64.0,,,,,,,,,,,,,,,,,,,,,,,,4.0,,,,,,,,,,,,,,171.0,,,,,,,,,,,,0.0,3.0,,,,,,,,,,,,,,,,,,,,,,,,,,,,,,,,,,,,,,,,,,,,,,,,,,,,,,,dmpnn_model,deepchem,,,,,,,,,,,,,,,,,,,,,,,,,,,,,,,,,,,pass_through_standardizer,,,,,,,,,,,,,,,,,,,,,,,,COMPLETE
44,44,0.6937750994486065,2023-12-29 15:22:15.960948,2023-12-29 15:36:01.569362,0 days 00:13:45.608414,,,,,,,,,,,,,,,,,,128.0,,,,,,,,,,,,,,,,,,,,,,,,,,,,,,,,,,64.0,,,,384.0,,,,,,,,,,,128.0,,,,,,,,,,,,,,,,,,,,,,,,,,,,,,5.0,,,,,,,,,,,,,,,,,,,,,,,,,,,smiles_to_vec_model,deepchem,,,,,,,,,,,,,,,,,,,,,,,,,,,,,,,,,,,pass_through_standardizer,,,,1.0,,,,,,,,,,,,,,,,,,,,COMPLETE
45,45,-inf,2023-12-29 15:36:01.678938,2023-12-29 16:36:01.795433,0 days 01:00:00.116495,,,,,,,,,,,,,,,,,,8.0,,,,,,,,,,,,,,,,,,,,,,256.0,,,,,,,,0.0,,,,,,,,485.0,,,,,,,,,,,,,,,,,"[64, 64]",,,,,,,,,,,,,,,,,,,,,,,,,,,,,,,,,,,,,,,,,True,,,,,,,,,,graph_conv_model,deepchem,,,,,,,,,,,,,,,,,,,,,,,,,,,,,,,,,,,basic_standardizer,,,,,,,,,,False,,,,,,,,,,,,,,COMPLETE
46,46,-inf,2023-12-29 16:36:01.830309,2023-12-29 17:36:02.173755,0 days 01:00:00.343446,,,,,,,,,,,,,,,,,,64.0,,,,False,,,,,,,,,,,,,,,,,,,,,,,,,0.5,,,,,,,,,260.0,,,,,,,,,,,,,,,,,,"[64, 64]",,,,,,,,,,,,,,,,,,,,,,,,,,,,,,,,,,,,,,,,,,,,,,,,,,gcn_model,deepchem,,,,,,,,,,,,,,,,,,,,,,,,0.5,,,,,,,,,,,pass_through_standardizer,,,,,,,,,True,,,,True,,,False,,,,,,,,COMPLETE
47,47,0.7114244491604522,2023-12-29 17:36:02.227715,2023-12-29 18:30:08.247938,0 days 00:54:06.020223,,,,,,,,,,,,,,,,,,64.0,,,,,,,,,,,,,,,,,,,,,,,,2.0,,,,,,,,,,,,,,594.0,,,,,,,,,,,,0.0,3.0,,,,,,,,,,,,,,,,,,,,,,,,,,,,,,,,,,,,,,,,,,,,,,,,,,,,,,,dmpnn_model,deepchem,,,,,,,,,,,,,,,,,,,,,,,,,,,,,,,,,,,pass_through_standardizer,,,,,,,,,,,,,,,,,,,,,,,,COMPLETE
48,48,0.6869437161511447,2023-12-29 18:30:08.269608,2023-12-29 18:59:36.715626,0 days 00:29:28.446018,,,,,,['flatten'],,,,,,,,,,,,64.0,,,,,,,,,,,,,,,,,,,,,,,,,,,,0.0,,,,,,,,,,339.0,,,,,,,,,,,,,,,,,,,,,,,,,,,,,,,,,,,,,,,,,,,,,,,,,,,,,,,,,,,,,,,,,,,,gat_model,deepchem,,10.0,,,,,,,,,,,,,,,,,,,,,0.0,,,,,,,,,,,,pass_through_standardizer,,,,,,,,True,,,,True,,,True,,,,,,,,,COMPLETE
49,49,-inf,2023-12-29 18:59:36.735522,2023-12-29 18:59:36.838438,0 days 00:00:00.102916,2d_descriptors,keras_tabular_transformer,,,,,,,,,,,,,,,,,,,,,,,,,,,,,,,,,,,,,,,,,,,,,,,,,,,16.0,,,,,,,,,,1D,,,,,,,,,,,,,,,,,,,,,,,,,,,,,,,,,,,,,,,,,,,,,,,,,,,,,,,,,,,,,,keras,,,4.0,,,,,,,,,,,,,,,,,,,,,,,,,,,,,standard_scaler,,,,,,,,,,,,,,,,,,,,,,,,,False,True,COMPLETE
50,50,0.7274677446443791,2023-12-29 18:59:36.856240,2023-12-29 20:18:07.565999,0 days 01:18:30.709759,,,,,,,,,,,,,,,,,,32.0,,,,,,,,,,,,,,,,,,,,,,,,,,,0.0,,,,,,,,,,,439.0,,,,,,,,,,,,,,,,,,,,,,,,,,,,,,,,,,,,,,,,,,,,,,,,[50],[500],,,,,,,,,,,,,,,,,,,dag_model,deepchem,,,,,,,,,,,128.0,,,,,,,,,,,,,,,,,,,,,,,,basic_standardizer,,,,,,,,,,,,,,,,,,,,,,,,COMPLETE
51,51,-inf,2023-12-29 20:18:07.587886,2023-12-29 21:18:07.816288,0 days 01:00:00.228402,,,,,,,,,,,,,,,,,,32.0,,,,,,,,,,,,,,,,,,,,,,,,,,,0.0,,,,,,,,,,,464.0,,,,,,,,,,,,,,,,,,,,,,,,,,,,,,,,,,,,,,,,,,,,,,,,[50],[500],,,,,,,,,,,,,,,,,,,dag_model,deepchem,,,,,,,,,,,128.0,,,,,,,,,,,,,,,,,,,,,,,,basic_standardizer,,,,,,,,,,,,,,,,,,,,,,,,COMPLETE
52,52,0.703695912308447,2023-12-29 21:18:07.856064,2023-12-29 22:57:22.037111,0 days 01:39:14.181047,,,,,,,,,,,,,,,,,,32.0,,,,,,,,,,,,,,,,,,,,,,,,,,,0.0,,,,,,,,,,,414.0,,,,,,,,,,,,,,,,,,,,,,,,,,,,,,,,,,,,,,,,,,,,,,,,[50],[50],,,,,,,,,,,,,,,,,,,dag_model,deepchem,,,,,,,,,,,128.0,,,,,,,,,,,,,,,,,,,,,,,,basic_standardizer,,,,,,,,,,,,,,,,,,,,,,,,COMPLETE
53,53,-inf,2023-12-29 22:57:22.072376,2023-12-29 23:59:52.541631,0 days 01:02:30.469255,,,,,,,,,,,,,,,,,,32.0,,,,,,,,,,,,,,,,,,,,,,,,,,,,,,,,,0.0,,,,,259.0,,,,,,,,,,,,,,,,,,,,,,,,,,,,,,,,,,,,,,,,,,,,,,,,,,,,,,,,,,,,,,,,,,,,weave_model,deepchem,,,,,,,,,,,,256.0,,,50.0,,,,,,,,,,,,,,,,,,,,basic_standardizer,,,,,,,,,,,False,,,,,,,,,,,,,COMPLETE
54,54,-inf,2023-12-29 23:59:52.569780,2023-12-30 00:59:52.719827,0 days 01:00:00.150047,,,,,,,,,,,,,,,,,,256.0,,,,,,,,,,,,,,,,,,,,,,,,,,0.5,,,,,,,,,,,,561.0,,,,,,,,,,,,,,,,,,,500.0,,,,,,,,,,,,,,,,,,,,,,,,,,,,,,,,,,,,,,,,,,,,,,,,,attentive_fp_model,deepchem,,,,,,,,,,,,,,,,,,,,1.0,,,,,,,,,,,,,,,basic_standardizer,,,,,,,False,,,,,,,False,,,,,,,,,,COMPLETE
55,55,-inf,2023-12-30 00:59:52.769921,2023-12-30 01:39:41.782771,0 days 00:39:49.012850,,,,,,,,,,,,32.0,,,,,,64.0,,,,,,,,,,,,,,,,,,,,,,,,,,,,,,,,,,,,,,158.0,,,,,,,,,,,,,,,,,,,,,,,,,,,,,,,,,,,,,,,,,,,,,,,,,,,,,,,,,,,,,,,,,,,,chem_ception_model,deepchem,,,,,,,,,,,,,,,,,,,,,,,,,,,,,,,,,,heavy_standardisation,custom_standardizer,,,,,,,,,,,,,,,,,,,,,,,,COMPLETE
56,56,0.71684321578698,2023-12-30 01:39:41.816963,2023-12-30 02:13:44.495767,0 days 00:34:02.678804,,,,,,,,,,,,,,,,,,64.0,,,,,,,,,,,,,,,,,,,,,,,,3.0,,,,,,,,,,,,,,230.0,,,,,,,,,,,,0.25,2.0,,,,,,,,,,,,,,,,,,,,,,,,,,,,,,,,,,,,,,,,,,,,,,,,,,,,,,,dmpnn_model,deepchem,,,,,,,,,,,,,,,,,,,,,,,,,,,,,,,,,,,pass_through_standardizer,,,,,,,,,,,,,,,,,,,,,,,,COMPLETE
57,57,0.7336867722323975,2023-12-30 02:13:44.552564,2023-12-30 02:58:50.343902,0 days 00:45:05.791338,,,,,,,,,,,,,,,,,,256.0,,,,,,,,,,,,,,,,,,,,,,,,,,,0.5,,,,,,,,,,,366.0,,,,,,,,,,,,,,,,,,,,,,,,,,,,,,,,,,,,,,,,,,,,,,,,[100],[500],,,,,,,,,,,,,,,,,,,dag_model,deepchem,,,,,,,,,,,64.0,,,,,,,,,,,,,,,,,,,,,,,,pass_through_standardizer,,,,,,,,,,,,,,,,,,,,,,,,COMPLETE
58,58,0.7024949820130172,2023-12-30 02:58:50.422341,2023-12-30 03:04:01.592345,0 days 00:05:11.170004,,,,,,,,,,,,,,,,,,256.0,,,,,,,,,,,,,,,,,,,,,,,,,,,,,,,,0.0,,,,,,360.0,,,,,,,,,,,,,,,,,,,,,,,,,,,,,,,,,,,,,,,,,,,,,,,,,,,,,,,,,,,,,,,,,,,,text_cnn_model,deepchem,,,,,,75.0,,,,,,,,,,,,,,,,,,,,,,,,,,,,,pass_through_standardizer,,,,,,,,,,,,,,,,,,,,,,,,COMPLETE
59,59,0.6097751980889994,2023-12-30 03:04:01.612873,2023-12-30 04:02:01.829965,0 days 00:58:00.217092,,,keras_bidirectional_rnn,,,,,,,,,,,,,,256.0,,,,,,,,,,,,,,,,,,,,,relu,0.14194092319541501,,144.0,,,,,,,,,,,,,,1000.0,,,,,,,,2D,,,,,,,,,,,,,0.25597580469070164,0.48300909986794566,0.48967680408378733,20.0,16.0,247.0,,,,,,,,,,,,,,,,,,,,,,,,,,,0.0859954794982955,,,178.0,,,,,,,,,,,,,,keras,,,,,,,,,,,,,3.0,,,1.0,,,,,,,,,,,,,,,,,,,pass_through_standardizer,,,,,,,,,,,,,,,,,,,,,,,,COMPLETE
60,60,0.7244401621351164,2023-12-30 04:02:01.863830,2023-12-30 04:36:12.739069,0 days 00:34:10.875239,,,,,,,,,,,,,,,,,,256.0,,,,,,,,,,,,,,,,,,,,,,,,2.0,,,,,,,,,,,,,,297.0,,,,,,,,,,,,0.0,3.0,,,,,,,,,,,,,,,,,,,,,,,,,,,,,,,,,,,,,,,,,,,,,,,,,,,,,,,dmpnn_model,deepchem,,,,,,,,,,,,,,,,,,,,,,,,,,,,,,,,,,,pass_through_standardizer,,,,,,,,,,,,,,,,,,,,,,,,COMPLETE
61,61,0.7225965237657908,2023-12-30 04:36:12.761028,2023-12-30 05:27:29.040500,0 days 00:51:16.279472,,,,,,,,,,,,,,,,,,256.0,,,,,,,,,,,,,,,,,,,,,,,,,,,0.5,,,,,,,,,,,456.0,,,,,,,,,,,,,,,,,,,,,,,,,,,,,,,,,,,,,,,,,,,,,,,,[100],[500],,,,,,,,,,,,,,,,,,,dag_model,deepchem,,,,,,,,,,,64.0,,,,,,,,,,,,,,,,,,,,,,,,pass_through_standardizer,,,,,,,,,,,,,,,,,,,,,,,,COMPLETE
62,62,-inf,2023-12-30 05:27:29.063429,2023-12-30 06:27:29.238134,0 days 01:00:00.174705,,,,,,,,,,,,,,,,,,8.0,,,,,,,,,,,,,,,,,,,,,,,,,,,0.5,,,,,,,,,,,445.0,,,,,,,,,,,,,,,,,,,,,,,,,,,,,,,,,,,,,,,,,,,,,,,,[100],[500],,,,,,,,,,,,,,,,,,,dag_model,deepchem,,,,,,,,,,,64.0,,,,,,,,,,,,,,,,,,,,,,,,pass_through_standardizer,,,,,,,,,,,,,,,,,,,,,,,,COMPLETE
63,63,-inf,2023-12-30 06:27:29.299478,2023-12-30 06:34:53.881608,0 days 00:07:24.582130,,,,,,,,,,,,,,,,,,128.0,,,,,,,,,,,,,,,,,,,,,,,,,,,0.25,,,,,,,,,,,373.0,,,,,,,,,,,,,,,,,,,,,,,,,,,,,,,,,,,,,,,,,,,,,,,,[500],"[200, 100]",,,,,,,,,,,,,,,,,,,dag_model,deepchem,,,,,,,,,,,256.0,,,,,,,,,,,,,,,,,,,,,,,,basic_standardizer,,,,,,,,,,,,,,,,,,,,,,,,COMPLETE
64,64,0.6775416259223496,2023-12-30 06:34:53.931634,2023-12-30 07:04:40.355230,0 days 00:29:46.423596,atom_pair,,,,,,,,,,svc,,,,,,,,,,,,True,,True,bagging_classifier_model,,,,,,,,,,,,,,,,,,,,,,,,,,,,,,,,,,,,low_variance_fs,,,,,,,,,,,,,,,,,,,,,,,,,,,,,,,,,,,,,,,,,,,,,,,,,,,,,20.0,,,,,,1.0,,,,sklearn,1024.0,,,,,,,,350.0,,,,,,,,,,,,,,,,,,,,,,,,,,pass_through_standardizer,,,,,,0.14848327880890935,,,,,,,,,,,,,,,,,,COMPLETE
65,65,-inf,2023-12-30 07:04:40.382570,2023-12-30 08:04:40.751902,0 days 01:00:00.369332,,,,,,['mean'],,,,,,,,,,,,32.0,,,,,,,,,,,,,,,,,,,,,,,,,,,,0.5,,,,,,,,,,658.0,,,,,,,,,,,,,,,,,,,,,,,,,,,,,,,,,,,,,,,,,,,,,,,,,,,,,,,,,,,,,,,,,,,,gat_model,deepchem,,10.0,,,,,,,,,,,,,,,,,,,,,0.5,,,,,,,,,,,,pass_through_standardizer,,,,,,,,False,,,,False,,,True,,,,,,,,,COMPLETE
66,66,-inf,2023-12-30 08:04:40.799511,2023-12-30 09:04:40.958854,0 days 01:00:00.159343,,,,,,,,,,,,,,,,,,16.0,,,,,,,,,,,,,,,,,,,,,,,,,,,,,,,,,,128.0,,,,900.0,,,,,,,,,,,32.0,,,,,,,,,,,,,,,,,,,,,,,,,,,,,,7.0,,,,,,,,,,,,,,,,,,,,,,,,,,,smiles_to_vec_model,deepchem,,,,,,,,,,,,,,,,,,,,,,,,,,,,,,,,,,,chembl_standardizer,,,,2.0,,,,,,,,,,,,,,,,,,,,COMPLETE
67,67,0.6873086070086633,2023-12-30 09:04:41.013404,2023-12-30 10:36:34.869087,0 days 01:31:53.855683,,,,,,,,,,,,,,,,,,64.0,,,,,,,,,,,,,,,,,,,,,,,,2.0,,,,,,,,,,,,,,500.0,,,,,,,,,,,,0.0,3.0,,,,,,,,,,,,,,,,,,,,,,,,,,,,,,,,,,,,,,,,,,,,,,,,,,,,,,,dmpnn_model,deepchem,,,,,,,,,,,,,,,,,,,,,,,,,,,,,,,,,,heavy_standardisation,custom_standardizer,,,,,,,,,,,,,,,,,,,,,,,,COMPLETE
68,68,0.6594099359904846,2023-12-30 10:36:34.894308,2023-12-30 11:31:47.227710,0 days 00:55:12.333402,,,,,,,,,,,,,,,,,,256.0,,,,,,,,,,,,,,,,,,,,,,,,,,,0.0,,,,,,,,,,,328.0,,,,,,,,,,,,,,,,,,,,,,,,,,,,,,,,,,,,,,,,,,,,,,,,[100],[500],,,,,,,,,,,,,,,,,,,dag_model,deepchem,,,,,,,,,,,64.0,,,,,,,,,,,,,,,,,,,,,,,,pass_through_standardizer,,,,,,,,,,,,,,,,,,,,,,,,COMPLETE
69,69,0.6997150975696859,2023-12-30 11:31:47.280510,2023-12-30 12:08:29.507165,0 days 00:36:42.226655,maccs,,,,,,,0.3443079510321346,,,,,,,,,,,,,,,,,,bernoulli_nb_model,,,,,,,,,,,,,,,,,,,,,,,,,,,,,,,,,,,,k_best,,,,,,,,,,,,,,,,,,,,,,,,,,,,,,23.0,,,,,,,,,,,,,,,,,,,,,,,,,,,,,,,,,sklearn,,,,,,,,,,,,,,,,,,,,,,,,,,,,,,,,,,,pass_through_standardizer,,,,,,,,,,,,,,,,,,,,,,,,COMPLETE
70,70,-inf,2023-12-30 12:08:29.600292,2023-12-30 13:08:29.808746,0 days 01:00:00.208454,,,,,,,,,,,,,,,,,,64.0,,,,,,,,,,,,,,,,,,,,,,,,,,,,,,,0.0,,,,,,,209.0,,,,,,,,,,,,,,,,,,,,,,,,,,,,,,,,,,,,,,,,,,,,,,,,,,,,,,,,,,,,,,16.0,,,,,,pagtn_model,deepchem,,,,,,,,,,,,,,,,,,,1.0,,5.0,,,,,,,,,,,,,,basic_standardizer,,,,,,,,,,,,,,,,,,,,,,,,COMPLETE
71,71,0.6666322501881836,2023-12-30 13:08:29.862612,2023-12-30 14:05:27.411183,0 days 00:56:57.548571,rdk,,,2.062756334429202,,,,,,,,,,,,,,,,,,,,,,linear_svc_model,,,,,,,,,,,,,,,,,,,,,,,,,,,,,,,,,,,,select_from_model_fs,,,,,,,,2048.0,,,,,,,,,,,,,,,,,,,,,,,,,,,,,,,,,,,,,,,,,,,,,,,,,5.0,,,,3.0,,sklearn,,,,,,,943.0,,,,,,,,,,,,,,,,,,,,,,,,,,,,chembl_standardizer,,,,,,,,,,,,,,,,,,,,,,,,COMPLETE
72,72,-inf,2023-12-30 14:05:27.458739,2023-12-30 14:10:20.099985,0 days 00:04:52.641246,morgan,,,,,,,,,,,,,,,,,,,,,,,,,linear_discriminant_analysis_model,,,,,,,,,,,,,,,,,,,,,,,,,,,,,,,,,,,,pass_through_transformer,,,,,,,,,,,,,,,,,,,,,,,,,,,,,,,,,,,,,,,,,,,,,,,,,,,,,,,,,,,,,,,sklearn,,,,2048.0,,,,,,,,,,,,,,,,,,,,,6.0,,,,,,,,eigen,,chembl_standardizer,,,,,,,,,,,,,,,,,,,,,,,,COMPLETE
73,73,-inf,2023-12-30 14:10:20.145367,2023-12-30 15:10:20.180917,0 days 01:00:00.035550,mixed,,,,,,,,,,,,,,,,,,,,,,,,,,,,,,,,,,,,,,,,,,,,,,,,,,,,,,,,,,,mol2vec,mol2vec,,,,,,,,,,,,,,,,,,,,,,,,,,,,,,,,,,,,,,,,,,,,,,,,,,,,,,,,,,,,,,,,sklearn,,,,,,,,,,,,,,,,,,,,,,,,,,,,,,,,,,,,,,,,,,,,,,,,,,,,,,,,,,,COMPLETE
74,74,0.7207632886745712,2023-12-30 15:10:20.207877,2023-12-30 15:54:44.313218,0 days 00:44:24.105341,mixed,,,,tanh,,,,0.0005168660295075877,,,,,,,,,,,,,,,,,mlp_classifier_model,,,,,,,,,,,,,,,,,,,,,,,,,,,,,,,,,,atom_pair,rdk,percentil_fs,,,,,,,,,,,,,,,,,,,,,,,,,,"(50,)",,,,,,,,,,,,,,,,,,,,,,,,,,,,,,,,,,,,,sklearn,,,,,,,,,,,,,,,,,,,,,,78.0,,,,,,,,,,,,,chembl_standardizer,,,,,,,,,,,,,,,,,,,,,,,,COMPLETE
75,75,0.6471757939104722,2023-12-30 15:54:44.366321,2023-12-30 16:56:33.051834,0 days 01:01:48.685513,,,keras_simple_rnn,,,,,,,,,,,,,,,,,,256.0,,,,,,,,,,,,,,,,,tanh,0.25296201976098487,,160.0,,,,,,,,,,,,,,,,,,50.0,,,,2D,,,,,,,,,,,,,,,,,,,,,,,,,,,,,,,,,,,,,,,,,,,,,,,,,,,,,,,,,,,,,,keras,,,,,,,,,,,,,,,,,1.0,,,,,,,,,0.02461419864548653,,,44.0,,,,,,chembl_standardizer,,,,,,,,,,,,,,,,,,,,,,,,COMPLETE
76,76,0.7161741715622189,2023-12-30 16:56:33.125944,2023-12-30 17:34:05.006695,0 days 00:37:31.880751,,,,,,,,,,,,,,,,,,64.0,,,,,,,,,,,,,,,,,,,,,,,,3.0,,,,,,,,,,,,,,290.0,,,,,,,,,,,,0.0,2.0,,,,,,,,,,,,,,,,,,,,,,,,,,,,,,,,,,,,,,,,,,,,,,,,,,,,,,,dmpnn_model,deepchem,,,,,,,,,,,,,,,,,,,,,,,,,,,,,,,,,,,pass_through_standardizer,,,,,,,,,,,,,,,,,,,,,,,,COMPLETE
77,77,0.7355356263386835,2023-12-30 17:34:05.025986,2023-12-30 17:59:57.043856,0 days 00:25:52.017870,,,,,,,,,,,,,,,,,,512.0,,,,,,,,,,,,,,,,,,,,,,,,2.0,,,,,,,,,,,,,,104.0,,,,,,,,,,,,0.25,2.0,,,,,,,,,,,,,,,,,,,,,,,,,,,,,,,,,,,,,,,,,,,,,,,,,,,,,,,dmpnn_model,deepchem,,,,,,,,,,,,,,,,,,,,,,,,,,,,,,,,,,,pass_through_standardizer,,,,,,,,,,,,,,,,,,,,,,,,COMPLETE
78,78,0.7207183241074059,2023-12-30 17:59:57.064048,2023-12-30 18:27:41.782088,0 days 00:27:44.718040,,,,,,,,,,,,,,,,,,512.0,,,,,,,,,,,,,,,,,,,,,,,,2.0,,,,,,,,,,,,,,119.0,,,,,,,,,,,,0.25,2.0,,,,,,,,,,,,,,,,,,,,,,,,,,,,,,,,,,,,,,,,,,,,,,,,,,,,,,,dmpnn_model,deepchem,,,,,,,,,,,,,,,,,,,,,,,,,,,,,,,,,,,pass_through_standardizer,,,,,,,,,,,,,,,,,,,,,,,,COMPLETE
79,79,0.7133675211768056,2023-12-30 18:27:41.800106,2023-12-30 19:13:08.782429,0 days 00:45:26.982323,,,,,,,,,,,,,,,,,,512.0,,,,,,,,,,,,,,,,,,,,,,,,2.0,,,,,,,,,,,,,,155.0,,,,,,,,,,,,0.25,3.0,,,,,,,,,,,,,,,,,,,,,,,,,,,,,,,,,,,,,,,,,,,,,,,,,,,,,,,dmpnn_model,deepchem,,,,,,,,,,,,,,,,,,,,,,,,,,,,,,,,,,,pass_through_standardizer,,,,,,,,,,,,,,,,,,,,,,,,COMPLETE
80,80,0.7339145469853943,2023-12-30 19:13:08.817262,2023-12-30 20:00:24.738352,0 days 00:47:15.921090,,,,,,,,,,,,,,,,,,512.0,,,,,,,,,,,,,,,,,,,,,,,,2.0,,,,,,,,,,,,,,237.0,,,,,,,,,,,,0.25,1.0,,,,,,,,,,,,,,,,,,,,,,,,,,,,,,,,,,,,,,,,,,,,,,,,,,,,,,,dmpnn_model,deepchem,,,,,,,,,,,,,,,,,,,,,,,,,,,,,,,,,,,pass_through_standardizer,,,,,,,,,,,,,,,,,,,,,,,,COMPLETE
81,81,0.6900507018064099,2023-12-30 20:00:24.757278,2023-12-30 20:33:09.399908,0 days 00:32:44.642630,,,,,,,,,,,,,,,,,,512.0,,,,,,,,,,,,,,,,,,,,,,,,2.0,,,,,,,,,,,,,,245.0,,,,,,,,,,,,0.25,1.0,,,,,,,,,,,,,,,,,,,,,,,,,,,,,,,,,,,,,,,,,,,,,,,,,,,,,,,dmpnn_model,deepchem,,,,,,,,,,,,,,,,,,,,,,,,,,,,,,,,,,,pass_through_standardizer,,,,,,,,,,,,,,,,,,,,,,,,COMPLETE
