,number,value,datetime_start,datetime_complete,duration,params_1D_featurizer,params_1d_model,params_2d_model,params_C_linear_svc,params_C_passive_aggressive_classifier,params_algorithm_kneighbors_classifier,params_alpha_perceptron,params_attention_dropout_0,params_attention_dropout_1,params_attention_key_dim_0,params_attention_key_dim_1,params_base_estimator_bagging_classifier,params_base_filters,params_batch_normalization_0,params_batch_normalization_1,params_batch_normalization_2,params_batch_size_deepchem,params_batchnorm,params_bootstrap_bagging_classifier,params_bootstrap_features,params_classification_model,params_conv_activation_0,params_conv_activation_1,params_conv_activation_2,params_conv_batch_norm_0,params_conv_batch_norm_1,params_conv_batch_norm_2,params_conv_dropout_0,params_conv_dropout_1,params_conv_dropout_2,params_degree_nu_svc,params_dense_activation,params_dense_dropout,params_dense_layer_size,params_dense_units,params_depth_dmpnn,params_dropout,params_dropout_attentive_fp,params_dropout_dag,params_dropout_gcn,params_dropout_graph_conv,params_dropout_pagtn,params_dropout_text_cnn,params_dropouts_weave,params_embedding_dim,params_embedding_output_dim,params_epochs_deepchem,params_f1,params_f2,params_feature_selector,params_featurizer_type,params_filter_0,params_filter_1,params_filter_2,params_filters,params_fnn_dropout_p,params_fnn_layers,params_fpSize,params_g_noise,params_gamma_nu_svc,params_graph_conv_layers_conv_model,params_graph_conv_layers_gcn,params_graph_feat_size_attentive_fp,params_gru_dropout_0,params_gru_dropout_1,params_gru_dropout_2,params_gru_units_0,params_gru_units_1,params_gru_units_2,params_hidden_activation_0,params_hidden_activation_1,params_hidden_activation_2,params_hidden_dropout_0,params_hidden_dropout_1,params_hidden_dropout_2,params_hidden_layer_units_0,params_hidden_layer_units_1,params_hidden_layer_units_2,params_k,params_kernel_nu_svc,params_kernel_size_0,params_kernel_size_1,params_kernel_size_2,params_kernel_size_smiles_to_vec,params_l1_0,params_l1_1,params_l1_2,params_l2_0,params_l2_1,params_l2_2,params_layer_sizes_dag,params_layer_sizes_gather,params_leaf_size_kneighbors_classifier,params_learning_rate_hist_gradient_boosting_classifier,params_lstm_dropout_0,params_lstm_dropout_1,params_lstm_dropout_2,params_lstm_units_0,params_lstm_units_1,params_lstm_units_2,params_master_atom,params_maxLength,params_maxPath,params_max_length_pagtn,params_max_path,params_minLength,params_minPath,params_min_path,params_model_steps,params_model_type,params_nBits,params_n_attention_heads,params_n_attention_layers,params_n_bits,params_n_conv_layers,params_n_embedding_text_cnn,params_n_estimators,params_n_estimators_bagging_classifier,params_n_graph_feat_dag,params_n_graph_feat_weave,params_n_gru_layers,params_n_hidden_layers,params_n_hidden_weave,params_n_lstm_layers,params_n_neighbors_kneighbors_classifier,params_n_rnn_layers,params_nu_nu_svc,params_num_heads,params_num_layers_attentive_fp,params_num_layers_pagtn,params_p,params_percentile,params_predictor_dropout_gcn,params_quantile_range,params_radius,params_reg_param,params_rnn_dropouts_0,params_rnn_units_0,params_scaler,params_solver,params_standardization_type,params_standardizer,params_stride_0,params_stride_1,params_stride_2,params_strides,params_support_weak,params_threshold,params_use_chirality_attentive_fp,params_use_chirality_gat,params_use_chirality_gcn,params_use_chirality_graph_conv,params_use_chirality_weave,params_use_edges_gat,params_use_edges_gcn,params_use_partial_charge_attentive_fp,params_use_partial_charge_gat,params_use_partial_charge_gcn,params_weight_gbr,params_weight_lr,params_weight_mlp,params_weight_rfr,params_weight_svc,params_weights_kneighbors_classifier,params_with_centering,params_with_scaling,state
93,93,0.6371694081112687,2024-02-18 12:26:23.086711,2024-02-18 13:25:30.916915,0 days 00:59:07.830204,,,,,,,,,,,,,,,,,128.0,,,,,,,,,,,,,,,,,,,3.0,,,,,,,,,,,798.0,,,,,,,,,0.25,2.0,,,,,,,,,,,,,,,,,,,,,,,,,,,,,,,,,,,,,,,,,,,,,,,,,,,,dmpnn_model,deepchem,,,,,,,,,,,,,,,,,,,,,,,,,,,,,,,,chembl_standardizer,,,,,,,,,,,,,,,,,,,,,,,,,COMPLETE
94,94,0.643270684741615,2024-02-18 13:25:30.943210,2024-02-18 14:13:13.358011,0 days 00:47:42.414801,,,,,,,,,,,,,,,,,128.0,,,,,,,,,,,,,,,,,,,3.0,,,,,,,,,,,658.0,,,,,,,,,0.25,2.0,,,,,,,,,,,,,,,,,,,,,,,,,,,,,,,,,,,,,,,,,,,,,,,,,,,,dmpnn_model,deepchem,,,,,,,,,,,,,,,,,,,,,,,,,,,,,,,,pass_through_standardizer,,,,,,,,,,,,,,,,,,,,,,,,,COMPLETE
95,95,0.6756037683246986,2024-02-18 14:13:13.426422,2024-02-18 15:14:20.319264,0 days 01:01:06.892842,,,,,,,,,,,,,,,,,128.0,,,,,,,,,,,,,,,,,,,3.0,,,,,,,,,,,874.0,,,,,,,,,0.25,2.0,,,,,,,,,,,,,,,,,,,,,,,,,,,,,,,,,,,,,,,,,,,,,,,,,,,,dmpnn_model,deepchem,,,,,,,,,,,,,,,,,,,,,,,,,,,,,,,,chembl_standardizer,,,,,,,,,,,,,,,,,,,,,,,,,COMPLETE
96,96,-inf,2024-02-18 15:14:20.342972,2024-02-18 16:14:20.438582,0 days 01:00:00.095610,,,,,,,,,,,,,,,,,128.0,,,,,,,,,,,,,,,,,,,,,0.0,,,,,,,,,901.0,,,,,,,,,,,,,,,,100.0,,,,,,,,,,,,,,,,,,,,,,,,,,,,,,,,,,,,,,,,,,,,,,attentive_fp_model,deepchem,,,,,,,,,,,,,,,,,,,1.0,,,,,,,,,,,,,chembl_standardizer,,,,,,,False,,,,,,,True,,,,,,,,,,,COMPLETE
97,97,-inf,2024-02-18 16:14:20.472837,2024-02-18 16:14:20.873491,0 days 00:00:00.400654,morgan,keras_1d_cnn,,,,,,,,,,,,,,,,,,,,tanh,tanh,relu,True,True,True,0.798869271198858,0.7467077453539744,0.5941413114966703,,tanh,,,192.0,,0.7811296696021034,,,,,,,,,,,,,,1D,4.0,8.0,18.0,,,,,0.08188086414049253,,,,,,,,,,,,,,,,,,,,,,59.0,16.0,64.0,,,,,,,,,,,,,,,,,,,,,,,,,,,keras,,,,1024.0,3.0,,,,,,,,,,,,,,,,,,,,6.0,,,,,,,,1.0,2.0,2.0,,,,,,,,,,,,,,,,,,,,,,COMPLETE
98,98,0.6356088562600191,2024-02-18 16:14:20.893158,2024-02-18 17:06:42.283196,0 days 00:52:21.390038,,,,,,,,,,,,,,,,,16.0,,,,,,,,,,,,,,,,,512.0,,,,,,,0.0,,,,,,865.0,,,,,,,,,,,,,,"[128, 64]",,,,,,,,,,,,,,,,,,,,,,,,,,,,,,,,,,,,,,,,True,,,,,,,,graph_conv_model,deepchem,,,,,,,,,,,,,,,,,,,,,,,,,,,,,,,,chembl_standardizer,,,,,,,,,,True,,,,,,,,,,,,,,,COMPLETE
99,99,-inf,2024-02-18 17:06:42.310872,2024-02-18 18:06:42.430030,0 days 01:00:00.119158,,,,,,,,,,,,,,,,,32.0,,,,,,,,,,,,,,,,,,,3.0,,,,,,,,,,,984.0,,,,,,,,,0.25,2.0,,,,,,,,,,,,,,,,,,,,,,,,,,,,,,,,,,,,,,,,,,,,,,,,,,,,dmpnn_model,deepchem,,,,,,,,,,,,,,,,,,,,,,,,,,,,,,,,chembl_standardizer,,,,,,,,,,,,,,,,,,,,,,,,,COMPLETE
