,number,value,datetime_start,datetime_complete,duration,params_1D_featurizer,params_1d_model,params_2d_model,params_C_linear_svr,params_C_nu_svr,params_C_svr,params_algorithm_kneighbors_regressor,params_algorithm_radius_neighbors_regressor,params_alpha_1,params_alpha_2,params_alpha_bayesian_ridge,params_alpha_gamma_regressor,params_alpha_gaussian_process_regressor,params_alpha_quantile_regressor,params_alpha_ridge_cv,params_alpha_ridge_model,params_alpha_tweedie_regressor,params_attention_dropout_0,params_attention_dropout_1,params_attention_dropout_2,params_attention_dropout_3,params_attention_key_dim_0,params_attention_key_dim_1,params_attention_key_dim_2,params_attention_key_dim_3,params_base_estimator_bagging_regressor,params_batch_normalization_0,params_batch_normalization_1,params_batch_normalization_2,params_batch_normalization_3,params_batch_normalization_4,params_batch_size_1d_conv,params_batch_size_bi_rnn,params_batch_size_deepchem,params_batch_size_fcnn,params_batch_size_rnn,params_batch_size_simple_rnn,params_batch_size_tabular_transformer,params_bootstrap_bagging_regressor,params_bootstrap_features,params_bootstrap_random_forest_regressor,params_conv_activation_0,params_conv_activation_1,params_conv_activation_2,params_conv_batch_norm_0,params_conv_batch_norm_1,params_conv_batch_norm_2,params_conv_dropout_0,params_conv_dropout_1,params_conv_dropout_2,params_criterion_random_forest_regressor,params_degree_nu_svr,params_degree_svr,params_dense_activation,params_dense_dropout,params_dense_layer_size,params_dense_units,params_depth_dmpnn,params_dropout,params_dropout_attentive_fp,params_dropout_dag,params_dropout_graph_conv,params_dropout_pagtn,params_dropout_text_cnn,params_dropouts_weave,params_embed_dropout_p,params_embedding_output_dim,params_encoder_dropout_p,params_epochs_1d_conv,params_epochs_bi_rnn,params_epochs_deepchem,params_epochs_fcnn,params_epochs_rnn,params_epochs_simple_rnn,params_epochs_tabular_transformer,params_epsilon_linear_svr,params_f1,params_f2,params_feature_selector,params_featurizer_type,params_ff_dropout_p,params_filter_0,params_filter_1,params_filter_2,params_fnn_dropout_p,params_fnn_layers,params_fpSize,params_g_noise,params_gamma_nu_svr,params_gamma_svr,params_gen_dropout_p,params_gen_n_layers,params_graph_conv_layers_conv_model,params_graph_feat_size_attentive_fp,params_gru_dropout_0,params_gru_dropout_1,params_gru_dropout_2,params_gru_units_0,params_gru_units_1,params_gru_units_2,params_hidden_activation_0,params_hidden_activation_1,params_hidden_activation_2,params_hidden_activation_3,params_hidden_activation_4,params_hidden_dropout_0,params_hidden_dropout_1,params_hidden_dropout_2,params_hidden_dropout_3,params_hidden_dropout_4,params_hidden_layer_units_0,params_hidden_layer_units_1,params_hidden_layer_units_2,params_hidden_layer_units_3,params_hidden_layer_units_4,params_k,params_kernel_nu_svr,params_kernel_size_0,params_kernel_size_1,params_kernel_size_2,params_kernel_svr,params_l1_0,params_l1_1,params_l1_2,params_l1_3,params_l1_4,params_l2_0,params_l2_1,params_l2_2,params_l2_3,params_l2_4,params_lambda_1_ard_regression,params_lambda_1_bayesian_ridge,params_lambda_2_ard_regression,params_lambda_2_bayesian_ridge,params_layer_sizes_dag,params_layer_sizes_gather,params_leaf_size_kneighbors_regressor,params_leaf_size_radius_neighbors_regressor,params_learning_rate_ada_boost_regressor,params_learning_rate_hist_gradient_boosting_regressor,params_loss_ada_boost_regressor,params_loss_hist_gradient_boosting_regressor,params_lstm_dropout_0,params_lstm_dropout_1,params_lstm_dropout_2,params_lstm_units_0,params_lstm_units_1,params_lstm_units_2,params_master_atom,params_maxLength,params_maxPath,params_max_features_random_forest_regressor,params_max_length_pagtn,params_max_path,params_method,params_minLength,params_minPath,params_min_path,params_model_steps,params_model_type,params_nBits,params_n_attention_heads,params_n_attention_layers,params_n_bits,params_n_conv_layers,params_n_embedding_text_cnn,params_n_encoders,params_n_estimators,params_n_estimators_ada_boost_regressor,params_n_estimators_bagging_regressor,params_n_estimators_random_forest_regressor,params_n_graph_feat_dag,params_n_graph_feat_weave,params_n_gru_layers,params_n_hidden_layers,params_n_hidden_weave,params_n_layers,params_n_lstm_layers,params_n_neighbors_kneighbors_regressor,params_n_quantiles,params_n_rnn_layers,params_norm,params_nu_nu_svr,params_num_heads,params_num_layers_attentive_fp,params_num_layers_pagtn,params_output_distribution,params_p,params_percentile,params_power_tweedie_regressor,params_quantile,params_quantile_range,params_radius,params_radius_n_radius_neighbors_regressor,params_regression_model,params_rnn_dropouts_0,params_rnn_dropouts_1,params_rnn_dropouts_2,params_rnn_units_0,params_rnn_units_1,params_rnn_units_2,params_sa_dropout_p,params_scaler,params_standardization_type,params_standardize,params_standardizer,params_stride_0,params_stride_1,params_stride_2,params_support_weak,params_threshold,params_threshold_lambda,params_use_chirality_attentive_fp,params_use_chirality_gat,params_use_chirality_graph_conv,params_use_chirality_weave,params_use_edges_gat,params_use_partial_charge_attentive_fp,params_use_partial_charge_gat,params_weights_kneighbors_regressor,params_weights_radius_neighbors_regressor,params_with_centering,params_with_mean,params_with_scaling,params_with_std,state
86,86,,2023-12-30 22:26:25.610625,2023-12-30 23:41:37.099938,0 days 01:15:11.489313,,,keras_bidirectional_rnn,,,,,,,,,,,,,,,,,,,,,,,,,,,,,,32.0,,,,,,,,,,,,,,,,,,,,,tanh,0.20409882344910105,,16.0,,,,,,,,,,,,,200.0,,,,,,,,,,2D,,,,,,,,,,,,,,,0.019116842248605992,,,20.0,,,,,,,,,,,,,,,,,,,,,,,,,,,,,,,,,,,,,,,,,,,,,,0.1105933436194626,,,231.0,,,,,,,,,,,,,,keras,,,,,,,,,,,,,,1.0,,,,1.0,,,,,,,,,,,,,,,,,,,,,,,,,,simple_standardisation,,custom_standardizer,,,,,,,,,,,,,,,,,,,,FAIL
87,87,,2023-12-30 23:41:37.113200,2023-12-31 01:26:22.251885,0 days 01:44:45.138685,,,keras_bidirectional_rnn,,,,,,,,,,,,,,,,,,,,,,,,,,,,,,32.0,,,,,,,,,,,,,,,,,,,,,tanh,0.21082979440363633,,16.0,,,,,,,,,,,,,50.0,,,,,,,,,,2D,,,,,,,,,,,,,,,0.011530829192489933,,,24.0,,,,,,,,,,,,,,,,,,,,,,,,,,,,,,,,,,,,,,,,,,,,,,0.11622150598071357,,,216.0,,,,,,,,,,,,,,keras,,,,,,,,,,,,,,1.0,,,,1.0,,,,,,,,,,,,,,,,,,,,,,,,,,simple_standardisation,,custom_standardizer,,,,,,,,,,,,,,,,,,,,FAIL
88,88,,2023-12-31 01:26:22.312962,2023-12-31 02:46:39.537346,0 days 01:20:17.224384,,,keras_bidirectional_rnn,,,,,,,,,,,,,,,,,,,,,,,,,,,,,,256.0,,,,,,,,,,,,,,,,,,,,,tanh,0.19970636895675464,,16.0,,,,,,,,,,,,,1000.0,,,,,,,,,,2D,,,,,,,,,,,,,,,0.005384675063537625,,,18.0,,,,,,,,,,,,,,,,,,,,,,,,,,,,,,,,,,,,,,,,,,,,,,0.11506237589820373,,,227.0,,,,,,,,,,,,,,keras,,,,,,,,,,,,,,1.0,,,,1.0,,,,,,,,,,,,,,,,,,,,,,,,,,simple_standardisation,,custom_standardizer,,,,,,,,,,,,,,,,,,,,FAIL
89,89,,2023-12-31 02:46:39.551398,2023-12-31 04:10:59.169935,0 days 01:24:19.618537,,,keras_bidirectional_rnn,,,,,,,,,,,,,,,,,,,,,,,,,,,,,,256.0,,,,,,,,,,,,,,,,,,,,,tanh,0.2197043631131668,,16.0,,,,,,,,,,,,,150.0,,,,,,,,,,2D,,,,,,,,,,,,,,,0.0078030263717732695,,,19.0,,,,,,,,,,,,,,,,,,,,,,,,,,,,,,,,,,,,,,,,,,,,,,0.10509787067328102,,,237.0,,,,,,,,,,,,,,keras,,,,,,,,,,,,,,1.0,,,,1.0,,,,,,,,,,,,,,,,,,,,,,,,,,simple_standardisation,,custom_standardizer,,,,,,,,,,,,,,,,,,,,FAIL
90,90,,2023-12-31 04:10:59.187791,2023-12-31 06:02:52.202854,0 days 01:51:53.015063,,,keras_bidirectional_rnn,,,,,,,,,,,,,,,,,,,,,,,,,,,,,,32.0,,,,,,,,,,,,,,,,,,,,,tanh,0.1831670878630739,,16.0,,,,,,,,,,,,,300.0,,,,,,,,,,2D,,,,,,,,,,,,,,,0.048477038541589634,,,22.0,,,,,,,,,,,,,,,,,,,,,,,,,,,,,,,,,,,,,,,,,,,,,,0.09656974135871671,,,219.0,,,,,,,,,,,,,,keras,,,,,,,,,,,,,,1.0,,,,1.0,,,,,,,,,,,,,,,,,,,,,,,,,,simple_standardisation,,custom_standardizer,,,,,,,,,,,,,,,,,,,,FAIL
91,91,-inf,2023-12-31 06:02:52.215975,2023-12-31 07:02:52.264918,0 days 01:00:00.048943,,,keras_bidirectional_rnn,,,,,,,,,,,,,,,,,,,,,,,,,,,,,,64.0,,,,,,,,,,,,,,,,,,,,,tanh,0.20140688951280944,,32.0,,,,,,,,,,,,,300.0,,,,,,,,,,2D,,,,,,,,,,,,,,,0.004336889884553885,,,24.0,,,,,,,,,,,,,,,,,,,,,,,,,,,,,,,,,,,,,,,,,,,,,,0.12320589794544684,,,219.0,,,,,,,,,,,,,,keras,,,,,,,,,,,,,,1.0,,,,1.0,,,,,,,,,,,,,,,,,,,,,,,,,,simple_standardisation,,custom_standardizer,,,,,,,,,,,,,,,,,,,,COMPLETE
92,92,-inf,2023-12-31 07:02:52.322811,2023-12-31 07:10:03.377092,0 days 00:07:11.054281,rdk,keras_tabular_transformer,,,,,,,,,,,,,,,,0.46078755018214657,0.1861616507674469,0.0022931576116057006,,16.0,8.0,4.0,,,,,,,,,,,,,,64.0,,,,,,,,,,,,,,,,tanh,0.09930026438873196,,48.0,,,,,,,,,,32.0,,,,,,,,150.0,,,,,1D,,,,,,,2048.0,,,,,,,,,,,,,,,,,,,,,,,,,,,,,,,,,,,,,,,,,,,,,,,,,,,,,,,,,,,,,,,,,,,,9.0,,,,1.0,,keras,,4.0,3.0,,,,,,,,,,,,,,,,,,,,,,,,,,,,,,,,,,,,,,,,,simple_standardisation,,custom_standardizer,,,,,,,,,,,,,,,,,,,,COMPLETE
93,93,0.30223077201614185,2023-12-31 07:10:03.415991,2023-12-31 08:35:06.713948,0 days 01:25:03.297957,morgan,keras_1d_cnn,,,,,,,,,,,,,,,,,,,,,,,,,,,,,,128.0,,,,,,,,,,relu,,,True,,,0.04631782424702339,,,,,,tanh,,,32.0,,0.5263319864794419,,,,,,,,,,100.0,,,,,,,,,,,1D,,20.0,,,,,,0.06279830651280463,,,,,,,,,,,,,,,,,,,,,,,,,,,,,,64.0,,,,,,,,,,,,,,,,,,,,,,,,,,,,,,,,,,,,,,,,,,,keras,,,,1024.0,1.0,,,,,,,,,,,,,,,,,,,,,,,,,,,,6.0,,,,,,,,,,,simple_standardisation,,custom_standardizer,2.0,,,,,,,,,,,,,,,,,,,COMPLETE
94,94,0.319888288673981,2023-12-31 08:35:06.734325,2023-12-31 09:41:58.534021,0 days 01:06:51.799696,2d_descriptors,,,,,,,,,,,,,0.092645714007625,,,,,,,,,,,,,,,,,,,,,,,,,,,,,,,,,,,,,,,,,,,,,,,,,,,,,,,,,,,,,,,,,percentil_fs,,,,,,,,,,,,,,,,,,,,,,,,,,,,,,,,,,,,,,,,,,,,,,,,,,,,,,,,,,,,,,,,,,,,,,,,,,,,,yeo-johnson,,,,,sklearn,,,,,,,,,,,,,,,,,,,,,,,,,,,,,67.0,,0.13658799766975677,,,,quantile_regressor_model,,,,,,,,power_transformer,simple_standardisation,False,custom_standardizer,,,,,,,,,,,,,,,,,,,,COMPLETE
95,95,,2023-12-31 09:41:58.562925,2023-12-31 10:38:24.881546,0 days 00:56:26.318621,2d_descriptors,,,,,1.4539584978673958,,,,,,,,,,,,,,,,,,,,,,,,,,,,,,,,,,,,,,,,,,,,,,,3.0,,,,,,,,,,,,,,,,,,,,,,,,,,pass_through_transformer,,,,,,,,,,,0.3547474462975034,,,,,,,,,,,,,,,,,,,,,,,,,,,,,,,rbf,,,,,,,,,,,,,,,,,,,,,,,,,,,,,,,,,,,,,,,,sklearn,,,,,,,,,,,,,,,,,,,,,,,,,,,,,,,,,,,svr_model,,,,,,,,standard_scaler,simple_standardisation,,custom_standardizer,,,,,,,,,,,,,,,,,True,,False,FAIL
96,96,0.2882933039590425,2023-12-31 10:38:24.901913,2023-12-31 11:34:47.201512,0 days 00:56:22.299599,2d_descriptors,,,,,,,,,,8.902104795085041,,,,,,,,,,,,,,,,,,,,,,,,,,,,,,,,,,,,,,,,,,,,,,,,,,,,,,,,,,,,,,,,,,,,pass_through_transformer,,,,,,,,,,,,,,,,,,,,,,,,,,,,,,,,,,,,,,,,,,,,,,,,,,,,,,0.6857476166588761,,5.236876621282876,,,,,,,,,,,,,,,,,,,,,,,,,,sklearn,,,,,,,,,,,,,,,,,,,,,,,,,,,,,,,,"(25.0, 75.0)",,,bayesian_ridge_model,,,,,,,,robust_scaler,simple_standardisation,,custom_standardizer,,,,,,,,,,,,,,,,False,,False,,COMPLETE
97,97,0.16151435452659366,2023-12-31 11:34:47.240310,2023-12-31 12:45:17.635169,0 days 01:10:30.394859,2d_descriptors,,,,,,,,,,,,,,,8.238063956817815,,,,,,,,,,,,,,,,,,,,,,,,,,,,,,,,,,,,,,,,,,,,,,,,,,,,,,,,,,,,,,,percentil_fs,,,,,,,,,,,,,,,,,,,,,,,,,,,,,,,,,,,,,,,,,,,,,,,,,,,,,,,,,,,,,,,,,,,,,,,,,,,,,,,,,,sklearn,,,,,,,,,,,,,,,,,,,,,,,,,,,,,51.0,,,,,,ridge_model,,,,,,,,standard_scaler,simple_standardisation,,custom_standardizer,,,,,,,,,,,,,,,,,False,,False,COMPLETE
98,98,0.015002262307577691,2023-12-31 12:45:17.660153,2023-12-31 16:53:05.234973,0 days 04:07:47.574820,2d_descriptors,,,,,,,,,,,,,,,,,,,,,,,,,,,,,,,,,,,,,,,,,,,,,,,,,,,,,,,,,,,,,,,,,,,,,,,,,,,,,,pass_through_transformer,,,,,,,,,,,,,,,,,,,,,,,,,,,,,,,,,,,,,,,,,,,,,,,,,,,,,,,,,,,,,,,,,,,,,,,,,,,,,box-cox,,,,,sklearn,,,,,,,,,,,,,,,,,,,,,,,,,,,,,,,,,,,theil_sen_regressor_model,,,,,,,,power_transformer,,True,chembl_standardizer,,,,,,,,,,,,,,,,,,,,COMPLETE
99,99,0.0379174773843489,2023-12-31 16:53:05.264235,2023-12-31 17:49:28.898228,0 days 00:56:23.633993,2d_descriptors,,,,,,,,,,,,,,,,,,,,,,,,,,,,,,,,,,,,,,,,,,,,,,,,,,,,,,,,,,,,,,,,,,,,,,,,,,,,,,percentil_fs,,,,,,,,,,,,,,,,,,,,,,,,,,,,,,,,,,,,,,,,,,,,,,,,,,,,,,,,,,,,,0.17989990244384246,,exponential,,,,,,,,,,,,,,,,,,,sklearn,,,,,,,,,350.0,,,,,,,,,,,811.0,,,,,,,normal,,74.0,,,,,,ada_boost_regressor_model,,,,,,,,quantile_transformer,heavy_standardisation,,custom_standardizer,,,,,,,,,,,,,,,,,,,,COMPLETE
